fact_id,source_system,source_file,canal_origen,canal_movimiento,tipo_movimiento,es_devolucion,fecha_movimiento_raw,fecha_movimiento,store_id_raw,store_id_std,doc_tipo,doc_id_raw,doc_id_std,line_id_raw,line_id_std,return_id,customer_id_raw,customer_id_std,flag_customer_in_crm,product_id_raw,product_id_std,flag_product_in_master,descripcion_producto,categoria,subcategoria,cantidad_raw,cantidad_signed,cantidad_abs,precio_unitario_raw,precio_unitario_num,descuento_pct_raw,descuento_pct_num,descuento_importe_raw,descuento_importe_num,importe_linea_raw,importe_signed_num,importe_abs_num,moneda,iva_pct,coste_unitario_num,coste_total_num,margen_bruto_num,metodo_pago,estado_pedido,origen,ticket_id_original,ticket_line_id_original,order_id_original,order_line_id_original,motivo_devolucion,metodo_devolucion,caja_id,cajero_id,flag_fecha_parseada,flag_importe_parseado,nombre_producto,precio_venta_num,estado_producto
F000001,ECOM,lineas_pedido.csv,ONLINE,ONLINE,VENTA,0,2025-05-11 15:46:46,2025-05-11 15:46:46,ONLINE,ONLINE,ORDER,O-202400001,O-202400001,OL-0000001,OL-0000001,,C0014,C0014,1,P1078,P1078,1,Estantería Atlas 160cm,Muebles,Estanterías,2,2.0,2.0,730.66,730.66,,,,,1461.32,1461.32,1461.32,EUR,21,497.07,994.14,467.17999999999995,Tarjeta,Pendiente,marketplace,,,O-202400001,OL-0000001,,,,,1,1,Estantería Atlas 160cm,702.02,Activo
F000002,ECOM,lineas_pedido.csv,ONLINE,ONLINE,VENTA,0,2025-05-11 15:46:46,2025-05-11 15:46:46,ONLINE,ONLINE,ORDER,O-202400001,O-202400001,OL-0000002,OL-0000002,,C0014,C0014,1,P1071,P1071,1,"Bombilla Aurora ""Star""",Iluminación,Bombillas,1,1.0,1.0,134.46,134.46,5,5.0,6.72,6.72,"127,74",127.74,127.74,EUR,21,81.49,81.49,46.25,Tarjeta,Pendiente,marketplace,,,O-202400001,OL-0000002,,,,,1,1,"Bombilla Aurora ""Star""",136.91,Descatalogado
F000003,ECOM,lineas_pedido.csv,ONLINE,ONLINE,VENTA,0,2025-05-11 15:46:46,2025-05-11 15:46:46,ONLINE,ONLINE,ORDER,O-202400001,O-202400001,OL-0000003,OL-0000003,,C0014,C0014,1,P1051,P1051,1,Alfombra Aurora Set 2 uds,Textil hogar,Alfombras,1,1.0,1.0,"22,62",22.62,5,5.0,1.13,1.13,21.49,21.49,21.49,EUR,21,12.4,12.4,9.089999999999998,Tarjeta,Pendiente,marketplace,,,O-202400001,OL-0000003,,,,,1,1,Alfombra Aurora Set 2 uds,23.53,Descatalogado
F000004,ECOM,lineas_pedido.csv,ONLINE,ONLINE,VENTA,0,2025-05-11 15:46:46,2025-05-11 15:46:46,ONLINE,ONLINE,ORDER,O-202400001,O-202400001,OL-0000004,OL-0000004,,C0014,C0014,1,,,0,,,,2,2.0,2.0,448.87,448.87,,,,,897.74,897.74,897.74,EUR,,,,,Tarjeta,Pendiente,marketplace,,,O-202400001,OL-0000004,,,,,1,1,,,
F000005,ECOM,lineas_pedido.csv,ONLINE,ONLINE,VENTA,0,2025-05-11 15:46:46,2025-05-11 15:46:46,ONLINE,ONLINE,ORDER,O-202400001,O-202400001,OL-0000005,OL-0000005,,C0014,C0014,1,P1037,P1037,1,"Bombilla Boreal ""Star""",Iluminación,Bombillas,2,2.0,2.0,51.54,51.54,,,,,€103.08,103.08,103.08,EUR,21,25.43,50.86,52.22,Tarjeta,Pendiente,marketplace,,,O-202400001,OL-0000005,,,,,1,1,"Bombilla Boreal ""Star""",50.59,Descatalogado
F000006,ECOM,lineas_pedido.csv,ONLINE,ONLINE,VENTA,0,20/03/2024 09:20,2024-03-20 09:20:00,ONLINE,ONLINE,ORDER,O-202400002,O-202400002,OL-0000006,OL-0000006,,C0006,C0006,1,P1064,P1064,1,Estantería Minimal 120cm,Muebles,Estanterías,1,1.0,1.0,449.48,449.48,,,,,449,449.0,449.0,EUR,21,210.29,210.29,238.71,Tarjeta,Devuelto Parcial,marketplace,,,O-202400002,OL-0000006,,,,,1,1,Estantería Minimal 120cm,447.43,Activo
F000007,ECOM,lineas_pedido.csv,ONLINE,ONLINE,VENTA,0,20/03/2024 09:20,2024-03-20 09:20:00,ONLINE,ONLINE,ORDER,O-202400002,O-202400002,OL-0000007,OL-0000007,,C0006,C0006,1,,,0,,,,1,1.0,1.0,893.89,893.89,,,,,893.89,893.89,893.89,EUR,,,,,Tarjeta,Devuelto Parcial,marketplace,,,O-202400002,OL-0000007,,,,,1,1,,,
F000008,ECOM,lineas_pedido.csv,ONLINE,ONLINE,VENTA,0,2024-05-06 08:05:31,2024-05-06 08:05:31,ONLINE,ONLINE,ORDER,O-202400003,O-202400003,OL-0000008,OL-0000008,,C9999,C9999,0,P1036,P1036,1,Cortina Aurora 90x200,Textil hogar,Cortinas,1,1.0,1.0,"26,02",26.02,,,,,26.02,26.02,26.02,EUR,21,18.23,18.23,7.789999999999999,Tarjeta,Entregado,marketplace,,,O-202400003,OL-0000008,,,,,1,1,Cortina Aurora 90x200,26.11,Activo
F000009,ECOM,lineas_pedido.csv,ONLINE,ONLINE,VENTA,0,2024-05-06 08:05:31,2024-05-06 08:05:31,ONLINE,ONLINE,ORDER,O-202400003,O-202400003,OL-0000009,OL-0000009,,C9999,C9999,0,P1041,P1041,1,Vela Luna ★,Decoración,Velas,3,3.0,3.0,118.27,118.27,5,5.0,17.74,17.74,"337,07",337.07,337.07,EUR,21,51.47,154.41,182.66,Tarjeta,Entregado,marketplace,,,O-202400003,OL-0000009,,,,,1,1,Vela Luna ★,120.85,Activo
F000010,ECOM,lineas_pedido.csv,ONLINE,ONLINE,VENTA,0,2024-05-06 08:05:31,2024-05-06 08:05:31,ONLINE,ONLINE,ORDER,O-202400003,O-202400003,OL-0000010,OL-0000010,,C9999,C9999,0,P1001,P1001,1,Cuadro Atlas ★,Decoración,Cuadros,1,1.0,1.0,33.11,33.11,25,25.0,8.28,8.28,€24.83,24.83,24.83,EUR,21,21.79,21.79,3.039999999999999,Tarjeta,Entregado,marketplace,,,O-202400003,OL-0000010,,,,,1,1,Cuadro Atlas ★,31.63,Activo
F000011,ECOM,lineas_pedido.csv,ONLINE,ONLINE,VENTA,0,2024-05-06 08:05:31,2024-05-06 08:05:31,ONLINE,ONLINE,ORDER,O-202400003,O-202400003,OL-0000011,OL-0000011,,C9999,C9999,0,P1039,P1039,1,Cuadro Nórdico ★,Decoración,Cuadros,2,2.0,2.0,223.73,223.73,20,20.0,89.49,89.49,357.97,357.97,357.97,EUR,21,84.28,168.56,189.41000000000003,Tarjeta,Entregado,marketplace,,,O-202400003,OL-0000011,,,,,1,1,Cuadro Nórdico ★,237.04,Descatalogado
F000012,ECOM,lineas_pedido.csv,ONLINE,ONLINE,VENTA,0,2024/06/14 03:38:45,2024-06-14 03:38:45,ONLINE,ONLINE,ORDER,O-202400004,O-202400004,OL-0000012,OL-0000012,,C0034,C0034,1,P1064,P1064,1,Estantería Minimal 120cm,Muebles,Estanterías,1,1.0,1.0,405.14,405.14,,,,,€405.14,405.14,405.14,EUR,21,210.29,210.29,194.85,Tarjeta,Devuelto Parcial,web,,,O-202400004,OL-0000012,,,,,1,1,Estantería Minimal 120cm,447.43,Activo
F000013,ECOM,lineas_pedido.csv,ONLINE,ONLINE,VENTA,0,2024/06/14 03:38:45,2024-06-14 03:38:45,ONLINE,ONLINE,ORDER,O-202400004,O-202400004,OL-0000013,OL-0000013,,C0034,C0034,1,P1030,P1030,1,Sofá Vintage XL,Muebles,Sofás,1,1.0,1.0,930.99,930.99,30,30.0,€279.30,279.3,€651.69,651.69,651.69,EUR,21,426.26,426.26,225.43000000000006,Tarjeta,Devuelto Parcial,web,,,O-202400004,OL-0000013,,,,,1,1,Sofá Vintage XL,1014.73,Descatalogado
F000013,ECOM,lineas_pedido.csv,ONLINE,ONLINE,VENTA,0,2024/06/14 03:38:45,2024-06-14 03:38:45,ONLINE,ONLINE,ORDER,O-202400004,O-202400004,OL-0000013,OL-0000013,,C0034,C0034,1,P1030,P1030,1,Sofá Vintage XL,Muebles,Sofás,1,1.0,1.0,930.99,930.99,30,30.0,€279.30,279.3,€651.69,651.69,651.69,EUR,21,426.26,426.26,225.43000000000006,Tarjeta,Devuelto Parcial,web,,,O-202400004,OL-0000013,,,,,1,1,Sofá Vintage XL (dup),1014.73,Descatalogado
F000014,ECOM,lineas_pedido.csv,ONLINE,ONLINE,VENTA,0,2024/06/14 03:38:45,2024-06-14 03:38:45,ONLINE,ONLINE,ORDER,O-202400004,O-202400004,OL-0000014,OL-0000014,,C0034,C0034,1,P1077,P1077,1,"Aplique Atlas ""Star""",Iluminación,Apliques,1,1.0,1.0,212.43,212.43,5,5.0,10.62,10.62,201.81,201.81,201.81,EUR,21,80.77,80.77,121.04,Tarjeta,Devuelto Parcial,web,,,O-202400004,OL-0000014,,,,,1,1,"Aplique Atlas ""Star""",209.96,Activo
F000015,ECOM,lineas_pedido.csv,ONLINE,ONLINE,VENTA,0,2024/06/14 03:38:45,2024-06-14 03:38:45,ONLINE,ONLINE,ORDER,O-202400004,O-202400004,OL-0000015,OL-0000015,,C0034,C0034,1,P1062,P1062,1,Sábana Brisa Pack 4,Textil hogar,Sábanas,3,3.0,3.0,,,,,,,"568,59",568.59,568.59,EUR,21,124.89,374.67,193.92000000000002,Tarjeta,Devuelto Parcial,web,,,O-202400004,OL-0000015,,,,,1,1,Sábana Brisa Pack 4,200.87,Activo
F000016,ECOM,lineas_pedido.csv,ONLINE,ONLINE,VENTA,0,2024-10-25 20:34:57,2024-10-25 20:34:57,ONLINE,ONLINE,ORDER,O-202400005,O-202400005,OL-0000016,OL-0000016,,C9999,C9999,0,P1030,P1030,1,Sofá Vintage XL,Muebles,Sofás,1,1.0,1.0,948.84,948.84,25,25.0,"237,21",237.21,711.63,711.63,711.63,EUR,21,426.26,426.26,285.37,Desconocido,Entregado,marketplace,,,O-202400005,OL-0000016,,,,,1,1,Sofá Vintage XL,1014.73,Descatalogado
F000016,ECOM,lineas_pedido.csv,ONLINE,ONLINE,VENTA,0,2024-10-25 20:34:57,2024-10-25 20:34:57,ONLINE,ONLINE,ORDER,O-202400005,O-202400005,OL-0000016,OL-0000016,,C9999,C9999,0,P1030,P1030,1,Sofá Vintage XL,Muebles,Sofás,1,1.0,1.0,948.84,948.84,25,25.0,"237,21",237.21,711.63,711.63,711.63,EUR,21,426.26,426.26,285.37,Desconocido,Entregado,marketplace,,,O-202400005,OL-0000016,,,,,1,1,Sofá Vintage XL (dup),1014.73,Descatalogado
F000017,ECOM,lineas_pedido.csv,ONLINE,ONLINE,VENTA,0,2024-10-25 20:34:57,2024-10-25 20:34:57,ONLINE,ONLINE,ORDER,O-202400005,O-202400005,OL-0000017,OL-0000017,,C9999,C9999,0,P1078,P1078,1,Estantería Atlas 160cm,Muebles,Estanterías,1,1.0,1.0,707.07,707.07,10,10.0,70.71,70.71,"636,36",636.36,636.36,EUR,21,497.07,497.07,139.29000000000002,Desconocido,Entregado,marketplace,,,O-202400005,OL-0000017,,,,,1,1,Estantería Atlas 160cm,702.02,Activo
F000018,ECOM,lineas_pedido.csv,ONLINE,ONLINE,VENTA,0,2025-10-15 17:51:13,2025-10-15 17:51:13,ONLINE,ONLINE,ORDER,O-202400006,O-202400006,OL-0000018,OL-0000018,,,,0,P1048,P1048,1,Mesa Minimal 160cm,Muebles,Mesas,2,2.0,2.0,469.75,469.75,,,,,939.50,939.5,939.5,EUR,21,205.56,411.12,528.38,Bizum,Entregado,,,,O-202400006,OL-0000018,,,,,1,1,Mesa Minimal 160cm,469.1,Activo
F000019,ECOM,lineas_pedido.csv,ONLINE,ONLINE,VENTA,0,2025-10-15 17:51:13,2025-10-15 17:51:13,ONLINE,ONLINE,ORDER,O-202400006,O-202400006,OL-0000019,OL-0000019,,,,0,P1018,P1018,1,Cojine Minimal ★,Decoración,Cojines,1,1.0,1.0,187.54,187.54,5,5.0,"9,38",9.38,"178,16",178.16,178.16,EUR,21,130.86,130.86,47.29999999999998,Bizum,Entregado,,,,O-202400006,OL-0000019,,,,,1,1,Cojine Minimal ★,179.25,Descatalogado
F000020,ECOM,lineas_pedido.csv,ONLINE,ONLINE,VENTA,0,2025-10-15 17:51:13,2025-10-15 17:51:13,ONLINE,ONLINE,ORDER,O-202400006,O-202400006,OL-0000020,OL-0000020,,,,0,P1007,P1007,1,Figura Boreal ★,Decoración,Figuras,4,4.0,4.0,"245,55",245.55,,,,,982.20,982.2,982.2,EUR,21,103.14,412.56,569.6400000000001,Bizum,Entregado,,,,O-202400006,OL-0000020,,,,,1,1,Figura Boreal ★,242.02,Activo
F000021,ECOM,lineas_pedido.csv,ONLINE,ONLINE,VENTA,0,25/09/2025 19:46,2025-09-25 19:46:00,ONLINE,ONLINE,ORDER,O-202400007,O-202400007,OL-0000021,OL-0000021,,C0061,C0061,1,P1046,P1046,1,"Aplique Atlas ""Star""",Iluminación,Apliques,1,1.0,1.0,346.34,346.34,0,0.0,0.00,0.0,€346.34,346.34,346.34,EUR,21,250.51,250.51,95.82999999999998,Tarjeta,Entregado,app,,,O-202400007,OL-0000021,,,,,1,1,"Aplique Atlas ""Star""",338.61,Activo
F000022,ECOM,lineas_pedido.csv,ONLINE,ONLINE,VENTA,0,25/09/2025 19:46,2025-09-25 19:46:00,ONLINE,ONLINE,ORDER,O-202400007,O-202400007,OL-0000022,OL-0000022,,C0061,C0061,1,P1018,P1018,1,Cojine Minimal ★,Decoración,Cojines,1,1.0,1.0,176.13,176.13,10,10.0,17.61,17.61,"158,52",158.52,158.52,EUR,21,130.86,130.86,27.659999999999997,Tarjeta,Entregado,app,,,O-202400007,OL-0000022,,,,,1,1,Cojine Minimal ★,179.25,Descatalogado
F000023,ECOM,lineas_pedido.csv,ONLINE,ONLINE,VENTA,0,2024-01-06 14:02:49,2024-01-06 14:02:49,ONLINE,ONLINE,ORDER,O-202400008,O-202400008,OL-0000023,OL-0000023,,CX123,CX123,0,P1040,P1040,1,Manta Boreal 140x200,Textil hogar,Mantas,2,2.0,2.0,€29.95,29.95,30,30.0,"17,97",17.97,41.93,41.93,41.93,EUR,21,21.51,43.02,-1.0900000000000034,Tarjeta,Entregado,web,,,O-202400008,OL-0000023,,,,,1,1,Manta Boreal 140x200,30.52,Descatalogado
F000024,ECOM,lineas_pedido.csv,ONLINE,ONLINE,VENTA,0,2024-01-06 14:02:49,2024-01-06 14:02:49,ONLINE,ONLINE,ORDER,O-202400008,O-202400008,OL-0000024,OL-0000024,,CX123,CX123,0,p1000,P1000,1,Sofá Aurora 160cm,Muebles,Sofás,1,1.0,1.0,201.63,201.63,,,,,201.63,201.63,201.63,EUR,21,143.47,143.47,58.16,Tarjeta,Entregado,web,,,O-202400008,OL-0000024,,,,,1,1,Sofá Aurora 160cm,221.99,Activo
F000025,ECOM,lineas_pedido.csv,ONLINE,ONLINE,VENTA,0,2024/02/17 01:54:07,2024-02-17 01:54:07,ONLINE,ONLINE,ORDER,O-202400009,O-202400009,OL-0000025,OL-0000025,,C0025,C0025,1,P1006,P1006,1,Cortina Élite 200x300,Textil hogar,Cortinas,1,1.0,1.0,102.96,102.96,,,,,102.96,102.96,102.96,EUR,21,62.96,62.96,39.99999999999999,paypal,Entregado,app,,,O-202400009,OL-0000025,,,,,1,1,Cortina Élite 200x300,113.02,Activo
F000026,ECOM,lineas_pedido.csv,ONLINE,ONLINE,VENTA,0,2024/02/17 01:54:07,2024-02-17 01:54:07,ONLINE,ONLINE,ORDER,O-202400009,O-202400009,OL-0000026,OL-0000026,,C0025,C0025,1,P1018,P1018,1,Cojine Minimal ★,Decoración,Cojines,1,1.0,1.0,€177.43,177.43,0,0.0,0.00,0.0,177.43,177.43,177.43,EUR,21,130.86,130.86,46.56999999999999,paypal,Entregado,app,,,O-202400009,OL-0000026,,,,,1,1,Cojine Minimal ★,179.25,Descatalogado
F000027,ECOM,lineas_pedido.csv,ONLINE,ONLINE,VENTA,0,2024/02/17 01:54:07,2024-02-17 01:54:07,ONLINE,ONLINE,ORDER,O-202400009,O-202400009,OL-0000027,OL-0000027,,C0025,C0025,1,P1011,P1011,1,Vela Eco ★,Decoración,Velas,1,1.0,1.0,85.53,85.53,,,,,85.53,85.53,85.53,EUR,21,68.81,68.81,16.72,paypal,Entregado,app,,,O-202400009,OL-0000027,,,,,1,1,Vela Eco ★,92.55,Activo
F000028,ECOM,lineas_pedido.csv,ONLINE,ONLINE,VENTA,0,2030-01-13 08:59:00,2030-01-13 08:59:00,ONLINE,ONLINE,ORDER,O-202400010,O-202400010,OL-0000028,OL-0000028,,C0094,C0094,1,P1058,P1058,1,Manta Nórdico 140x200,Textil hogar,Mantas,3,3.0,3.0,€61.58,61.58,,,,,184.74,184.74,184.74,EUR,21,39.18,117.53999999999999,67.20000000000002,ContraReembolso,Entregado,web,,,O-202400010,OL-0000028,,,,,1,1,Manta Nórdico 140x200,64.7,Activo
F000029,ECOM,lineas_pedido.csv,ONLINE,ONLINE,VENTA,0,2030-01-13 08:59:00,2030-01-13 08:59:00,ONLINE,ONLINE,ORDER,O-202400010,O-202400010,OL-0000029,OL-0000029,,C0094,C0094,1,P1077,P1077,1,"Aplique Atlas ""Star""",Iluminación,Apliques,1,1.0,1.0,198.97,198.97,20,20.0,39.79,39.79,159.18,159.18,159.18,EUR,21,80.77,80.77,78.41000000000001,ContraReembolso,Entregado,web,,,O-202400010,OL-0000029,,,,,1,1,"Aplique Atlas ""Star""",209.96,Activo
F000030,ECOM,lineas_pedido.csv,ONLINE,ONLINE,VENTA,0,2030-01-13 08:59:00,2030-01-13 08:59:00,ONLINE,ONLINE,ORDER,O-202400010,O-202400010,OL-0000030,OL-0000030,,C0094,C0094,1,P1092,P1092,1,Armario Sol Compact,Muebles,Armarios,1,1.0,1.0,"580,51",580.51,10,10.0,58.05,58.05,522.46,522.46,522.46,EUR,21,368.27,368.27,154.19000000000005,ContraReembolso,Entregado,web,,,O-202400010,OL-0000030,,,,,1,1,Armario Sol Compact,555.0,Descatalogado
F000031,ECOM,lineas_pedido.csv,ONLINE,ONLINE,VENTA,0,2025/06/08 10:52:27,2025-06-08 10:52:27,ONLINE,ONLINE,ORDER,O-202400011,O-202400011,OL-0000031,OL-0000031,,C0075,C0075,1,P1059,P1059,1,Armario Minimal 120cm,Muebles,Armarios,1,1.0,1.0,760.82,760.82,,,,,760.82,760.82,760.82,EUR,21,386.71,386.71,374.11000000000007,ApplePay,Entregado,,,,O-202400011,OL-0000031,,,,,1,1,Armario Minimal 120cm,763.98,Activo
F000032,ECOM,lineas_pedido.csv,ONLINE,ONLINE,VENTA,0,2025/06/08 10:52:27,2025-06-08 10:52:27,ONLINE,ONLINE,ORDER,O-202400011,O-202400011,OL-0000032,OL-0000032,,C0075,C0075,1,P1069,P1069,1,Sofá Zen 120cm,Muebles,Sofás,2,2.0,2.0,538.14,538.14,30,30.0,322.88,322.88,"753,40",753.4,753.4,EUR,21,193.43,386.86,366.53999999999996,ApplePay,Entregado,,,,O-202400011,OL-0000032,,,,,1,1,Sofá Zen 120cm,522.47,Activo
F000033,ECOM,lineas_pedido.csv,ONLINE,ONLINE,VENTA,0,2025-04-27 11:14:51,2025-04-27 11:14:51,ONLINE,ONLINE,ORDER,O-202400012,O-202400012,OL-0000033,OL-0000033,,C0034,C0034,1,P1096,P1096,1,Figura Vintage ★,Decoración,Figuras,1,1.0,1.0,€139.12,139.12,,,,,€139.12,139.12,139.12,EUR,21,73.92,73.92,65.2,PayPal,Entregado,app,,,O-202400012,OL-0000033,,,,,1,1,Figura Vintage ★,144.85,Activo
F000034,ECOM,lineas_pedido.csv,ONLINE,ONLINE,VENTA,0,2025/07/11 09:15:38,2025-07-11 09:15:38,ONLINE,ONLINE,ORDER,O-202400013,O-202400013,OL-0000034,OL-0000034,,C0033,C0033,1,p1097,P1097,1,Sofá Eco 120cm,Muebles,Sofás,1,1.0,1.0,730,730.0,15,15.0,€109.43,109.43,620.10,620.1,620.1,EUR,21,480.42,480.42,139.68,Tarjeta,Entregado,marketplace,,,O-202400013,OL-0000034,,,,,1,1,Sofá Eco 120cm,768.59,Activo
F000035,ECOM,lineas_pedido.csv,ONLINE,ONLINE,VENTA,0,2025/07/11 09:15:38,2025-07-11 09:15:38,ONLINE,ONLINE,ORDER,O-202400013,O-202400013,OL-0000035,OL-0000035,,C0033,C0033,1,SKU-1019,SKU-1019,1,Vela Aurora ★,Decoración,Velas,2,2.0,2.0,46.94,46.94,,,,,93.88,93.88,93.88,EUR,21,23.98,47.96,45.919999999999995,Tarjeta,Entregado,marketplace,,,O-202400013,OL-0000035,,,,,1,1,Vela Aurora ★,47.65,Descatalogado
F000036,ECOM,lineas_pedido.csv,ONLINE,ONLINE,VENTA,0,2025/07/11 09:15:38,2025-07-11 09:15:38,ONLINE,ONLINE,ORDER,O-202400013,O-202400013,OL-0000036,OL-0000036,,C0033,C0033,1,P1020,P1020,1,Alfombra Zen 200x300,Textil hogar,Alfombras,2,2.0,2.0,,,,,,,210.20,210.2,210.2,EUR,21,40.67,81.34,128.85999999999999,Tarjeta,Entregado,marketplace,,,O-202400013,OL-0000036,,,,,1,1,Alfombra Zen 200x300,112.47,Activo
F000037,ECOM,lineas_pedido.csv,ONLINE,ONLINE,VENTA,0,2025/07/11 09:15:38,2025-07-11 09:15:38,ONLINE,ONLINE,ORDER,O-202400013,O-202400013,OL-0000037,OL-0000037,,C0033,C0033,1,P1077,P1077,1,"Aplique Atlas ""Star""",Iluminación,Apliques,1,1.0,1.0,203.19,203.19,15,15.0,€30.48,30.48,172.71,172.71,172.71,EUR,21,80.77,80.77,91.94000000000001,Tarjeta,Entregado,marketplace,,,O-202400013,OL-0000037,,,,,1,1,"Aplique Atlas ""Star""",209.96,Activo
F000038,ECOM,lineas_pedido.csv,ONLINE,ONLINE,VENTA,0,2025/07/11 09:15:38,2025-07-11 09:15:38,ONLINE,ONLINE,ORDER,O-202400013,O-202400013,OL-0000038,OL-0000038,,C0033,C0033,1,P1049,P1049,1,"Lámparas techo Boreal ""Star""",Iluminación,Lámparas techo,3,3.0,3.0,352.44,352.44,20,20.0,211.46,211.46,846,846.0,846.0,EUR,21,255.88,767.64,78.36000000000001,Tarjeta,Entregado,marketplace,,,O-202400013,OL-0000038,,,,,1,1,"Lámparas techo Boreal ""Star""",368.25,Descatalogado
F000039,ECOM,lineas_pedido.csv,ONLINE,ONLINE,VENTA,0,2025-03-28 10:45:55,2025-03-28 10:45:55,ONLINE,ONLINE,ORDER,O-202400014,O-202400014,OL-0000039,OL-0000039,,C0006,C0006,1,P1055,P1055,1,Cuadro Luna ★,Decoración,Cuadros,1,1.0,1.0,121.38,121.38,,,,,121.38,121.38,121.38,EUR,21,77.33,77.33,44.05,ApplePay,Devuelto Total,app,,,O-202400014,OL-0000039,,,,,1,1,Cuadro Luna ★,124.61,Activo
F000040,ECOM,lineas_pedido.csv,ONLINE,ONLINE,VENTA,0,2025-03-28 10:45:55,2025-03-28 10:45:55,ONLINE,ONLINE,ORDER,O-202400014,O-202400014,OL-0000040,OL-0000040,,C0006,C0006,1,P1003,P1003,1,Espejo Atlas ★,Decoración,Espejos,2,2.0,2.0,256.53,256.53,25,25.0,128.26,128.26,384.80,384.8,384.8,EUR,21,160.81,321.62,63.18000000000001,ApplePay,Devuelto Total,app,,,O-202400014,OL-0000040,,,,,1,1,Espejo Atlas ★,264.87,Descatalogado
F000041,ECOM,lineas_pedido.csv,ONLINE,ONLINE,VENTA,0,2025-03-28 10:45:55,2025-03-28 10:45:55,ONLINE,ONLINE,ORDER,O-202400014,O-202400014,OL-0000041,OL-0000041,,C0006,C0006,1,P1058,P1058,1,Manta Nórdico 140x200,Textil hogar,Mantas,1,1.0,1.0,64.38,64.38,20,20.0,€12.88,12.88,"51,50",51.5,51.5,EUR,21,39.18,39.18,12.32,ApplePay,Devuelto Total,app,,,O-202400014,OL-0000041,,,,,1,1,Manta Nórdico 140x200,64.7,Activo
F000042,ECOM,lineas_pedido.csv,ONLINE,ONLINE,VENTA,0,2024-07-26 05:37:08,2024-07-26 05:37:08,ONLINE,ONLINE,ORDER,O-202400015,O-202400015,OL-0000042,OL-0000042,,C0061,C0061,1,P1073,P1073,1,Espejo Minimal ★,Decoración,Espejos,1,1.0,1.0,,,15,15.0,16.84,16.84,95.40,95.4,95.4,EUR,21,83.92,83.92,11.480000000000004,BIZUM,Entregado,web,,,O-202400015,OL-0000042,,,,,1,1,Espejo Minimal ★,114.54,Activo
F000043,ECOM,lineas_pedido.csv,ONLINE,ONLINE,VENTA,0,2024-07-26 05:37:08,2024-07-26 05:37:08,ONLINE,ONLINE,ORDER,O-202400015,O-202400015,OL-0000043,OL-0000043,,C0061,C0061,1,P1067,P1067,1,"Lámparas pie Boreal ""Star""",Iluminación,Lámparas pie,1,1.0,1.0,€358.05,358.05,0,0.0,0.00,0.0,358.05,358.05,358.05,EUR,21,202.12,202.12,155.93,BIZUM,Entregado,web,,,O-202400015,OL-0000043,,,,,1,1,"Lámparas pie Boreal ""Star""",355.71,Activo
F000044,ECOM,lineas_pedido.csv,ONLINE,ONLINE,VENTA,0,2024-03-30 14:07:33,2024-03-30 14:07:33,ONLINE,ONLINE,ORDER,O-202400016,O-202400016,OL-0000044,OL-0000044,,C9999,C9999,0,P1036,P1036,1,Cortina Aurora 90x200,Textil hogar,Cortinas,1,1.0,1.0,25.51,25.51,30,30.0,"7,65",7.65,17.86,17.86,17.86,EUR,21,18.23,18.23,-0.370000000000001,Tarjeta,Entregado,app,,,O-202400016,OL-0000044,,,,,1,1,Cortina Aurora 90x200,26.11,Activo
F000045,ECOM,lineas_pedido.csv,ONLINE,ONLINE,VENTA,0,2024-03-30 14:07:33,2024-03-30 14:07:33,ONLINE,ONLINE,ORDER,O-202400016,O-202400016,OL-0000045,OL-0000045,,C9999,C9999,0,P1004,P1004,1,Cama Sol 120cm,decoración,Camas,1,1.0,1.0,1159.26,1159.26,5,5.0,"57,96",57.96,€1101.30,1101.3,1101.3,EUR,21,,,,Tarjeta,Entregado,app,,,O-202400016,OL-0000045,,,,,1,1,Cama Sol 120cm,1131.94,Activo
F000046,ECOM,lineas_pedido.csv,ONLINE,ONLINE,VENTA,0,2024-03-30 14:07:33,2024-03-30 14:07:33,ONLINE,ONLINE,ORDER,O-202400016,O-202400016,OL-0000046,OL-0000046,,C9999,C9999,0,P1054,P1054,1,Figura Minimal ★,Decoración,Figuras,1,1.0,1.0,113.36,113.36,,,,,"113,36",113.36,113.36,EUR,21,54.5,54.5,58.86,Tarjeta,Entregado,app,,,O-202400016,OL-0000046,,,,,1,1,Figura Minimal ★,110.1,Activo
F000047,ECOM,lineas_pedido.csv,ONLINE,ONLINE,VENTA,0,2024-03-30 14:07:33,2024-03-30 14:07:33,ONLINE,ONLINE,ORDER,O-202400016,O-202400016,OL-0000047,OL-0000047,,C9999,C9999,0,P1071,P1071,1,"Bombilla Aurora ""Star""",Iluminación,Bombillas,1,1.0,1.0,140.57,140.57,30,30.0,€42.17,42.17,€98.40,98.4,98.4,EUR,21,81.49,81.49,16.91000000000001,Tarjeta,Entregado,app,,,O-202400016,OL-0000047,,,,,1,1,"Bombilla Aurora ""Star""",136.91,Descatalogado
F000048,ECOM,lineas_pedido.csv,ONLINE,ONLINE,VENTA,0,2024/10/09 21:34:49,2024-10-09 21:34:49,ONLINE,ONLINE,ORDER,O-202400017,O-202400017,OL-0000048,OL-0000048,,C0085,C0085,1,p10X1,P10X1,0,Producto desconocido,,,1,1.0,1.0,"199,91",199.91,10,10.0,19.99,19.99,179.92,179.92,179.92,EUR,,,,,Desconocido,Pendiente,web,,,O-202400017,OL-0000048,,,,,1,1,,,
F000049,ECOM,lineas_pedido.csv,ONLINE,ONLINE,VENTA,0,2024/10/09 21:34:49,2024-10-09 21:34:49,ONLINE,ONLINE,ORDER,O-202400017,O-202400017,OL-0000049,OL-0000049,,C0085,C0085,1,P1091,P1091,1,"Bombilla Eco ""Star""",Iluminación,Bombillas,1,1.0,1.0,"354,93",354.93,-5,-5.0,-17.75,-17.75,€372.68,372.68,372.68,EUR,21,144.5,144.5,228.18,Desconocido,Pendiente,web,,,O-202400017,OL-0000049,,,,,1,1,"Bombilla Eco ""Star""",388.99,Descatalogado
F000050,ECOM,lineas_pedido.csv,ONLINE,ONLINE,VENTA,0,2024/10/09 21:34:49,2024-10-09 21:34:49,ONLINE,ONLINE,ORDER,O-202400017,O-202400017,OL-0000050,OL-0000050,,C0085,C0085,1,P1009,P1009,1,Cortina Vintage Pack 4,Textil hogar,Cortinas,2,2.0,2.0,22.41,22.41,0,0.0,"0,00",0.0,44.82,44.82,44.82,EUR,21,10.34,20.68,24.14,Desconocido,Pendiente,web,,,O-202400017,OL-0000050,,,,,1,1,Cortina Vintage Pack 4,21.75,Activo
F000051,ECOM,lineas_pedido.csv,ONLINE,ONLINE,VENTA,0,2024-08-24 00:38:22,2024-08-24 00:38:22,ONLINE,ONLINE,ORDER,O-202400018,O-202400018,OL-0000051,OL-0000051,,C0060,C0060,1,P1036,P1036,1,Cortina Aurora 90x200,Textil hogar,Cortinas,1,1.0,1.0,25.46,25.46,-5,-5.0,-1.27,-1.27,"26,73",26.73,26.73,EUR,21,18.23,18.23,8.5,PayPal,Entregado,,,,O-202400018,OL-0000051,,,,,1,1,Cortina Aurora 90x200,26.11,Activo
F000052,ECOM,lineas_pedido.csv,ONLINE,ONLINE,VENTA,0,2024-08-24 00:38:22,2024-08-24 00:38:22,ONLINE,ONLINE,ORDER,O-202400018,O-202400018,OL-0000052,OL-0000052,,C0060,C0060,1,P1065,P1065,1,Sofá Atlas 3 plazas,Muebles,Sofás,3,3.0,3.0,1013.93,1013.93,,,,,3041.79,3041.79,3041.79,EUR,21,412.52,1237.56,1804.23,PayPal,Entregado,,,,O-202400018,OL-0000052,,,,,1,1,Sofá Atlas 3 plazas,1087.01,Activo
F000053,ECOM,lineas_pedido.csv,ONLINE,ONLINE,VENTA,0,2024-08-24 00:38:22,2024-08-24 00:38:22,ONLINE,ONLINE,ORDER,O-202400018,O-202400018,OL-0000053,OL-0000053,,C0060,C0060,1,p1082,P1082,1,Vela Vintage ★,Decoración,Velas,1,1.0,1.0,"215,21",215.21,5,5.0,10.76,10.76,204.45,204.45,204.45,EUR,21,161.63,161.63,42.81999999999999,PayPal,Entregado,,,,O-202400018,OL-0000053,,,,,1,1,Vela Vintage ★,229.75,Activo
F000054,ECOM,lineas_pedido.csv,ONLINE,ONLINE,VENTA,0,2024-08-24 00:38:22,2024-08-24 00:38:22,ONLINE,ONLINE,ORDER,O-202400018,O-202400018,OL-0000054,OL-0000054,,C0060,C0060,1,P1023,P1023,1,"Aplique Élite ""Star""",Iluminación,Apliques,1,1.0,1.0,"138,18",138.18,30,30.0,€41.45,41.45,96.73,96.73,96.73,EUR,21,98.01,98.01,-1.2800000000000011,PayPal,Entregado,,,,O-202400018,OL-0000054,,,,,1,1,"Aplique Élite ""Star""",142.08,Descatalogado
F000055,ECOM,lineas_pedido.csv,ONLINE,ONLINE,VENTA,0,2024-08-24 00:38:22,2024-08-24 00:38:22,ONLINE,ONLINE,ORDER,O-202400018,O-202400018,OL-0000055,OL-0000055,,C0060,C0060,1,P1030,P1030,1,Sofá Vintage XL,Muebles,Sofás,1,1.0,1.0,984.61,984.61,25,25.0,246.15,246.15,"738,46",738.46,738.46,EUR,21,426.26,426.26,312.20000000000005,PayPal,Entregado,,,,O-202400018,OL-0000055,,,,,1,1,Sofá Vintage XL,1014.73,Descatalogado
F000055,ECOM,lineas_pedido.csv,ONLINE,ONLINE,VENTA,0,2024-08-24 00:38:22,2024-08-24 00:38:22,ONLINE,ONLINE,ORDER,O-202400018,O-202400018,OL-0000055,OL-0000055,,C0060,C0060,1,P1030,P1030,1,Sofá Vintage XL,Muebles,Sofás,1,1.0,1.0,984.61,984.61,25,25.0,246.15,246.15,"738,46",738.46,738.46,EUR,21,426.26,426.26,312.20000000000005,PayPal,Entregado,,,,O-202400018,OL-0000055,,,,,1,1,Sofá Vintage XL (dup),1014.73,Descatalogado
F000056,ECOM,lineas_pedido.csv,ONLINE,ONLINE,VENTA,0,2024-08-24 00:38:22,2024-08-24 00:38:22,ONLINE,ONLINE,ORDER,O-202400018,O-202400018,OL-0000056,OL-0000056,,C0060,C0060,1,P1003,P1003,1,Espejo Atlas ★,Decoración,Espejos,1,1.0,1.0,273.41,273.41,,,,,273.41,273.41,273.41,EUR,21,160.81,160.81,112.60000000000002,PayPal,Entregado,,,,O-202400018,OL-0000056,,,,,1,1,Espejo Atlas ★,264.87,Descatalogado
F000057,ECOM,lineas_pedido.csv,ONLINE,ONLINE,VENTA,0,17/11/2024 21:44,2024-11-17 21:44:00,ONLINE,ONLINE,ORDER,O-202400019,O-202400019,OL-0000057,OL-0000057,,C0052,C0052,1,P1083,P1083,1,"Aplique Aurora ""Star""",Iluminación,,2,2.0,2.0,409.53,409.53,0,0.0,"0,00",0.0,"819,06",819.06,819.06,EUR,21,219.73,439.46,379.59999999999997,PayPal,Cancelado,,,,O-202400019,OL-0000057,,,,,1,1,"Aplique Aurora ""Star""",393.42,Activo
F000058,ECOM,lineas_pedido.csv,ONLINE,ONLINE,VENTA,0,17/11/2024 21:44,2024-11-17 21:44:00,ONLINE,ONLINE,ORDER,O-202400019,O-202400019,OL-0000058,OL-0000058,,C0052,C0052,1,P1042,P1042,1,Espejo Minimal ★,Decoración,Espejos,2,2.0,2.0,71.56,71.56,30,30.0,42.94,42.94,100.18,100.18,100.18,EUR,21,32.41,64.82,35.360000000000014,PayPal,Cancelado,,,,O-202400019,OL-0000058,,,,,1,1,Espejo Minimal ★,77.19,Activo
F000059,ECOM,lineas_pedido.csv,ONLINE,ONLINE,VENTA,0,2025-04-20 20:40:01,2025-04-20 20:40:01,ONLINE,ONLINE,ORDER,O-202400020,O-202400020,OL-0000059,OL-0000059,,,,0,P1059,P1059,1,Armario Minimal 120cm,Muebles,Armarios,2,2.0,2.0,,,-5,-5.0,-70.34,-70.34,1477.20,1477.2,1477.2,EUR,21,386.71,773.42,703.7800000000001,PayPal,Entregado,,,,O-202400020,OL-0000059,,,,,1,1,Armario Minimal 120cm,763.98,Activo
F000060,ECOM,lineas_pedido.csv,ONLINE,ONLINE,VENTA,0,2025-04-20 20:40:01,2025-04-20 20:40:01,ONLINE,ONLINE,ORDER,O-202400020,O-202400020,OL-0000060,OL-0000060,,,,0,P1092,P1092,1,Armario Sol Compact,Muebles,Armarios,1,1.0,1.0,550.00,550.0,,,,,550.00,550.0,550.0,EUR,21,368.27,368.27,181.73000000000002,PayPal,Entregado,,,,O-202400020,OL-0000060,,,,,1,1,Armario Sol Compact,555.0,Descatalogado
F000061,ECOM,lineas_pedido.csv,ONLINE,ONLINE,VENTA,0,2025-06-23 00:09:43,2025-06-23 00:09:43,ONLINE,ONLINE,ORDER,O-202400021,O-202400021,OL-0000061,OL-0000061,,C0060,C0060,1,P1047,P1047,1,Sofá Atlas 3 plazas,Muebles,Sofás,1,1.0,1.0,527.58,527.58,,,,,528,528.0,528.0,EUR,21,253.03,253.03,274.97,Transferencia ,Entregado,app,,,O-202400021,OL-0000061,,,,,1,1,Sofá Atlas 3 plazas,508.08,Activo
F000062,ECOM,lineas_pedido.csv,ONLINE,ONLINE,VENTA,0,2025-06-23 00:09:43,2025-06-23 00:09:43,ONLINE,ONLINE,ORDER,O-202400021,O-202400021,OL-0000062,OL-0000062,,C0060,C0060,1,P1073,P1073,1,Espejo Minimal ★,Decoración,Espejos,1,1.0,1.0,€112.89,112.89,,,,,112.89,112.89,112.89,EUR,21,83.92,83.92,28.97,Transferencia ,Entregado,app,,,O-202400021,OL-0000062,,,,,1,1,Espejo Minimal ★,114.54,Activo
F000063,ECOM,lineas_pedido.csv,ONLINE,ONLINE,VENTA,0,2025-06-23 00:09:43,2025-06-23 00:09:43,ONLINE,ONLINE,ORDER,O-202400021,O-202400021,OL-0000063,OL-0000063,,C0060,C0060,1,P1025,P1025,1,Figura Nórdico ★,Decoración,Figuras,2,2.0,2.0,81.15,81.15,15,15.0,24.35,24.35,137.95,137.95,137.95,EUR,21,46.11,92.22,45.72999999999999,Transferencia ,Entregado,app,,,O-202400021,OL-0000063,,,,,1,1,Figura Nórdico ★,90.09,Descatalogado
F000064,ECOM,lineas_pedido.csv,ONLINE,ONLINE,VENTA,0,2024-07-30 23:52:58,2024-07-30 23:52:58,ONLINE,ONLINE,ORDER,O-202400022,O-202400022,OL-0000064,OL-0000064,,C0052,C0052,1,P1020,P1020,1,Alfombra Zen 200x300,Textil hogar,Alfombras,2,2.0,2.0,€102.13,102.13,25,25.0,51.06,51.06,153.20,153.2,153.2,EUR,21,40.67,81.34,71.85999999999999,Bizum,Entregado,,,,O-202400022,OL-0000064,,,,,1,1,Alfombra Zen 200x300,112.47,Activo
F000065,ECOM,lineas_pedido.csv,ONLINE,ONLINE,VENTA,0,2024-07-30 23:52:58,2024-07-30 23:52:58,ONLINE,ONLINE,ORDER,O-202400022,O-202400022,OL-0000065,OL-0000065,,C0052,C0052,1,P1017,P1017,1,"Lámparas techo Zen ""Star""",Iluminación,Lámparas techo,3,3.0,3.0,66.03,66.03,,,,,198.09,198.09,198.09,EUR,21,-12.5,-37.5,235.59,Bizum,Entregado,,,,O-202400022,OL-0000065,,,,,1,1,"Lámparas techo Zen ""Star""",66.47,Activo
F000066,ECOM,lineas_pedido.csv,ONLINE,ONLINE,VENTA,0,2024-07-30 23:52:58,2024-07-30 23:52:58,ONLINE,ONLINE,ORDER,O-202400022,O-202400022,OL-0000066,OL-0000066,,C0052,C0052,1,P1038,P1038,1,"Lámparas pie Boreal ""Star""",Iluminación,Lámparas pie,2,2.0,2.0,22,22.0,,,,,44.84,44.84,44.84,EUR,21,10.92,21.84,23.000000000000004,Bizum,Entregado,,,,O-202400022,OL-0000066,,,,,1,1,"Lámparas pie Boreal ""Star""",22.01,Activo
F000067,ECOM,lineas_pedido.csv,ONLINE,ONLINE,VENTA,0,14/07/2024 22:40,2024-07-14 22:40:00,ONLINE,ONLINE,ORDER,O-202400023,O-202400023,OL-0000067,OL-0000067,,C0045,C0045,1,P1002,P1002,1,Sábana Brisa 90x200,Textil hogar,Sábanas,2,2.0,2.0,173.57,173.57,25,25.0,86.78,86.78,€260.36,260.36,260.36,EUR,21,106.71,213.42,46.940000000000026,ContraReembolso,Devuelto Total,web,,,O-202400023,OL-0000067,,,,,1,1,Sábana Brisa 90x200,169.18,Activo
F000068,ECOM,lineas_pedido.csv,ONLINE,ONLINE,VENTA,0,14/07/2024 22:40,2024-07-14 22:40:00,ONLINE,ONLINE,ORDER,O-202400023,O-202400023,OL-0000068,OL-0000068,,C0045,C0045,1,P1002,P1002,1,Sábana Brisa 90x200,Textil hogar,Sábanas,1,1.0,1.0,€166.21,166.21,15,15.0,€24.93,24.93,141.28,141.28,141.28,EUR,21,106.71,106.71,34.57000000000001,ContraReembolso,Devuelto Total,web,,,O-202400023,OL-0000068,,,,,1,1,Sábana Brisa 90x200,169.18,Activo
F000069,ECOM,lineas_pedido.csv,ONLINE,ONLINE,VENTA,0,2025-08-27 03:05:29,2025-08-27 03:05:29,ONLINE,ONLINE,ORDER,O-202400024,O-202400024,OL-0000069,OL-0000069,,C0040,C0040,1,P1061,P1061,1,Sábana Minimal 200x300,Textil hogar,Sábanas,1,1.0,1.0,182.61,182.61,0,0.0,0.00,0.0,182.61,182.61,182.61,EUR,21,128.73,128.73,53.880000000000024,Tarjeta,Entregado,web,,,O-202400024,OL-0000069,,,,,1,1,Sábana Minimal 200x300,200.88,Activo
F000070,ECOM,lineas_pedido.csv,ONLINE,ONLINE,VENTA,0,2025-08-27 03:05:29,2025-08-27 03:05:29,ONLINE,ONLINE,ORDER,O-202400024,O-202400024,OL-0000070,OL-0000070,,C0040,C0040,1,P1067,P1067,1,"Lámparas pie Boreal ""Star""",Iluminación,Lámparas pie,1,1.0,1.0,356.66,356.66,5,5.0,17.83,17.83,338.83,338.83,338.83,EUR,21,202.12,202.12,136.70999999999998,Tarjeta,Entregado,web,,,O-202400024,OL-0000070,,,,,1,1,"Lámparas pie Boreal ""Star""",355.71,Activo
F000071,ECOM,lineas_pedido.csv,ONLINE,ONLINE,VENTA,0,2025-08-27 03:05:29,2025-08-27 03:05:29,ONLINE,ONLINE,ORDER,O-202400024,O-202400024,OL-0000071,OL-0000071,,C0040,C0040,1,P1098,P1098,1,Espejo Boreal ★,Decoración,Espejos,2,2.0,2.0,217.05,217.05,,,,,434.10,434.1,434.1,EUR,21,,,,Tarjeta,Entregado,web,,,O-202400024,OL-0000071,,,,,1,1,Espejo Boreal ★,216.71,Activo
F000072,ECOM,lineas_pedido.csv,ONLINE,ONLINE,VENTA,0,2025-08-27 03:05:29,2025-08-27 03:05:29,ONLINE,ONLINE,ORDER,O-202400024,O-202400024,OL-0000072,OL-0000072,,C0040,C0040,1,p1005,P1005,1,Producto desconocido,Decoración,Cuadros,1,1.0,1.0,935.96,935.96,15,15.0,140.39,140.39,795.57,795.57,795.57,EUR,21,98.34,98.34,697.23,Tarjeta,Entregado,web,,,O-202400024,OL-0000072,,,,,1,1,Cuadro Luna ★,180.29,Activo
F000073,ECOM,lineas_pedido.csv,ONLINE,ONLINE,VENTA,0,2025-10-21 21:14:15,2025-10-21 21:14:15,ONLINE,ONLINE,ORDER,O-202400025,O-202400025,OL-0000073,OL-0000073,,C0059,C0059,1,P1046,P1046,1,"Aplique Atlas ""Star""",Iluminación,Apliques,1,1.0,1.0,328.29,328.29,0,0.0,0,0.0,328.29,328.29,328.29,EUR,21,250.51,250.51,77.78000000000003,Tarjeta,Entregado,,,,O-202400025,OL-0000073,,,,,1,1,"Aplique Atlas ""Star""",338.61,Activo
F000074,ECOM,lineas_pedido.csv,ONLINE,ONLINE,VENTA,0,2025-10-21 21:14:15,2025-10-21 21:14:15,ONLINE,ONLINE,ORDER,O-202400025,O-202400025,OL-0000074,OL-0000074,,C0059,C0059,1,P1035,P1035,1,Manta Brisa Set 2 uds,Textil hogar,Mantas,1,1.0,1.0,210.54,210.54,30,30.0,63.16,63.16,147.38,147.38,147.38,EUR,21,79.47,79.47,67.91,Tarjeta,Entregado,,,,O-202400025,OL-0000074,,,,,1,1,Manta Brisa Set 2 uds,218.12,Activo
F000075,ECOM,lineas_pedido.csv,ONLINE,ONLINE,VENTA,0,2025-10-21 21:14:15,2025-10-21 21:14:15,ONLINE,ONLINE,ORDER,O-202400025,O-202400025,OL-0000075,OL-0000075,,C0059,C0059,1,P1025,P1025,1,Figura Nórdico ★,Decoración,Figuras,2,2.0,2.0,93.77,93.77,,,,,187.54,187.54,187.54,EUR,21,46.11,92.22,95.32,Tarjeta,Entregado,,,,O-202400025,OL-0000075,,,,,1,1,Figura Nórdico ★,90.09,Descatalogado
F000076,ECOM,lineas_pedido.csv,ONLINE,ONLINE,VENTA,0,2025-10-21 21:14:15,2025-10-21 21:14:15,ONLINE,ONLINE,ORDER,O-202400025,O-202400025,OL-0000076,OL-0000076,,C0059,C0059,1,p1060,P1060,1,Cortina Luna 200x300,Textil hogar,Cortinas,1,1.0,1.0,55.46,55.46,0,0.0,0.00,0.0,55.46,55.46,55.46,EUR,21,37.18,37.18,18.28,Tarjeta,Entregado,,,,O-202400025,OL-0000076,,,,,1,1,Cortina Luna 200x300,55.79,Descatalogado
F000077,ECOM,lineas_pedido.csv,ONLINE,ONLINE,VENTA,0,2025-10-21 21:14:15,2025-10-21 21:14:15,ONLINE,ONLINE,ORDER,O-202400025,O-202400025,OL-0000077,OL-0000077,,C0059,C0059,1,P1074,P1074,1,Sábana Vintage Pack 4,Textil hogar,Sábanas,1,1.0,1.0,99.50,99.5,,,,,"99,50",99.5,99.5,EUR,21,73.38,73.38,26.120000000000005,Tarjeta,Entregado,,,,O-202400025,OL-0000077,,,,,1,1,Sábana Vintage Pack 4,98.89,Activo
F000078,ECOM,lineas_pedido.csv,ONLINE,ONLINE,VENTA,0,2024-09-18 06:53:15,2024-09-18 06:53:15,ONLINE,ONLINE,ORDER,O-202400026,O-202400026,OL-0000078,OL-0000078,,C0034,C0034,1,P1004,P1004,1,Cama Sol 120cm,decoración,Camas,2,2.0,2.0,"1121,66",1121.66,,,,,2243.32,2243.32,2243.32,EUR,21,,,,Transferencia,Entregado,,,,O-202400026,OL-0000078,,,,,1,1,Cama Sol 120cm,1131.94,Activo
F000079,ECOM,lineas_pedido.csv,ONLINE,ONLINE,VENTA,0,2024-09-18 06:53:15,2024-09-18 06:53:15,ONLINE,ONLINE,ORDER,O-202400026,O-202400026,OL-0000079,OL-0000079,,C0034,C0034,1,P1037,P1037,1,"Bombilla Boreal ""Star""",Iluminación,Bombillas,3,3.0,3.0,"49,21",49.21,5,5.0,7,7.0,140.25,140.25,140.25,EUR,21,25.43,76.28999999999999,63.96000000000001,Transferencia,Entregado,,,,O-202400026,OL-0000079,,,,,1,1,"Bombilla Boreal ""Star""",50.59,Descatalogado
F000080,ECOM,lineas_pedido.csv,ONLINE,ONLINE,VENTA,0,2025-06-21 07:50:50,2025-06-21 07:50:50,ONLINE,ONLINE,ORDER,O-202400027,O-202400027,OL-0000080,OL-0000080,,C0045,C0045,1, P1078,P1078,1,Estantería Atlas 160cm,Muebles,Estanterías,2,2.0,2.0,735.86,735.86,,,,,"1471,72",1471.72,1471.72,EUR,21,497.07,994.14,477.58000000000004,ApplePay,Entregado,marketplace,,,O-202400027,OL-0000080,,,,,1,1,Estantería Atlas 160cm,702.02,Activo
F000081,ECOM,lineas_pedido.csv,ONLINE,ONLINE,VENTA,0,2025-06-21 07:50:50,2025-06-21 07:50:50,ONLINE,ONLINE,ORDER,O-202400027,O-202400027,OL-0000081,OL-0000081,,C0045,C0045,1,P1020,P1020,1,Alfombra Zen 200x300,Textil hogar,Alfombras,1,1.0,1.0,116.44,116.44,30,30.0,34.93,34.93,"81,51",81.51,81.51,EUR,21,40.67,40.67,40.84,ApplePay,Entregado,marketplace,,,O-202400027,OL-0000081,,,,,1,1,Alfombra Zen 200x300,112.47,Activo
F000082,ECOM,lineas_pedido.csv,ONLINE,ONLINE,VENTA,0,2025-06-21 07:50:50,2025-06-21 07:50:50,ONLINE,ONLINE,ORDER,O-202400027,O-202400027,OL-0000082,OL-0000082,,C0045,C0045,1,P1018,P1018,1,Cojine Minimal ★,Decoración,Cojines,1,1.0,1.0,,,25,25.0,€44.28,44.28,€132.85,132.85,132.85,EUR,21,130.86,130.86,1.9899999999999807,ApplePay,Entregado,marketplace,,,O-202400027,OL-0000082,,,,,1,1,Cojine Minimal ★,179.25,Descatalogado
F000083,ECOM,lineas_pedido.csv,ONLINE,ONLINE,VENTA,0,2025-06-21 07:50:50,2025-06-21 07:50:50,ONLINE,ONLINE,ORDER,O-202400027,O-202400027,OL-0000083,OL-0000083,,C0045,C0045,1,P1097,P1097,1,Sofá Eco 120cm,Muebles,Sofás,2,2.0,2.0,805.04,805.04,,,,,1610.08,1610.08,1610.08,EUR,21,480.42,960.84,649.2399999999999,ApplePay,Entregado,marketplace,,,O-202400027,OL-0000083,,,,,1,1,Sofá Eco 120cm,768.59,Activo
F000084,ECOM,lineas_pedido.csv,ONLINE,ONLINE,VENTA,0,2024-03-19 01:56:32,2024-03-19 01:56:32,ONLINE,ONLINE,ORDER,O-202400028,O-202400028,OL-0000084,OL-0000084,,C0091,C0091,1,P1085,P1085,1,Sofá Boreal Compact,Muebles,Sofás,2,2.0,2.0,1043.81,1043.81,0,0.0,0.00,0.0,2087.62,2087.62,2087.62,EUR,21,551.98,1103.96,983.6599999999999,PayPal,En preparación,,,,O-202400028,OL-0000084,,,,,1,1,Sofá Boreal Compact,1142.37,Descatalogado
F000085,ECOM,lineas_pedido.csv,ONLINE,ONLINE,VENTA,0,2024-03-19 01:56:32,2024-03-19 01:56:32,ONLINE,ONLINE,ORDER,O-202400028,O-202400028,OL-0000085,OL-0000085,,C0091,C0091,1,P1064,P1064,1,Estantería Minimal 120cm,Muebles,Estanterías,1,1.0,1.0,447.29,447.29,0,0.0,0.00,0.0,447.29,447.29,447.29,EUR,21,210.29,210.29,237.00000000000003,PayPal,En preparación,,,,O-202400028,OL-0000085,,,,,1,1,Estantería Minimal 120cm,447.43,Activo
F000086,ECOM,lineas_pedido.csv,ONLINE,ONLINE,VENTA,0,2025-01-16 22:49:13,2025-01-16 22:49:13,ONLINE,ONLINE,ORDER,O-202400029,O-202400029,OL-0000086,OL-0000086,,C0073,C0073,1,P1063,P1063,1,Armario Brisa 160cm,Muebles,Armarios,1,1.0,1.0,"426,38",426.38,15,15.0,63.96,63.96,362.42,362.42,362.42,EUR,21,318.23,318.23,44.19,BIZUM,Entregado,app,,,O-202400029,OL-0000086,,,,,1,1,Armario Brisa 160cm,433.43,Activo
F000087,ECOM,lineas_pedido.csv,ONLINE,ONLINE,VENTA,0,2025-01-16 22:49:13,2025-01-16 22:49:13,ONLINE,ONLINE,ORDER,O-202400029,O-202400029,OL-0000087,OL-0000087,,C0073,C0073,1,p1005,P1005,1,Producto desconocido,Decoración,Cuadros,1,1.0,1.0,318.82,318.82,15,15.0,47.82,47.82,271.00,271.0,271.0,EUR,21,98.34,98.34,172.66,BIZUM,Entregado,app,,,O-202400029,OL-0000087,,,,,1,1,Cuadro Luna ★,180.29,Activo
F000088,ECOM,lineas_pedido.csv,ONLINE,ONLINE,VENTA,0,2025-01-16 22:49:13,2025-01-16 22:49:13,ONLINE,ONLINE,ORDER,O-202400029,O-202400029,OL-0000088,OL-0000088,,C0073,C0073,1,p10X1,P10X1,0,Producto desconocido,,,1,1.0,1.0,€597.10,597.1,,,,,597.10,597.1,597.1,EUR,,,,,BIZUM,Entregado,app,,,O-202400029,OL-0000088,,,,,1,1,,,
F000089,ECOM,lineas_pedido.csv,ONLINE,ONLINE,VENTA,0,2025-01-16 22:49:13,2025-01-16 22:49:13,ONLINE,ONLINE,ORDER,O-202400029,O-202400029,OL-0000089,OL-0000089,,C0073,C0073,1,P1061,P1061,1,Sábana Minimal 200x300,Textil hogar,Sábanas,1,1.0,1.0,"205,89",205.89,0,0.0,0.00,0.0,205.89,205.89,205.89,EUR,21,128.73,128.73,77.16,BIZUM,Entregado,app,,,O-202400029,OL-0000089,,,,,1,1,Sábana Minimal 200x300,200.88,Activo
F000090,ECOM,lineas_pedido.csv,ONLINE,ONLINE,VENTA,0,2025-01-16 22:49:13,2025-01-16 22:49:13,ONLINE,ONLINE,ORDER,O-202400029,O-202400029,OL-0000090,OL-0000090,,C0073,C0073,1,P1020,P1020,1,Alfombra Zen 200x300,Textil hogar,Alfombras,2,2.0,2.0,116.31,116.31,5,5.0,"11,63",11.63,220.99,220.99,220.99,EUR,21,40.67,81.34,139.65,BIZUM,Entregado,app,,,O-202400029,OL-0000090,,,,,1,1,Alfombra Zen 200x300,112.47,Activo
F000091,ECOM,lineas_pedido.csv,ONLINE,ONLINE,VENTA,0,2025-04-30 20:26:43,2025-04-30 20:26:43,ONLINE,ONLINE,ORDER,O-202400030,O-202400030,OL-0000091,OL-0000091,,C0010,C0010,1,P1035,P1035,1,Manta Brisa Set 2 uds,Textil hogar,Mantas,1,1.0,1.0,"224,87",224.87,,,,,"224,87",224.87,224.87,EUR,21,79.47,79.47,145.4,Bizum,Pendiente,web,,,O-202400030,OL-0000091,,,,,1,1,Manta Brisa Set 2 uds,218.12,Activo
F000092,ECOM,lineas_pedido.csv,ONLINE,ONLINE,VENTA,0,2025-04-30 20:26:43,2025-04-30 20:26:43,ONLINE,ONLINE,ORDER,O-202400030,O-202400030,OL-0000092,OL-0000092,,C0010,C0010,1,P9999,P9999,0,Producto desconocido,,,1,1.0,1.0,744.78,744.78,,,,,744.78,744.78,744.78,EUR,,,,,Bizum,Pendiente,web,,,O-202400030,OL-0000092,,,,,1,1,,,
F000093,ECOM,lineas_pedido.csv,ONLINE,ONLINE,VENTA,0,2025-04-30 20:26:43,2025-04-30 20:26:43,ONLINE,ONLINE,ORDER,O-202400030,O-202400030,OL-0000093,OL-0000093,,C0010,C0010,1,P1013,P1013,1,"Lámparas techo Brisa ""Star""",Iluminación,Lámparas techo,1,1.0,1.0,307.58,307.58,20,20.0,61.52,61.52,246.06,246.06,246.06,EUR,21,220.42,220.42,25.640000000000015,Bizum,Pendiente,web,,,O-202400030,OL-0000093,,,,,1,1,"Lámparas techo Brisa ""Star""",313.25,Activo
F000094,ECOM,lineas_pedido.csv,ONLINE,ONLINE,VENTA,0,2025-04-30 20:26:43,2025-04-30 20:26:43,ONLINE,ONLINE,ORDER,O-202400030,O-202400030,OL-0000094,OL-0000094,,C0010,C0010,1,P1039,P1039,1,Cuadro Nórdico ★,Decoración,Cuadros,1,1.0,1.0,215.09,215.09,5,5.0,10.75,10.75,204.34,204.34,204.34,EUR,21,84.28,84.28,120.06,Bizum,Pendiente,web,,,O-202400030,OL-0000094,,,,,1,1,Cuadro Nórdico ★,237.04,Descatalogado
F000095,ECOM,lineas_pedido.csv,ONLINE,ONLINE,VENTA,0,2025-04-30 20:26:43,2025-04-30 20:26:43,ONLINE,ONLINE,ORDER,O-202400030,O-202400030,OL-0000095,OL-0000095,,C0010,C0010,1,P1014,P1014,1,Cuadro Zen ★,Decoración,Cuadros,1,1.0,1.0,70.07,70.07,,,,,"70,07",70.07,70.07,EUR,21,42.36,42.36,27.709999999999994,Bizum,Pendiente,web,,,O-202400030,OL-0000095,,,,,1,1,Cuadro Zen ★,68.99,Descatalogado
F000096,ECOM,lineas_pedido.csv,ONLINE,ONLINE,VENTA,0,2025-02-26 23:22:42,2025-02-26 23:22:42,ONLINE,ONLINE,ORDER,O-202400031,O-202400031,OL-0000096,OL-0000096,,C0008,C0008,1,P1048,P1048,1,Mesa Minimal 160cm,Muebles,Mesas,1,1.0,1.0,459.51,459.51,5,5.0,€22.98,22.98,437,437.0,437.0,EUR,21,205.56,205.56,231.44,Tarjeta,Entregado,web,,,O-202400031,OL-0000096,,,,,1,1,Mesa Minimal 160cm,469.1,Activo
F000097,ECOM,lineas_pedido.csv,ONLINE,ONLINE,VENTA,0,2025-02-26 23:22:42,2025-02-26 23:22:42,ONLINE,ONLINE,ORDER,O-202400031,O-202400031,OL-0000097,OL-0000097,,C0008,C0008,1,P1055,P1055,1,Cuadro Luna ★,Decoración,Cuadros,2,2.0,2.0,117.96,117.96,10,10.0,24,24.0,212.33,212.33,212.33,EUR,21,77.33,154.66,57.670000000000016,Tarjeta,Entregado,web,,,O-202400031,OL-0000097,,,,,1,1,Cuadro Luna ★,124.61,Activo
F000098,ECOM,lineas_pedido.csv,ONLINE,ONLINE,VENTA,0,2025-02-26 23:22:42,2025-02-26 23:22:42,ONLINE,ONLINE,ORDER,O-202400031,O-202400031,OL-0000098,OL-0000098,,C0008,C0008,1,P1064,P1064,1,Estantería Minimal 120cm,Muebles,Estanterías,1,1.0,1.0,461.47,461.47,,,,,"461,47",461.47,461.47,EUR,21,210.29,210.29,251.18000000000004,Tarjeta,Entregado,web,,,O-202400031,OL-0000098,,,,,1,1,Estantería Minimal 120cm,447.43,Activo
F000099,ECOM,lineas_pedido.csv,ONLINE,ONLINE,VENTA,0,2024-06-26 19:27:37,2024-06-26 19:27:37,ONLINE,ONLINE,ORDER,O-202400032,O-202400032,OL-0000099,OL-0000099,,CX123,CX123,0, P1029,P1029,1,Figura Luna ★,Decoración,Figuras,3,3.0,3.0,48.09,48.09,30,30.0,43.28,43.28,€100.99,100.99,100.99,EUR,21,24.65,73.94999999999999,27.040000000000006,Tarjeta,Entregado,marketplace,,,O-202400032,OL-0000099,,,,,1,1,Figura Luna ★,52.11,Activo
F000100,ECOM,lineas_pedido.csv,ONLINE,ONLINE,VENTA,0,2024/11/15 17:37:14,2024-11-15 17:37:14,ONLINE,ONLINE,ORDER,O-202400033,O-202400033,OL-0000100,OL-0000100,,,,0,P1013,P1013,1,"Lámparas techo Brisa ""Star""",Iluminación,Lámparas techo,4,4.0,4.0,320,320.0,30,30.0,384.28,384.28,896.64,896.64,896.64,EUR,21,220.42,881.68,14.960000000000036,Tarjeta,Entregado,,,,O-202400033,OL-0000100,,,,,1,1,"Lámparas techo Brisa ""Star""",313.25,Activo
F000101,ECOM,lineas_pedido.csv,ONLINE,ONLINE,VENTA,0,2025-04-30 18:27:50,2025-04-30 18:27:50,ONLINE,ONLINE,ORDER,O-202400034,O-202400034,OL-0000101,OL-0000101,,C0037,C0037,1,P1068,P1068,1,"Lámparas mesa Minimal ""Star""",Iluminación,Lámparas mesa,1,1.0,1.0,49.74,49.74,,,,,€49.74,49.74,49.74,EUR,21,22.52,22.52,27.220000000000002,PayPal,Entregado,,,,O-202400034,OL-0000101,,,,,1,1,"Lámparas mesa Minimal ""Star""",50.41,Descatalogado
F000102,ECOM,lineas_pedido.csv,ONLINE,ONLINE,VENTA,0,2025-04-30 18:27:50,2025-04-30 18:27:50,ONLINE,ONLINE,ORDER,O-202400034,O-202400034,OL-0000102,OL-0000102,,C0037,C0037,1,P1081,P1081,1,"Bombilla Élite ""Star""",Iluminación,Bombillas,2,2.0,2.0,"359,73",359.73,,,,,719.46,719.46,719.46,EUR,21,269.44,538.88,180.58000000000004,PayPal,Entregado,,,,O-202400034,OL-0000102,,,,,1,1,"Bombilla Élite ""Star""",385.02,Activo
F000103,ECOM,lineas_pedido.csv,ONLINE,ONLINE,VENTA,0,2025-04-30 18:27:50,2025-04-30 18:27:50,ONLINE,ONLINE,ORDER,O-202400034,O-202400034,OL-0000103,OL-0000103,,C0037,C0037,1,P1081,P1081,1,"Bombilla Élite ""Star""",Iluminación,Bombillas,3,3.0,3.0,,,10,10.0,115.99,115.99,"1043,93",1043.93,1043.93,EUR,21,269.44,808.3199999999999,235.61000000000013,PayPal,Entregado,,,,O-202400034,OL-0000103,,,,,1,1,"Bombilla Élite ""Star""",385.02,Activo
F000104,ECOM,lineas_pedido.csv,ONLINE,ONLINE,VENTA,0,2025-01-01 18:48:53,2025-01-01 18:48:53,ONLINE,ONLINE,ORDER,O-202400035,O-202400035,OL-0000104,OL-0000104,,,,0,P1036,P1036,1,Cortina Aurora 90x200,Textil hogar,Cortinas,1,1.0,1.0,"27,20",27.2,25,25.0,6.80,6.8,20.40,20.4,20.4,EUR,21,18.23,18.23,2.169999999999998,Bizum,Cancelado,,,,O-202400035,OL-0000104,,,,,1,1,Cortina Aurora 90x200,26.11,Activo
F000105,ECOM,lineas_pedido.csv,ONLINE,ONLINE,VENTA,0,2025-01-01 18:48:53,2025-01-01 18:48:53,ONLINE,ONLINE,ORDER,O-202400035,O-202400035,OL-0000105,OL-0000105,,,,0,P1010,P1010,1,Cama Sol Compact,Muebles,Camas,1,1.0,1.0,904.27,904.27,5,5.0,45.21,45.21,859.06,859.06,859.06,EUR,21,429.38,429.38,429.67999999999995,Bizum,Cancelado,,,,O-202400035,OL-0000105,,,,,1,1,Cama Sol Compact,902.67,Activo
F000106,ECOM,lineas_pedido.csv,ONLINE,ONLINE,VENTA,0,2025-01-01 18:48:53,2025-01-01 18:48:53,ONLINE,ONLINE,ORDER,O-202400035,O-202400035,OL-0000106,OL-0000106,,,,0,P1083,P1083,1,"Aplique Aurora ""Star""",Iluminación,,1,1.0,1.0,,,,,,,,0.0,0.0,EUR,21,219.73,219.73,-219.73,Bizum,Cancelado,,,,O-202400035,OL-0000106,,,,,1,1,"Aplique Aurora ""Star""",393.42,Activo
F000107,ECOM,lineas_pedido.csv,ONLINE,ONLINE,VENTA,0,2024-09-25 01:34:35,2024-09-25 01:34:35,ONLINE,ONLINE,ORDER,O-202400036,O-202400036,OL-0000107,OL-0000107,,C0101,C0101,0,P1018,P1018,1,Cojine Minimal ★,Decoración,Cojines,1,1.0,1.0,186.08,186.08,,,,,€186.08,186.08,186.08,EUR,21,130.86,130.86,55.22,Transferencia,En preparación,web,,,O-202400036,OL-0000107,,,,,1,1,Cojine Minimal ★,179.25,Descatalogado
F000108,ECOM,lineas_pedido.csv,ONLINE,ONLINE,VENTA,0,2024-09-25 01:34:35,2024-09-25 01:34:35,ONLINE,ONLINE,ORDER,O-202400036,O-202400036,OL-0000108,OL-0000108,,C0101,C0101,0,P1022,P1022,1,Armario Aurora 120cm,Muebles,Armarios,1,1.0,1.0,"810,95",810.95,,,,,810.95,810.95,810.95,EUR,21,537.32,537.32,273.63,Transferencia,En preparación,web,,,O-202400036,OL-0000108,,,,,1,1,Armario Aurora 120cm,827.7,Activo
F000109,ECOM,lineas_pedido.csv,ONLINE,ONLINE,VENTA,0,2024-09-25 01:34:35,2024-09-25 01:34:35,ONLINE,ONLINE,ORDER,O-202400036,O-202400036,OL-0000109,OL-0000109,,C0101,C0101,0,P1083,P1083,1,"Aplique Aurora ""Star""",Iluminación,,1,1.0,1.0,381.02,381.02,25,25.0,95,95.0,285.77,285.77,285.77,EUR,21,219.73,219.73,66.03999999999999,Transferencia,En preparación,web,,,O-202400036,OL-0000109,,,,,1,1,"Aplique Aurora ""Star""",393.42,Activo
F000110,ECOM,lineas_pedido.csv,ONLINE,ONLINE,VENTA,0,2024/04/08 01:24:03,2024-04-08 01:24:03,ONLINE,ONLINE,ORDER,O-202400037,O-202400037,OL-0000110,OL-0000110,,,,0,P1076,P1076,1,Cortina Eco 200x300,Textil hogar,Cortinas,1,1.0,1.0,206,206.0,5,5.0,10.31,10.31,"195,96",195.96,195.96,EUR,21,77.52,77.52,118.44000000000001,Bizum,Entregado,,,,O-202400037,OL-0000110,,,,,1,1,Cortina Eco 200x300,219.17,Descatalogado
F000111,ECOM,lineas_pedido.csv,ONLINE,ONLINE,VENTA,0,2024/04/08 01:24:03,2024-04-08 01:24:03,ONLINE,ONLINE,ORDER,O-202400037,O-202400037,OL-0000111,OL-0000111,,,,0,P1022,P1022,1,Armario Aurora 120cm,Muebles,Armarios,2,2.0,2.0,774.16,774.16,0,0.0,€0.00,0.0,1548.32,1548.32,1548.32,EUR,21,537.32,1074.64,473.67999999999984,Bizum,Entregado,,,,O-202400037,OL-0000111,,,,,1,1,Armario Aurora 120cm,827.7,Activo
F000112,ECOM,lineas_pedido.csv,ONLINE,ONLINE,VENTA,0,2024-09-02 22:59:30,2024-09-02 22:59:30,ONLINE,ONLINE,ORDER,O-202400038,O-202400038,OL-0000112,OL-0000112,,C0080,C0080,1,P1026,P1026,1,Cuadro Vintage ★,Decoración,Cuadros,1,1.0,1.0,80.28,80.28,30,30.0,24.08,24.08,56.20,56.2,56.2,EUR,21,33.86,33.86,22.340000000000003,Tarjeta,Entregado,app,,,O-202400038,OL-0000112,,,,,1,1,Cuadro Vintage ★,86.77,Activo
F000113,ECOM,lineas_pedido.csv,ONLINE,ONLINE,VENTA,0,2024-09-02 22:59:30,2024-09-02 22:59:30,ONLINE,ONLINE,ORDER,O-202400038,O-202400038,OL-0000113,OL-0000113,,C0080,C0080,1,P1003,P1003,1,Espejo Atlas ★,Decoración,Espejos,1,1.0,1.0,253.73,253.73,0,0.0,"0,00",0.0,253.73,253.73,253.73,EUR,21,160.81,160.81,92.91999999999999,Tarjeta,Entregado,app,,,O-202400038,OL-0000113,,,,,1,1,Espejo Atlas ★,264.87,Descatalogado
F000114,ECOM,lineas_pedido.csv,ONLINE,ONLINE,VENTA,0,2024-09-02 22:59:30,2024-09-02 22:59:30,ONLINE,ONLINE,ORDER,O-202400038,O-202400038,OL-0000114,OL-0000114,,C0080,C0080,1,P1082,P1082,1,Vela Vintage ★,Decoración,Velas,2,2.0,2.0,"233,19",233.19,5,5.0,"23,32",23.32,€443.06,443.06,443.06,EUR,21,161.63,323.26,119.80000000000001,Tarjeta,Entregado,app,,,O-202400038,OL-0000114,,,,,1,1,Vela Vintage ★,229.75,Activo
F000115,ECOM,lineas_pedido.csv,ONLINE,ONLINE,VENTA,0,2024-09-02 22:59:30,2024-09-02 22:59:30,ONLINE,ONLINE,ORDER,O-202400038,O-202400038,OL-0000115,OL-0000115,,C0080,C0080,1,P1002,P1002,1,Sábana Brisa 90x200,Textil hogar,Sábanas,0,0.0,0.0,160.62,160.62,,,,,€0.00,0.0,0.0,EUR,21,106.71,0.0,0.0,Tarjeta,Entregado,app,,,O-202400038,OL-0000115,,,,,1,1,Sábana Brisa 90x200,169.18,Activo
F000116,ECOM,lineas_pedido.csv,ONLINE,ONLINE,VENTA,0,2024-09-02 22:59:30,2024-09-02 22:59:30,ONLINE,ONLINE,ORDER,O-202400038,O-202400038,OL-0000116,OL-0000116,,C0080,C0080,1, P1034,P1034,1,Jarrone Atlas ★,Decoración,Jarrones,1,1.0,1.0,270.02,270.02,-5,-5.0,"-13,50",-13.5,283.52,283.52,283.52,EUR,21,197.13,197.13,86.38999999999999,Tarjeta,Entregado,app,,,O-202400038,OL-0000116,,,,,1,1,Jarrone Atlas ★,295.57,Activo
F000117,ECOM,lineas_pedido.csv,ONLINE,ONLINE,VENTA,0,2024-09-02 22:59:30,2024-09-02 22:59:30,ONLINE,ONLINE,ORDER,O-202400038,O-202400038,OL-0000117,OL-0000117,,C0080,C0080,1,P1066,P1066,1,Jarrón Brisa 💠,Iluminación,Lámparas pie,1,1.0,1.0,"84,11",84.11,25,25.0,21.03,21.03,63.08,63.08,63.08,EUR,21,62.67,62.67,0.4099999999999966,Tarjeta,Entregado,app,,,O-202400038,OL-0000117,,,,,1,1,Jarrón Brisa 💠,85.56,Activo
F000118,ECOM,lineas_pedido.csv,ONLINE,ONLINE,VENTA,0,2024-05-12 00:43:29,2024-05-12 00:43:29,ONLINE,ONLINE,ORDER,O-202400039,O-202400039,OL-0000118,OL-0000118,,C0064,C0064,1,P1081,P1081,1,"Bombilla Élite ""Star""",Iluminación,Bombillas,4,4.0,4.0,€367.54,367.54,20,20.0,294.03,294.03,"1176,13",1176.13,1176.13,EUR,21,269.44,1077.76,98.37000000000012,,Entregado,app,,,O-202400039,OL-0000118,,,,,1,1,"Bombilla Élite ""Star""",385.02,Activo
F000119,ECOM,lineas_pedido.csv,ONLINE,ONLINE,VENTA,0,2024-05-12 00:43:29,2024-05-12 00:43:29,ONLINE,ONLINE,ORDER,O-202400039,O-202400039,OL-0000119,OL-0000119,,C0064,C0064,1,SKU-9999,SKU-9999,0,,,,4,4.0,4.0,619,619.0,,,,,€2474.44,2474.44,2474.44,EUR,,,,,,Entregado,app,,,O-202400039,OL-0000119,,,,,1,1,,,
F000120,ECOM,lineas_pedido.csv,ONLINE,ONLINE,VENTA,0,2024-05-12 00:43:29,2024-05-12 00:43:29,ONLINE,ONLINE,ORDER,O-202400039,O-202400039,OL-0000120,OL-0000120,,C0064,C0064,1,P9999,P9999,0,Producto desconocido,,,1,1.0,1.0,553.49,553.49,25,25.0,138.37,138.37,415.12,415.12,415.12,EUR,,,,,,Entregado,app,,,O-202400039,OL-0000120,,,,,1,1,,,
F000121,ECOM,lineas_pedido.csv,ONLINE,ONLINE,VENTA,0,2024-05-12 00:43:29,2024-05-12 00:43:29,ONLINE,ONLINE,ORDER,O-202400039,O-202400039,OL-0000121,OL-0000121,,C0064,C0064,1,P1035,P1035,1,Manta Brisa Set 2 uds,Textil hogar,Mantas,1,1.0,1.0,€216.04,216.04,20,20.0,43.21,43.21,"172,83",172.83,172.83,EUR,21,79.47,79.47,93.36000000000001,,Entregado,app,,,O-202400039,OL-0000121,,,,,1,1,Manta Brisa Set 2 uds,218.12,Activo
F000122,ECOM,lineas_pedido.csv,ONLINE,ONLINE,VENTA,0,2024-05-12 00:43:29,2024-05-12 00:43:29,ONLINE,ONLINE,ORDER,O-202400039,O-202400039,OL-0000122,OL-0000122,,C0064,C0064,1,P1016,P1016,1,"Aplique Élite ""Star""",Iluminación,Apliques,1,1.0,1.0,"290,32",290.32,0,0.0,"0,00",0.0,"290,32",290.32,290.32,EUR,21,126.21,126.21,164.11,,Entregado,app,,,O-202400039,OL-0000122,,,,,1,1,"Aplique Élite ""Star""",300.77,Descatalogado
F000123,ECOM,lineas_pedido.csv,ONLINE,ONLINE,VENTA,0,2024-10-25 19:12:06,2024-10-25 19:12:06,ONLINE,ONLINE,ORDER,O-202400040,O-202400040,OL-0000123,OL-0000123,,C0038,C0038,1,P1080,P1080,1,Espejo Boreal ★,Decoración,Espejos,2,2.0,2.0,€188.33,188.33,30,30.0,113.00,113.0,,263.66,263.66,EUR,21,95.67,191.34,72.32000000000002,ApplePay,Entregado,app,,,O-202400040,OL-0000123,,,,,1,1,Espejo Boreal ★,202.14,Activo
F000124,ECOM,lineas_pedido.csv,ONLINE,ONLINE,VENTA,0,2025-05-02 23:23:36,2025-05-02 23:23:36,ONLINE,ONLINE,ORDER,O-202400041,O-202400041,OL-0000124,OL-0000124,,,,0,P1066,P1066,1,Jarrón Brisa 💠,Iluminación,Lámparas pie,1,1.0,1.0,78.16,78.16,,,,,€78.16,78.16,78.16,EUR,21,62.67,62.67,15.489999999999995,ContraReembolso,Devuelto Parcial,marketplace,,,O-202400041,OL-0000124,,,,,1,1,Jarrón Brisa 💠,85.56,Activo
F000125,ECOM,lineas_pedido.csv,ONLINE,ONLINE,VENTA,0,2025-05-02 23:23:36,2025-05-02 23:23:36,ONLINE,ONLINE,ORDER,O-202400041,O-202400041,OL-0000125,OL-0000125,,,,0,P1071,P1071,1,"Bombilla Aurora ""Star""",Iluminación,Bombillas,1,1.0,1.0,126.87,126.87,30,30.0,€38.06,38.06,88.81,88.81,88.81,EUR,21,81.49,81.49,7.320000000000007,ContraReembolso,Devuelto Parcial,marketplace,,,O-202400041,OL-0000125,,,,,1,1,"Bombilla Aurora ""Star""",136.91,Descatalogado
F000126,ECOM,lineas_pedido.csv,ONLINE,ONLINE,VENTA,0,10/12/2025 23:06,2025-12-10 23:06:00,ONLINE,ONLINE,ORDER,O-202400042,O-202400042,OL-0000126,OL-0000126,,,,0,P1056,P1056,1,Cortina Luna Set 2 uds,Textil hogar,Cortinas,1,1.0,1.0,206.98,206.98,15,15.0,"31,05",31.05,176,176.0,176.0,EUR,21,124.96,124.96,51.040000000000006,Bizum,Entregado,,,,O-202400042,OL-0000126,,,,,1,1,Cortina Luna Set 2 uds,218.54,Activo
F000127,ECOM,lineas_pedido.csv,ONLINE,ONLINE,VENTA,0,10/12/2025 23:06,2025-12-10 23:06:00,ONLINE,ONLINE,ORDER,O-202400042,O-202400042,OL-0000127,OL-0000127,,,,0,P1037,P1037,1,"Bombilla Boreal ""Star""",Iluminación,Bombillas,2,2.0,2.0,"47,15",47.15,,,,,94.30,94.3,94.3,EUR,21,25.43,50.86,43.44,Bizum,Entregado,,,,O-202400042,OL-0000127,,,,,1,1,"Bombilla Boreal ""Star""",50.59,Descatalogado
F000128,ECOM,lineas_pedido.csv,ONLINE,ONLINE,VENTA,0,10/12/2025 23:06,2025-12-10 23:06:00,ONLINE,ONLINE,ORDER,O-202400042,O-202400042,OL-0000128,OL-0000128,,,,0,P1065,P1065,1,Sofá Atlas 3 plazas,Muebles,Sofás,1,1.0,1.0,1103.94,1103.94,,,,,"1103,94",1103.94,1103.94,EUR,21,412.52,412.52,691.4200000000001,Bizum,Entregado,,,,O-202400042,OL-0000128,,,,,1,1,Sofá Atlas 3 plazas,1087.01,Activo
F000129,ECOM,lineas_pedido.csv,ONLINE,ONLINE,VENTA,0,2025-09-30 18:58:10,2025-09-30 18:58:10,ONLINE,ONLINE,ORDER,O-202400043,O-202400043,OL-0000129,OL-0000129,,C0080,C0080,1,P1037,P1037,1,"Bombilla Boreal ""Star""",Iluminación,Bombillas,2,2.0,2.0,,,5,5.0,5.18,5.18,€98.38,98.38,98.38,EUR,21,25.43,50.86,47.519999999999996,Transferencia,Entregado,,,,O-202400043,OL-0000129,,,,,1,1,"Bombilla Boreal ""Star""",50.59,Descatalogado
F000130,ECOM,lineas_pedido.csv,ONLINE,ONLINE,VENTA,0,2025-09-30 18:58:10,2025-09-30 18:58:10,ONLINE,ONLINE,ORDER,O-202400043,O-202400043,OL-0000130,OL-0000130,,C0080,C0080,1,P1028,P1028,1,Sábana Zen 90x200,Textil hogar,Sábanas,2,2.0,2.0,74,74.0,5,5.0,7.43,7.43,,140.57,140.57,EUR,21,27.17,54.34,86.22999999999999,Transferencia,Entregado,,,,O-202400043,OL-0000130,,,,,1,1,Sábana Zen 90x200,71.04,Descatalogado
F000131,ECOM,lineas_pedido.csv,ONLINE,ONLINE,VENTA,0,2025-09-30 18:58:10,2025-09-30 18:58:10,ONLINE,ONLINE,ORDER,O-202400043,O-202400043,OL-0000131,OL-0000131,,C0080,C0080,1,P1042,P1042,1,Espejo Minimal ★,Decoración,Espejos,1,1.0,1.0,76.65,76.65,10,10.0,7.67,7.67,68.98,68.98,68.98,EUR,21,32.41,32.41,36.57000000000001,Transferencia,Entregado,,,,O-202400043,OL-0000131,,,,,1,1,Espejo Minimal ★,77.19,Activo
F000132,ECOM,lineas_pedido.csv,ONLINE,ONLINE,VENTA,0,2025-04-01 04:49:03,2025-04-01 04:49:03,ONLINE,ONLINE,ORDER,O-202400044,O-202400044,OL-0000132,OL-0000132,,C0063,C0063,1,p1005,P1005,1,Producto desconocido,Decoración,Cuadros,1,1.0,1.0,"95,69",95.69,-5,-5.0,-4.78,-4.78,100.47,100.47,100.47,EUR,21,98.34,98.34,2.1299999999999955,BIZUM,Entregado,,,,O-202400044,OL-0000132,,,,,1,1,Cuadro Luna ★,180.29,Activo
F000133,ECOM,lineas_pedido.csv,ONLINE,ONLINE,VENTA,0,2024-03-12 04:54:59,2024-03-12 04:54:59,ONLINE,ONLINE,ORDER,O-202400045,O-202400045,OL-0000133,OL-0000133,,c0077,C0077,1,P1022,P1022,1,Armario Aurora 120cm,Muebles,Armarios,2,2.0,2.0,860.66,860.66,,,,,1721.32,1721.32,1721.32,EUR,21,537.32,1074.64,646.6799999999998,Bizum,Devuelto Parcial,web,,,O-202400045,OL-0000133,,,,,1,1,Armario Aurora 120cm,827.7,Activo
F000134,ECOM,lineas_pedido.csv,ONLINE,ONLINE,VENTA,0,2024-03-12 04:54:59,2024-03-12 04:54:59,ONLINE,ONLINE,ORDER,O-202400045,O-202400045,OL-0000134,OL-0000134,,c0077,C0077,1,P1072,P1072,1,"Aplique Aurora ""Star""",Iluminación,Apliques,1,1.0,1.0,194,194.0,10,10.0,19.37,19.37,174.36,174.36,174.36,EUR,21,136.28,136.28,38.08000000000001,Bizum,Devuelto Parcial,web,,,O-202400045,OL-0000134,,,,,1,1,"Aplique Aurora ""Star""",213.45,Activo
F000135,ECOM,lineas_pedido.csv,ONLINE,ONLINE,VENTA,0,2024-03-12 04:54:59,2024-03-12 04:54:59,ONLINE,ONLINE,ORDER,O-202400045,O-202400045,OL-0000135,OL-0000135,,c0077,C0077,1,P1043,P1043,1,Cama Sol 3 plazas,Muebles,Camas,3,3.0,3.0,894.25,894.25,20,20.0,€536.55,536.55,"2146,20",2146.2,2146.2,EUR,21,315.71,947.1299999999999,1199.07,Bizum,Devuelto Parcial,web,,,O-202400045,OL-0000135,,,,,1,1,Cama Sol 3 plazas,871.01,Descatalogado
F000136,ECOM,lineas_pedido.csv,ONLINE,ONLINE,VENTA,0,2025-05-28 11:00:27,2025-05-28 11:00:27,ONLINE,ONLINE,ORDER,O-202400046,O-202400046,OL-0000136,OL-0000136,,,,0,p1006,P1006,1,Cortina Élite 200x300,Textil hogar,Cortinas,3,3.0,3.0,101.92,101.92,,,,,€307.72,307.72,307.72,EUR,21,62.96,188.88,118.84000000000003,Bizum,Entregado,marketplace,,,O-202400046,OL-0000136,,,,,1,1,Cortina Élite 200x300,113.02,Activo
F000137,ECOM,lineas_pedido.csv,ONLINE,ONLINE,VENTA,0,2025-05-28 11:00:27,2025-05-28 11:00:27,ONLINE,ONLINE,ORDER,O-202400046,O-202400046,OL-0000137,OL-0000137,,,,0,P1008,P1008,1,"Bombilla Nórdico ""Star""",Iluminación,Bombillas,1,1.0,1.0,29.65,29.65,5,5.0,1.48,1.48,"28,17",28.17,28.17,EUR,21,21.54,21.54,6.630000000000003,Bizum,Entregado,marketplace,,,O-202400046,OL-0000137,,,,,1,1,"Bombilla Nórdico ""Star""",28.73,Descatalogado
F000138,ECOM,lineas_pedido.csv,ONLINE,ONLINE,VENTA,0,2025-05-28 11:00:27,2025-05-28 11:00:27,ONLINE,ONLINE,ORDER,O-202400046,O-202400046,OL-0000138,OL-0000138,,,,0,P1004,P1004,1,Cama Sol 120cm,decoración,Camas,1,1.0,1.0,1091.50,1091.5,,,,,"1091,50",1091.5,1091.5,EUR,21,,,,Bizum,Entregado,marketplace,,,O-202400046,OL-0000138,,,,,1,1,Cama Sol 120cm,1131.94,Activo
F000139,ECOM,lineas_pedido.csv,ONLINE,ONLINE,VENTA,0,21/12/24,2024-12-21 00:00:00,ONLINE,ONLINE,ORDER,O-202400047,O-202400047,OL-0000139,OL-0000139,,,,0,P1061,P1061,1,Sábana Minimal 200x300,Textil hogar,Sábanas,1,1.0,1.0,206.35,206.35,25,25.0,51.59,51.59,154.76,154.76,154.76,EUR,21,128.73,128.73,26.03,ApplePay,Entregado,,,,O-202400047,OL-0000139,,,,,1,1,Sábana Minimal 200x300,200.88,Activo
F000140,ECOM,lineas_pedido.csv,ONLINE,ONLINE,VENTA,0,21/12/24,2024-12-21 00:00:00,ONLINE,ONLINE,ORDER,O-202400047,O-202400047,OL-0000140,OL-0000140,,,,0,p1041,P1041,1,Vela Luna ★,Decoración,Velas,1,1.0,1.0,114.44,114.44,15,15.0,17.17,17.17,97.27,97.27,97.27,EUR,21,51.47,51.47,45.8,ApplePay,Entregado,,,,O-202400047,OL-0000140,,,,,1,1,Vela Luna ★,120.85,Activo
F000141,ECOM,lineas_pedido.csv,ONLINE,ONLINE,VENTA,0,21/12/24,2024-12-21 00:00:00,ONLINE,ONLINE,ORDER,O-202400047,O-202400047,OL-0000141,OL-0000141,,,,0,P1042,P1042,1,Espejo Minimal ★,Decoración,Espejos,2,2.0,2.0,74.35,74.35,,,,,€158.99,158.99,158.99,EUR,21,32.41,64.82,94.17000000000002,ApplePay,Entregado,,,,O-202400047,OL-0000141,,,,,1,1,Espejo Minimal ★,77.19,Activo
F000142,ECOM,lineas_pedido.csv,ONLINE,ONLINE,VENTA,0,21/12/24,2024-12-21 00:00:00,ONLINE,ONLINE,ORDER,O-202400047,O-202400047,OL-0000142,OL-0000142,,,,0,P1049,P1049,1,"Lámparas techo Boreal ""Star""",Iluminación,Lámparas techo,1,1.0,1.0,384,384.0,,,,,,384.0,384.0,EUR,21,255.88,255.88,128.12,ApplePay,Entregado,,,,O-202400047,OL-0000142,,,,,1,1,"Lámparas techo Boreal ""Star""",368.25,Descatalogado
F000143,ECOM,lineas_pedido.csv,ONLINE,ONLINE,VENTA,0,27/01/2025 16:09,2025-01-27 16:09:00,ONLINE,ONLINE,ORDER,O-202400048,O-202400048,OL-0000143,OL-0000143,,,,0,P1023,P1023,1,"Aplique Élite ""Star""",Iluminación,Apliques,1,1.0,1.0,148.19,148.19,25,25.0,37.05,37.05,111.14,111.14,111.14,EUR,21,98.01,98.01,13.129999999999995,Bizum,Entregado,,,,O-202400048,OL-0000143,,,,,1,1,"Aplique Élite ""Star""",142.08,Descatalogado
F000144,ECOM,lineas_pedido.csv,ONLINE,ONLINE,VENTA,0,27/01/2025 16:09,2025-01-27 16:09:00,ONLINE,ONLINE,ORDER,O-202400048,O-202400048,OL-0000144,OL-0000144,,,,0,P1059,P1059,1,Armario Minimal 120cm,Muebles,Armarios,1,1.0,1.0,,,30,30.0,235.22,235.22,548.84,548.84,548.84,EUR,21,386.71,386.71,162.13000000000005,Bizum,Entregado,,,,O-202400048,OL-0000144,,,,,1,1,Armario Minimal 120cm,763.98,Activo
F000145,ECOM,lineas_pedido.csv,ONLINE,ONLINE,VENTA,0,2024-02-22 03:27:20,2024-02-22 03:27:20,ONLINE,ONLINE,ORDER,O-202400049,O-202400049,OL-0000145,OL-0000145,,,,0,P1021,P1021,1,"Bombilla Brisa ""Star""",Iluminación,Bombillas,1,1.0,1.0,275.49,275.49,0,0.0,0.00,0.0,275.49,275.49,275.49,EUR,21,153.44,153.44,122.05000000000001,Bizum,Entregado,,,,O-202400049,OL-0000145,,,,,1,1,"Bombilla Brisa ""Star""",305.88,Activo
F000146,ECOM,lineas_pedido.csv,ONLINE,ONLINE,VENTA,0,2024-06-23 04:13:38,2024-06-23 04:13:38,ONLINE,ONLINE,ORDER,O-202400050,O-202400050,OL-0000146,OL-0000146,,C0036,C0036,1,P1072,P1072,1,"Aplique Aurora ""Star""",Iluminación,Apliques,1,1.0,1.0,193.53,193.53,30,30.0,58.06,58.06,135.47,135.47,135.47,EUR,21,136.28,136.28,-0.8100000000000023,PayPal,Devuelto Parcial,web,,,O-202400050,OL-0000146,,,,,1,1,"Aplique Aurora ""Star""",213.45,Activo
F000147,ECOM,lineas_pedido.csv,ONLINE,ONLINE,VENTA,0,2024-06-23 04:13:38,2024-06-23 04:13:38,ONLINE,ONLINE,ORDER,O-202400050,O-202400050,OL-0000147,OL-0000147,,C0036,C0036,1,P1074,P1074,1,Sábana Vintage Pack 4,Textil hogar,Sábanas,1,1.0,1.0,98.75,98.75,,,,,98.75,98.75,98.75,EUR,21,73.38,73.38,25.370000000000005,PayPal,Devuelto Parcial,web,,,O-202400050,OL-0000147,,,,,1,1,Sábana Vintage Pack 4,98.89,Activo
F000148,ECOM,lineas_pedido.csv,ONLINE,ONLINE,VENTA,0,2024-06-23 04:13:38,2024-06-23 04:13:38,ONLINE,ONLINE,ORDER,O-202400050,O-202400050,OL-0000148,OL-0000148,,C0036,C0036,1,P1029,P1029,1,Figura Luna ★,Decoración,Figuras,1,1.0,1.0,"52,02",52.02,-5,-5.0,"-2,60",-2.6,55,55.0,55.0,EUR,21,24.65,24.65,30.35,PayPal,Devuelto Parcial,web,,,O-202400050,OL-0000148,,,,,1,1,Figura Luna ★,52.11,Activo
F000149,ECOM,lineas_pedido.csv,ONLINE,ONLINE,VENTA,0,2024-03-12 06:29:13,2024-03-12 06:29:13,ONLINE,ONLINE,ORDER,O-202400051,O-202400051,OL-0000149,OL-0000149,,C0048,C0048,1,P1016,P1016,1,"Aplique Élite ""Star""",Iluminación,Apliques,1,1.0,1.0,"276,61",276.61,,,,,€276.61,276.61,276.61,EUR,21,126.21,126.21,150.40000000000003,Bizum,Entregado,,,,O-202400051,OL-0000149,,,,,1,1,"Aplique Élite ""Star""",300.77,Descatalogado
F000150,ECOM,lineas_pedido.csv,ONLINE,ONLINE,VENTA,0,2024-03-12 06:29:13,2024-03-12 06:29:13,ONLINE,ONLINE,ORDER,O-202400051,O-202400051,OL-0000150,OL-0000150,,C0048,C0048,1,P1064,P1064,1,Estantería Minimal 120cm,Muebles,Estanterías,1,1.0,1.0,458.05,458.05,30,30.0,137.41,137.41,320.64,320.64,320.64,EUR,21,210.29,210.29,110.35,Bizum,Entregado,,,,O-202400051,OL-0000150,,,,,1,1,Estantería Minimal 120cm,447.43,Activo
F000151,ECOM,lineas_pedido.csv,ONLINE,ONLINE,VENTA,0,2024-03-12 06:29:13,2024-03-12 06:29:13,ONLINE,ONLINE,ORDER,O-202400051,O-202400051,OL-0000151,OL-0000151,,C0048,C0048,1,P1098,P1098,1,Espejo Boreal ★,Decoración,Espejos,1,1.0,1.0,"217,33",217.33,,,,,€217.33,217.33,217.33,EUR,21,,,,Bizum,Entregado,,,,O-202400051,OL-0000151,,,,,1,1,Espejo Boreal ★,216.71,Activo
F000152,ECOM,lineas_pedido.csv,ONLINE,ONLINE,VENTA,0,2025-02-13 06:45:49,2025-02-13 06:45:49,ONLINE,ONLINE,ORDER,O-202400052,O-202400052,OL-0000152,OL-0000152,,C0001,C0001,1,P1033,P1033,1,Cojine Sol ★,Decoración,Cojines,1,1.0,1.0,226.86,226.86,30,30.0,68.06,68.06,158.80,158.8,158.8,EUR,21,,,,PayPal,Entregado,web,,,O-202400052,OL-0000152,,,,,1,1,Cojine Sol ★,245.88,Descatalogado
F000153,ECOM,lineas_pedido.csv,ONLINE,ONLINE,VENTA,0,2025-02-13 06:45:49,2025-02-13 06:45:49,ONLINE,ONLINE,ORDER,O-202400052,O-202400052,OL-0000153,OL-0000153,,C0001,C0001,1,P1050,P1050,1,Cama Brisa Compact,Muebles,Camas,2,2.0,2.0,"174,00",174.0,15,15.0,52.20,52.2,295.80,295.8,295.8,EUR,21,115.02,230.04,65.76000000000002,PayPal,Entregado,web,,,O-202400052,OL-0000153,,,,,1,1,Cama Brisa Compact,190.66,Activo
F000154,ECOM,lineas_pedido.csv,ONLINE,ONLINE,VENTA,0,2024/12/04 19:43:21,2024-12-04 19:43:21,ONLINE,ONLINE,ORDER,O-202400053,O-202400053,OL-0000154,OL-0000154,,C0074,C0074,1,,,0,Producto desconocido,,,1,1.0,1.0,453.44,453.44,15,15.0,"68,02",68.02,"385,42",385.42,385.42,EUR,,,,,ContraReembolso,Entregado,app,,,O-202400053,OL-0000154,,,,,1,1,,,
F000155,ECOM,lineas_pedido.csv,ONLINE,ONLINE,VENTA,0,2024/12/04 19:43:21,2024-12-04 19:43:21,ONLINE,ONLINE,ORDER,O-202400053,O-202400053,OL-0000155,OL-0000155,,C0074,C0074,1,,,0,,,,1,1.0,1.0,790.58,790.58,5,5.0,"39,53",39.53,751.05,751.05,751.05,EUR,,,,,ContraReembolso,Entregado,app,,,O-202400053,OL-0000155,,,,,1,1,,,
F000156,ECOM,lineas_pedido.csv,ONLINE,ONLINE,VENTA,0,2024/12/04 19:43:21,2024-12-04 19:43:21,ONLINE,ONLINE,ORDER,O-202400053,O-202400053,OL-0000156,OL-0000156,,C0074,C0074,1,P1087,P1087,1,Jarrone Eco ★,Decoración,Jarrones,3,3.0,3.0,"197,40",197.4,20,20.0,€118.44,118.44,473.76,473.76,473.76,EUR,21,105.39,316.17,157.58999999999997,ContraReembolso,Entregado,app,,,O-202400053,OL-0000156,,,,,1,1,Jarrone Eco ★,192.94,Activo
F000157,ECOM,lineas_pedido.csv,ONLINE,ONLINE,VENTA,0,2024/12/04 19:43:21,2024-12-04 19:43:21,ONLINE,ONLINE,ORDER,O-202400053,O-202400053,OL-0000157,OL-0000157,,C0074,C0074,1,P1022,P1022,1,Armario Aurora 120cm,Muebles,Armarios,1,1.0,1.0,862.78,862.78,,,,,"862,78",862.78,862.78,EUR,21,537.32,537.32,325.4599999999999,ContraReembolso,Entregado,app,,,O-202400053,OL-0000157,,,,,1,1,Armario Aurora 120cm,827.7,Activo
F000158,ECOM,lineas_pedido.csv,ONLINE,ONLINE,VENTA,0,2024-02-29 07:48:53,2024-02-29 07:48:53,ONLINE,ONLINE,ORDER,O-202400054,O-202400054,OL-0000158,OL-0000158,,CX123,CX123,0,P1092,P1092,1,Armario Sol Compact,Muebles,Armarios,2,2.0,2.0,€541.07,541.07,,,,,1082,1082.0,1082.0,EUR,21,368.27,736.54,345.46000000000004,PayPal,En preparación,,,,O-202400054,OL-0000158,,,,,1,1,Armario Sol Compact,555.0,Descatalogado
F000159,ECOM,lineas_pedido.csv,ONLINE,ONLINE,VENTA,0,2024-02-29 07:48:53,2024-02-29 07:48:53,ONLINE,ONLINE,ORDER,O-202400054,O-202400054,OL-0000159,OL-0000159,,CX123,CX123,0,P1025,P1025,1,Figura Nórdico ★,Decoración,Figuras,1,1.0,1.0,93.66,93.66,20,20.0,18.73,18.73,74.93,74.93,74.93,EUR,21,46.11,46.11,28.820000000000007,PayPal,En preparación,,,,O-202400054,OL-0000159,,,,,1,1,Figura Nórdico ★,90.09,Descatalogado
F000160,ECOM,lineas_pedido.csv,ONLINE,ONLINE,VENTA,0,2024-02-29 07:48:53,2024-02-29 07:48:53,ONLINE,ONLINE,ORDER,O-202400054,O-202400054,OL-0000160,OL-0000160,,CX123,CX123,0,P1001,P1001,1,Cuadro Atlas ★,Decoración,Cuadros,3,3.0,3.0,"30,09",30.09,,,,,90.27,90.27,90.27,EUR,21,21.79,65.37,24.89999999999999,PayPal,En preparación,,,,O-202400054,OL-0000160,,,,,1,1,Cuadro Atlas ★,31.63,Activo
F000161,ECOM,lineas_pedido.csv,ONLINE,ONLINE,VENTA,0,2025-06-13 01:14:53,2025-06-13 01:14:53,ONLINE,ONLINE,ORDER,O-202400055,O-202400055,OL-0000161,OL-0000161,,C0081,C0081,1,P1001,P1001,1,Cuadro Atlas ★,Decoración,Cuadros,1,1.0,1.0,,,30,30.0,8.92,8.92,,-8.92,8.92,EUR,21,21.79,21.79,-30.71,Bizum,Entregado,,,,O-202400055,OL-0000161,,,,,1,1,Cuadro Atlas ★,31.63,Activo
F000162,ECOM,lineas_pedido.csv,ONLINE,ONLINE,VENTA,0,2025-06-13 01:14:53,2025-06-13 01:14:53,ONLINE,ONLINE,ORDER,O-202400055,O-202400055,OL-0000162,OL-0000162,,C0081,C0081,1,P1053,P1053,1,"Aplique Nórdico ""Star""",Iluminación,,1,1.0,1.0,223.21,223.21,30,30.0,66.96,66.96,€156.25,156.25,156.25,EUR,21,114.35,114.35,41.900000000000006,Bizum,Entregado,,,,O-202400055,OL-0000162,,,,,1,1,"Aplique Nórdico ""Star""",226.61,Activo
F000163,ECOM,lineas_pedido.csv,ONLINE,ONLINE,VENTA,0,2025-06-13 01:14:53,2025-06-13 01:14:53,ONLINE,ONLINE,ORDER,O-202400055,O-202400055,OL-0000163,OL-0000163,,C0081,C0081,1,P1045,P1045,1,Sofá Aurora 120cm,Muebles,Sofás,1,1.0,1.0,177.80,177.8,5,5.0,€8.89,8.89,168.91,168.91,168.91,EUR,21,125.27,125.27,43.64,Bizum,Entregado,,,,O-202400055,OL-0000163,,,,,1,1,Sofá Aurora 120cm,170.98,Descatalogado
F000164,ECOM,lineas_pedido.csv,ONLINE,ONLINE,VENTA,0,2025-06-13 01:14:53,2025-06-13 01:14:53,ONLINE,ONLINE,ORDER,O-202400055,O-202400055,OL-0000164,OL-0000164,,C0081,C0081,1,P1034,P1034,1,Jarrone Atlas ★,Decoración,Jarrones,1,1.0,1.0,"273,27",273.27,30,30.0,81.98,81.98,191.29,191.29,191.29,EUR,21,197.13,197.13,-5.840000000000003,Bizum,Entregado,,,,O-202400055,OL-0000164,,,,,1,1,Jarrone Atlas ★,295.57,Activo
F000165,ECOM,lineas_pedido.csv,ONLINE,ONLINE,VENTA,0,25/12/2024 09:34,2024-12-25 09:34:00,ONLINE,ONLINE,ORDER,O-202400056,O-202400056,OL-0000165,OL-0000165,,C0074,C0074,1,P1055,P1055,1,Cuadro Luna ★,Decoración,Cuadros,1,1.0,1.0,124.22,124.22,30,30.0,37.27,37.27,86.95,86.95,86.95,EUR,21,77.33,77.33,9.620000000000005,Transferencia,Entregado,,,,O-202400056,OL-0000165,,,,,1,1,Cuadro Luna ★,124.61,Activo
F000166,ECOM,lineas_pedido.csv,ONLINE,ONLINE,VENTA,0,25/12/2024 09:34,2024-12-25 09:34:00,ONLINE,ONLINE,ORDER,O-202400056,O-202400056,OL-0000166,OL-0000166,,C0074,C0074,1,p1005,P1005,1,Cuadro Luna ★,Decoración,Cuadros,2,2.0,2.0,573.50,573.5,15,15.0,€172.05,172.05,975,975.0,975.0,EUR,21,98.34,196.68,778.3199999999999,Transferencia,Entregado,,,,O-202400056,OL-0000166,,,,,1,1,Cuadro Luna ★,180.29,Activo
F000167,ECOM,lineas_pedido.csv,ONLINE,ONLINE,VENTA,0,25/12/2024 09:34,2024-12-25 09:34:00,ONLINE,ONLINE,ORDER,O-202400056,O-202400056,OL-0000167,OL-0000167,,C0074,C0074,1,P1080,P1080,1,Espejo Boreal ★,Decoración,Espejos,1,1.0,1.0,192.41,192.41,,,,,192.41,192.41,192.41,EUR,21,95.67,95.67,96.74,Transferencia,Entregado,,,,O-202400056,OL-0000167,,,,,1,1,Espejo Boreal ★,202.14,Activo
F000168,ECOM,lineas_pedido.csv,ONLINE,ONLINE,VENTA,0,24/08/2025 13:04,2025-08-24 13:04:00,ONLINE,ONLINE,ORDER,O-202400057,O-202400057,OL-0000168,OL-0000168,,C0009,C0009,1,P1092,P1092,1,Armario Sol Compact,Muebles,Armarios,2,2.0,2.0,511.85,511.85,25,25.0,255.93,255.93,767.77,767.77,767.77,EUR,21,368.27,736.54,31.230000000000018,ApplePay,Entregado,,,,O-202400057,OL-0000168,,,,,1,1,Armario Sol Compact,555.0,Descatalogado
F000169,ECOM,lineas_pedido.csv,ONLINE,ONLINE,VENTA,0,2025-05-14 19:35:01,2025-05-14 19:35:01,ONLINE,ONLINE,ORDER,O-202400058,O-202400058,OL-0000169,OL-0000169,,,,0,P1060,P1060,1,Cortina Luna 200x300,Textil hogar,Cortinas,2,2.0,2.0,54,54.0,10,10.0,10.75,10.75,96.75,96.75,96.75,€,21,37.18,74.36,22.39,Transferencia,Entregado,web,,,O-202400058,OL-0000169,,,,,1,1,Cortina Luna 200x300,55.79,Descatalogado
F000170,ECOM,lineas_pedido.csv,ONLINE,ONLINE,VENTA,0,2025-05-14 19:35:01,2025-05-14 19:35:01,ONLINE,ONLINE,ORDER,O-202400058,O-202400058,OL-0000170,OL-0000170,,,,0,P1015,P1015,1,"Bombilla Vintage ""Star""",Iluminación,Bombillas,2,2.0,2.0,76,76.0,10,10.0,15.27,15.27,137,137.0,137.0,€,21,30.57,61.14,75.86,Transferencia,Entregado,web,,,O-202400058,OL-0000170,,,,,1,1,"Bombilla Vintage ""Star""",83.13,Activo
F000171,ECOM,lineas_pedido.csv,ONLINE,ONLINE,VENTA,0,2025-05-14 19:35:01,2025-05-14 19:35:01,ONLINE,ONLINE,ORDER,O-202400058,O-202400058,OL-0000171,OL-0000171,,,,0,,,0,Producto desconocido,,,1,1.0,1.0,,,10,10.0,105,105.0,944.63,944.63,944.63,€,,,,,Transferencia,Entregado,web,,,O-202400058,OL-0000171,,,,,1,1,,,
F000172,ECOM,lineas_pedido.csv,ONLINE,ONLINE,VENTA,0,2025/01/29 08:01:19,2025-01-29 08:01:19,ONLINE,ONLINE,ORDER,O-202400059,O-202400059,OL-0000172,OL-0000172,,C0044,C0044,1,P101Z,P101Z,0,Producto desconocido,,,1,1.0,1.0,€1139.04,1139.04,,,,,1139.04,1139.04,1139.04,EUR,,,,,ApplePay,Pendiente,,,,O-202400059,OL-0000172,,,,,1,1,,,
F000173,ECOM,lineas_pedido.csv,ONLINE,ONLINE,VENTA,0,2025/01/29 08:01:19,2025-01-29 08:01:19,ONLINE,ONLINE,ORDER,O-202400059,O-202400059,OL-0000173,OL-0000173,,C0044,C0044,1,,,0,,,,2,2.0,2.0,407.47,407.47,30,30.0,244.48,244.48,570.46,570.46,570.46,EUR,,,,,ApplePay,Pendiente,,,,O-202400059,OL-0000173,,,,,1,1,,,
F000174,ECOM,lineas_pedido.csv,ONLINE,ONLINE,VENTA,0,2025/12/03 03:18:10,2025-12-03 03:18:10,ONLINE,ONLINE,ORDER,O-202400060,O-202400060,OL-0000174,OL-0000174,,,,0,P1087,P1087,1,Jarrone Eco ★,Decoración,Jarrones,0,0.0,0.0,189.82,189.82,0,0.0,0.00,0.0,0.00,0.0,0.0,EUR,21,105.39,0.0,0.0,Transferencia,Devuelto Parcial,web,,,O-202400060,OL-0000174,,,,,1,1,Jarrone Eco ★,192.94,Activo
F000175,ECOM,lineas_pedido.csv,ONLINE,ONLINE,VENTA,0,2025/12/03 03:18:10,2025-12-03 03:18:10,ONLINE,ONLINE,ORDER,O-202400060,O-202400060,OL-0000175,OL-0000175,,,,0,P1036,P1036,1,Cortina Aurora 90x200,Textil hogar,Cortinas,2,2.0,2.0,26.36,26.36,,,,,"52,72",52.72,52.72,EUR,21,18.23,36.46,16.259999999999998,Transferencia,Devuelto Parcial,web,,,O-202400060,OL-0000175,,,,,1,1,Cortina Aurora 90x200,26.11,Activo
F000176,ECOM,lineas_pedido.csv,ONLINE,ONLINE,VENTA,0,2024-08-09 09:57:35,2024-08-09 09:57:35,ONLINE,ONLINE,ORDER,O-202400061,O-202400061,OL-0000176,OL-0000176,,C0056,C0056,1,P1092,P1092,1,Armario Sol Compact,Muebles,Armarios,2,2.0,2.0,546.92,546.92,,,,,,1093.84,1093.84,EUR,21,368.27,736.54,357.29999999999995,Tarjeta,Cancelado,,,,O-202400061,OL-0000176,,,,,1,1,Armario Sol Compact,555.0,Descatalogado
F000177,ECOM,lineas_pedido.csv,ONLINE,ONLINE,VENTA,0,2024-08-09 09:57:35,2024-08-09 09:57:35,ONLINE,ONLINE,ORDER,O-202400061,O-202400061,OL-0000177,OL-0000177,,C0056,C0056,1, P1007,P1007,1,Figura Boreal ★,Decoración,Figuras,1,1.0,1.0,218.36,218.36,25,25.0,54.59,54.59,163.77,163.77,163.77,EUR,21,103.14,103.14,60.63000000000001,Tarjeta,Cancelado,,,,O-202400061,OL-0000177,,,,,1,1,Figura Boreal ★,242.02,Activo
F000178,ECOM,lineas_pedido.csv,ONLINE,ONLINE,VENTA,0,2024-08-09 09:57:35,2024-08-09 09:57:35,ONLINE,ONLINE,ORDER,O-202400061,O-202400061,OL-0000178,OL-0000178,,C0056,C0056,1,P1079,P1079,1,Cuadro Boreal ★,Decoración,Cuadros,1,1.0,1.0,,,15,15.0,22.28,22.28,"126,28",126.28,126.28,EUR,21,78.83,78.83,47.45,Tarjeta,Cancelado,,,,O-202400061,OL-0000178,,,,,1,1,Cuadro Boreal ★,159.34,Activo
F000179,ECOM,lineas_pedido.csv,ONLINE,ONLINE,VENTA,0,2024-08-09 09:57:35,2024-08-09 09:57:35,ONLINE,ONLINE,ORDER,O-202400061,O-202400061,OL-0000179,OL-0000179,,C0056,C0056,1,P1003,P1003,1,Espejo Atlas ★,Decoración,Espejos,1,1.0,1.0,255.08,255.08,25,25.0,63.77,63.77,191.31,191.31,191.31,EUR,21,160.81,160.81,30.5,Tarjeta,Cancelado,,,,O-202400061,OL-0000179,,,,,1,1,Espejo Atlas ★,264.87,Descatalogado
F000180,ECOM,lineas_pedido.csv,ONLINE,ONLINE,VENTA,0,2025-06-24 15:43:20,2025-06-24 15:43:20,ONLINE,ONLINE,ORDER,O-202400062,O-202400062,OL-0000180,OL-0000180,,c0011,C0011,1,P1048,P1048,1,Mesa Minimal 160cm,Muebles,Mesas,3,3.0,3.0,434.97,434.97,0,0.0,"0,00",0.0,1304.91,1304.91,1304.91,EUR,21,205.56,616.6800000000001,688.23,Transferencia,Entregado,app,,,O-202400062,OL-0000180,,,,,1,1,Mesa Minimal 160cm,469.1,Activo
F000181,ECOM,lineas_pedido.csv,ONLINE,ONLINE,VENTA,0,2025-06-24 15:43:20,2025-06-24 15:43:20,ONLINE,ONLINE,ORDER,O-202400062,O-202400062,OL-0000180,OL-0000180,,c0011,C0011,1,P1048,P1048,1,Mesa Minimal 160cm,Muebles,Mesas,3,3.0,3.0,434.97,434.97,0,0.0,"0,00",0.0,1304.91,1304.91,1304.91,EUR,21,205.56,616.6800000000001,688.23,Transferencia,Pendiente,app,,,O-202400062,OL-0000180,,,,,1,1,Mesa Minimal 160cm,469.1,Activo
F000182,ECOM,lineas_pedido.csv,ONLINE,ONLINE,VENTA,0,2025-06-24 15:43:20,2025-06-24 15:43:20,ONLINE,ONLINE,ORDER,O-202400062,O-202400062,OL-0000181,OL-0000181,,c0011,C0011,1,P1081,P1081,1,"Bombilla Élite ""Star""",Iluminación,Bombillas,-1,-1.0,1.0,378.93,378.93,10,10.0,0.00,0.0,-378.93,-378.93,378.93,EUR,21,269.44,-269.44,-109.49000000000001,Transferencia,Entregado,app,,,O-202400062,OL-0000181,,,,,1,1,"Bombilla Élite ""Star""",385.02,Activo
F000183,ECOM,lineas_pedido.csv,ONLINE,ONLINE,VENTA,0,2025-06-24 15:43:20,2025-06-24 15:43:20,ONLINE,ONLINE,ORDER,O-202400062,O-202400062,OL-0000181,OL-0000181,,c0011,C0011,1,P1081,P1081,1,"Bombilla Élite ""Star""",Iluminación,Bombillas,-1,-1.0,1.0,378.93,378.93,10,10.0,0.00,0.0,-378.93,-378.93,378.93,EUR,21,269.44,-269.44,-109.49000000000001,Transferencia,Pendiente,app,,,O-202400062,OL-0000181,,,,,1,1,"Bombilla Élite ""Star""",385.02,Activo
F000184,ECOM,lineas_pedido.csv,ONLINE,ONLINE,VENTA,0,2025-07-12 02:38:13,2025-07-12 02:38:13,ONLINE,ONLINE,ORDER,O-202400063,O-202400063,OL-0000182,OL-0000182,,C0054,C0054,1,P1025,P1025,1,Figura Nórdico ★,Decoración,Figuras,1,1.0,1.0,86.58,86.58,25,25.0,21.64,21.64,64.94,64.94,64.94,EUR,21,46.11,46.11,18.83,Tarjeta,Entregado,marketplace,,,O-202400063,OL-0000182,,,,,1,1,Figura Nórdico ★,90.09,Descatalogado
F000185,ECOM,lineas_pedido.csv,ONLINE,ONLINE,VENTA,0,2025-07-12 02:38:13,2025-07-12 02:38:13,ONLINE,ONLINE,ORDER,O-202400063,O-202400063,OL-0000183,OL-0000183,,C0054,C0054,1,P1014,P1014,1,Cuadro Zen ★,Decoración,Cuadros,1,1.0,1.0,62.60,62.6,15,15.0,9.39,9.39,53.21,53.21,53.21,EUR,21,42.36,42.36,10.850000000000001,Tarjeta,Entregado,marketplace,,,O-202400063,OL-0000183,,,,,1,1,Cuadro Zen ★,68.99,Descatalogado
F000186,ECOM,lineas_pedido.csv,ONLINE,ONLINE,VENTA,0,2025-07-12 02:38:13,2025-07-12 02:38:13,ONLINE,ONLINE,ORDER,O-202400063,O-202400063,OL-0000184,OL-0000184,,C0054,C0054,1,P1010,P1010,1,Cama Sol Compact,Muebles,Camas,3,3.0,3.0,857.82,857.82,10,10.0,€257.35,257.35,2316.11,2316.11,2316.11,EUR,21,429.38,1288.1399999999999,1027.9700000000003,Tarjeta,Entregado,marketplace,,,O-202400063,OL-0000184,,,,,1,1,Cama Sol Compact,902.67,Activo
F000187,ECOM,lineas_pedido.csv,ONLINE,ONLINE,VENTA,0,2025-07-12 02:38:13,2025-07-12 02:38:13,ONLINE,ONLINE,ORDER,O-202400063,O-202400063,OL-0000185,OL-0000185,,C0054,C0054,1,P1039,P1039,1,Cuadro Nórdico ★,Decoración,Cuadros,2,2.0,2.0,234.79,234.79,20,20.0,93.92,93.92,€375.66,375.66,375.66,EUR,21,84.28,168.56,207.10000000000002,Tarjeta,Entregado,marketplace,,,O-202400063,OL-0000185,,,,,1,1,Cuadro Nórdico ★,237.04,Descatalogado
F000188,ECOM,lineas_pedido.csv,ONLINE,ONLINE,VENTA,0,2025-07-12 02:38:13,2025-07-12 02:38:13,ONLINE,ONLINE,ORDER,O-202400063,O-202400063,OL-0000186,OL-0000186,,C0054,C0054,1,P1067,P1067,1,"Lámparas pie Boreal ""Star""",Iluminación,Lámparas pie,1,1.0,1.0,346.84,346.84,25,25.0,"86,71",86.71,260,260.0,260.0,EUR,21,202.12,202.12,57.879999999999995,Tarjeta,Entregado,marketplace,,,O-202400063,OL-0000186,,,,,1,1,"Lámparas pie Boreal ""Star""",355.71,Activo
F000189,ECOM,lineas_pedido.csv,ONLINE,ONLINE,VENTA,0,13/04/2024 14:56,2024-04-13 14:56:00,ONLINE,ONLINE,ORDER,O-202400064,O-202400064,OL-0000187,OL-0000187,,C0100,C0100,1,P1001,P1001,1,Cuadro Atlas ★,Decoración,Cuadros,1,1.0,1.0,"32,08",32.08,10,10.0,3.21,3.21,28.87,28.87,28.87,EUR,21,21.79,21.79,7.080000000000002,BIZUM,Devuelto Total,app,,,O-202400064,OL-0000187,,,,,1,1,Cuadro Atlas ★,31.63,Activo
F000190,ECOM,lineas_pedido.csv,ONLINE,ONLINE,VENTA,0,13/04/2024 14:56,2024-04-13 14:56:00,ONLINE,ONLINE,ORDER,O-202400064,O-202400064,OL-0000188,OL-0000188,,C0100,C0100,1,P1099,P1099,1,Figura Eco ★,Decoración,Figuras,1,1.0,1.0,€192.05,192.05,20,20.0,38.41,38.41,153.64,153.64,153.64,EUR,21,79.26,79.26,74.37999999999998,BIZUM,Devuelto Total,app,,,O-202400064,OL-0000188,,,,,1,1,Figura Eco ★,184.78,Activo
F000191,ECOM,lineas_pedido.csv,ONLINE,ONLINE,VENTA,0,13/04/2024 14:56,2024-04-13 14:56:00,ONLINE,ONLINE,ORDER,O-202400064,O-202400064,OL-0000189,OL-0000189,,C0100,C0100,1,P1042,P1042,1,Espejo Minimal ★,Decoración,Espejos,1,1.0,1.0,76.74,76.74,110,110.0,"84,41",84.41,-7.67,-7.67,7.67,EUR,21,32.41,32.41,-40.08,BIZUM,Devuelto Total,app,,,O-202400064,OL-0000189,,,,,1,1,Espejo Minimal ★,77.19,Activo
F000192,ECOM,lineas_pedido.csv,ONLINE,ONLINE,VENTA,0,2024/08/10 05:29:37,2024-08-10 05:29:37,ONLINE,ONLINE,ORDER,O-202400065,O-202400065,OL-0000190,OL-0000190,,C0016,C0016,1,P1050,P1050,1,Cama Brisa Compact,Muebles,Camas,1,1.0,1.0,180.08,180.08,30,30.0,54.02,54.02,"126,06",126.06,126.06,€,21,115.02,115.02,11.040000000000006,Tarjeta,Entregado,web,,,O-202400065,OL-0000190,,,,,1,1,Cama Brisa Compact,190.66,Activo
F000193,ECOM,lineas_pedido.csv,ONLINE,ONLINE,VENTA,0,2024-09-11 16:52:12,2024-09-11 16:52:12,ONLINE,ONLINE,ORDER,O-202400066,O-202400066,OL-0000191,OL-0000191,,C0089,C0089,1, P1026,P1026,1,Cuadro Vintage ★,Decoración,Cuadros,1,1.0,1.0,87,87.0,,,,,87.11,87.11,87.11,EUR,21,33.86,33.86,53.25,ApplePay,Entregado,web,,,O-202400066,OL-0000191,,,,,1,1,Cuadro Vintage ★,86.77,Activo
F000194,ECOM,lineas_pedido.csv,ONLINE,ONLINE,VENTA,0,2024-09-11 16:52:12,2024-09-11 16:52:12,ONLINE,ONLINE,ORDER,O-202400066,O-202400066,OL-0000192,OL-0000192,,C0089,C0089,1,P1072,P1072,1,"Aplique Aurora ""Star""",Iluminación,Apliques,1,1.0,1.0,212.81,212.81,,,,,212.81,212.81,212.81,EUR,21,136.28,136.28,76.53,ApplePay,Entregado,web,,,O-202400066,OL-0000192,,,,,1,1,"Aplique Aurora ""Star""",213.45,Activo
F000195,ECOM,lineas_pedido.csv,ONLINE,ONLINE,VENTA,0,2024-09-11 16:52:12,2024-09-11 16:52:12,ONLINE,ONLINE,ORDER,O-202400066,O-202400066,OL-0000193,OL-0000193,,C0089,C0089,1,P1046,P1046,1,"Aplique Atlas ""Star""",Iluminación,Apliques,2,2.0,2.0,314,314.0,,,,,627.90,627.9,627.9,EUR,21,250.51,501.02,126.88,ApplePay,Entregado,web,,,O-202400066,OL-0000193,,,,,1,1,"Aplique Atlas ""Star""",338.61,Activo
F000196,ECOM,lineas_pedido.csv,ONLINE,ONLINE,VENTA,0,2024-09-11 16:52:12,2024-09-11 16:52:12,ONLINE,ONLINE,ORDER,O-202400066,O-202400066,OL-0000194,OL-0000194,,C0089,C0089,1,P1042,P1042,1,Espejo Minimal ★,Decoración,Espejos,1,1.0,1.0,72.41,72.41,0,0.0,"0,00",0.0,€72.41,72.41,72.41,EUR,21,32.41,32.41,40.0,ApplePay,Entregado,web,,,O-202400066,OL-0000194,,,,,1,1,Espejo Minimal ★,77.19,Activo
F000197,ECOM,lineas_pedido.csv,ONLINE,ONLINE,VENTA,0,2024-09-11 16:52:12,2024-09-11 16:52:12,ONLINE,ONLINE,ORDER,O-202400066,O-202400066,OL-0000195,OL-0000195,,C0089,C0089,1,P1061,P1061,1,Sábana Minimal 200x300,Textil hogar,Sábanas,2,2.0,2.0,"200,13",200.13,0,0.0,"0,00",0.0,400.26,400.26,400.26,EUR,21,128.73,257.46,142.8,ApplePay,Entregado,web,,,O-202400066,OL-0000195,,,,,1,1,Sábana Minimal 200x300,200.88,Activo
F000198,ECOM,lineas_pedido.csv,ONLINE,ONLINE,VENTA,0,2024-04-08 01:05:53,2024-04-08 01:05:53,ONLINE,ONLINE,ORDER,O-202400067,O-202400067,OL-0000196,OL-0000196,,c0073,C0073,1,P1034,P1034,1,Jarrone Atlas ★,Decoración,Jarrones,1,1.0,1.0,309.12,309.12,25,25.0,77.28,77.28,231.84,231.84,231.84,EUR,21,197.13,197.13,34.71000000000001,ApplePay,Entregado,marketplace,,,O-202400067,OL-0000196,,,,,1,1,Jarrone Atlas ★,295.57,Activo
F000199,ECOM,lineas_pedido.csv,ONLINE,ONLINE,VENTA,0,2024-04-08 01:05:53,2024-04-08 01:05:53,ONLINE,ONLINE,ORDER,O-202400067,O-202400067,OL-0000197,OL-0000197,,c0073,C0073,1,P1007,P1007,1,Figura Boreal ★,Decoración,Figuras,1,1.0,1.0,244.31,244.31,,,,,244.31,244.31,244.31,EUR,21,103.14,103.14,141.17000000000002,ApplePay,Entregado,marketplace,,,O-202400067,OL-0000197,,,,,1,1,Figura Boreal ★,242.02,Activo
F000200,ECOM,lineas_pedido.csv,ONLINE,ONLINE,VENTA,0,2024-04-08 01:05:53,2024-04-08 01:05:53,ONLINE,ONLINE,ORDER,O-202400067,O-202400067,OL-0000198,OL-0000198,,c0073,C0073,1,P1046,P1046,1,"Aplique Atlas ""Star""",Iluminación,Apliques,2,2.0,2.0,,,0,0.0,"0,00",0.0,624.56,624.56,624.56,EUR,21,250.51,501.02,123.53999999999996,ApplePay,Entregado,marketplace,,,O-202400067,OL-0000198,,,,,1,1,"Aplique Atlas ""Star""",338.61,Activo
F000201,ECOM,lineas_pedido.csv,ONLINE,ONLINE,VENTA,0,2024-04-08 01:05:53,2024-04-08 01:05:53,ONLINE,ONLINE,ORDER,O-202400067,O-202400067,OL-0000199,OL-0000199,,c0073,C0073,1,P1036,P1036,1,Cortina Aurora 90x200,Textil hogar,Cortinas,2,2.0,2.0,,,0,0.0,0.00,0.0,48.46,48.46,48.46,EUR,21,18.23,36.46,12.0,ApplePay,Entregado,marketplace,,,O-202400067,OL-0000199,,,,,1,1,Cortina Aurora 90x200,26.11,Activo
F000202,ECOM,lineas_pedido.csv,ONLINE,ONLINE,VENTA,0,2024-04-08 01:05:53,2024-04-08 01:05:53,ONLINE,ONLINE,ORDER,O-202400067,O-202400067,OL-0000200,OL-0000200,,c0073,C0073,1,P1030,P1030,1,Sofá Vintage XL,Muebles,Sofás,1,1.0,1.0,"1052,73",1052.73,,,,,1052.73,1052.73,1052.73,EUR,21,426.26,426.26,626.47,ApplePay,Entregado,marketplace,,,O-202400067,OL-0000200,,,,,1,1,Sofá Vintage XL,1014.73,Descatalogado
F000202,ECOM,lineas_pedido.csv,ONLINE,ONLINE,VENTA,0,2024-04-08 01:05:53,2024-04-08 01:05:53,ONLINE,ONLINE,ORDER,O-202400067,O-202400067,OL-0000200,OL-0000200,,c0073,C0073,1,P1030,P1030,1,Sofá Vintage XL,Muebles,Sofás,1,1.0,1.0,"1052,73",1052.73,,,,,1052.73,1052.73,1052.73,EUR,21,426.26,426.26,626.47,ApplePay,Entregado,marketplace,,,O-202400067,OL-0000200,,,,,1,1,Sofá Vintage XL (dup),1014.73,Descatalogado
F000203,ECOM,lineas_pedido.csv,ONLINE,ONLINE,VENTA,0,2024-04-08 01:05:53,2024-04-08 01:05:53,ONLINE,ONLINE,ORDER,O-202400067,O-202400067,OL-0000201,OL-0000201,,c0073,C0073,1,P1045,P1045,1,Sofá Aurora 120cm,Muebles,Sofás,1,1.0,1.0,176.60,176.6,,,,,176.60,176.6,176.6,EUR,21,125.27,125.27,51.33,ApplePay,Entregado,marketplace,,,O-202400067,OL-0000201,,,,,1,1,Sofá Aurora 120cm,170.98,Descatalogado
F000204,ECOM,lineas_pedido.csv,ONLINE,ONLINE,VENTA,0,2025-06-30 20:12:57,2025-06-30 20:12:57,ONLINE,ONLINE,ORDER,O-202400068,O-202400068,OL-0000202,OL-0000202,,,,0,p1020,P1020,1,Alfombra Zen 200x300,Textil hogar,Alfombras,1,1.0,1.0,112.78,112.78,25,25.0,28.20,28.2,€84.58,84.58,84.58,EUR,21,40.67,40.67,43.91,ContraReembolso,Entregado,app,,,O-202400068,OL-0000202,,,,,1,1,Alfombra Zen 200x300,112.47,Activo
F000205,ECOM,lineas_pedido.csv,ONLINE,ONLINE,VENTA,0,2025-06-30 20:12:57,2025-06-30 20:12:57,ONLINE,ONLINE,ORDER,O-202400068,O-202400068,OL-0000203,OL-0000203,,,,0,P1031,P1031,1,Cama Nórdico 3 plazas,Muebles,Camas,1,1.0,1.0,1111.63,1111.63,20,20.0,222.33,222.33,889.30,889.3,889.3,EUR,21,773.05,773.05,116.25,ContraReembolso,Entregado,app,,,O-202400068,OL-0000203,,,,,1,1,Cama Nórdico 3 plazas,1136.89,Activo
F000206,ECOM,lineas_pedido.csv,ONLINE,ONLINE,VENTA,0,2025-06-30 20:12:57,2025-06-30 20:12:57,ONLINE,ONLINE,ORDER,O-202400068,O-202400068,OL-0000204,OL-0000204,,,,0,P1087,P1087,1,Jarrone Eco ★,Decoración,Jarrones,2,2.0,2.0,191.70,191.7,,,,,€383.40,383.4,383.4,EUR,21,105.39,210.78,172.61999999999998,ContraReembolso,Entregado,app,,,O-202400068,OL-0000204,,,,,1,1,Jarrone Eco ★,192.94,Activo
F000207,ECOM,lineas_pedido.csv,ONLINE,ONLINE,VENTA,0,08/09/25,2025-09-08 00:00:00,ONLINE,ONLINE,ORDER,O-202400069,O-202400069,OL-0000205,OL-0000205,,,,0,P1063,P1063,1,Armario Brisa 160cm,Muebles,Armarios,1,1.0,1.0,"447,68",447.68,0,0.0,0.00,0.0,447.68,447.68,447.68,EUR,21,318.23,318.23,129.45,ApplePay,Pendiente,app,,,O-202400069,OL-0000205,,,,,1,1,Armario Brisa 160cm,433.43,Activo
F000208,ECOM,lineas_pedido.csv,ONLINE,ONLINE,VENTA,0,2024-09-03 05:49:26,2024-09-03 05:49:26,ONLINE,ONLINE,ORDER,O-202400070,O-202400070,OL-0000206,OL-0000206,,C0100,C0100,1,P1041,P1041,1,Vela Luna ★,Decoración,Velas,2,2.0,2.0,122.50,122.5,,,,,"245,00",245.0,245.0,EUR,21,51.47,102.94,142.06,Bizum,Devuelto Total,marketplace,,,O-202400070,OL-0000206,,,,,1,1,Vela Luna ★,120.85,Activo
F000209,ECOM,lineas_pedido.csv,ONLINE,ONLINE,VENTA,0,2024-04-07 05:20:36,2024-04-07 05:20:36,ONLINE,ONLINE,ORDER,O-202400071,O-202400071,OL-0000207,OL-0000207,,C0076,C0076,1,P9999,P9999,0,,,,1,1.0,1.0,764.79,764.79,25,25.0,191.20,191.2,"573,59",573.59,573.59,EUR,,,,,Transferencia,Entregado,marketplace,,,O-202400071,OL-0000207,,,,,1,1,,,
F000210,ECOM,lineas_pedido.csv,ONLINE,ONLINE,VENTA,0,2024-04-07 05:20:36,2024-04-07 05:20:36,ONLINE,ONLINE,ORDER,O-202400071,O-202400071,OL-0000208,OL-0000208,,C0076,C0076,1,P1020,P1020,1,Alfombra Zen 200x300,Textil hogar,Alfombras,1,1.0,1.0,102.51,102.51,,,,,102.51,102.51,102.51,EUR,21,40.67,40.67,61.84,Transferencia,Entregado,marketplace,,,O-202400071,OL-0000208,,,,,1,1,Alfombra Zen 200x300,112.47,Activo
F000211,ECOM,lineas_pedido.csv,ONLINE,ONLINE,VENTA,0,2025-01-10 02:44:38,2025-01-10 02:44:38,ONLINE,ONLINE,ORDER,O-202400072,O-202400072,OL-0000209,OL-0000209,,C0089,C0089,1, P1051,P1051,1,Alfombra Aurora Set 2 uds,Textil hogar,Alfombras,2,2.0,2.0,21.38,21.38,10,10.0,4.28,4.28,38.48,38.48,38.48,EUR,21,12.4,24.8,13.679999999999996,Bizum,Entregado,app,,,O-202400072,OL-0000209,,,,,1,1,Alfombra Aurora Set 2 uds,23.53,Descatalogado
F000212,ECOM,lineas_pedido.csv,ONLINE,ONLINE,VENTA,0,2025-01-10 02:44:38,2025-01-10 02:44:38,ONLINE,ONLINE,ORDER,O-202400072,O-202400072,OL-0000210,OL-0000210,,C0089,C0089,1,,,0,Producto desconocido,,,2,2.0,2.0,"1146,93",1146.93,30,30.0,688.16,688.16,"1605,70",1605.7,1605.7,EUR,,,,,Bizum,Entregado,app,,,O-202400072,OL-0000210,,,,,1,1,,,
F000213,ECOM,lineas_pedido.csv,ONLINE,ONLINE,VENTA,0,2024-04-19 10:08:58,2024-04-19 10:08:58,ONLINE,ONLINE,ORDER,O-202400073,O-202400073,OL-0000211,OL-0000211,,C0032,C0032,1,P1018,P1018,1,Cojine Minimal ★,Decoración,Cojines,1,1.0,1.0,163.04,163.04,20,20.0,32.61,32.61,130,130.0,130.0,EUR,21,130.86,130.86,-0.8600000000000136,Tarjeta,Entregado,marketplace,,,O-202400073,OL-0000211,,,,,1,1,Cojine Minimal ★,179.25,Descatalogado
F000214,ECOM,lineas_pedido.csv,ONLINE,ONLINE,VENTA,0,2024-04-19 10:08:58,2024-04-19 10:08:58,ONLINE,ONLINE,ORDER,O-202400073,O-202400073,OL-0000212,OL-0000212,,C0032,C0032,1,P1057,P1057,1,"Lámparas pie Luna ""Star""",Iluminación,Lámparas pie,1,1.0,1.0,130.49,130.49,,,,,130.49,130.49,130.49,EUR,21,51.93,51.93,78.56,Tarjeta,Entregado,marketplace,,,O-202400073,OL-0000212,,,,,1,1,"Lámparas pie Luna ""Star""",133.29,Descatalogado
F000215,ECOM,lineas_pedido.csv,ONLINE,ONLINE,VENTA,0,2024-04-19 10:08:58,2024-04-19 10:08:58,ONLINE,ONLINE,ORDER,O-202400073,O-202400073,OL-0000213,OL-0000213,,C0032,C0032,1,P1021,P1021,1,"Bombilla Brisa ""Star""",Iluminación,Bombillas,1,1.0,1.0,300.25,300.25,0,0.0,0.00,0.0,307.89,307.89,307.89,EUR,21,153.44,153.44,154.45,Tarjeta,Entregado,marketplace,,,O-202400073,OL-0000213,,,,,1,1,"Bombilla Brisa ""Star""",305.88,Activo
F000216,ECOM,lineas_pedido.csv,ONLINE,ONLINE,VENTA,0,2024/02/07 19:03:12,2024-02-07 19:03:12,ONLINE,ONLINE,ORDER,O-202400074,O-202400074,OL-0000214,OL-0000214,, C0061,C0061,1,P1020,P1020,1,Alfombra Zen 200x300,Textil hogar,Alfombras,1,1.0,1.0,€102.23,102.23,25,25.0,25.56,25.56,"76,67",76.67,76.67,EUR,21,40.67,40.67,36.0,Transferencia,Entregado,web,,,O-202400074,OL-0000214,,,,,1,1,Alfombra Zen 200x300,112.47,Activo
F000217,ECOM,lineas_pedido.csv,ONLINE,ONLINE,VENTA,0,2024/02/07 19:03:12,2024-02-07 19:03:12,ONLINE,ONLINE,ORDER,O-202400074,O-202400074,OL-0000215,OL-0000215,, C0061,C0061,1,P1064,P1064,1,Estantería Minimal 120cm,Muebles,Estanterías,2,2.0,2.0,"463,10",463.1,10,10.0,"92,62",92.62,834,834.0,834.0,EUR,21,210.29,420.58,413.42,Transferencia,Entregado,web,,,O-202400074,OL-0000215,,,,,1,1,Estantería Minimal 120cm,447.43,Activo
F000218,ECOM,lineas_pedido.csv,ONLINE,ONLINE,VENTA,0,2024/02/07 19:03:12,2024-02-07 19:03:12,ONLINE,ONLINE,ORDER,O-202400074,O-202400074,OL-0000216,OL-0000216,, C0061,C0061,1,P1031,P1031,1,Cama Nórdico 3 plazas,Muebles,Camas,0,0.0,0.0,"1109,46",1109.46,5,5.0,0.00,0.0,0.00,0.0,0.0,EUR,21,773.05,0.0,0.0,Transferencia,Entregado,web,,,O-202400074,OL-0000216,,,,,1,1,Cama Nórdico 3 plazas,1136.89,Activo
F000219,ECOM,lineas_pedido.csv,ONLINE,ONLINE,VENTA,0,09/04/2024 22:27,2024-04-09 22:27:00,ONLINE,ONLINE,ORDER,O-202400075,O-202400075,OL-0000217,OL-0000217,,C0047,C0047,1,P1076,P1076,1,Cortina Eco 200x300,Textil hogar,Cortinas,1,1.0,1.0,197.90,197.9,,,,,197.90,197.9,197.9,EUR,21,77.52,77.52,120.38000000000001,paypal,Entregado,marketplace,,,O-202400075,OL-0000217,,,,,1,1,Cortina Eco 200x300,219.17,Descatalogado
F000220,ECOM,lineas_pedido.csv,ONLINE,ONLINE,VENTA,0,09/04/2024 22:27,2024-04-09 22:27:00,ONLINE,ONLINE,ORDER,O-202400075,O-202400075,OL-0000218,OL-0000218,,C0047,C0047,1,P1068,P1068,1,"Lámparas mesa Minimal ""Star""",Iluminación,Lámparas mesa,2,2.0,2.0,49.96,49.96,,,,,99.92,99.92,99.92,EUR,21,22.52,45.04,54.88,paypal,Entregado,marketplace,,,O-202400075,OL-0000218,,,,,1,1,"Lámparas mesa Minimal ""Star""",50.41,Descatalogado
F000221,ECOM,lineas_pedido.csv,ONLINE,ONLINE,VENTA,0,09/04/2024 22:27,2024-04-09 22:27:00,ONLINE,ONLINE,ORDER,O-202400075,O-202400075,OL-0000219,OL-0000219,,C0047,C0047,1,P1084,P1084,1,Espejo Eco ★,Decoración,Espejos,1,1.0,1.0,"43,74",43.74,,,,,43.74,43.74,43.74,EUR,21,24.47,24.47,19.270000000000003,paypal,Entregado,marketplace,,,O-202400075,OL-0000219,,,,,1,1,Espejo Eco ★,45.73,Activo
F000222,ECOM,lineas_pedido.csv,ONLINE,ONLINE,VENTA,0,09/04/2024 22:27,2024-04-09 22:27:00,ONLINE,ONLINE,ORDER,O-202400075,O-202400075,OL-0000220,OL-0000220,,C0047,C0047,1,P1078,P1078,1,Estantería Atlas 160cm,Muebles,Estanterías,3,3.0,3.0,677.64,677.64,30,30.0,609.88,609.88,1423.04,1423.04,1423.04,EUR,21,497.07,1491.21,-68.17000000000007,paypal,Entregado,marketplace,,,O-202400075,OL-0000220,,,,,1,1,Estantería Atlas 160cm,702.02,Activo
F000223,ECOM,lineas_pedido.csv,ONLINE,ONLINE,VENTA,0,09/04/2024 22:27,2024-04-09 22:27:00,ONLINE,ONLINE,ORDER,O-202400075,O-202400075,OL-0000221,OL-0000221,,C0047,C0047,1,P1052,P1052,1,Cama Vintage 3 plazas,Muebles,Camas,1,1.0,1.0,632.85,632.85,30,30.0,189.85,189.85,443.00,443.0,443.0,EUR,21,513.63,513.63,-70.63,paypal,Entregado,marketplace,,,O-202400075,OL-0000221,,,,,1,1,Cama Vintage 3 plazas,700.64,Activo
F000224,ECOM,lineas_pedido.csv,ONLINE,ONLINE,VENTA,0,09/04/2024 22:27,2024-04-09 22:27:00,ONLINE,ONLINE,ORDER,O-202400075,O-202400075,OL-0000222,OL-0000222,,C0047,C0047,1,P1009,P1009,1,Cortina Vintage Pack 4,Textil hogar,Cortinas,1,1.0,1.0,20.37,20.37,,,,,"20,37",20.37,20.37,EUR,21,10.34,10.34,10.030000000000001,paypal,Entregado,marketplace,,,O-202400075,OL-0000222,,,,,1,1,Cortina Vintage Pack 4,21.75,Activo
F000225,ECOM,lineas_pedido.csv,ONLINE,ONLINE,VENTA,0,2025-04-06 03:49:47,2025-04-06 03:49:47,ONLINE,ONLINE,ORDER,O-202400076,O-202400076,OL-0000223,OL-0000223,,,,0,P1074,P1074,1,Sábana Vintage Pack 4,Textil hogar,Sábanas,1,1.0,1.0,100.96,100.96,,,,,101,101.0,101.0,EUR,21,73.38,73.38,27.620000000000005,ApplePay,Entregado,app,,,O-202400076,OL-0000223,,,,,1,1,Sábana Vintage Pack 4,98.89,Activo
F000226,ECOM,lineas_pedido.csv,ONLINE,ONLINE,VENTA,0,2025-04-06 03:49:47,2025-04-06 03:49:47,ONLINE,ONLINE,ORDER,O-202400076,O-202400076,OL-0000224,OL-0000224,,,,0,P1037,P1037,1,"Bombilla Boreal ""Star""",Iluminación,Bombillas,1,1.0,1.0,48.25,48.25,5,5.0,2.41,2.41,58.39,58.39,58.39,EUR,21,25.43,25.43,32.96,ApplePay,Entregado,app,,,O-202400076,OL-0000224,,,,,1,1,"Bombilla Boreal ""Star""",50.59,Descatalogado
F000227,ECOM,lineas_pedido.csv,ONLINE,ONLINE,VENTA,0,2025-07-14 07:52:22,2025-07-14 07:52:22,ONLINE,ONLINE,ORDER,O-202400077,O-202400077,OL-0000225,OL-0000225,,,,0,P1033,P1033,1,Cojine Sol ★,Decoración,Cojines,1,1.0,1.0,"226,80",226.8,,,,,226.80,226.8,226.8,EUR,21,,,,ApplePay,Entregado,web,,,O-202400077,OL-0000225,,,,,1,1,Cojine Sol ★,245.88,Descatalogado
F000228,ECOM,lineas_pedido.csv,ONLINE,ONLINE,VENTA,0,2025-07-14 07:52:22,2025-07-14 07:52:22,ONLINE,ONLINE,ORDER,O-202400077,O-202400077,OL-0000226,OL-0000226,,,,0,P1099,P1099,1,Figura Eco ★,Decoración,Figuras,1,1.0,1.0,,,,,,,"181,77",181.77,181.77,EUR,21,79.26,79.26,102.51,ApplePay,Entregado,web,,,O-202400077,OL-0000226,,,,,1,1,Figura Eco ★,184.78,Activo
F000229,ECOM,lineas_pedido.csv,ONLINE,ONLINE,VENTA,0,2025-07-14 07:52:22,2025-07-14 07:52:22,ONLINE,ONLINE,ORDER,O-202400077,O-202400077,OL-0000227,OL-0000227,,,,0,P1097,P1097,1,Sofá Eco 120cm,Muebles,Sofás,1,1.0,1.0,765.83,765.83,0,0.0,0.00,0.0,765.83,765.83,765.83,EUR,21,480.42,480.42,285.41,ApplePay,Entregado,web,,,O-202400077,OL-0000227,,,,,1,1,Sofá Eco 120cm,768.59,Activo
F000230,ECOM,lineas_pedido.csv,ONLINE,ONLINE,VENTA,0,2025-07-02 04:36:14,2025-07-02 04:36:14,ONLINE,ONLINE,ORDER,O-202400078,O-202400078,OL-0000228,OL-0000228,,C0068,C0068,1,,,0,,,,1,1.0,1.0,"1127,29",1127.29,,,,,1127.29,1127.29,1127.29,EUR,,,,,Bizum,Pendiente,marketplace,,,O-202400078,OL-0000228,,,,,1,1,,,
F000231,ECOM,lineas_pedido.csv,ONLINE,ONLINE,VENTA,0,2025-07-02 04:36:14,2025-07-02 04:36:14,ONLINE,ONLINE,ORDER,O-202400078,O-202400078,OL-0000229,OL-0000229,,C0068,C0068,1,P1078,P1078,1,Estantería Atlas 160cm,Muebles,Estanterías,1,1.0,1.0,721.86,721.86,0,0.0,0.00,0.0,721.86,721.86,721.86,EUR,21,497.07,497.07,224.79000000000002,Bizum,Pendiente,marketplace,,,O-202400078,OL-0000229,,,,,1,1,Estantería Atlas 160cm,702.02,Activo
F000232,ECOM,lineas_pedido.csv,ONLINE,ONLINE,VENTA,0,2025-07-02 04:36:14,2025-07-02 04:36:14,ONLINE,ONLINE,ORDER,O-202400078,O-202400078,OL-0000230,OL-0000230,,C0068,C0068,1,P1049,P1049,1,"Lámparas techo Boreal ""Star""",Iluminación,Lámparas techo,2,2.0,2.0,340.86,340.86,,,,,681.72,681.72,681.72,EUR,21,255.88,511.76,169.96000000000004,Bizum,Pendiente,marketplace,,,O-202400078,OL-0000230,,,,,1,1,"Lámparas techo Boreal ""Star""",368.25,Descatalogado
F000233,ECOM,lineas_pedido.csv,ONLINE,ONLINE,VENTA,0,2025-07-02 04:36:14,2025-07-02 04:36:14,ONLINE,ONLINE,ORDER,O-202400078,O-202400078,OL-0000231,OL-0000231,,C0068,C0068,1,P1021,P1021,1,"Bombilla Brisa ""Star""",Iluminación,Bombillas,0,0.0,0.0,283.77,283.77,30,30.0,0.00,0.0,0.00,0.0,0.0,EUR,21,153.44,0.0,0.0,Bizum,Pendiente,marketplace,,,O-202400078,OL-0000231,,,,,1,1,"Bombilla Brisa ""Star""",305.88,Activo
F000234,ECOM,lineas_pedido.csv,ONLINE,ONLINE,VENTA,0,2025-07-02 04:36:14,2025-07-02 04:36:14,ONLINE,ONLINE,ORDER,O-202400078,O-202400078,OL-0000232,OL-0000232,,C0068,C0068,1,P1034,P1034,1,Jarrone Atlas ★,Decoración,Jarrones,1,1.0,1.0,€290.58,290.58,20,20.0,58.12,58.12,"232,46",232.46,232.46,EUR,21,197.13,197.13,35.33000000000001,Bizum,Pendiente,marketplace,,,O-202400078,OL-0000232,,,,,1,1,Jarrone Atlas ★,295.57,Activo
F000235,ECOM,lineas_pedido.csv,ONLINE,ONLINE,VENTA,0,2025-03-11 08:14:45,2025-03-11 08:14:45,ONLINE,ONLINE,ORDER,O-202400079,O-202400079,OL-0000233,OL-0000233,,C0087,C0087,1,P1047,P1047,1,Sofá Atlas 3 plazas,Muebles,Sofás,1,1.0,1.0,484.96,484.96,10,10.0,48.50,48.5,436.46,436.46,436.46,EUR,21,253.03,253.03,183.42999999999998,Bizum,Pendiente,marketplace,,,O-202400079,OL-0000233,,,,,1,1,Sofá Atlas 3 plazas,508.08,Activo
F000236,ECOM,lineas_pedido.csv,ONLINE,ONLINE,VENTA,0,2025-03-11 08:14:45,2025-03-11 08:14:45,ONLINE,ONLINE,ORDER,O-202400079,O-202400079,OL-0000234,OL-0000234,,C0087,C0087,1,P1067,P1067,1,"Lámparas pie Boreal ""Star""",Iluminación,Lámparas pie,1,1.0,1.0,351.12,351.12,110,110.0,386.23,386.23,€-35.11,-35.11,35.11,EUR,21,202.12,202.12,-237.23000000000002,Bizum,Pendiente,marketplace,,,O-202400079,OL-0000234,,,,,1,1,"Lámparas pie Boreal ""Star""",355.71,Activo
F000237,ECOM,lineas_pedido.csv,ONLINE,ONLINE,VENTA,0,2024-04-16 14:57:12,2024-04-16 14:57:12,ONLINE,ONLINE,ORDER,O-202400080,O-202400080,OL-0000235,OL-0000235,,C0068,C0068,1,P1027,P1027,1,Sábana Nórdico 140x200,Textil hogar,Sábanas,1,1.0,1.0,102.94,102.94,0,0.0,0.00,0.0,€102.94,102.94,102.94,EUR,21,39.47,39.47,63.47,Bizum,Entregado,app,,,O-202400080,OL-0000235,,,,,1,1,Sábana Nórdico 140x200,103.97,Activo
F000238,ECOM,lineas_pedido.csv,ONLINE,ONLINE,VENTA,0,2024-04-16 14:57:12,2024-04-16 14:57:12,ONLINE,ONLINE,ORDER,O-202400080,O-202400080,OL-0000236,OL-0000236,,C0068,C0068,1,p1025,P1025,1,Figura Nórdico ★,Decoración,Figuras,1,1.0,1.0,"87,10",87.1,10,10.0,"8,71",8.71,78.39,78.39,78.39,EUR,21,46.11,46.11,32.28,Bizum,Entregado,app,,,O-202400080,OL-0000236,,,,,1,1,Figura Nórdico ★,90.09,Descatalogado
F000239,ECOM,lineas_pedido.csv,ONLINE,ONLINE,VENTA,0,2024-04-16 14:57:12,2024-04-16 14:57:12,ONLINE,ONLINE,ORDER,O-202400080,O-202400080,OL-0000237,OL-0000237,,C0068,C0068,1,P1013,P1013,1,"Lámparas techo Brisa ""Star""",Iluminación,Lámparas techo,1,1.0,1.0,304.44,304.44,110,110.0,334.88,334.88,-30.44,-30.44,30.44,EUR,21,220.42,220.42,-250.85999999999999,Bizum,Entregado,app,,,O-202400080,OL-0000237,,,,,1,1,"Lámparas techo Brisa ""Star""",313.25,Activo
F000240,ECOM,lineas_pedido.csv,ONLINE,ONLINE,VENTA,0,2025-02-19 15:57:41,2025-02-19 15:57:41,ONLINE,ONLINE,ORDER,O-202400081,O-202400081,OL-0000238,OL-0000238,,,,0,P1055,P1055,1,Cuadro Luna ★,Decoración,Cuadros,1,1.0,1.0,112.84,112.84,20,20.0,€22.57,22.57,90.27,90.27,90.27,€,21,77.33,77.33,12.939999999999998,Bizum,Entregado,app,,,O-202400081,OL-0000238,,,,,1,1,Cuadro Luna ★,124.61,Activo
