payment_id,ticket_id,fecha_pago,store_id,caja_id,cajero_id,metodo_pago,importe_pagado,moneda,referencia_autorizacion,estado_pago,observaciones
PAY-0000001, T-500031,2025-09-28 10:29:00,S004,CAJ02,EMP074,CC,€848.91,EUR,NQ4FMYZY,OK,
PAY-0000002, T-500031,28/09/25 10:29,S004,CAJ02,EMP074,Vale,113.42,EUR,OC6UZHR5XF,OK,
PAY-0000003, T-500039,07/04/25 00:50,S003,CAJ02,EMP006,Visa/Mastercard,66.51,EUR,VQJT7YE511M,OK,
PAY-0000004, T-500069,17/05/25 19:52,S005,CAJ05,EMP030,Visa/Mastercard,1572.10,EUR,VREN93II,OK,
PAY-0000005, T-500199,2025-02-28 18:54:00,,CAJ03,EMP028,Tarjeta (Crédito),330.98,EUR,9XPSEIMVIHC,OK,
PAY-0000006, T-500199,28/02/2025 18:54,,CAJ03,EMP028,Tarjeta Débito,201.46,EUR,3GDPPQ0Y9DO,OK,
PAY-0000007, T-500203,02/09/25 02:42,S003,CAJ01,EMP051,EFECTIVO,668.40,EUR,,OK,
PAY-0000008, T-500223,19/08/25 02:40,S002,CAJ07,EMP023,Tarjeta credito,1216.67,EUR,8UT0CVS4F,OK,
PAY-0000009, T-500345,05/09/2025 00:00,S002,CAJ05,,CC,€274.73,EUR,IOYKL1CQ99,OK,
PAY-0000010, T-500348,2025-12-27 13:20:59,S002,CJ02,EMP027,TARJETA CREDITO,"1,447.67",,0FKHMY4S,OK,
PAY-0000011, T-500356,30/03/2025,S003,CAJ07,EMP016,Tarjeta (Débito),,EUR,UFEL6246HI,OK,
PAY-0000012, T-500357,19/09/25 14:44,S005,CAJ03,EMP029,Cash,51.53 EUR,EUR,J2D54I3QK,OK,
PAY-0000013, T-500357,19/09/25 14:44,S005,CAJ03,EMP029,CC,64.05,EUR,G8JDP0LVSN,OK,
PAY-0000014, T-500414,23/09/2025 10:46,S004,CAJ05,EMP069,Tarjeta Crédito,454.44,EUR,,OK,
PAY-0000015, T-500434,17/01/25 17:51,S001,CAJ08,EMP021,cash,"910,41",EUR,QPHR62GDSW,OK,
PAY-0000016, T-500435,15/02/25 01:48,S001,CAJ03,EMP004,Visa/Mastercard,263.85,EUR,6452H2ZQ,OK,
PAY-0000017, T-500435,2025-02-15 02:47:00,S001,CAJ03,EMP004,TARJETA CREDITO,299.08,EUR,QF5Q14J1RIPZ,OK,
PAY-0000018, T-500456,14/05/2025,S003,CAJ07,EM048,Efectivo,10.46,EUR,NAM148P0TVHH,OK,
PAY-0000019, T-500456,14/05/2025,S003,CAJ07,EM048,Tarjeta credito,"117,32",EUR,DP5GJLQM,OK,
PAY-0000020, T-500508,2025-07-01 00:08:00,S002,CAJ03,EMP034,Credit Card,"3,04",EUR,8QJNV8Z2FLU7,OK,
PAY-0000021, T-500508,01/07/2025,S002,CAJ03,EMP034,TARJETA CREDITO,€208.59,EUR,2MPNSM43D8W3,OK,
PAY-0000022, T-500508,2025-07-01 00:00:00,S002,CAJ03,EMP034,Tarjeta Débito,26.02,EUR,,OK,
PAY-0000023, T-500517,19/05/25 01:06,S001,CAJ07,EMP073,EFECTIVO,81.42,EUR,DZR1YXR2D,OK,
PAY-0000024, T-500517,19/05/25 01:06,S001,CAJ07,EMP073,Tarjeta (Crédito),87.75,EUR,ZL08YG0J,OK,
PAY-0000025, T-500528,2025-05-13 04:03:05,S004,CAJ04,EMP029,Tarjeta Crédito,360.45,EUR,UQPGB7R3,OK,
PAY-0000026, T-500534,5 de octubre de 2025 01:05,S001,CAJ03,EMP008,Vale,1432.49,EUR,,OK,
PAY-0000027, T-500538,14/08/25 20:50,S001,CAJ01,EMP031,Contado,286.25,EUR,ZZQY72WX7P,OK,
PAY-0000028, T-500554,2025-11-24 04:05:00,S004,CAJ05,EMP049,Vale Devolución,50.77,EUR,0VAIY4VA13U,OK,
PAY-0000029, T-500554,24/11/25 04:05,S004,CAJ05,EMP049,Tarjeta Regalo,142.08,EUR,4LYK83TQ,OK,
PAY-0000030, T-500565,24/10/25 17:54,S003,CAJ04,EMP077,Credit Card,"134,71",EUR,,OK,
PAY-0000031, T-500565,2025-10-24 17:54:00,S003,CAJ04,EMP077,Tarjeta (Crédito),168.46,EUR,,OK,
PAY-0000032, T-500565,24/10/25 17:54,S003,CAJ04,EMP077,CC,-108.36,EUR,,OK,Importe negativo (posible devolución mal registrada)
PAY-0000033, T-500589,2025-02-13 00:12:30,S05,CAJ06,EMP053,Contado,-396.05 EUR,EUR,,OK,Importe negativo (posible devolución mal registrada)
PAY-0000034, T-500662,2025-12-14 14:59:00,S001,CAJ05,EMP054,Tarjeta (Crédito),"1078,62",EUR,,OK,
PAY-0000035, T-500684,03/08/25 04:21,S003,CAJ03,EMP019,Credit Card,496.23,EUR,5BCW790PDW5,OK,
PAY-0000036, T-500774,20/06/25 07:38,S001,CAJ04,EMP010,Tarjeta Débito,551.28,EUR,,OK,
PAY-0000037, T-500774,20/06/2025 07:39,S001,CAJ04,EMP010,TARJETA CREDITO,26.36,EUR,,OK,
PAY-0000038, T-500834,25/08/25 07:54,S005,CAJ05,EMP057,BIZUM,132.27,EUR,361I2HGJ11Y,OK,
PAY-0000039, T-500871,20/06/25 21:31,S004,CAJ01,EMP066,Efectivo,426.98,EUR,8K52QC1IYYO,OK,
PAY-0000040, T-500890,22 de febrero de 2025 03:37,S003,CAJ06,EMP037,Credit Card,"2906,49",EUR,,OK,
PAY-0000041, T-500917,2025-05-03 05:18:41,S004,CAJ07,EMP060,Visa/Mastercard,360.72,EUR,0FODRO8BNP84,OK,
PAY-0000042, T-500917,2025-05-03 05:18:41,S004,CAJ07,EMP060,cash,383.81,EUR,8BM92H3TV3I1,OK,
PAY-0000043, T-500982,08/12/25 01:11,S002,CAJ02,EMP026,EFECTIVO,€852.48,EUR,0R2SDS8B,OK,
PAY-0000044, T-501003,2025-05-06 10:06:00,S002,CAJ03,EMP018,Credit Card,"319,49",EUR,TL9TQVDZ4X1Z,OK,
PAY-0000045, T-501010,12/06/25 03:15,S002,CAJ07,EMP048,TARJETA CREDITO,"170,07",EUR,3UVULEMX15,OK,
PAY-0000046, T-501013,16/04/25 14:52,S003,CAJ08,EMP035✓,TARJETA CREDITO,413.60€,EUR,WXA73JGZLMA5,OK,
PAY-0000047, T-501014,2025-10-05 22:14:00,S005,CAJ07,EMP063,Tarjeta Regalo,415.76,EUR,RPJ1EPKYRYB,OK,
PAY-0000048, T-501054,2025-11-10 17:37:00,S002,CAJ08,EMP022,cash,"1,544.43",EUR,QCLPOXKO,OK,
PAY-0000049, T-501067,17/09/25 23:25,S004,CAJ03,EMP064,Credit Card,43.99,EUR,S6M033IFHV1X,OK,
PAY-0000050, T-501067,17/09/25 23:25,S004,CAJ03,EMP064,Tarjeta (Crédito),46.45,EUR,PQW2VMCQB,OK,
PAY-0000051, T-501093,07/09/25 12:47,S002,CAJ08,EMP059,Efectivo,167.33,EUR,349DXBZ9,OK,
PAY-0000052, T-501194,19/07/25 17:12,S002,CAJ01,EMP017,cash,39.19,EUR,MUFM8ZOV7,OK,
PAY-0000053,500018,03/05/25 00:24,S001,CAJ06,EMP027,Gift Card,48.80,EUR,K2ST0SX5,OK,
PAY-0000054,500018,2025-05-03 01:52:00,S001,CAJ06,EMP027,Tarjeta (Débito),"478,53",EUR,II826GYUP12,OK,
PAY-0000055,500019,2025-02-21 00:00:00,S005,CAJ02,EMP028,EFECTIVO,113.52,EUR,,OK,
PAY-0000056,500025,14/09/2025,S004,CAJ08,EMP030,Tarjeta debito,448.08,EUR,K3ZEZQAC,OK,
PAY-0000057,500025,14/09/2025,S004,CAJ08,EMP030,Cash,486.82 EUR,EUR,4RTWUZKA,OK,
PAY-0000058,500123,29/01/25 08:09,S005,CAJ05,EMP052,Visa/Mastercard,1182.57,EUR,10LBT3G2,OK,
PAY-0000059,500132,2025-08-26 11:23:18,S003,CAJ07,EMP053,Tarjeta (Crédito),€272.26,EUR,5BXJ2POP8M,OK,
PAY-0000060,500140,7 de septiembre de 2025 01:27,S003,CAJ02,EMP043,Tarjeta (Crédito),"3925,07",EUR,FPQ06WPX2CY,OK,
PAY-0000061,500187,2025-10-25 12:32:00,S002,CAJ03,EMP073,Tarjeta credito,63.47 EUR,EUR,TOXIE0RNU,OK,
PAY-0000062,500187,25/10/25 10:53,S002,CAJ03,EMP073,Efectivo,119.49,EUR,389YZTKK,OK,
PAY-0000063,500222,03/03/25 23:48,S003,CAJ08,EMP075,Gift Card,237.54,EUR,S13C9XQYM52,OK,
PAY-0000064,500247,27/05/25 05:00,S003,CAJ05,EMP036,Credit Card,"512,54",EUR,WDXVUGW6M7,OK,
PAY-0000065,500247,27/05/25 05:00,S003,CAJ05,EMP036,CC,"158,03",EUR,R2YKCCPRHV,OK,
PAY-0000066,500247,2025-05-27 05:00:00,S003,CAJ05,EMP036,Efectivo,674.98,EUR,B85P8637,OK,
PAY-0000067,500308,31/12/25 10:43,S004,CAJ06,EMP068,CC,1519.14,EUR,4P501NOU,OK,
PAY-0000068,500344,2025-05-06 16:55:27,S004,CAJ08,EMP024,GiftCard,"4,324.12 EUR",EUR,BELRQVSL,OK,
PAY-0000069,500422,29/09/25 20:59,S004,CAJ01,EMP050,cash,84.23,EUR,R821UZVGWW4F,OK,
PAY-0000070,500422,29/09/25 20:59,S004,CAJ01,EMP050,Contado,10.68,EUR,SU9RN8QTT,OK,
PAY-0000071,500422,2025-09-29 20:59:00,S004,CAJ01,EMP050,tarjeta regalo,115.43,EUR,YRRU7ZKUT,OK,
PAY-0000072,500443,15/04/25 18:37,S001,CAJ06,EMP038,Tarjeta debito,309.55,EUR,IB6IIDLRYE89,OK,
PAY-0000073,500482,03/05/25 22:07,S004,CAJ07,EMP061,Cash,"398,23",EUR,9OR7875A,OK,
PAY-0000074,500482,03/05/25 22:07,S004,CAJ07,EMP061,TARJETA_REGALO,"121,31",EUR,ZAMKYGVWOP,OK,
PAY-0000075,500486,2025-09-05 17:54:16,S005,CAJ08,EMP060,Tarjeta credito,,EUR,QFY751YW,OK,
PAY-0000076,500512,02/12/25 06:20,S001,CAJ08,EMP073,Tarjeta credito,1333.26,EUR,ZCUCTSUFLSEH,OK,
PAY-0000077,500613,26/06/25 21:17,S003,CAJ01,EMP019,Efectivo,72.98,EUR,TC69QKGE,OK,
PAY-0000078,500637,2025-03-12 07:56:33,S005,CAJ08,EMP013,tarjeta regalo,572.58,EUR,19QZPNIQ,OK,
PAY-0000079,500637,12/03/2025 07:56,S005,CAJ08,EMP013,Credit Card,"266,19",EUR,VZB0OIH5CSK,OK,
PAY-0000080,500637,2025-03-12 07:56:33,S005,CAJ08,EMP013,Debit Card,"135,31",EUR,56WPR97Y2LOF,OK,
PAY-0000081,500655,2025-12-21,S004,CAJ02,EMP020,Tarjeta (Crédito),242.56,EUR,BNVBC2VYH,OK,
PAY-0000082,500667,2025-09-27 10:42:00,S005,CAJ03,EMP073,Vale,€1042.34,EUR,JSRD9Q46NO,OK,
PAY-0000083,500678,2025-09-23 19:13:59,S004,CAJ06,EMP029,TARJETA CREDITO,3046.48,EUR,0MFTG698S,OK,
PAY-0000084,500707,10/09/25 00:17,S03,CAJ05,EMP016,Tarjeta Débito,"79,37",EUR,TJ9A3Y36,OK,
PAY-0000085,500707,10/09/25 00:17,S03,CAJ05,EMP016,Efectivo,"626,53",EUR,X41DNTCA,OK,
PAY-0000086,500712,21/07/2025 13:32,S004,CAJ01,EMP048,Cupón,€63.82,EUR,7L8V1ZOCF,OK,
PAY-0000087,500744,2025-05-27,S005,CAJ07,EMP012,CC,€274.32,EUR,,OK,
PAY-0000088,500747,10/12/24 19:15,S001,CAJ02,,DEBITO,"1.626,87",EUR,0LDALMJEG,OK,
PAY-0000089,500771,2025-12-07 09:06:00,S005,CAJ06,EMP039,Tarjeta Crédito,1369.44,EUR,EKRCPPRCJ,OK,
PAY-0000090,500788,2025-03-24 03:07:59,S003,CAJ03,EMP004,Tarjeta credito,,EUR,VZRGOL0W82,OK,
PAY-0000091,500812,2025-04-20 22:35:14,S001,CAJ02,EMP063,TARJETA CREDITO,184.41,EUR,YFKJFPNQVUT,OK,
PAY-0000092,500812,2025-04-20 23:21:14,S001,CAJ02,EMP063,Efectivo,13.95,EUR,9YO18PAJSSUU,OK,
PAY-0000093,500831,09/09/25 11:35,S004,CAJ08,EMP061,CC,405.00,EUR,PZLK3E4X,OK,
PAY-0000094,500831,09/09/25 11:35,S004,CAJ08,EMP061,GiftCard,"231,48",EUR,5QPAHKZ2U2TN,OK,
PAY-0000095,500835,2025-02-03 10:27:00,S003,CAJ02,EMP073,Debit Card,€942.57,EUR,LIENFNVUP,OK,
PAY-0000096,500841,2025-05-20 00:50:00,S004,CAJ06,EMP013,Bizum,301.46,EUR,O4RCB1KJTGQ,OK,
PAY-0000097,500841,20/05/25 00:50,S004,CAJ06,EMP013,CC,387.63,EUR,K9QM3P91I,OK,
PAY-0000098,500853,2025-09-04 23:47:18,S003,CAJ06,EMP058,Visa/Mastercard,797.70,EUR,9YD82795E5IZ,OK,
PAY-0000099,500861,18/10/2025 13:39,S005,CAJ08,EMP045,Cash,1387.54,EUR,WZ42O83RLKT,OK,
PAY-0000100,500887,25/10/25 21:24,S004,,EMP018,Visa/Mastercard,18.19,EUR,JN6FOKZIXZ,OK,
PAY-0000101,500887,25/10/25 21:24,s004,CAJ07,EMP018,Efectivo,14.76,EUR,DNKN35XY,OK,
PAY-0000102,500894,10/05/25 14:47,S004,CAJ06,EMP063,Tarjeta credito,132.31,EUR,,OK,
PAY-0000103,500927,11/10/25 03:18,S005,CAJ06,EMP053,Efectivo,"949,03",EUR,RERVT997E,OK,
PAY-0000104,500944,13/07/25 11:34,S005,CAJ02,EMP025,Visa/Mastercard,€767.62,EUR,ZCTWJLSH3TO,OK,
PAY-0000105,500972,14/11/25 15:51,S004,CAJ08,EMP003,Tarjeta Crédito,"1365,53",EUR,S2ZGE2J51B,OK,
PAY-0000106,501005,20/10/25 21:23,S005,CAJ06,EMP021,Visa/Mastercard,"244,83",EUR,IQNF74T6,OK,
PAY-0000107,501036,2 de junio de 2025 17:31,S001,CAJ03,EMP006,Debit Card,140.52,EUR,51LDQNK20IN,OK,
PAY-0000108, 501056 ,2025-11-25 18:17:52,S005,CAJ07,EMP007,Contado,922.70 EUR,EUR,TIRC9ZD76,OK,
PAY-0000109,501056,2025-11-25 18:17:52,S005,CAJ07,EMP007,Tarjeta (Crédito),330.22,EUR,,OK,
PAY-0000110,501081,10/12/25 09:31,S002,CAJ07,EMP043,Cash,"2315,04",EUR,JEFY3ZB4LDI,OK,
PAY-0000111,501088,11/06/2025 09:26,S002,CAJ05,EMP038,TARJETA CREDITO,"4552,51",EUR,NWXUJ3AC6PE,OK,
PAY-0000112,501091,04/03/25 06:28,S005,CAJ02,EMP021,Efectivo,€1668.97,EUR,IKOTCKEH5SW2,OK,
PAY-0000113,501134,2025-12-28 12:36:53,S003,CAJ03,EMP061,TARJETA CREDITO,"74,33",EUR,99DXJ37C9H42,OK,
PAY-0000114,501134,2025-12-28 12:36:53,S003,CAJ03,EMP061,Cupon,209.58,EUR,,OK,
PAY-0000115,501138,19/07/25 05:19,s001,CAJ05,EMP036,CC,48.32,EUR,FZFDSNCZ,OK,
PAY-0000116,501138,19/07/25 05:19,S001,CAJ05,EMP036,tarjeta regalo,€174.72,EUR,2IVGLYE088O9,OK,
PAY-0000117,501138,2025-07-19 05:19:00,S001,CAJ05,EMP036,Gift Card,275.24,EUR,,OK,
PAY-0000118, 501144 ,22/11/25 06:58,S001,CAJ06,EMP015,Tarjeta (Débito),110.23,EUR,MN32U1IQ2BA,OK,
PAY-0000119,501154,2025-08-31,S004,CAJ03,EMP077,Debit Card,616.58,EUR,HGZZ0JKIBU,OK,
PAY-0000120,501160,14/04/25 07:39,S002,CAJ06,EMP019,Credit Card,1437.97,EUR,NNGBPJ4UF,OK,
PAY-0000121,501161,10 de noviembre de 2025 11:57,S004,CAJ02,EMP019,Tarjeta (Crédito),100.57,EUR,,OK,
PAY-0000122,501182,01/09/25 19:41,S005,CAJ07,EMP079,Tarjeta Regalo,"249,20",EUR,4J66CNOLJ,OK,
PAY-0000123,501182,2025-09-01 19:41:00,S005,CAJ07,EMP079,GiftCard,102.90,EUR,,OK,
PAY-0000124,501185,2025-04-15 04:56:00,S001,CAJ03,EMP044,CC,1895.22 EUR,EUR,076A3KKR,OK,
PAY-0000125,T-500000,13/12/25 11:42,S001,CAJ04,EMP014,EFECTIVO,766.81,EUR,2CZO2SUG5HCB,OK,
PAY-0000126,T-500000,13/12/25 11:42,S001,CAJ04,EMP014,tarjeta regalo,532.12,EUR,,OK,
PAY-0000127,T-500001,2025-03-04 01:20:00,S005,CAJ08,EMP001,cash,3997.05,EUR,6XVAJ2K8XPN,OK,
PAY-0000128,T-500003,03/12/25 12:12,S001,CAJ04,EMP011,Visa/Mastercard,415.03,EUR,X5JZ6KF162,OK,
PAY-0000129,T-500004,28/05/25 08:46,S001,CAJ03,EMP032,Visa/Mastercard,€587.25,EUR,6YS445GDEJ3,OK,
PAY-0000130,T-500005,09/08/2025 06:30,S001,CAJ07,EMP028,tarjeta regalo,"80,63",EUR,C6S5NKB4EHOU,OK,
PAY-0000131,T-500006,23/02/25 17:20,s005,,EMP052,EFECTIVO,108.85,EUR,PPPRAT0861TA,OK,
PAY-0000132,T-500007,05/01/2025,S004,CAJ08,EMP071,TARJETA CREDITO,138.41,EUR,,OK,
PAY-0000133,T-500008,2025-10-23 00:46:00,S003,,EMP034,Tarjeta (Crédito),35.83,EUR,BEPEJZHY,OK,
PAY-0000134,T-500008,23/10/2025,S003,,EMP034,Cash,1201.49,EUR,HJSHZKBRH7LA,OK,
PAY-0000135,T-500009,2025-12-27 20:21:36,S002,CAJ01,EM063,Tarjeta (Débito),316.76,EUR,PE46AEXL68,OK,
PAY-0000136,T-500009,2025-12-27 19:49:36,S002,CAJ01,EM063,Cash,76.21,EUR,,OK,
PAY-0000137,T-500010 ,2025-03-06 03:53:00,S004,CAJ03,EMP061,EFECTIVO,171.45,EUR,,OK,
PAY-0000138,T-500010 ,2025-03-06 04:56:00,S004,CAJ03,EMP061,Tarjeta Crédito,€597.75,EUR,P0RXXF36,OK,
PAY-0000139,T-500011,07/04/25 06:38,S004,CAJ06,EMP067,Contado,92.82,EUR,,OK,
PAY-0000140,T-500011,07/04/25 06:38,S004,CAJ06,EMP067,,72.74,EUR,UXQM334L1VZN,OK,
PAY-0000141,T-500012,25/03/2025,S001,CAJ02,EMP036,Tarjeta Crédito,914.82,EUR,E4H3GM1BW,OK,
PAY-0000142,T-500013,01/07/25 08:59,S004,CAJ02,EMP046,Credit Card,14.30,EUR,DXVL5PVYI,OK,
PAY-0000143,T-500013,01/07/25 08:59,S004,CAJ02,EMP046,Visa/Mastercard,184.75,EUR,WHWKMY9X8SYL,OK,
PAY-0000144,T-500014,19/04/2025 04:13,S001,CAJ04,EMP018,CC,"774,82",EUR,9YFC2HTMQ,OK,
PAY-0000145,T-500016,2025-01-23 17:06:13,S004,CAJ08,EMP038,Gift Card,208.67,EUR,0H54PIWZ,OK,
PAY-0000146,T-500017,20 de septiembre de 2025 05:26,S001,CAJ02,EMP009,EFECTIVO,"229,26",EUR,ZFFLB7WXRUM,OK,
PAY-0000147,T-500017,20 de septiembre de 2025 05:26,S001,CAJ02,EMP009,Tarjeta debito,180.79,EUR,XLK8WRU1X,OK,
PAY-0000148,T-500020,2025-02-22 03:41:02,,CAJ05,EMP014,Visa/Mastercard,419.94,EUR,QB6GS8G8TACY,OK,
PAY-0000149,T-500021,14/06/25 12:00,S003,CAJ05,EMP007,Contado,"214,98",EUR,UIJNWPAY,OK,
PAY-0000150,T-500022,21/11/25 02:59,,CAJ02,EMP020,Tarjeta (Crédito),376.24 EUR,EUR,TEO2T8FY6,OK,
PAY-0000151,T-500023,2025-12-10 08:43:57,S003,CAJ04,EMP046,Tarjeta Crédito,€549.43,EUR,FGWJEYUB19TX,OK,
PAY-0000152,T-500024,2025-06-09 21:26:41,S002,CAJ01,EMP043,EFECTIVO,216.21,EUR,U38GL2ZXJMYL,OK,
PAY-0000153,T-500026,12/04/25 10:42,S004,CAJ06,EMP015,Credit Card,12.77,EUR,U1HBJ6TXFO6V,OK,
PAY-0000154,T-500026,12/04/25 10:42,S004,CAJ06,EMP015,VALE,10.22,EUR,X80RMHRCNBH6,OK,
PAY-0000155,T-500027,26 de diciembre de 2025 10:59,S005,CAJ04,,Tarjeta Crédito,1086.42 EUR,EUR,N6SM5RRVSF,OK,
PAY-0000156,T-500028,2025-09-16 23:53:00,S003,CAJ02,EMP039,Tarjeta credito,109.91,EUR,BUFWBUCJG,OK,
PAY-0000157,T-500029,2025-03-23,S002,CAJ05,EMP001,Tarjeta Regalo,94.95,EUR,GY7VCNEAS6,OK,
PAY-0000158,T-500030,2025-11-14 20:15:00,S002,CAJ05,EMP080,Tarjeta credito,680.10,EUR,P5ZP7R1M264U,OK,
PAY-0000159,T-500032,05/08/25 11:23,s001,CAJ04,EMP067,Vale,19.16,EUR,XJ4PNJY1O2R,OK,
PAY-0000160,T-500032,05/08/25 11:23,S001,CAJ04,EMP067,Cupón,3.48,EUR,DS22WYBOW,OK,
PAY-0000161,T-500033,19/12/2025 05:18,S005,CAJ08,EMP065,CC,1977.42,EUR,KBVSIGBIAF92,OK,
PAY-0000162,T-500034,02/04/25 01:38,S005,CAJ04,EMP010,GiftCard,"2,704.67 EUR",EUR,CK82853UY8U1,OK,
PAY-0000163,T-500035,01/06/25 06:11,S004,CAJ08,EMP027,Credit Card,324.16 EUR,EUR,IDY3C7RM6J,OK,
PAY-0000164,T-500036,2025-10-13 07:48:00,S001,CAJ05,EMP054,Credit Card,90.02,EUR,WR965R96KH,ANULADO,
PAY-0000165,T-500036,2025-10-13 07:17:00,S001,CAJ05,EMP054,Tarjeta (Débito),38.96,EUR,AHULWJTI,OK,
PAY-0000166,T-500037,19/12/25 05:11,S004,CAJ08,EMP080,Debit Card,734.84,EUR,H20RAPE6WTL,OK,
PAY-0000167,T-500038,2025-12-08 14:50:20,S001,CAJ06,EMP042,Tarjeta Crédito,1010.56,EUR,HUXG2MYR06NK,OK,
PAY-0000168,T-500038,2025-12-08 14:50:20,S001,CAJ06,EMP042,Cash,"33,08",EUR,ZVO5270SQG,OK,
PAY-0000169,T-500040,05/03/2025 14:32,S003,CAJ03,EMP015,DEBITO,"204,13",EUR,LIKWE4BX4LR,OK,
PAY-0000170,T-500041,22/08/25 04:14,S002,CAJ04,,TARJETA_REGALO,315.38,EUR,PNJKA34M,OK,
PAY-0000171,T-500042,2025-05-21 15:50:13,S03,CAJ07,EMP014,Cash,€148.20,EUR,3YK03O4GKWWJ,OK,
PAY-0000172,T-500042,2025-05-21 15:50:13,S03,CAJ07,EMP014,cash,"94,37",EURO,2RNZBC1FJO,OK,
PAY-0000173,T-500043,27/11/25 18:32,S005,CAJ08,EMP076,TARJETA CREDITO,422.67,EUR,7F00TERKMB,OK,
PAY-0000174,T-500043,27/11/25 18:32,S005,CAJ08,EMP076,Cash,513.41,EUR,F1IRYM81CMFT,OK,
PAY-0000175,T-500044,2025-04-11 08:01:08,S001,CAJ06,EMP028,GiftCard,951.10,EUR,M0J36TCFKJNA,OK,
PAY-0000176,T-500045,2025-01-07 17:51:00,S004,CAJ04,EMP063,Tarjeta Débito,643.31 EUR,EUR,B7GBDGBX,OK,
PAY-0000177,T-500046,08/10/25 02:51,S005,CAJ08,EMP033,DC,"2331,46",EUR,2CWT04CHSD,OK,
PAY-0000178,T-500047,21/05/25 03:39,S004,CAJ05,EMP025,EFECTIVO,"1008,40",EUR,TV76T94OW,OK,
PAY-0000179,T-500048,13 de mayo de 2025 07:36,S004,CAJ01,EMP061,Contado,52.86,EUR,A9HL1737SU,OK,
PAY-0000180,T-500049,24/10/25 21:07,S001,CAJ05,EMP032,EFECTIVO,189.72,EUR,3DXB3N27M5P7,OK,
PAY-0000181,T-500050,15/10/25 10:07,S003,CAJ07,EMP080,Contado,405.44,EUR,SHKOECUBODS1,OK,
PAY-0000182,T-500050,15/10/25 10:07,S003,CAJ07,EMP080,Tarjeta Regalo,"462,90",EUR,DYPMLVAK9W9P,OK,
PAY-0000183,T-500051 ,20/04/2025 20:26,S001,CAJ08,EMP030,Tarjeta credito,97.07,EUR,HSJR0FZAU,OK,
PAY-0000184,T-500051 ,2025-04-20 20:48:00,S001,CAJ08,EMP030,Tarjeta (Débito),1661.69,EUR,5XIN9DL5TG,OK,
PAY-0000185,T-500052,2025-01-28 18:19:00,S002,CAJ04,EMP035,Tarjeta Débito,"488,29",EUR,78IMOE0S,OK,
PAY-0000186,T-500052,2025-01-28 17:35:00,S002,CAJ04,EMP035,Tarjeta Crédito,"16,93",EUR,5LZSE99F7,OK,
PAY-0000187,T-500053,2025-06-20 00:12:00,S004,CAJ07,EMP065,Visa/Mastercard,1384.96,EUR,EA9WVWVI,OK,
PAY-0000188,T-500054,24/10/25 08:41,S005,CAJ01,EMP035,EFECTIVO,67.99,EUR,1C795RLQI,OK,
PAY-0000189,T-500054,2025-10-24 08:41:00,S005,CAJ01,EMP035,CC,369.59,EUR,Q55IT9BN18G,OK,
PAY-0000190,T-500055,2025-02-10 14:56:00,S004,CAJ08,EMP043,cash,554.13,EUR,OQGVZHQJY62,OK,
PAY-0000191,T-500055,10/02/25 14:56,S004,CAJ08,EMP043,Credit Card,50.69,EUR,6UXF5GZPL,OK,
PAY-0000192,T-500056,17/11/25 08:52,S003,CAJ02,EMP052,Tarjeta Crédito,,EUR,CVITWU3BFXB,OK,
PAY-0000193,T-500057,2025-06-20 03:32:00,S004,CAJ04,EMP017,DEBITO,"178,89",EUR,314CQE4LOHH,OK,
PAY-0000194,T-500057,2025-06-20,S004,CAJ04,EMP017,DEBITO,278.02€,EUR,9MEUSWRGVZ9A,OK,
PAY-0000195,T-500058,15 de febrero de 2025 14:51,S003,CAJ07,EMP015,VALE,€12.51,EUR,ELOU83G4,OK,
PAY-0000196,T-500058,15 de febrero de 2025 14:51,S003,CAJ07,EMP015,Debit Card,50.86,EUR,7CSUYTAUL62,OK,
PAY-0000197,T-500059,2025-12-08 11:54:53,S002,CAJ03,EMP077,TARJETA CREDITO,21.32 EUR,EUR,3KSGNBHDS26,OK,
PAY-0000198,T-500059,2025-12-08 11:54:53,S002,CAJ03,EMP077,Credit Card,6.70,EUR,QZSA7YVD,OK,
PAY-0000199,T-500060,14/09/25 07:05,S003,CAJ05,EMP076,Voucher,€510.65,EUR,MLFZKICWMPEQ,ANULADO,
PAY-0000200,T-500061,2025-06-09 12:42:05,S002,CAJ04,EMP030,Cash,75.46,EUR,,OK,
PAY-0000201,T-500062,2025-02-08 23:27:00,S002,CAJ01,EMP076,Cash,"598,66",EUR,QBRMQG1VED,OK,
PAY-0000202,T-500063,27/11/25 19:01,S001,CAJ05,EMP051,Visa/Mastercard,816.48,EUR,YGY0Z4EVLDQL,OK,
PAY-0000203,T-500064,24/12/25 15:40,S004,,EMP031,CC,111.06,EUR,HYLU6K7P9MD,OK,
PAY-0000204,T-500065,2025-01-22 20:15:00,S001,CAJ05,EMP006,Tarjeta credito,820.64 EUR,EUR,PHGFT4MPK5E,OK,
PAY-0000205,T-500066,29/06/25 02:13,S005,CAJ04,EMP075,Credit Card,7.51,EUR,MGVU4ISOTN9,OK,
PAY-0000206,T-500067,14/06/25 18:50,S005,CAJ08,EMP076,Debit Card,"340,37",EUR,YTUW6TAQ,OK,
PAY-0000207,T-500068,19/11/25 08:30,S004,CAJ05,EMP038✓,cash,"119,18",EUR,,OK,
PAY-0000208,T-500070,22/05/25 16:45,S002,CAJ01,EMP057,Efectivo,935.34,EUR,JZR25MDF7,OK,
PAY-0000209,T-500071,10 de abril de 2025 19:08,S005,CAJ06,EMP035,Tarjeta (Crédito),"82,32",EUR,01TNZRF5A7Q,OK,
PAY-0000210,T-500071,10 de abril de 2025 19:08,S005,CAJ06,EMP035,Cupon,96.36€,EUR,,OK,
PAY-0000211,T-500071,10 de abril de 2025 19:08,S005,CAJ06,EMP035,EFECTIVO,55.41,EUR,Y9LAACOSYM,OK,
PAY-0000212,T-500072 ,2025-11-04 01:41:00,S002,CAJ07,EMP072,CC,1177.23,EUR,,OK,
PAY-0000213,T-500073,2025-08-07,S003,CAJ04,EMP080,Credit Card,€299.46,EUR,J3GC9HOX,OK,
PAY-0000214,T-500074,2025-02-15 03:32:00,S004,CAJ01,EMP039,Contado,681.05,EURO,US7RP422TA8,OK,
PAY-0000215,T-500075,2025-08-28,S005,CAJ03,EMP013,TARJETA CREDITO,€241.80,EUR,XKODYR5PGBA,OK,
PAY-0000216,T-500076,2025-02-17 10:36:00,S003,CAJ06,EMP036,Tarjeta (Crédito),"1400,12",EUR,FU7BFXQ7BZEG,OK,
PAY-0000217,T-500077,2025-03-25 20:48:44,S002,CAJ04,EMP071,Tarjeta credito,397.88,EUR,TL8HBGCJ1GNF,OK,
PAY-0000218,T-500078,2025-01-11 00:17:18,s002,CAJ05,EMP015,Tarjeta (Crédito),114.39 EUR,EUR,HXSO7VBGR,OK,
PAY-0000219,T-500079,2025-05-21 14:26:00,S002,CAJ02,EMP061,tarjeta regalo,"133,04",EUR,RF7BNHJW6QD,OK,
PAY-0000220,T-500079,21/05/25 14:26,S002,CAJ02,EMP061,Cash,11.67,EUR,IIOH6CVBPH,OK,
PAY-0000221,T-500080,15/06/2025,S005,CAJ01,EMP062,Debit Card,"268,15",EUR,6UTIOS5HRQAP,OK,
PAY-0000222,T-500081,2025-06-26 04:56:03,S005,CAJ06,EMP077,Tarjeta debito,1208.59,EUR,1YOHMI9AYFQU,OK,
PAY-0000223,T-500082,11/10/25 08:28,S002,CAJ04,EMP059,Tarjeta credito,"246,06",EUR,T22C50B8Y5DN,OK,
PAY-0000224,T-500084,10/02/25 05:37,S004,CAJ01,EMP077,CC,31.52,EUR,MJYJCMRSEZ,OK,
PAY-0000225,T-500085,2025-09-07,S003,CAJ07,EMP080,CC,482.96,EUR,ZR5SWK8T,OK,
PAY-0000226,T-500086,5 de junio de 2025 15:34,S003,,EMP019,Efectivo,509.59,EUR,4QKE2GJR81BM,OK,
PAY-0000227,T-500087,10/12/2025 01:20,S003,CAJ06,EMP073,Contado,137.02 EUR,EUR,9FQ9TEA718,OK,
PAY-0000228,T-500087,2025-12-10,S003,CAJ06,EMP073,TARJETA CREDITO,287.00,EUR,07MERBYEAWHM,OK,
PAY-0000229,T-500088,16/06/25 23:05,S004,CAJ07,EMP066,DC,€1485.69,EUR,,OK,
PAY-0000230,T-500089,2025-02-16,S001,CAJ04,EMP033,tarjeta regalo,€402.38,EUR,,OK,
PAY-0000231,T-500089,16/02/25 14:20,S001,CAJ04,EMP033,Cash,"165,57",EUR,AWJGQU6H,OK,
PAY-0000232,T-500090,01/12/25 19:26,S003,CAJ01,EMP059,cash,59.06,EUR,B1R8VNRPJ,OK,
PAY-0000233,T-500090,2025-12-01 19:26:00,S003,CAJ01,EMP059,Tarjeta (Crédito),188.78,EUR,JP6MKT7S,OK,
PAY-0000234,T-500091,2025-11-24 23:09:00,S003,CAJ08,EMP047,Tarjeta debito,"102,94",EUR,O7FHS32UY84,OK,
PAY-0000235,T-500092,16/05/25 16:24,S001,CAJ02,EMP025,Credit Card,488.26,EUR,I4FIEECY,OK,
PAY-0000236,T-500092,2025-05-16 16:24:00,S001,CAJ02,EMP025,Cash,"628,35",EUR,127H6GMD,OK,
PAY-0000237,T-500093,24/06/25 08:06,S001,CAJ08,EMP073,Cupón,€384.51,EUR,774RZGYD,OK,
PAY-0000238,T-500093,24/06/25 08:06,S001,CAJ08,EMP073,TARJETA CREDITO,279.00,EUR,CRNQ0Y4I,OK,
PAY-0000239,T-500094,18/08/25 16:25,S003,CAJ02,EMP039,Tarjeta (Crédito),849.77 EUR,EUR,C9MV9E40K,OK,
PAY-0000240,T-500095,2025-10-14 23:14:35,S001,CAJ07,EMP071,Tarjeta (Crédito),918.38,EUR,,OK,
PAY-0000241,T-500096,2025-02-02 18:09:00,S002,CAJ08,EMP044,Credit Card,56.63,EUR,T8BP6NLNQBU4,OK,
PAY-0000242,T-500096,02/02/25 18:00,S002,CAJ08,EMP044,Visa/Mastercard,636.71,EUR,OR8WM9LB,OK,
PAY-0000243,T-500097,09/09/25 09:19,S003,CAJ06,EMP007,Visa/Mastercard,€582.29,EUR,EGTBXPSPAQ,OK,
PAY-0000244,T-500098,2025-09-29 06:18:18,S002,CAJ03,EMP040,TARJETA CREDITO,65.62€,EUR,4TKB9OI0,OK,
PAY-0000245,T-500099,2025-03-12 00:10:19,S005,CAJ07,EMP003,cash,€34.27,EUR,Q1GAZ5UH80Q7,OK,
PAY-0000246,T-500100,2025-05-27 08:52:00,S005,CAJ01,EMP080,Credit Card,"212,42",EUR,JVOEGI3QU,OK,
PAY-0000247,T-500100,27/05/25 07:17,S005,CAJ01,EMP080,Contado,80.68,EUR,LKC86Y5O,OK,
PAY-0000248,T-500101,2025-10-18 16:51:00,S001,CAJ04,EMP079,Contado,269.30,EUR,307HDHJO5CT,OK,
PAY-0000249,T-500102,15/07/2025 07:25,S002,CAJ08,EMP037,Cash,-4.73,EUR,,OK,Importe negativo (posible devolución mal registrada)
PAY-0000250,T-500103,21/04/2025 16:58,S004,CAJ02,EMP067,,114.48,EUR,K4FPL3X2J,OK,
PAY-0000251,T-500104,2025-05-30 23:39:00,S003,CAJ07,EMP065,Cash,"1,194.56",EUR,2EOWLCFS831,OK,
PAY-0000252,T-500105,2025-02-23 21:38:00,S002,CAJ05,EMP061,cash,6.71,EUR,7XW69HZG,OK,
PAY-0000253,T-500105,23/02/25 21:38,S002,CAJ05,EMP061,Credit Card,47.69,EUR,G52KRE4V9,OK,
PAY-0000254,T-500106,2025-02-17 07:42:32,S002,CAJ07,EMP037,Cash,1696.18,EUR,Z0JDCLI6978,OK,
PAY-0000255,T-500107,04/04/25 10:13,S005,CAJ03,EMP001,FINANCIACION,"347,84",EUR,JL9R9KMP6,OK,
PAY-0000256,T-500108,2025-05-25 23:25:49,S005,CAJ07,EMP006,CC,"270,33",EUR,ZP97BMZRR,OK,
PAY-0000257,T-500108,2025-05-25 23:25:49,S005,CAJ07,EMP006,TARJETA CREDITO,"75,21",EUR,G7IRDLK9EN7D,OK,
PAY-0000258,T-500109,2025-09-23 21:47:00,S003,CAJ06,EMP023,Voucher,220.68,EUR,LBC8NOG85D,OK,
PAY-0000259,T-500110,3 de mayo de 2025 13:33,S004,CAJ04,EMP026,tarjeta regalo,"49,46",EUR,HQNJVDPNGWDS,OK,
PAY-0000260,T-500110,3 de mayo de 2025 13:33,S004,CAJ04,EMP026,Visa/Mastercard,"49,98",EUR,K9YKIPUT7SS,OK,
PAY-0000261,T-500111,05/06/25 08:28,S001,,EMP048,Tarjeta (Crédito),32.48,EUR,WJ85GG0V5DT,OK,
PAY-0000262,T-500111,05/06/25 08:28,S001,CAJ06,EMP048,tarjeta regalo,80.84,EUR,2DEG3ZGARFI,OK,
PAY-0000263,T-500112,2025-11-16 09:05:00,S005,CAJ02,EMP011,Tarjeta Crédito,€1488.86,EUR,WZ940VTK,OK,
PAY-0000264,T-500113,18 de junio de 2025 21:56,S004,CAJ01,EMP046,GiftCard,€1142.86,EUR,7MZAKGMIH6MV,OK,
PAY-0000265,T-500114,27/01/2025 02:39,S002,CAJ03,EMP057,TARJETA CREDITO,"1,146.88",EUR,VDO9KHBA5,OK,
PAY-0000266,T-500115,25/07/25 14:55,S004,CAJ06,EMP010,CC,282.73,EUR,,OK,
PAY-0000267,T-500115,2025-07-25 15:51:00,S004,CAJ06,EMP010,Tarjeta Regalo,"1,136.08",EUR,W56FKPS0D,OK,
PAY-0000268,T-500116,25/03/2025,S005,CAJ02,EMP034,Vale Devolución,657.55 EUR,EUR,PI2OOQ42NBFA,OK,
PAY-0000269,T-500117,2025-04-23 20:20:21,S004,CAJ06,EMP009,Cupón,15.97,EUR,5ZLM36VFOX5W,OK,
PAY-0000270,T-500118,11/01/25 04:59,S005,CAJ04,EMP031,Tarjeta (Débito),"355,24",EUR,A6TJ3KPS0,OK,
PAY-0000271,T-500119,2025-01-29,S001,CAJ08,EMP053,Efectivo,,EUR,Y3UFN0DSG2,OK,
PAY-0000272,T-500120,21/07/25 05:03,S005,CAJ03,EMP008,Credit Card,€767.08,EUR,Y80PFSRQ8ST,OK,
PAY-0000273,T-500121,2025-08-31 17:37:00,S003,CAJ05,EMP071,Tarjeta credito,206.10,EUR,FVB66H3RE,OK,
PAY-0000274,T-500122,07/09/25 02:46,S005,CAJ01,EMP004,CC,"1,031.43",EUR,XOIOT860X5ZU,OK,
PAY-0000275,T-500124,04/05/25 22:22,S003,CAJ03,EMP066,Efectivo,42.92,EUR,,OK,
PAY-0000276,T-500125,15/03/25 17:22,S002,CAJ03,EMP074,Contado,"1,266.11 EUR",EUR,FJDLOGWLAC,OK,
PAY-0000277,T-500125,15/03/25 17:22,S002,CAJ03,EMP074,Cash,77.68,EUR,8JLTCBW6ATV,OK,
PAY-0000278,T-500126,12/07/25 04:44,S004,CAJ04,EMP007,Tarjeta debito,676.90,EUR,,PENDIENTE,
PAY-0000279,T-500127,2025-03-17 14:19:00,S003,CAJ06,EMP007,Tarjeta Crédito,959.10,EUR,Z3095HS258W,OK,
PAY-0000280,T-500128,22/05/25 23:41,,CAJ02,EMP044,DEBITO,140.14 EUR,EUR,T2XCB3YYM33,OK,
PAY-0000281,T-500129,02/06/25 14:36,S005,CAJ03,EMP079,Visa/Mastercard,243.11,EUR,8BRZVA9WDJS,OK,
PAY-0000282,T-500129,2025-06-02 14:36:00,S005,CAJ03,EMP079,Tarjeta Regalo,70.04,EUR,,OK,
PAY-0000283,T-500130,16/12/25 01:06,S001,CAJ02,EMP075,Tarjeta Crédito,371.36 EUR,EUR,N15IKPQAHCU,OK,
PAY-0000284,T-500130,2025-12-16,S001,CAJ02,EMP075,Contado,"41,12",EUR,274IR833SICV,OK,
PAY-0000285,T-500131,28/05/25 15:37,S001,CAJ03,EMP080,Tarjeta Crédito,109.27,EUR,B4OWO52WQQPW,OK,
PAY-0000286,T-500133,13/05/2025,S004,CAJ06,EMP059,Efectivo,€168.04,EUR,GEBEVSXMVTF,OK,
PAY-0000287,T-500134,26/04/25 13:58,S004,,EMP039,Tarjeta Crédito,"1.087,53",EUR,VLU8WPFQ2BH,OK,
PAY-0000288,T-500135,2025-10-28 05:28:00,S003,CAJ07,EMP051,,"225,94",,W6M9HKHJG,OK,
PAY-0000289,T-500136,2025-08-07 06:23:00,S003,CAJ04,EMP069,EFECTIVO,381.91,EUR,,OK,
PAY-0000290,T-500137,03/07/25 11:07,S005,CAJ04,EMP053,Visa/Mastercard,282.41,EUR,,OK,
PAY-0000291,T-500137,03/07/25 11:07,S005,CAJ04,EMP053,Tarjeta Crédito,30.68,EUR,CS1XSRQLNZZR,OK,
PAY-0000292,T-500138,08/09/2025 21:06,S004,CAJ04,EMP037,CC,"735,38",EUR,BSMQPNRJAPJC,OK,
PAY-0000293,T-500138,08/09/25 20:12,S004,CAJ04,EMP037,Efectivo,1066.97,EUR,GVE4ZTJ1KM,OK,
PAY-0000294,T-500139,2025-06-04 05:47:27,S002,CAJ03,EMP005,Efectivo,58.15,EUR,P7PP4BF5L,OK,
PAY-0000295,T-500139,2025-06-04 04:15:27,S002,CAJ03,EMP005,Credit Card,€1001.13,EUR,F8LWVV59H,OK,
PAY-0000296,T-500141,2025-05-11 22:06:47,S001,CAJ08,EM024,Tarjeta Débito,1063.14,EUR,QNAL6O9E,OK,
PAY-0000297,T-500142,2025-12-30 10:31:00,S001,CAJ02,EMP018,Tarjeta (Crédito),240.76,EUR,,OK,
PAY-0000298,T-500143,30/06/25 17:47,S05,CAJ06,EMP008,Gift Card,271.46,EUR,OGWPNXZDZ,OK,
PAY-0000299,T-500144,21 de febrero de 2025 20:57,S001,CAJ05,EMP029,Visa/Mastercard,"153,18",EUR,1LQJSQCZ0N04,OK,
PAY-0000300,T-500145,2025-01-31 07:58:12,S002,CAJ02,EMP068,Tarjeta debito,"105,45",EUR,TOC1YFMH,OK,
PAY-0000301,T-500146,2025-07-09 20:12:24,S002,CAJ08,EMP027,Visa/Mastercard,378.35€,EUR,YC8D4X0BS,OK,
PAY-0000302,T-500147,2025-08-13 14:15:06,S003,CAJ07,EMP001,DC,492.80,EUR,CHKV9DT9,OK,
PAY-0000303,T-500148,2025-12-13 00:00:00,S001,CAJ03,EMP054,CC,€2.39,EUR,S0SZAA1EIPI,OK,
PAY-0000304,T-500148,13/12/2025,S001,CAJ03,EMP054,TARJETA CREDITO,€3.12,EUR,S9XKA4LI,OK,
PAY-0000305,T-500148,2025-12-13 01:27:00,S001,CAJ03,EMP054,Visa/Mastercard,"1,99",EUR,,OK,
PAY-0000306,T-500149,21/10/25 16:06,S003,CAJ07,EMP029,Vale Devolución,65.85,EUR,J2C9OGPS0,OK,
PAY-0000307,T-500149,21/10/25 16:06,S003,CAJ07,EMP029,Tarjeta Crédito,"397,17",EUR,NVCEQFGAS0,OK,
PAY-0000308,T-500150,30/12/25 14:22,S002,CAJ02,EMP054,Visa/Mastercard,9.76,EUR,SRYZX70IB3,OK,
PAY-0000309,T-500150,2025-12-30 14:22:00,S002,CAJ02,EMP054,Cupón,2796.07,EUR,OV6SGP3JK8X,OK,
PAY-0000310,T-500151,2 de diciembre de 2025 10:32,S002,CAJ07,EMP070,Visa/Mastercard,64.44,EUR,D1PPKPGG,OK,
PAY-0000311,T-500152,27/04/25 16:52,S003,,EMP067,Tarjeta Regalo,95.93,EUR,JMVRYDC1,OK,
PAY-0000312,T-500153,04/05/25 18:49,S005,CAJ06,EMP049,Tarjeta Débito,170.93,EUR,V953A5O47AE,OK,
PAY-0000313,T-500153,2025-05-04 19:46:00,S005,CAJ06,EMP049,Financiacion,737.74,EUR,580YIR02M7,OK,
PAY-0000314,T-500153,2025-05-04 18:49:00,S005,CAJ06,EMP049,CC,156.80,EUR,E2KYT5GQ,OK,
PAY-0000315,T-500154,22/02/25 01:50,S002,CAJ01,EMP054,EFECTIVO,635.98,EUR,,OK,
PAY-0000316,T-500155,2025-01-29 06:23:56,S002,CAJ07,EMP078,Cash,133.85,EUR,,OK,
PAY-0000317,T-500155,2025-01-29 06:23:56,S002,CAJ07,EMP078,Tarjeta Débito,118.96,EUR,LVGNP127,OK,
PAY-0000318,T-500156,15/02/2025,S003,CAJ01,EMP025,Tarjeta Regalo,1186.95,EUR,SYJ4UWHK8C,OK,
PAY-0000319,T-500157,30/04/25 18:42,S002,CAJ05,EMP069,Tarjeta (Crédito),195.24,EUR,PRMOC0K7ZT,OK,
PAY-0000320,T-500158,07/01/25 07:10,S003,CAJ01,EMP029,Tarjeta (Crédito),334.31 EUR,EUR,N9YGCMR8E,OK,
PAY-0000321,T-500158,07/01/25 07:10,S003,CAJ01,EMP029,Vale,92.01,EUR,15XJXNEC,OK,
PAY-0000322,T-500159,2025-09-07 05:01:32,S002,CAJ06,EMP063,Efectivo,"894,69",EUR,OZO32TC4T,OK,
PAY-0000323,T-500160,17/09/25 12:13,S005,CAJ01,EMP010,Tarjeta credito,300.50,EUR,SNTP8AK8,OK,
PAY-0000324,T-500160,2025-09-17 12:13:00,S005,CAJ01,EMP010,Visa/Mastercard,210.26,EUR,IGK38VHM,OK,
PAY-0000325,T-500161,14/09/25 00:58,S002,CAJ06,EMP079,DEBITO,€2983.05,EUR,X3VPF9PAVCED,OK,
PAY-0000326,T-500162,07/02/25 09:42,S005,CAJ07,EMP023,TARJETA CREDITO,356.47,EUR,DMUKJDBL1G3,OK,
PAY-0000327,T-500163,2025-11-18 01:12:00,S004,CAJ04,EMP029,Cupon,,EUR,PMQK8SZ7I,OK,
PAY-0000328,T-500164,18 de junio de 2025 12:19,S005,,EMP011,BIZUM,310.29,EUR,Y7ERYYTEAG3,OK,
PAY-0000329,T-500165,2025-04-19 21:15:00,S002,CAJ08,EMP010,cash,279.82,EUR,NEMBRG8M,OK,
PAY-0000330,T-500166,2025-04-04 09:21:00,S005,CAJ07,EMP039,Tarjeta Débito,"183,49",EUR,CAQKDM0OAPH,OK,
PAY-0000331,T-500166,04/04/25 09:21,s005,CAJ07,EMP039,TARJETA CREDITO,126.01 EUR,EUR,DP4FMPM5HG,OK,
PAY-0000332,T-500167,30 de enero de 2025 12:32,S001,CAJ06,EMP056,Tarjeta Crédito,"117,32",EUR,S74NDDAFS1I,OK,
PAY-0000333,T-500167,30 de enero de 2025 12:32,S001,CAJ06,EMP056,Gift Card,203.01,EUR,GKEJZXPR2D0V,OK,
PAY-0000334,T-500168,2025-09-21,S004,CAJ06,,EFECTIVO,€29.69,EUR,PCPBDN7ZI6,OK,
PAY-0000335,T-500169,30/04/25 17:15,S002,CAJ06,,cash,€500.11,EUR,TNXHN5E0EV6X,OK,
PAY-0000336,T-500170,2025-01-05 19:01:00,S001,CAJ02,EMP042,Tarjeta Crédito,711.74,EUR,6QZ6CP7SAV,OK,
PAY-0000337,T-500170,05/01/25 19:01,S001,CAJ02,EMP042,VALE,16.38,EUR,N2OJGFHZ52QZ,OK,
PAY-0000338,T-500171,11/07/25 12:14,S005,CAJ07,EMP035,Visa/Mastercard,"244,03",EUR,XW8L85JE,OK,
PAY-0000339,T-500172,2025-06-03,S004,CAJ04,EMP018,Visa/Mastercard,12.51 EUR,EUR,,OK,
PAY-0000340,T-500172,2025-06-03 16:06:59,S004,CAJ04,EMP018,Efectivo,69.20€,EUR,GG5GR0XAFGO,OK,
PAY-0000341,T-500172,2025-06-03 18:02:59,S004,CAJ04,EMP018,BIZUM,"36,79",EUR,1XBIDFWA,OK,
PAY-0000342,T-500173,10/03/25 23:41,S005,CAJ06,EMP026,Voucher,108.36,EUR,3DKS4F6A,OK,
PAY-0000343,T-500174,2025-12-28 23:29:00,S002,CAJ05,EMP051,EFECTIVO,"250,33",EUR,6VGTVYFY,OK,
PAY-0000344,T-500175,27/01/2025 20:36,S004,CAJ04,EMP038,Cash,177.45,EUR,U8KD9GNL,OK,
PAY-0000345,T-500176,05/06/2025,S004,CAJ02,EMP077,Tarjeta (Débito),177.33,EUR,ZIA9AU87C,OK,
PAY-0000346,T-500177,2025-05-18,S005,CAJ02,EMP032,Tarjeta (Crédito),57.28,EUR,NZXC45BNCCU,OK,
PAY-0000347,T-500177,18/05/25 20:55,S005,CAJ02,EMP032,Tarjeta credito,1974.50,EUR,VGFOP8QZ,OK,
PAY-0000348,T-500178,18/07/25 07:50,S003,CAJ07,EMP013,EFECTIVO,539.50,EUR,RXONBNPJDN2,OK,
PAY-0000349,T-500179,03/02/25 08:13,S005,CAJ01,EMP038,Financiación,43.66,EUR,DL918SLOME,OK,
PAY-0000350,T-500180,2025-10-04 00:56:00,S001,CAJ08,EMP039,Financing,65.20,EUR,3X1F8S0X7,OK,
PAY-0000351,T-500180,04/10/25 00:56,S001,CAJ08,EMP039,Tarjeta Débito,"128,87",EUR,U9DA1L526,OK,
PAY-0000352,T-500181,01/04/25 01:03,S002,CAJ03,EMP055,cash,237.67,EUR,4O47EN48NY,OK,
PAY-0000353,T-500182,20/10/25 04:10,s002,CAJ07,EMP028,Visa/Mastercard,"26,43",EUR,MQT3DGD8,OK,
PAY-0000354,T-500182,2025-10-20,S002,CAJ07,EMP028,Tarjeta Débito,"588,65",EUR,U91C329HHA,OK,
PAY-0000355,T-500183,06/09/25 04:55,S002,,EMP063,EFECTIVO,"431,39",EUR,FMPRYFZMYO,OK,
PAY-0000356,T-500184,2025-04-29 14:20:00,S003,CAJ02,EMP041,Tarjeta Crédito,48.77,EUR,J0974WXUB0G,OK,
PAY-0000357,T-500185,14/03/25 15:53,S005,CAJ03,EMP063,EFECTIVO,242.61,EUR,P9M7QNTFPKXY,OK,
PAY-0000358,T-500186,2025-11-23 04:21:00,S005,CAJ08,EMP063,Efectivo,137.27,EUR,H1TE48M2Q6X,OK,
PAY-0000359,T-500186,23/11/2025 04:21,S005,CAJ08,EMP063,Tarjeta Crédito,1268.03,EUR,FN33VM89,PENDIENTE,
PAY-0000360,T-500188,19/11/2025,S001,CAJ08,EMP055,Tarjeta (Débito),"433,61",EUR,W24WJT8H,OK,
PAY-0000361,T-500189,2025-12-01,S001,CAJ04,EMP076,Contado,"487,78",EUR,TI221XJ7W,OK,
PAY-0000362,T-500190,14/04/2025,S005,CAJ03,EMP038,Debit Card,"116,10",EUR,NL63GAGUVB9,OK,
PAY-0000363,T-500191,2025-02-21 12:46:06,S004,CAJ05,EMP017,GiftCard,"461,18",EUR,,OK,
PAY-0000364,T-500192,2025-12-08 19:21:37,S005,CAJ07,EMP010,DEBITO,356.48,EUR,L28R5P03WVPU,OK,
PAY-0000365,T-500192,2025-12-08,S005,CAJ07,EMP010,Tarjeta (Débito),99.28,EUR,PGIHNFLAYZ,OK,
PAY-0000366,T-500192,2025-12-08 19:21:37,S005,CAJ07,EMP010,GiftCard,20.15,EUR,YP3HBRBJEQV,OK,
PAY-0000367,T-500193,2025-06-28,S004,CAJ01,EMP012,Efectivo,1001.06,EUR,1OULWOZQ48,OK,
PAY-0000368,T-500194,2025-02-20,S002,CAJ06,EMP044,Efectivo,166.57,EUR,J2D8CLW3,OK,
PAY-0000369,T-500196,10/09/25 00:17,S003,CAJ06,EMP048,Cash,1010.06,EUR,IJKCU5X0HC8,OK,
PAY-0000370,T-500197,2025-09-22 01:53:00,,CAJ08,EMP076,Tarjeta (Crédito),523.76,EUR,NQWHOCPY8U,OK,
PAY-0000371,T-500198,23/02/2025,S001,CAJ02,EMP048,Tarjeta Crédito,"1521,91",EUR,NBN7GGGJVS,OK,
PAY-0000372,T-500200,2025-02-02 17:15:17,S003,CAJ06,EMP032,Tarjeta Crédito,165.38,EUR,2MKV0DSZR,OK,
PAY-0000373,T-500201,01/11/25 09:33,S002,CAJ04,EMP038,TARJETA CREDITO,"77,14",EUR,8URID3U94S,OK,
PAY-0000374,T-500202,1 de agosto de 2025 04:24,S001,CAJ06,EMP073,DEBITO,76.40,EUR,146VEY0A94XF,OK,
PAY-0000375,T-500204,01/06/2025 18:27,S003,CAJ04,EMP020,Credit Card,€144.81,EUR,,OK,
PAY-0000376,T-500204,2025-06-01,S003,CAJ04,EMP020,TARJETA CREDITO,26.44,EUR,DA7FYSKUFR,OK,
PAY-0000377,T-500205,25/08/25 10:43,,CAJ02,EMP015,Tarjeta debito,208.43,EUR,8ZF0P7KB7,OK,
PAY-0000378,T-500206,2025-12-06 05:14:16,S003,CAJ05,EMP017,Cash,"92,41",EUR,KK7QG24DSY,OK,
PAY-0000379,T-500207,30/11/25 17:48,S005,CAJ08,EMP047,TARJETA CREDITO,"408,57",EUR,65B4EYQ1S4DJ,OK,
PAY-0000380,T-500208,24/12/2025,S001,CAJ01,EMP061,cash,556.91,EUR,,OK,
PAY-0000381,T-500209,31/01/25 05:57,S004,CAJ04,EMP041,Tarjeta Regalo,"141,83",EUR,34T3Y4WPW,OK,
PAY-0000382,T-500210,2025-08-03,S001,CAJ05,,Vale Devolución,327.70 EUR,EUR,EOUBXXQ6MF5,OK,
PAY-0000383,T-500211,2025-08-01 06:18:00,S003,CAJ08,EMP026,CC,872.97,EUR,7C4R8VGZSX,OK,
PAY-0000384,T-500212,10 de octubre de 2025 10:08,S001,CAJ01,EMP049,GiftCard,320.75,EUR,D50N97CJB,OK,
PAY-0000385,T-500213,2025-10-18 10:55:00,S001,CAJ07,EMP048,Tarjeta (Débito),€158.83,EUR,3GUWYH36MOTC,OK,
PAY-0000386,T-500214,2025-12-26 15:20:11,S004,CAJ03,EMP034,Visa/Mastercard,"1,402.71 EUR",EUR,DRBTA3K3OM,OK,
PAY-0000387,T-500214,2025-12-26 15:20:11,S004,CAJ03,EMP034,DC,243.18,EUR,XBPH5CH3L1,OK,
PAY-0000388,T-500215,16/02/2025 21:29,S005,CAJ02,EMP060,Tarjeta (Crédito),€239.32,EUR,IMR25I7A2HVN,OK,
PAY-0000389,T-500216,04/10/25 04:28,S003,CAJ01,EMP042,Cash,"135,20",EUR,052U9AZ3CEG,OK,
PAY-0000390,T-500217,2025-06-29 10:33:00,S001,CAJ08,EMP071,Tarjeta credito,786.95,EUR,72KXSJZSB6,OK,
PAY-0000391,T-500218,30/01/2025,S003,CAJ02,EMP034,Tarjeta credito,817.85,EUR,,OK,
PAY-0000392,T-500219,09/10/25 08:11,S001,CAJ08,EMP074,CC,"973,76",EUR,B1761M3J1H,OK,
PAY-0000393,T-500220,2025-08-02,S002,CAJ04,EMP064,Tarjeta (Crédito),20.57,EUR,Q9I6KYJ91KU,OK,
PAY-0000394,T-500221,31/10/25 11:30,S005,CAJ07,EMP046,TARJETA CREDITO,140.05,EUR,HC7JVLCG1J5E,OK,
PAY-0000395,T-500224,10/03/25 04:18,S005,CAJ04,EMP064,Tarjeta Crédito,209.16,EUR,VMCPSILN,OK,
PAY-0000396,T-500225,2025-02-27 08:46:32,S002,CAJ03,EMP042,cash,"306,34",EUR,,OK,
PAY-0000397,T-500226,22/02/25 23:49,S003,CAJ07,EMP044,CC,1174.80,EUR,,OK,
PAY-0000398,T-500226,22/02/25 23:49,S003,CAJ07,EMP044,Visa/Mastercard,332.31,EUR,29IL9YQ8O,OK,
PAY-0000399,T-500227,27/05/25 22:47,S005,CAJ06,EMP076,cash,639.09,EUR,MEOSFR5HGQ,OK,
PAY-0000400,T-500228,26 de agosto de 2025 10:29,S004,CAJ01,EMP041,Visa/Mastercard,38.93,EUR,ZIKM3MVDZC7,OK,
PAY-0000401,T-500228,26 de agosto de 2025 10:29,S004,CAJ01,EMP041,Credit Card,172.65,EUR,D6VNXNPSV8DK,OK,
PAY-0000402,T-500229,27/09/2025 06:36,S001,CAJ06,EMP034,CC,€426.36,EUR,JP5K7917XF,OK,
PAY-0000403,T-500229,27/09/25 04:52,S001,CAJ06,EMP034,CC,590.09 EUR,EUR,,OK,
PAY-0000404,T-500230,2025-07-06 05:09:49,S004,CAJ07,EMP049,Debit Card,"1135,73",EUR,LSJWS1ZL,OK,
PAY-0000405,T-500231,2025-03-04 01:21:00,S003,CAJ02,EMP022,Tarjeta (Crédito),98.29,EUR,KH5840ACUHG,OK,
PAY-0000406,T-500231,04/03/2025,S003,CAJ02,EMP022,CC,"164,64",EUR,VTKH861PQIP,OK,
PAY-0000407,T-500232,09/02/25 07:47,S004,CAJ03,EMP056,TARJETA CREDITO,641.80,EUR,JLOPO6J0M3,OK,
PAY-0000408,T-500233,2025-07-10,S003,CAJ02,EMP074,EFECTIVO,606.58,EUR,CBHT94OZKFNO,OK,
PAY-0000409,T-500235,2025-11-22 02:08:22,S003,CAJ01,EMP060,Efectivo,237.33,EUR,5CSZ0A0T7D,OK,
PAY-0000410,T-500236,12 de junio de 2025 13:56,S005,CAJ04,EMP050,Tarjeta (Crédito),203.58 EUR,EUR,UR6TIARONTD,OK,
PAY-0000411,T-500236,12 de junio de 2025 13:56,S005,CAJ04,EMP050,tarjeta regalo,€5.06,EUR,,OK,
PAY-0000412,T-500237,21 de septiembre de 2025 03:04,S004,CAJ01,EMP067,Credit Card,€167.91,EUR,BYV5JHURR,OK,
PAY-0000413,T-500237,21 de septiembre de 2025 03:04,S004,CAJ01,EMP067,Contado,24.83,EUR,1F0FP8BPG,OK,
PAY-0000414,T-500238,2025-04-11 03:40:30,S004,CAJ07,EMP019,CC,"275,33",EUR,8NVQHL097FZR,OK,
PAY-0000415,T-500238,2025-04-11 03:40:30,s004,CAJ07,EMP019,Credit Card,"400,11",EUR,MUIW7J35,OK,
PAY-0000416,T-500239,31/10/25 13:50,S004,CAJ01,EMP080,Credit Card,921.02,EUR,1VJ35YRG29D2,OK,
PAY-0000417,T-500240,07/12/25 22:33,S001,CAJ02,EMP069,DEBITO,241.97 EUR,EUR,LCVHFWJFPPZJ,OK,
PAY-0000418,T-500240,07/12/25 22:33,S001,CAJ02,EMP069,Efectivo,1883.69,EUR,HMHVL66S,OK,
PAY-0000419,T-500241,2025-01-20 01:13:00,S002,CAJ07,EMP043,Cash,1456.05,EUR,NWZZG4C4,OK,
PAY-0000420,T-500242,05/05/25 14:42,S001,CAJ04,EMP057,tarjeta regalo,334.31,EUR,,OK,
PAY-0000421,T-500243,03/10/2025,S005,CAJ01,EMP021,Tarjeta (Débito),"527,16",EUR,LUEQ4D7D,OK,
PAY-0000422,T-500244,01/10/25 15:39,S002,CAJ04,EMP007,DEBITO,7.89,EUR,BZGFLIG5GK,OK,
PAY-0000423,T-500245,2025-11-22 07:29:00,S004,CAJ08,EMP045,CC,1127.26,EUR,HZS32D1JQB,OK,
PAY-0000424,T-500246,2025-07-19 08:07:40,S002,CAJ04,EMP035,Tarjeta credito,751.40,EUR,,OK,
PAY-0000425,T-500248,26/04/25 21:59,S005,CAJ06,EMP077,DC,€2054.73,EUR,,OK,
PAY-0000426,T-500249,05/05/25 02:45,S003,CAJ04,EMP077,CC,721.19,EUR,8L12QFAF,OK,
PAY-0000427,T-500249,05/05/25 02:45,S003,CAJ04,EMP077,Tarjeta Crédito,€30.87,eur,6Y3Z1DE1E,OK,
PAY-0000428,T-500250,05/09/25 21:30,S004,CAJ04,EMP029,Visa/Mastercard,€91.45,EUR,6XEGHPMXPKN,OK,
PAY-0000429,T-500250,2025-09-05,S004,CAJ04,EMP029,Tarjeta (Crédito),29.40,EUR,,OK,
PAY-0000430,T-500251,2025-03-13 02:19:00,S001,CAJ05,EMP072,GiftCard,151.91,EUR,Z48EGP15CA8,OK,
PAY-0000431,T-500252,03/12/25 11:22,S003,CAJ05,EMP016,DC,915.12,EUR,PQKBE0TOGT,OK,
PAY-0000432,T-500253,10/08/2025 03:13,S003,CAJ03,EMP026,cash,"1605,08",EUR,N9C70PA8,OK,
PAY-0000433,T-500254 ,2025-04-17 05:27:00,S003,CAJ03,,Cash,11.53,EUR,JYV6YJOAO,OK,
PAY-0000434,T-500254 ,17/04/25 05:27,S003,CAJ03,,Tarjeta Débito,€97.66,EUR,PVTRUML3F4RT,OK,
PAY-0000435,T-500255,11/10/25 18:14,S004,CAJ08,EMP005,Tarjeta (Débito),"1,166.01",EUR,UO11K09NTN,OK,
PAY-0000436,T-500256,17/08/25 14:48,S002,CAJ06,EMP014,EFECTIVO,804.33,EUR,XYWWSTIO,OK,
PAY-0000437,T-500257,2025-03-15 04:15:28,S005,CAJ03,EMP063,Tarjeta credito,760.23 EUR,EUR,VSCUOAVFW,OK,
PAY-0000438,T-500257,2025-03-15 04:15:28,S005,CAJ03,EMP063,Tarjeta (Crédito),1027.54,EUR,LK6HQIV92,OK,
PAY-0000439,T-500258,06/09/25 16:13,S005,CAJ02,EMP005,Contado,406.07,EUR,5TZV9ZP3C3,OK,
PAY-0000440,T-500259,2025-04-09 03:59:00,S001,CAJ02,EMP049,Debit Card,200.15,EUR,HDXC6RIJKQ2,OK,
PAY-0000441,T-500260,28/08/2025 21:21,S005,CAJ03,EMP014,Tarjeta (Crédito),572.42,EUR,FKNWBHKVJ,OK,
PAY-0000442,T-500261,22/03/25 15:50,S003,CAJ05,EMP071,BIZUM,307.25,EUR,MLIK22XM,OK,
PAY-0000443,T-500261,22/03/2025 15:50,S003,CAJ05,EMP071,Cash,474.83,EUR,SJ84TC2QSI,OK,
PAY-0000444,T-500261,22/03/2025 15:50,S003,CAJ05,EMP071,CC,€808.05,EUR,6EKHI1RD,OK,
PAY-0000445,T-500262,08/09/25 05:39,s002,CAJ02,EMP013,Credit Card,396.06,EUR,9JOJWLRKXJT,OK,
PAY-0000446,T-500263,22/10/25 10:58,S003,CAJ06,EMP015,Visa/Mastercard,€1233.84,EUR,3GDILK1QY7HY,OK,
PAY-0000447,T-500264,2025-06-05,S005,CAJ02,EMP044,Tarjeta credito,326.14,EUR,L03LLU1A7,OK,
PAY-0000448,T-500265,20/12/25 21:14,S002,CAJ01,EMP021,Tarjeta credito,609.13,EUR,4DILRZQ8BXY,OK,
PAY-0000449,T-500266,2025-01-25 14:20:05,S002,CAJ08,EMP053,TARJETA_REGALO,143.67,EUR,,OK,
PAY-0000450,T-500267,14/09/25 23:36,S005,CAJ06,EMP080,Credit Card,1226.41,EUR,,OK,
PAY-0000451,T-500268,2025-12-04 16:49:00,S005,CAJ03,EMP061,Debit Card,"722,77",EUR,,OK,
PAY-0000452,T-500269,29 de noviembre de 2025 15:59,S004,CAJ02,EMP074,Tarjeta Crédito,"378,24",EUR,24D7V911P,OK,
PAY-0000453,T-500270,05/09/25 14:17,S001,CAJ01,EMP078,bizum,"29,39",EUR,LF4V1TXH3,OK,
PAY-0000454,T-500270,2025-09-05 14:17:00,S001,CAJ01,EMP078,Tarjeta credito,202.17,EUR,8LLIHKPJ7H,OK,
PAY-0000455,T-500271,2025-10-06 07:44:00,S001,CAJ08,EMP080,TARJETA_REGALO,538.48,EUR,0E1ERV0LG92M,OK,
PAY-0000456,T-500271,06/10/25 07:44,S001,CAJ08,EMP080,Efectivo,338.32,EUR,X35A806B,OK,
PAY-0000457,T-500272,2025-07-11 05:42:25,S003,CAJ06,EMP006,Contado,"257,80",EUR,,OK,
PAY-0000458,T-500273,19/01/25 01:24,S002,CAJ04,EMP014,Tarjeta Regalo,1407.29,EUR,NVSFA6D9ER94,OK,
PAY-0000459,T-500274,2025-06-18 02:05:00,S005,,EMP007,Tarjeta (Débito),"365,45",EUR,ICDO5DIGX,OK,
PAY-0000460,T-500275,25/08/2025 12:13,S002,CAJ06,EMP050,DC,272.46,EUR,AW4IOAR4G,OK,
PAY-0000461,T-500276,2025-10-04 11:08:00,S002,CAJ05,EMP071,Tarjeta credito,896.38,EUR,YMSCNX8E,OK,
PAY-0000462,T-500277,15/08/25 08:08,S002,CAJ06,EMP046,Contado,344.51,EUR,1H0S2UTBT,OK,
PAY-0000463,T-500278,22/01/2025 23:35,S004,CAJ02,EMP019,Tarjeta credito,171.86,EUR,86QE7AJUL7W8,OK,
PAY-0000464,T-500278,22/01/25 23:35,S004,CAJ02,EMP019,TARJETA CREDITO,75.52,EUR,C8J6E07FPY,OK,
PAY-0000465,T-500278,22/01/25 23:35,S004,CAJ02,EMP019,Tarjeta debito,"583,91",EUR,51Z58B4J,OK,
PAY-0000466,T-500279,2025-12-04 04:13:00,S002,CAJ01,EMP058,Visa/Mastercard,395.49,EUR,406XLYJMAZ,OK,
PAY-0000467,T-500280,2025-11-03 01:43:00,S003,CAJ01,EMP050,Debit Card,4460.90,EUR,,OK,
PAY-0000468,T-500281,18/03/25 07:13,S004,CAJ06,EMP070,TARJETA CREDITO,101.15,EUR,YAUA8D7204J,OK,
PAY-0000469,T-500281,2025-03-18 08:10:00,S004,CAJ06,EMP070,DC,7.08,EUR,12GRDMT28LL,OK,
PAY-0000470,T-500282,15/08/25 19:08,S001,CAJ07,EMP034,CC,€180.22,EUR,ZU1TOZHDV5OJ,OK,
PAY-0000471,T-500283,2025-01-29,S005,CAJ05,EMP074,Credit Card,442.25,EUR,IIXHAIAW4,OK,
PAY-0000472,T-500284,25/04/25 00:18,S004,CAJ04,EMP043,Credit Card,104.39€,EUR,,OK,
PAY-0000473,T-500285,05/04/25 16:38,S001,CAJ06,EMP079,bizum,€214.67,EUR,ZXT9QUBWRP,OK,
PAY-0000474,T-500286,17/07/2025,S005,CAJ01,EMP048,CC,1537.83,EUR,,OK,
PAY-0000475,T-500287,2025-06-14,S005,CAJ02,EMP028,cash,573.54,EUR,T00IV1GG,OK,
PAY-0000476,T-500288,2025-01-29 10:43:00,S001,CAJ03,EMP043,Tarjeta Crédito,"220,02",EUR,GOI9WM1S,OK,
PAY-0000477,T-500289,15/02/25 22:41,S004,CAJ07,EMP003,Efectivo,"152,59",EUR,9DYFNGP41,OK,
PAY-0000478,T-500289,15/02/25 22:41,S004,CAJ07,EMP003,cash,126.97,EUR,S6RV9777TNQE,OK,
PAY-0000479,T-500289,15/02/25 22:41,S004,CAJ07,EMP003,Tarjeta Débito,102.63,EUR,DSXLSUTOTHLQ,OK,
PAY-0000480,T-500290,20/04/25 07:55,S001,CAJ02,EMP039,TARJETA_REGALO,"236,98",EUR,LV6TX0TB,OK,
PAY-0000481,T-500291,2025-12-11 11:14:06,S002,CAJ05,EMP019,Efectivo,€67.31,EUR,XA7HY7AI3399,OK,
PAY-0000482,T-500291,2025-12-11 11:14:06,S002,CAJ05,EMP019,Voucher,142.88,EUR,,OK,
PAY-0000483,T-500291,2025-12-11 11:14:06,S002,CAJ05,EMP019,Tarjeta (Crédito),10.25,EUR,EYCEF2CTG08,OK,
PAY-0000484,T-500292,18/10/25 14:37,S001,CAJ07,EMP011,TARJETA CREDITO,401.45,EUR,BNDYCPN0P,OK,
PAY-0000485,T-500293,9 de agosto de 2025 07:33,S002,CAJ05,EMP024,EFECTIVO,224.82,EUR,FKCGGXP5CIT,OK,
PAY-0000486,T-500294,2025-05-09 11:45:00,S003,CAJ05,EMP075,Tarjeta Débito,151.24,EURO,41BTA3RU,OK,
PAY-0000487,T-500294,09/05/25 11:45,S003,CAJ05,EMP075,Efectivo,21.47,EUR,IK08NJF0PK,OK,
PAY-0000488,T-500294,09/05/2025 11:45,S003,CAJ05,EMP075,Visa/Mastercard,17.05,EUR,QMXETIZU802,OK,
PAY-0000489,T-500295,2025-06-16 08:06:51,S005,CAJ03,EMP047,Tarjeta (Crédito),"240,62",EUR,,OK,
PAY-0000490,T-500295,2025-06-16 08:06:51,S005,CAJ03,EMP047,Cash,162.81,EUR,2HOQ5E7L7W05,OK,
PAY-0000491,T-500296,28/10/25 21:21,S003,CAJ06,EMP060,Tarjeta Crédito,1554.11,EUR,ZKDU6FOTWF,OK,
PAY-0000492,T-500297,13/12/2025 11:01,S002,CAJ04,EMP010,Gift Card,47.93,EUR,88U595CE,OK,
PAY-0000493,T-500297,13/12/25 11:01,S002,CAJ04,EMP010,Tarjeta Crédito,39.22,EUR,A6PG4GKS6R6,OK,
PAY-0000494,T-500297,13/12/25 11:01,S002,CAJ04,EMP010,EFECTIVO,"51,49",EUR,AUKHQNZJNNS9,OK,
PAY-0000495,T-500298,28/03/2025,S001,CAJ08,EMP020,TARJETA CREDITO,"1038,60",EUR,GCUIDC00,OK,
PAY-0000496,T-500299,11/03/2025 00:00,S002,,EMP018,Contado,"313,23",EUR,,OK,
PAY-0000497,T-500300,21/07/25 03:02,S004,CAJ05,EMP006,Tarjeta Débito,388.80,EUR,AGHFT9ZZCGL9,OK,
PAY-0000498,T-500301,10/08/25 10:16,S005,CAJ05,EMP034,CC,"2.869,36",EUR,,OK,
PAY-0000499,T-500302,2025-05-14 23:56:00,S004,CAJ04,EMP046,TARJETA_REGALO,391.90,EUR,L9GVBMQQ749,OK,
PAY-0000500,T-500303,15/02/2025 22:55,S003,CAJ03,EMP078,Tarjeta credito,2649.68,EUR,,OK,
PAY-0000501,T-500304,02/09/25 11:44,s004,CAJ01,EMP076,DEBITO,497.50,EUR,,OK,
PAY-0000502,T-500305,2025-07-03 01:53:30,S001,CAJ05,EMP028,tarjeta regalo,€586.35,EUR,EK035N8CQPHL,OK,
PAY-0000503,T-500306,2025-08-20,S002,CAJ05,EMP044,Cash,443.30,EUR,L5NFLTQ6,OK,
PAY-0000504,T-500307,07/12/25 21:14,S002,CAJ03,EMP079,Credit Card,49.81,EUR,RL5H3G7VKC,OK,
PAY-0000505,T-500309,02/02/25 13:14,S005,CAJ03,EMP030,Vale Devolución,233.37,EUR,V1DJJZQFE,OK,
PAY-0000506,T-500310,11/02/25 09:25,,CAJ04,EMP041,Contado,€582.55,EUR,CZECCFS7I19M,OK,
PAY-0000507,T-500310,11/02/25 09:25,,CAJ04,EMP041,Credit Card,6137.10,EUR,,OK,
PAY-0000508,T-500311,05/08/25 12:51,S003,CAJ07,EMP053,Efectivo,324.16,EUR,RYZTBVHUAZ,OK,
PAY-0000509,T-500312,2025-03-04 20:02:23,S002,CAJ02,EMP058,Tarjeta debito,167.18,EUR,BVXSOGB205H,OK,
PAY-0000510,T-500312,2025-03-04 20:02:23,S002,CAJ02,EMP058,TARJETA_REGALO,17.70,EUR,AA34H8NL9VFR,OK,
PAY-0000511,T-500313,2025-08-22 02:41:00,S001,CAJ01,EMP019,Tarjeta (Crédito),"71,79",EUR,80NKXKBEF,OK,
PAY-0000512,T-500313,2025-08-22,S001,CAJ01,EMP019,Tarjeta credito,1775.91,EUR,5UUJZR0FCYB,OK,
PAY-0000513,T-500313,22/08/25 02:41,S001,CAJ01,EMP019,Efectivo,€3025.58,EUR,8GY39BU4UZ,OK,
PAY-0000514,T-500314,20 de junio de 2025 11:30,S005,CAJ01,EMP023,tarjeta regalo,€1686.55,EUR,QMK31RTMPV,OK,
PAY-0000515,T-500314,20 de junio de 2025 11:30,S005,CAJ01,EMP023,TARJETA CREDITO,"114,84",EUR,,OK,
PAY-0000516,T-500315,2025-02-03 17:26:00,S002,CAJ01,EMP001,EFECTIVO,1061.84,EUR,0Y2RL4N7S,OK,
PAY-0000517,T-500316,17/03/2025 14:34,,CAJ06,EMP036,Credit Card,"1.518,48",EUR,KHW8GAKH3YC,OK,
PAY-0000518,T-500317,2025-06-21 22:54:10,S001,CAJ05,EMP074,Tarjeta Crédito,"472,71",EUR,5NTDYWM8RAB,OK,
PAY-0000519,T-500318,2025-09-04 02:57:21,S004,CAJ01,EMP034,Contado,115.34,EUR,YVYBSCGJ,OK,
PAY-0000520,T-500319,18 de octubre de 2025 19:12,,CAJ05,EMP012,Visa/Mastercard,"145,53",EUR,IN0XGNKI5VR,OK,
PAY-0000521,T-500320,2025-03-22 07:18:59,S002,CAJ04,EMP031,Tarjeta Crédito,"392,75",EUR,ZCD5XRSI7EAD,OK,
PAY-0000522,T-500320,2025-03-22 07:18:59,S002,CAJ04,EMP031,Efectivo,"316,17",EUR,EZAC2EXVA5,OK,
PAY-0000523,T-500321,11/07/25 04:56,S004,CAJ01,EMP048,EFECTIVO,"123,32",EUR,UI14NIJC,OK,
PAY-0000524,T-500321,2025-07-11 06:21:00,S004,CAJ01,EMP048,Tarjeta debito,180.33,EUR,X1FVK1PBCD6,OK,
PAY-0000525,T-500322,30/07/2025,S002,CAJ03,EMP055,Credit Card,350.66,EUR,7VXUQDRMSWJJ,OK,
PAY-0000526,T-500323,09/02/25 03:02,S005,CJ01,EMP027,tarjeta regalo,594.05,EUR,2YGYZTHQS,OK,
PAY-0000527,T-500324,05/06/25 13:47,S002,CAJ04,EMP048,Tarjeta debito,"2,163.10",EUR,39AG77Q9VJU,OK,
PAY-0000528,T-500326,2025-11-13 02:06:00,S003,CAJ01,EMP021,Credit Card,"131,46",EUR,H6UAMWJPIWU,OK,
PAY-0000529,T-500327,2025-12-03 20:27:00,S005,CAJ05,EMP053,Tarjeta debito,52.34,EUR,IOIV67KA,OK,
PAY-0000530,T-500327,03/12/2025 20:27,S005,CAJ05,EMP053,Vale,"277,47",EUR,,OK,
PAY-0000531,T-500328,28 de mayo de 2025 23:50,S003,CAJ08,EMP058,Tarjeta debito,"2,63",EUR,GOHMJZ6N58Y,OK,
PAY-0000532,T-500328,28 de mayo de 2025 23:50,S003,CAJ08,EMP058,Cash,"295,97",EUR,DJIN9RG4XV3,OK,
PAY-0000533,T-500329,14/05/25 10:49,S004,CAJ07,EMP010,Vale Devolución,"169,72",EUR,IDBX287G,OK,
PAY-0000534,T-500330,18 de febrero de 2025 13:27,S003,CAJ08,EMP024,Tarjeta debito,2380.83,EUR,IA41SASCE,OK,
PAY-0000535,T-500330,18 de febrero de 2025 13:27,S003,CAJ08,EMP024,Efectivo,"1143,56",EUR,1CNAQ2YOTOS8,OK,
PAY-0000536,T-500331,23/07/25 11:52,S001,CAJ08,EMP004,Visa/Mastercard,388.34,EUR,AR1H11QV1F,OK,
PAY-0000537,T-500332,2025-09-15 00:00:00,S003,CAJ03,EMP022✓,Tarjeta debito,110.01,EUR,QNXPVMSR75,OK,
PAY-0000538,T-500333,06/09/25 11:14,S005,CAJ08,EMP073,Contado,€23.60,EUR,V51PSXT0S9F3,OK,
PAY-0000539,T-500334,25/09/25 02:28,S03,CAJ03,EMP061,Visa/Mastercard,243.30,EUR,9H9FB02H6F,OK,
PAY-0000540,T-500334,2025-09-25 02:28:00,S03,CAJ03,EMP061,cash,232.06,EUR,,OK,
PAY-0000541,T-500335,2025-03-05 09:46:55,S005,CAJ07,EMP056,Tarjeta debito,150.35,EUR,,OK,
PAY-0000542,T-500336,10/06/25 08:32,S005,CAJ05,EMP069,Tarjeta (Crédito),479.10,EUR,LCFR7CL6P3FR,OK,
PAY-0000543,T-500337,2025-02-09 18:10:00,S002,CAJ03,EMP069✓,Bizum,907.15 EUR,EUR,FP672ZFB,OK,
PAY-0000544,T-500338,13 de enero de 2025 07:48,S003,CAJ08,EMP060,cash,119.43,EUR,3GGO9DVW,OK,
PAY-0000545,T-500339,2025-06-22 00:41:00,S003,CAJ01,EMP032,Tarjeta Crédito,"256,89",EUR,LX3P724XHQZB,OK,
PAY-0000546,T-500340,17/01/25 09:12,S002,CAJ05,EMP021,TARJETA_REGALO,1099.86,EUR,XNOMB42O3Q8,OK,
PAY-0000547,T-500341,2025-11-05,S002,CAJ04,EM042,tarjeta regalo,"4222,88",EUR,IV86ZP1WZ,OK,
PAY-0000548,T-500342,2025-08-29 06:11:16,S002,CAJ02,EMP064,Debit Card,1091.50,EUR,QZTT1BLO,OK,
PAY-0000549,T-500343,20/06/25 09:09,S002,CAJ06,EMP045,Debit Card,"147,60",EUR,AIH3IABC2T,OK,
PAY-0000550,T-500346,01/03/25 20:36,S003,CAJ07,EMP064,Tarjeta (Crédito),"1384,82",EUR,GXAPLIRD70,OK,
PAY-0000551,T-500347,10/08/25 18:13,S002,CAJ04,EMP025,Tarjeta credito,420.88,EUR,C11JG1MS4,OK,
PAY-0000552,T-500349,31/01/25 06:24,S001,CAJ05,EMP010,CC,1955.17,EUR,F3TR7WB42P,OK,
PAY-0000553,T-500350,10/02/25 23:27,S005,CAJ03,EMP072,EFECTIVO,734.64,EUR,GUAXNM0ALQE,OK,
PAY-0000554,T-500351,22/06/25 01:10,S002,CAJ06,EMP069,CC,329.67,EUR,Z39K499NR,OK,
PAY-0000555,T-500351,2025-06-22 01:33:00,S002,CAJ06,EMP069,Tarjeta credito,"500,48",EUR,GH2IJ4TT,OK,
PAY-0000556,T-500352,2025-05-26 16:41:00,S004,CAJ06,EMP073,GiftCard,"514,00",EUR,,OK,
PAY-0000557,T-500353,2025-03-28 04:08:02,S001,CAJ01,,Credit Card,55.06,EUR,HZG85S9ASJ2,OK,
PAY-0000558,T-500354,23/02/25 18:03,S005,CAJ03,EMP059,Tarjeta Crédito,"282,61",EUR,AEV0YU3U8IZ,OK,
PAY-0000559,T-500355,2025-02-07,S001,CAJ08,EMP074,Efectivo,"792,18",EUR,5LOXYPHW,OK,
PAY-0000560,T-500358,17/10/25 10:50,S003,CAJ03,EMP011,Tarjeta (Débito),"822,91",EUR,KPA2TVMXQY,OK,
PAY-0000561,T-500358,17/10/25 10:50,S003,CAJ03,EMP011,Tarjeta credito,207.43,EUR,ZSYJX20AU5,OK,
PAY-0000562, T-500359 ,28/01/2025 19:46,S002,CAJ04,EMP068,Tarjeta (Crédito),14.42,EUR,RG0ZPZJH,OK,
PAY-0000563,T-500359,2025-01-28 19:46:00,S002,CAJ04,EMP068,Tarjeta (Débito),€65.42,EUR,RPUYD6I5HO,OK,
PAY-0000564,T-500360,7 de marzo de 2025 17:34,S003,CAJ06,EMP004,CC,122.28,EUR,,OK,
PAY-0000565,T-500361,2025-08-30 04:09:44,S003,CAJ02,EMP007,DC,0.40,EUR,25DSIUAZ7,OK,
PAY-0000566,T-500361,2025-08-30 04:09:44,S003,CAJ02,EMP007,Efectivo,"33,41",EUR,HKCQWB00N,OK,
PAY-0000567,T-500362,02/08/25 03:11,S003,CAJ04,EMP067,Credit Card,"656,18",EUR,JSTY87679,OK,
PAY-0000568,T-500362,2025-08-02,S003,CAJ04,EMP067,Vale Devolución,€2183.25,EUR,HK1QDU2E,OK,
PAY-0000569,T-500363,28 de agosto de 2025 23:50,S005,CAJ03,EMP026,Tarjeta (Crédito),"407,38",EUR,,OK,
PAY-0000570,T-500364,03/10/2025,S01,CAJ07,EMP049,Financiacion,1606.10,EUR,PPWC1QY9MBAA,OK,
PAY-0000571,T-500364,03/10/2025,S01,CAJ07,EMP049,DC,123.25,EUR,,OK,
PAY-0000572,T-500365,2025-01-08 03:14:00,S001,CAJ05,EMP051,Contado,870.62,EUR,6CG1S2LQSQBB,OK,
PAY-0000573,T-500366,13/05/25 17:40,S004,CAJ01,EMP036,Visa/Mastercard,€499.61,EUR,2NBZWBHO4,OK,
PAY-0000574,T-500367,30/07/25 13:59,S002,CAJ07,EMP078,Tarjeta Regalo,651.07,EUR,WJ4G8R7SN1,OK,
PAY-0000575,T-500367,30/07/25 13:59,S002,CAJ07,EMP078,Tarjeta (Crédito),114.58,EUR,IPZN0THL,OK,
PAY-0000576,T-500368,08/08/2025 08:43,S005,CAJ07,EMP019,Debit Card,9.60 EUR,EUR,86ADNOKKU,OK,
PAY-0000577,T-500368,08/08/2025 08:43,S005,CAJ07,EMP019,DEBITO,211.09,EUR,,OK,
PAY-0000578,T-500369,28/04/2025 00:26,S002,CAJ06,EMP053,Tarjeta (Débito),€89.77,EUR,33DZQQ5EB,OK,
PAY-0000579,T-500370,24/08/25 04:38,S001,CAJ01,EMP079,Tarjeta (Débito),799.26,EUR,,OK,
PAY-0000580,T-500371,31/05/25 11:23,S004,CAJ08,EMP048,Tarjeta (Crédito),,EUR,MWR03V8675Y,OK,
PAY-0000581,T-500371,31/05/25 11:23,S004,CAJ08,EMP048,CC,14.23,EUR,OR4V1OG07,OK,
PAY-0000582,T-500372,20/06/2025 16:01,S002,CAJ04,EMP009,Credit Card,167.85,EUR,7P80SD0P477,OK,
PAY-0000583,T-500373,2025-07-23 23:30:00,S004,CAJ07,EMP074,tarjeta regalo,256.12,EUR,3SGUR4PU,OK,
PAY-0000584,T-500373,2025-07-23,S004,CAJ07,EMP074,Cupon,173.04,EUR,KRYT6EBIN0,OK,
PAY-0000585,T-500374,20/01/2025,S005,CAJ01,EMP067,Efectivo,163.67,EUR,ZWW1UN2KTVV0,OK,
PAY-0000586,T-500375,08/09/25 22:06,S003,CAJ01,EMP019,CC,€18.36,EUR,,OK,
PAY-0000587,T-500376,2025-12-15 05:04:00,S002,CAJ06,EMP023,Tarjeta credito,"1974,61",EUR,19BP0L70SHY,OK,
PAY-0000588,T-500377,2025-05-30 03:57:00,S001,CAJ08,EMP011,CC,"246,43",EUR,B22O1TFXDT,OK,
PAY-0000589,T-500378,04/10/2025 12:45,S005,CAJ03,EMP019,EFECTIVO,2675.12,EUR,2LSWBB8RIA4P,OK,
PAY-0000590,T-500379,2025-07-13 06:37:00,S002,CAJ01,EM033,Efectivo,43.73,EUR,WC0BOGWHUP,OK,
PAY-0000591,T-500380,09/12/25 14:24,S004,CAJ08,,Tarjeta credito,"110,64",EUR,0RWRNBFZ,OK,
PAY-0000592,T-500380,09/12/25 14:24,S004,CAJ08,,Visa/Mastercard,"469,22",EUR,,OK,
PAY-0000593,T-500381,24 de diciembre de 2025 10:36,S003,CAJ01,EMP078,TARJETA CREDITO,150.70,EUR,E1ISYERUMEH,OK,
PAY-0000594,T-500382,06/02/2025,S005,CAJ08,EMP047,TARJETA CREDITO,"446,62",EUR,OT760RS6,OK,
PAY-0000595,T-500383,10/06/2025 17:36,S001,CAJ03,EMP036,Cash,2543.22,EUR,,OK,
PAY-0000596,T-500384 ,12/08/25 08:43,S005,CAJ05,EMP041,Tarjeta Crédito,947.46,EUR,,OK,
PAY-0000597,T-500385,2025-01-10 07:34:23,,CAJ04,,Cash,"2257,26",EUR,YXAM97YOFCX,OK,
PAY-0000598,T-500386,2025-04-09,S005,CJ04,EMP026,TARJETA CREDITO,522.10,EUR,,OK,
PAY-0000599,T-500387,2025-05-12 05:47:00,S005,CAJ01,EMP025,Tarjeta (Crédito),€37.49,EUR,SWXKQTQ36ZPM,OK,
PAY-0000600,T-500387,12/05/25 05:47,S005,CAJ01,EMP025,Tarjeta Crédito,€56.64,EUR,,OK,
PAY-0000601,T-500388,2025-01-22 18:09:55,S005,CAJ08,EMP053,Cash,"51,48",EUR,LSOGWIBJB6M9,OK,
PAY-0000602,T-500388,2025-01-22 18:09:55,S005,CAJ08,EMP053,CC,€77.86,EUR,OVHM3KWWETUJ,OK,
PAY-0000603,T-500388,22/01/2025 20:04,S005,CAJ08,EMP053,Contado,€508.68,EUR,G8O8G8HZMVY,OK,
PAY-0000604,T-500389,2025-05-26 17:29:00,S003,CAJ03,EMP004,Tarjeta Crédito,359.69,EUR,ALW563C36,OK,
PAY-0000605,T-500389,26/05/25 17:29,S003,CAJ03,EMP004,CC,41.50 EUR,EUR,LLD0N53R,OK,
PAY-0000606,T-500390,2025-05-25 07:24:00,S003,CAJ05,EMP064,Credit Card,"913,93",EUR,W8EVRC0ERJE,OK,
PAY-0000607,T-500391,2025-05-13 02:06:00,S001,CAJ01,EMP065,DEBITO,423.20,EUR,5EZS96KW0P,OK,
PAY-0000608,T-500391,2025-05-13 02:06:00,S001,CAJ01,EMP065,Credit Card,"322,49",EUR,,OK,
PAY-0000609,T-500392,05/10/25 03:57,S005,CAJ03,EMP005,Tarjeta Crédito,314.50,EUR,RSWP0YKKSW,OK,
PAY-0000610,T-500393,23/03/25 11:54,S001,CAJ05,EMP040,Tarjeta credito,"1594,88",EUR,7K8CH3Z3D,OK,
PAY-0000611,T-500394,16/04/25 06:23,S01,CAJ02,EMP045,CC,,EUR,1OZXGGMQJ,OK,
PAY-0000612,T-500395,2025-01-21 21:27:04,S001,CAJ08,EMP007,Tarjeta debito,2709.23,EUR,Z8XGQHPZH,OK,
PAY-0000613,T-500396,18/09/2025,S004,CAJ05,EMP026,Tarjeta (Crédito),427.16,EUR,ITIFXZIU6H,OK,
PAY-0000614,T-500398,29/06/25 03:05,S003,CAJ01,EMP015,Cash,717.85,EUR,6V4UAUPFL,OK,
PAY-0000615,T-500399,18/08/25 08:11,S001,CAJ02,EMP069,Credit Card,120.34,EUR,00BGBB1R3YQ,OK,
PAY-0000616,T-500399,18/08/25 08:11,S001,CAJ02,EMP069,Tarjeta (Débito),"73,27",EUR,,OK,
PAY-0000617,T-500400,2025-04-02 17:07:04,S005,CAJ07,EMP044,Vale,6.57,EUR,,OK,
PAY-0000618,T-500400,2025-04-02 19:05:04,S005,CAJ07,EMP044,EFECTIVO,100.10,EUR,36U9CYRVEOW0,OK,
PAY-0000619,T-500401,2025-06-07 14:16:17,S005,CAJ02,EMP023,Tarjeta (Débito),"888,68",EUR,0X717HW0B,OK,
PAY-0000620,T-500401,2025-06-07 14:16:17,S005,CAJ02,EMP023,TARJETA_REGALO,"305,91",EUR,DAUOS74U,OK,
PAY-0000621,T-500402,2025-09-14 15:51:00,S001,CAJ03,EMP001,Credit Card,202.04,EUR,VEZRAD8EJPML,OK,
PAY-0000622,T-500403,22/12/2025 10:32,S003,CAJ05,EMP056,Tarjeta credito,"226,77",EUR,P5AIEKX6,OK,
PAY-0000623,T-500403,22/12/2025 09:31,S003,CAJ05,EMP056,Tarjeta Débito,"67,39",EUR,8U1QP2WNV2M,OK,
PAY-0000624,T-500404,20/05/25 12:24,S003,,EMP072,TARJETA CREDITO,92.70,EUR,QJ7RPBAD,OK,
PAY-0000625,T-500404,20/05/25 12:24,S003,,EMP072,Cash,16.62,EUR,QICB5NTJ,OK,
PAY-0000626,T-500405,2025-08-04 16:54:15,S004,CAJ04,EMP061,Visa/Mastercard,"1108,68",EUR,,OK,
PAY-0000627,T-500406,07/09/2025,S002,CAJ08,EMP018,Tarjeta credito,1179.35,EUR,OPLLV12BVX,OK,
PAY-0000628,T-500407,2025-08-23 19:01:52,S004,CAJ08,EMP029,Visa/Mastercard,€2.00,EUR,2BVS3K337O,OK,
PAY-0000629,T-500408,2025-07-07 00:12:43,S005,CAJ01,EMP048,Tarjeta Regalo,"2009,51",EUR,I31PHYSVKU,OK,
PAY-0000630,T-500409 ,2025-07-29 09:40:00,S005,CAJ08,EMP010,Tarjeta Crédito,510.30,EUR,XXWXJ46T9,OK,
PAY-0000631,T-500409 ,2025-07-29 09:40:00,S005,CAJ08,EMP010,Tarjeta (Débito),"1,287.12",EUR,SVKXB3CTOJTF,OK,
PAY-0000632,T-500410,21/08/25 02:22,S003,CAJ05,EMP005,Contado,€149.44,EUR,4NDVDXDF6,OK,
PAY-0000633,T-500410,2025-08-21 02:22:00,S003,CAJ05,EMP005,Contado,7.15,EUR,JVIE6DUE,OK,
PAY-0000634,T-500411,2025-01-30 20:24:00,S003,CAJ01,EMP011,Tarjeta credito,3030.20,EUR,57ZKVNIJ,OK,
PAY-0000635,T-500412,02/04/2025,S002,CAJ06,EMP034,tarjeta regalo,€1441.40,EUR,TTSW5EJR91,ANULADO,
PAY-0000636,T-500413,2025-10-10 00:42:07,S004,CAJ07,EMP031,GiftCard,262.11,EUR,IROAGI7L,OK,
PAY-0000637,T-500415,2025-07-26 08:00:00,S004,CAJ06,EMP006,Tarjeta (Débito),-132.68,EUR,OC1R601EJT1,OK,Importe negativo (posible devolución mal registrada)
PAY-0000638,T-500415,2025-07-26,S004,CAJ06,EMP006,Efectivo,€-23.39,EUR,,OK,Importe negativo (posible devolución mal registrada)
PAY-0000639,T-500416,2025-09-20 06:10:00,S003,CAJ05,EMP051,TARJETA_REGALO,397.90,EUR,Y5LV92BEEV,OK,
PAY-0000640,T-500417,24/09/25 05:19,S001,CJ02,EMP013,TARJETA CREDITO,1636.88 EUR,EUR,,OK,
PAY-0000641, T-500417 ,24/09/25 05:19,S001,CJ02,EMP013,Tarjeta credito,107.61,EUR,JB79YJ65WPOL,OK,
PAY-0000642,T-500418,23/08/2025,S002,CAJ02,EMP016,TARJETA CREDITO,9.67,EUR,I2JONEW1M,OK,
PAY-0000643, T-500418 ,2025-08-23 00:00:00,S002,CAJ02,EMP016,cash,103.38,EUR,82P5YRO1W,OK,
PAY-0000644,T-500419,25/12/2025 08:08,S002,CAJ08,EMP010,Visa/Mastercard,"1899,76",EURO,9E5GV7P2A2Q,OK,
PAY-0000645,T-500420,11/04/25 06:57,S001,CAJ01,EMP043,Tarjeta credito,1143.16,EUR,M3G98GEYZILJ,OK,
PAY-0000646,T-500421,05/10/25 20:00,S002,CAJ07,EMP014,Tarjeta Crédito,2036.45,EUR,W09YW3DP11IK,OK,
PAY-0000647,T-500423,2025-09-25 16:22:00,S004,CAJ02,EMP001,Tarjeta Crédito,"320,55",EUR,,OK,
PAY-0000648,T-500424,28/06/25 12:08,S004,CAJ02,EMP044,EFECTIVO,474.96,EUR,ZORK64MG,OK,
PAY-0000649,T-500425,10/12/2025 18:47,S003,CAJ02,EMP046,TARJETA CREDITO,63.33,EUR,,OK,
PAY-0000650,T-500425,10/12/25 18:47,S003,CAJ02,EMP046,DEBITO,160.52,EUR,151VL9RZ4D4Y,OK,
PAY-0000651,T-500425,2025-12-10 18:47:00,S003,CAJ02,EMP046,Debit Card,"76,66",EUR,VFIUD99XR,OK,
PAY-0000652,T-500426,2025-01-07 09:01:46,S005,CAJ08,EMP058,CC,"89,86",EUR,NPE6SWYU2RNA,OK,
PAY-0000653,T-500426,2025-01-07 09:01:46,S005,CAJ08,,Tarjeta credito,267.09,EUR,12J21TELO9LY,OK,
PAY-0000654,T-500427,09/07/2025,S005,CAJ04,EMP005,Tarjeta Crédito,"300,35",EUR,PDAX6KDD49I,OK,
PAY-0000655,T-500427,2025-07-09 01:18:00,S005,CAJ04,EMP005,Debit Card,134.51 EUR,EUR,TKFTUWFV2TT,OK,
PAY-0000656,T-500428,25/01/25 20:07,S003,CAJ02,EMP022,Efectivo,"275,26",EUR,IADPZ9Q8SU5N,OK,
PAY-0000657,T-500429,2025-05-05 21:26:05,S004,CAJ07,EMP074,Tarjeta (Crédito),59.62,EUR,GCT2XFDZOEJF,OK,
PAY-0000658,T-500429,2025-05-05 21:32:05,S004,,EMP074,CC,"31,32",EUR,N4BPSAUE5R,OK,
PAY-0000659,T-500430,05/04/25 14:55,S002,CAJ03,EMP071,Efectivo,"3,39",EUR,ADS83GYZIE,OK,
PAY-0000660,T-500430,05/04/2025 14:55,S002,CAJ03,EMP071,Tarjeta Crédito,20.49,EUR,,OK,
PAY-0000661,T-500431,2025-10-02 11:18:00,S001,,EMP023,Contado,4609.56,EUR,BCPLA8JZ,OK,
PAY-0000662,T-500431,02/10/25 11:18,S001,,EMP023,EFECTIVO,2313.71,EUR,MVKQE4DWZ79,OK,
PAY-0000663,T-500431,2025-10-02 12:56:00,S001,,EMP023,Tarjeta (Crédito),496.27,EUR,6H52MJ13M7P,OK,
PAY-0000664,T-500432,2025-03-09,S002,CAJ05,EMP053,TARJETA_REGALO,€356.29,EUR,,OK,
PAY-0000665,T-500432,2025-03-09 18:54:00,S002,CAJ05,EMP053,Tarjeta Crédito,€123.51,EUR,MC8FU0AB76LB,OK,
PAY-0000666,T-500432,09/03/25 18:54,S002,CAJ05,EMP053,Voucher,470.94,EUR,F2ZQOYGW,OK,
PAY-0000667,T-500433,29/08/25 08:45,S001,CAJ04,EMP068,tarjeta regalo,"196,47",EUR,CDHZG58X,OK,
PAY-0000668,T-500433,2025-08-29 08:45:00,S001,CAJ04,EMP068,cash,128.59,EUR,BM0YX6X3B9KY,OK,
PAY-0000669,T-500436,10/06/25 05:40,S003,CAJ02,EMP013,EFECTIVO,43.60,EUR,,OK,
PAY-0000670,T-500436,10/06/2025 05:40,S003,CAJ02,EMP013,Contado,"102,05",EUR,OR7AAU76,OK,
PAY-0000671,T-500437,03/09/25 10:51,S005,CAJ07,EMP059,Credit Card,155.65,EUR,5AOQ14MAFM,OK,
PAY-0000672,T-500438,2025-11-03 00:07:00,S004,CAJ06,EMP038,BIZUM,€664.16,EUR,UX64BIW8,OK,
PAY-0000673,T-500438,03/11/2025 01:53,S004,CAJ06,EMP038,Cupón,€1408.78,EUR,,OK,
PAY-0000674,T-500438,2025-11-03,S004,CAJ06,EMP038,Tarjeta credito,108.18,EUR,OI4P2GAYQ,OK,
PAY-0000675,T-500439,22/11/25 01:18,S004,CAJ08,EMP028,Debit Card,267.58,EUR,C6SEURAND,OK,
PAY-0000676,T-500440,2025-01-18 04:11:57,S002,CAJ03,EMP001,GiftCard,97.29,EUR,7R1Z4C9VF6,OK,
PAY-0000677,T-500441,07/06/25 21:57,S001,CAJ04,EMP002,TARJETA CREDITO,2667.42,EUR,E8CDK9X07,OK,
PAY-0000678,T-500442,2025-06-26 15:25:24,S003,CAJ08,EMP075✓,cash,"1,570.53",EUR,R4E5IZB1EDM,OK,
PAY-0000679,T-500444,30/06/25 17:24,S001,CAJ06,EMP015,Visa/Mastercard,"149,51",EUR,9DY39CK5B,OK,
PAY-0000680,T-500445,14 de octubre de 2025 08:52,S002,CAJ06,EMP015,Gift Card,205.18 EUR,EUR,58P8O85BIOFU,OK,
PAY-0000681,T-500445,14 de octubre de 2025 08:52,S002,CAJ06,EMP015,Vale,"192,82",EUR,YVGIPAXNQ,OK,
PAY-0000682,T-500445,14 de octubre de 2025 08:52,S002,CAJ06,EMP015,Tarjeta (Débito),"39,81",EUR,7TLYDSS5B0,OK,
PAY-0000683,T-500446,08/07/25 19:57,S005,CAJ05,EMP048,Efectivo,"1212,86",EUR,89GNCTIJH3,OK,
PAY-0000684,T-500447,22/04/25 23:49,S001,CAJ08,EMP051,Tarjeta (Crédito),332.76,EUR,V62J16W8MIN,OK,
PAY-0000685,T-500448,08/09/25 08:53,S001,CAJ03,EMP054,Tarjeta (Débito),4.60,,,OK,
PAY-0000686,T-500449,16/09/25 14:13,S003,CAJ06,EMP042,CC,"10,96",EUR,JN7K98XV,OK,
PAY-0000687,T-500449,16/09/2025 14:13,S003,CAJ06,EMP042,Tarjeta credito,163.18,EUR,D66BX0RTM,OK,
PAY-0000688,T-500450,2025-04-21 00:46:00,S002,CAJ05,EMP007,Visa/Mastercard,1098.53,EUR,,OK,
PAY-0000689,T-500451,2025-06-21 05:22:00,S002,CAJ02,EMP041,EFECTIVO,"601,48",EUR,GQE6XB1Z337,OK,
PAY-0000690,T-500452,26/10/2025 11:06,S002,CAJ02,EMP052,Visa/Mastercard,239.18,EUR,K8YE71TWD96H,OK,
PAY-0000691,T-500453,07/11/25 12:35,S003,CAJ05,EMP074,Tarjeta credito,1509.97 EUR,EUR,,OK,
PAY-0000692,T-500454,2025-03-27 15:02:00,S002,CAJ02,EMP052,Tarjeta debito,238.05,EUR,IPS8QDB9B,OK,
PAY-0000693,T-500455,03/02/25 22:24,S003,CAJ02,EMP058,Efectivo,408.45,EUR,Z8R2W71TJ,OK,
PAY-0000694,T-500455,03/02/25 22:24,S003,CAJ02,EMP058,Tarjeta (Crédito),902.03,EUR,K9M94UZXY4G8,OK,
PAY-0000695,T-500457,17/08/25 00:54,S004,CAJ07,EMP054,Contado,8.60,EUR,J3AYIUKEUF5,OK,
PAY-0000696,T-500457,17/08/25 00:54,S004,CAJ07,EMP054,TARJETA CREDITO,710.81,EUR,2BLU27XNPZ,OK,
PAY-0000697,T-500458,04/08/2025,S005,,EMP035,TARJETA CREDITO,"10,72",EUR,AG9XC5REX,OK,
PAY-0000698,T-500458,04/08/2025,S005,,EMP035,tarjeta regalo,39.84,EUR,P6I29GPO1,OK,
PAY-0000699,T-500459,29/08/26 06:42,S003,CAJ05,EMP060,Contado,€93.71,EUR,LG8Y2WGEBEC,OK,
PAY-0000700,T-500460,24/10/25 23:41,s003,CAJ08,EMP032✓,FINANCIACION,245.71,EUR,QQL7PH6P9JLA,OK,
PAY-0000701,T-500461,2025-10-12,S003,CAJ08,EMP016,Tarjeta credito,"148,17",EUR,QANDTQYPICLK,OK,
PAY-0000702,T-500462,2025-04-24 07:12:00,S001,CAJ07,EMP046,cash,43.88,EUR,O7V1IZ4J,OK,
PAY-0000703,T-500462,24/04/2025 06:30,S001,CAJ07,EMP046,CC,"66,29",EUR,E00HU3X5U7D,OK,
PAY-0000704,T-500464,2025-03-02 00:33:22,S003,CAJ07,EMP021,GiftCard,690.75 EUR,EUR,4EIBKPK7F,OK,
PAY-0000705,T-500464,02/03/2025 02:07,S003,CAJ07,EMP021,BIZUM,698.65 EUR,EUR,GUW48TP37V7,OK,
PAY-0000706,T-500464,2025-03-02 00:33:22,S003,CAJ07,EMP021,EFECTIVO,"1708,48",EUR,BILKJHDKX,OK,
PAY-0000707,T-500465,20/02/25 23:10,S005,CAJ02,EMP010,Visa/Mastercard,220.54,EUR,F2DXR6CJ,OK,
PAY-0000708,T-500465,20/02/25 23:10,S005,CAJ02,EMP010,Tarjeta (Crédito),170.52,EUR,1011HE9WIEE,OK,
PAY-0000709,T-500466,29/11/25 18:05,S003,CAJ05,EMP016,Tarjeta Crédito,215.13€,EUR,1L6CKNC7GI,OK,
PAY-0000710,T-500467,14/09/2025 05:48,S001,CAJ07,EMP014,Tarjeta credito,1178.65,EUR,BNP5O3XT08,OK,
PAY-0000711,T-500467,2025-09-14 05:40:00,S001,CAJ07,EMP014,TARJETA CREDITO,"149,53",EUR,I5P2QFS7GLB8,OK,
PAY-0000712,T-500469,2025-07-25 09:08:00,S005,CAJ02,EMP075,CC,"1.004,89",EUR,QSIMYO7WY66Q,OK,
PAY-0000713,T-500470,19/09/25 13:42,S001,CAJ08,EMP076,Efectivo,469.66,EUR,FRNJHQFMK,OK,
PAY-0000714, T-500471 ,01/10/25 16:34,S003,CAJ02,EMP064,TARJETA CREDITO,776.83,EUR,K4RV7AQ2,OK,
PAY-0000715,T-500472,28 de enero de 2025 00:48,S004,CAJ07,EMP055,VALE,"893,83",EUR,8VLIG7R2F,OK,
PAY-0000716,T-500473,18/08/2025,S004,CAJ02,EMP051,Cash,231.69,EUR,BVLXUIIY3,OK,
PAY-0000717,T-500474,2025-10-25 11:22:40,S004,CAJ07,EMP036,TARJETA CREDITO,"1.506,97",EUR,BU4I4CXG,OK,
PAY-0000718,T-500475,11/02/2025 22:58,S005,CAJ08,EMP019,Tarjeta Crédito,"€1,505.71",EUR,JTO914YBNU,OK,
PAY-0000719,T-500476,2025-05-07 23:26:00,S001,CAJ01,EMP049,GiftCard,"790,87",EUR,XEF73GGAYB,OK,
PAY-0000720,T-500477,30/11/2025 20:43,S003,,,Vale,1699.36,EUR,YDFZDTC5PAYG,OK,
PAY-0000721,T-500478,05/08/2025,S004,CAJ07,EMP005,Tarjeta (Débito),"47,37",EUR,4WXUWCOZFQP,OK,
PAY-0000722,T-500478,2025-08-05 00:00:00,S004,CAJ07,EMP005,EFECTIVO,1225.70,EUR,,OK,
PAY-0000723,T-500479,04/07/25 19:48,S001,CAJ08,EMP070,,"410,43",EUR,ZFY40I6QV,OK,
PAY-0000724,T-500480,2025-05-16 11:46:02,S003,CAJ01,EMP017,Voucher,"345,00",EUR,43ICEV8E,OK,
PAY-0000725,T-500481,02/05/25 04:58,S003,CAJ01,EMP032,Contado,97.38 EUR,EUR,NG5UDLHWV6FL,OK,
PAY-0000726,T-500483,19 de junio de 2025 07:43,S003,CAJ06,EMP039,Efectivo,134.65,EUR,,OK,
PAY-0000727,T-500484,13/08/25 13:09,S005,CAJ04,EMP012,Debit Card,554.03 EUR,EUR,24EQKQ7MOU3D,OK,
PAY-0000728,T-500485,29/07/25 16:40,s001,CAJ05,EMP039,TARJETA CREDITO,-1812.73 EUR,EUR,VC4GTJS1A5UG,OK,Importe negativo (posible devolución mal registrada)
PAY-0000729,T-500487,2025-06-09 09:43:00,S004,CAJ03,EMP039,Visa/Mastercard,32143.50,EUR,BMOYD52MH,OK,
PAY-0000730,T-500488,06/11/25 12:59,S005,CAJ04,EMP025✓,Tarjeta Crédito,2040.18,EUR,OXBE1P5EI,OK,
PAY-0000731,T-500489,17/01/25 09:38,S001,CAJ05,EMP023,Tarjeta credito,3.23 EUR,EUR,6WPRLPG7GV,OK,
PAY-0000732,T-500489,2025-01-17 09:38:00,S001,CAJ05,EMP023,Contado,188.58,EUR,IPG43TLRCELM,OK,
PAY-0000733,T-500489,17/01/2025 09:38,s001,CAJ05,EMP023,CC,116.74,EUR,7XWQF1TTI,OK,
PAY-0000734,T-500490,23/11/25 03:36,S001,CAJ07,EMP012,GiftCard,677.99,EUR,MB4BLDQL,OK,
PAY-0000735,T-500491,2025-02-17 11:42:09,S005,CAJ05,EMP012,FINANCIACION,735.41,EUR,K6HMRTIEHC,OK,
PAY-0000736,T-500492,09/04/2025 18:18,S004,CAJ02,EMP036,Visa/Mastercard,"100,13",EUR,3PLCGQLLX7,OK,
PAY-0000737,T-500493,05/10/25 22:32,S004,CAJ05,EMP019,CC,297.44 EUR,EUR,79I3EVJN2J6B,OK,
PAY-0000738,T-500493,05/10/25 22:32,S004,CAJ05,EMP019,Efectivo,41.74,EUR,TOS6GKJ7,OK,
PAY-0000739,T-500494,30/09/2025 02:13,S001,CAJ04,EMP050,Contado,"474,15",EUR,BFPV0V6443KT,OK,
PAY-0000740,T-500494,30/09/2025 02:14,S001,CAJ04,EMP050,Visa/Mastercard,"1440,94",EUR,SOSC0WHS1,OK,
PAY-0000741,T-500495,30/11/25 18:20,S004,CAJ05,EMP031,Tarjeta debito,0.00,EUR,4QUNF57VH,OK,
PAY-0000742,T-500496,10/06/25 09:04,S001,CAJ02,EMP063,DEBITO,"1,240.92",EUR,I4EURE5M,OK,
PAY-0000743,T-500496,10/06/25 09:04,S001,CAJ02,EMP063,Visa/Mastercard,€182.47,EUR,ZHCMZ2RNO,OK,
PAY-0000744,T-500497,26/06/25 00:42,S003,CAJ06,EMP071,CC,409.07,EUR,QIX43IRGM5,OK,
PAY-0000745,T-500498,2025-10-26 02:37:08,S003,CAJ02,EMP032,,€426.86,EUR,J3YC6WZ8L6,OK,
PAY-0000746,T-500499,07/11/25 12:08,s004,CAJ03,EMP076,Cupón,"860,37",EUR,,OK,
PAY-0000747,T-500500,30/09/25 08:13,S001,CAJ04,EMP060,tarjeta regalo,€571.66,EUR,,OK,
PAY-0000748,T-500501,24/12/2025 06:55,S002,CJ02,EMP068,Efectivo,123.73,EUR,T6ERQ5A838,OK,
PAY-0000749,T-500502,17/11/25 01:03,S003,CAJ07,EMP027,cash,41.33,EUR,HKRAJIAA6,OK,
PAY-0000750,T-500502,17/11/25 01:03,S003,CAJ07,EMP027,Tarjeta (Débito),238.45,EUR,,OK,
PAY-0000751,T-500503,02/07/25 02:17,S004,CAJ06,EMP059,Tarjeta credito,"428,22",EUR,4XCRWDWF1,OK,
PAY-0000752,T-500503,02/07/25 02:17,S004,CAJ06,EMP059,Tarjeta Crédito,"228,21",EUR,42GA3YYGDTW,OK,
PAY-0000753,T-500504,02/04/25 04:52,S005,CAJ02,EMP007,Tarjeta Crédito,333.18,EUR,ZCMOTBMRLCR,OK,
PAY-0000754,T-500505,2025-02-21 08:32:00,,CAJ07,EMP051,Tarjeta Crédito,1964.16,EUR,GA3L71029,OK,
PAY-0000755,T-500506,19/02/25 15:50,S001,CAJ07,EMP015,Efectivo,"386,64",EUR,AMHV1F070VK,OK,
PAY-0000756,T-500506,19/02/25 15:50,S001,CAJ07,EMP015,Credit Card,"138,71",EUR,3ZA8E83MTEBD,OK,
PAY-0000757,T-500507,10/07/2025,S003,CAJ07,EMP041,DC,58.65,EUR,LJSI3UDUUR,OK,
PAY-0000758,T-500507,10/07/2025,S003,CAJ07,EMP041,DC,21.85,EUR,429KJPQ8S,OK,
PAY-0000759,T-500507,10/07/2025,S003,CAJ07,EMP041,Cash,"148,30",EUR,5ML51AATN,OK,
PAY-0000760,T-500509,2025-04-21 08:09:00,S001,CAJ03,EMP012,,393.55,EUR,3ER70UT10,OK,
PAY-0000761,T-500509,21/04/25 08:09,S001,CAJ03,EMP012,EFECTIVO,240.12,EUR,NBAV4VJHP6,OK,
PAY-0000762,T-500509,21/04/25 08:09,S001,CAJ03,EMP012,GiftCard,-353.51,EUR,8L9GJ4ANLIOB,OK,Importe negativo (posible devolución mal registrada)
PAY-0000763,T-500510,13/07/25 10:43,S005,CAJ03,EMP010,cash,"3.236,90",EUR,,OK,
PAY-0000764,T-500511,28/06/25 17:41,S005,CAJ02,EMP020✓,EFECTIVO,175.10,EUR,WGL8I9AKFD,OK,
PAY-0000765,T-500514,2025-07-19,S003,CAJ03,EMP013,cash,"93,81",EUR,JOBEIFDD,OK,
PAY-0000766,T-500515,2025-06-30 00:24:53,S005,CAJ07,EMP066,EFECTIVO,55.37,EUR,L08KGFP94K,OK,
PAY-0000767,T-500516,2025-02-19 15:05:00,S001,CAJ07,EMP062,TARJETA CREDITO,375.00,EUR,,OK,
PAY-0000768,T-500518,24 de junio de 2025 17:49,S001,CAJ05,EMP059,Tarjeta Regalo,7131.40,EUR,84JC755OTS4,OK,
PAY-0000769,T-500519,15/02/25 07:31,S005,CAJ02,,Tarjeta Regalo,"30,04",EUR,B051T8FMW4,OK,
PAY-0000770,T-500520,2025-02-04 01:25:00,S005,CAJ06,EMP051,TARJETA CREDITO,410.17,EUR,AYIIY2S53,OK,
PAY-0000771,T-500521,13/06/25 20:11,S002,CAJ04,EMP060,Cash,"1084,90",EUR,5EOL0TA8R,OK,
PAY-0000772,T-500522,04/01/25 01:23,S004,CAJ04,EMP051,Credit Card,"214,71",EUR,,OK,
PAY-0000773,T-500522,04/01/25 01:23,S004,CAJ04,EMP051,Tarjeta Crédito,27.65,EUR,5F9MZ99ZJUK,OK,
PAY-0000774,T-500523,2025-12-30,S003,CAJ07,EMP076,cash,1232.52,EUR,EQ1ZQ8DAYDW,OK,
PAY-0000775,T-500524,15/02/25 09:58,S003,CAJ05,EMP054,Contado,2.42,EUR,YZNM5SAX,OK,
PAY-0000776,T-500524,15/02/25 09:58,S003,CAJ05,EMP054,DC,127.99 EUR,EUR,4JXA2YMPYI,OK,
PAY-0000777,T-500525,24/09/2025 00:25,,CAJ08,EMP029,EFECTIVO,142.59,EUR,6F4ZZW5UK4,OK,
PAY-0000778,T-500525,2025-09-24 00:25:16,S002,CAJ08,EMP029,Bizum,"42,93",EUR,NZ1Z9ZO2,OK,
PAY-0000779,T-500526,20/04/25 16:41,S004,CAJ06,EMP021,cash,97.58,EUR,4ERTL15E166,OK,
PAY-0000780,T-500527,12/04/2025 08:43,S004,CAJ04,EMP003,DEBITO,"41,06",EUR,1PQFMPAH3Q,OK,
PAY-0000781,T-500529,2025-11-23 20:15:08,S005,CAJ02,EMP057,Cash,"163,73",EUR,YNFGJ1YOFQT,OK,
PAY-0000782,T-500529,2025-11-23 20:15:08,S005,CAJ02,EMP057,CC,89.14,EUR,HT7RYME6PS,OK,
PAY-0000783,T-500530,2025-12-20,S005,CAJ02,EMP016,Voucher,"541,40",EUR,1RU08L4PJAGX,OK,
PAY-0000784,T-500530,2025-12-20 19:00:10,S005,CAJ02,EMP016,Tarjeta Crédito,"1453,67",EUR,HO4QHCG7FD1,ANULADO,Pago anulado por duplicidad
PAY-0000785,T-500531,20/06/25 12:47,S002,CAJ06,EMP016,Credit Card,411.93,EUR,48AV3G60,OK,
PAY-0000786,T-500532,16/09/25 06:12,S002,CAJ06,EMP054,Vale,220.86,EUR,OG5BMABU,OK,
PAY-0000787,T-500532,16/09/25 06:12,S002,CAJ06,EMP054,Efectivo,1125.71,EUR,8BO7JFM03,OK,
PAY-0000788,T-500533,04/01/25 20:43,S004,CAJ06,EMP057,Contado,625.16,EUR,3ZQX3QFXM,OK,
PAY-0000789,T-500535,27/02/25 00:51,,CAJ01,EMP068,Visa/Mastercard,"12,340.36",EUR,U4GBGCN3,OK,
PAY-0000790,T-500536,09/10/25 14:24,S004,CAJ05,EMP069,,903.26 EUR,EUR,M9E5IMLZ6I,OK,
PAY-0000791,T-500537,16/07/25 05:30,s002,CAJ05,EMP039,CC,€32.39,EURO,E321D5C21,OK,
PAY-0000792,T-500539,2025-07-20,S005,CAJ07,EMP032,Contado,"268,23",EUR,XU6M9DEOCI,OK,
PAY-0000793,T-500541,2025-02-26 01:24:00,S004,CAJ08,EMP054,Credit Card,218.81,EUR,AUF0TJ5JG,OK,
PAY-0000794,T-500542,2025-02-16 04:12:00,S002,CAJ01,EMP072,tarjeta regalo,657.16,EUR,9N04FDTZJ2L7,OK,
PAY-0000795,T-500543,25/02/25 11:38,S003,CAJ06,EMP063✓,Vale,1688.82,EUR,,OK,
PAY-0000796,T-500543,25/02/25 11:38,S003,CAJ06,EMP063✓,Cupón,169.94,EUR,3T9LP2E2A,OK,
PAY-0000797,T-500544,11/08/2025 13:17,,CAJ06,EMP006,Contado,"176,63",EUR,TM27O19Q,OK,
PAY-0000798,T-500545,31/08/25 15:16,S004,CAJ08,EMP042,Tarjeta credito,189.75,EUR,A763BUPGRKB,OK,
PAY-0000799,T-500545,31/08/25 15:16,S004,CAJ08,EMP042,Visa/Mastercard,"285,84",EUR,H4ZPATQXLKDY,OK,
PAY-0000800,T-500546,27/10/25 15:47,S003,CAJ03,EMP074,Cash,"570,54",EUR,YH5HOA7WK,OK,
PAY-0000801,T-500547,16 de febrero de 2025 17:07,S005,CAJ04,EMP065,EFECTIVO,141.17,EUR,61PY2VG9353,OK,
PAY-0000802,T-500548,29/12/25 16:06,S004,CAJ06,EMP006,CC,"739,99",EUR,1GJPMH3U,OK,
PAY-0000803,T-500549,04/02/25 19:23,S001,CAJ03,EMP024,TARJETA CREDITO,849.34,EUR,9AMSM5R7,OK,
PAY-0000804,T-500550,18/11/25 11:06,S001,CAJ07,EMP034,FINANCIACION,277.87,EUR,Q8SJQONTQ,OK,
PAY-0000805,T-500551,2025-06-08 02:13:00,S005,CAJ02,EMP041,TARJETA CREDITO,39.07,EUR,U7FRZUD1LBQ4,OK,
PAY-0000806,T-500551,2025-06-08,S005,CAJ02,EMP041,Debit Card,346.33,EUR,HOXXAOZ5E,OK,
PAY-0000807,T-500552,2025-06-07 23:08:00,S005,CAJ04,EMP017,Cash,95.79,EUR,1UHYGSW419A,OK,
PAY-0000808,T-500553,01/01/25 09:19,S002,CAJ07,EMP072,Tarjeta (Crédito),"186,28",EUR,1OF7Y5R7,OK,
PAY-0000809,T-500555 ,08/11/2025 11:42,S001,CAJ05,EMP027,Tarjeta (Crédito),136.71,EUR,T3LJOKBZ,OK,
PAY-0000810,T-500555 ,2025-11-08 11:42:00,S001,CAJ05,EMP027,Contado,41.06,EUR,VPANGW3PAJVF,OK,
PAY-0000811,T-500556,2025-09-26 16:27:00,S003,CAJ08,EM043,Voucher,34.37,EUR,8JHE5S517DX,OK,
PAY-0000812,T-500556,26/09/2025 16:27,S003,CAJ08,EM043,,174.55,EUR,9OKQBBWBX54Q,OK,
PAY-0000813,T-500557,2025-12-13 15:22:00,S004,CAJ02,EMP010,Credit Card,205.62,EUR,GXWDPA7YZ5ND,OK,
PAY-0000814,T-500558,16/10/2025,S001,CAJ06,,Contado,€1078.90,EUR,XMS3RAG0K,OK,
PAY-0000815,T-500559,18/12/25 06:37,S002,CAJ08,EMP005,Visa/Mastercard,€112.22,EUR,IN1A7KNE,OK,
PAY-0000816,T-500560,2025-08-08 16:46:00,S003,CAJ08,EMP025,TARJETA CREDITO,"340,82",EUR,TE5U9IN7OFHE,OK,
PAY-0000817,T-500561,27/09/25 03:05,S005,CAJ05,EMP003,bizum,"71,34",EUR,,OK,
PAY-0000818,T-500561,27/09/25 03:05,S005,CAJ05,EMP003,Tarjeta (Crédito),8.30,EUR,6N968XF6V,OK,
PAY-0000819,T-500562,22/09/25 03:40,S001,CAJ06,EMP053,Tarjeta (Crédito),"187,56",EUR,8363DHTG1D9O,OK,
PAY-0000820,T-500563,10 de noviembre de 2025 16:03,S004,CAJ07,EMP011,Tarjeta Crédito,€71.48,EUR,50UHEH3R,OK,
PAY-0000821,T-500564,2025-08-19 02:47:13,S001,CAJ02,EMP056,EFECTIVO,170.22,EUR,3B79P7D7UW,OK,
PAY-0000822,T-500566,2025-08-26,S001,CAJ01,EMP057,Tarjeta (Crédito),207.28,EUR,7PLR1X08,OK,
PAY-0000823,T-500566,26/08/25 04:29,S001,CAJ01,EMP057,GiftCard,1115.07,EUR,,OK,
PAY-0000824,T-500567,2025-08-31 08:21:39,S001,CAJ07,EMP077,Tarjeta credito,526.94,EUR,HRHBKGK9JQTA,OK,
PAY-0000825,T-500568,2025-08-20,S001,CAJ06,EMP014,GiftCard,714.96,EUR,49DZ8FTMJN8B,OK,
PAY-0000826,T-500569,2025-01-24 13:43:00,S003,CAJ08,EMP018,Efectivo,55.43,EUR,3AKV62ZLLT9,OK,
PAY-0000827,T-500570,24/05/25 05:44,S005,CAJ03,EMP078,Contado,340.79,EUR,WYAQTFLVM8,OK,
PAY-0000828,T-500570,2025-05-24 06:10:00,S005,CAJ03,EMP078,EFECTIVO,234.29,EUR,614RS8U9BG9Z,OK,
PAY-0000829,T-500571,2025-05-13 15:54:00,S004,CAJ04,EMP026,Visa/Mastercard,256.13,EUR,IXEXB92YFAI,OK,
PAY-0000830,T-500572,2025-12-20 14:52:00,S005,CAJ06,EMP059,TARJETA CREDITO,"865,81",EUR,03U0UP229EO,OK,
PAY-0000831,T-500573,03/01/25 14:41,S003,CAJ07,EMP024,Tarjeta Regalo,"609,97",EUR,7BIOI3NETX,OK,
PAY-0000832,T-500574,2025-12-10 20:21:37,S003,CAJ01,EMP037,Contado,"190,56",EUR,QVIEXGOBZPE8,OK,
PAY-0000833,T-500574,2025-12-10 20:21:37,S003,CAJ01,EMP037,Tarjeta Débito,204.25,EUR,IDUWETOWTK,OK,
PAY-0000834,T-500575,2025-03-23 15:33:15,S001,CAJ03,EMP015,Cash,669.77,EUR,BAQX16OEM9N,OK,
PAY-0000835,T-500576,16/03/25 10:35,S005,CAJ02,EMP017,Visa/Mastercard,"13,16",EUR,VLUCNJ0HY,OK,
PAY-0000836,T-500576,16/03/2025 10:35,S005,CAJ02,EMP017,Tarjeta Crédito,172.98,EUR,874OHL5THLV,OK,
PAY-0000837,T-500576,16/03/25 10:35,s005,CAJ02,EMP017,Tarjeta Débito,62.14,EUR,TIAXUFVP,OK,
PAY-0000838,T-500577,02/09/2025,S002,CAJ05,EMP042,Contado,937.94,EUR,,OK,
PAY-0000839,T-500577,2025-09-02 00:00:00,S002,CAJ05,EMP042,Visa/Mastercard,"18,05",EUR,,OK,
PAY-0000840,T-500578,08/09/25 12:30,S001,CAJ02,EMP050,Tarjeta credito,199.86,EUR,LLD4YEO6PPY,OK,
PAY-0000841,T-500579,22/03/2025,S004,CAJ07,,Tarjeta Crédito,"19,58",EUR,7O0ZBO70B,OK,
PAY-0000842,T-500579,2025-03-22 00:48:00,S004,CAJ07,EMP075,Tarjeta Débito,€67.41,EUR,2KB6JY5R1SP,OK,
PAY-0000843,T-500579,22/03/2025 00:00,S004,CAJ07,EMP075,Efectivo,111.67,EUR,5280KQLRVD7,OK,
PAY-0000844,T-500580,2025-07-21 11:45:00,S003,CAJ02,EMP011,Cash,331.06,EUR,V2H31PHEIV,OK,
PAY-0000845,T-500581,21/06/2025 14:40,S004,CAJ08,EMP049✓,Visa/Mastercard,1229.30,EUR,EGVT67K37,OK,
PAY-0000846,T-500582,2025-03-18 08:52:35,S002,CAJ02,EMP070,DC,799.38,EUR,Z9H0UNL0UT5,OK,
PAY-0000847,T-500583,2025-05-15 14:50:00,S005,,EMP039,CC,30.35,EUR,4C5PNEDL,OK,
PAY-0000848,T-500584,18/10/25 22:27,S005,CAJ03,EMP030,Credit Card,"554,95",EUR,BSM2OTEY,OK,
PAY-0000849,T-500585,29/09/2025,S003,CAJ06,EMP055,BIZUM,223.03,EUR,,OK,
PAY-0000850,T-500586,2025-10-20,S001,CAJ06,EMP054,Tarjeta (Crédito),8.79,EUR,0T0I91KCJU,OK,
PAY-0000851,T-500586,20/10/25 06:59,S001,CAJ06,EMP054,Debit Card,"11,07",EUR,,OK,
PAY-0000852,T-500587,2025-01-25 19:24:00,S003,CAJ07,EMP027,DC,€20.27,EUR,,OK,
PAY-0000853,T-500588,2025-03-14 13:36:00,S001,CAJ03,EMP078,CC,"117,54",EUR,LK4AGLBD0,OK,
PAY-0000854,T-500588,14/03/25 12:05,S001,CAJ03,EMP078,Tarjeta (Crédito),14.82€,EUR,,OK,
PAY-0000855,T-500590,2025-06-28 05:47:00,S004,CAJ05,EMP065,CC,"121,74",EUR,BX0NWKQ4KSD,OK,
PAY-0000856,T-500591,2025-04-22 19:31:00,S005,CAJ08,EMP006,Credit Card,98.85,EUR,533UOT477,OK,
PAY-0000857,T-500592,20/12/25 17:34,S002,CAJ03,EMP056,Visa/Mastercard,172.67,EUR,5ZWQYT39UZ,OK,
PAY-0000858,T-500593,2025-10-08 13:20:00,S002,CAJ05,EMP009,TARJETA CREDITO,"121,03",EUR,CUN91WG3HJSO,OK,
PAY-0000859,T-500594,2025-07-16 14:11:00,S001,CAJ06,EMP022,Visa/Mastercard,908.25,EUR,SNX1SE3XR6N1,OK,
PAY-0000860,T-500594,16/07/25 12:51,S001,CAJ06,EMP022,Debit Card,125.80,EUR,X4XVQBZBRQW5,OK,
PAY-0000861,T-500594,2025-07-16 13:36:00,S001,CAJ06,EMP022,Cash,103.26,EUR,LWY1P6MXSW,OK,
PAY-0000862,T-500595,2025-12-23,S004,CAJ07,EMP033,Visa/Mastercard,158.26,EUR,924HTPL13,OK,
PAY-0000863,T-500596,24/08/25 17:32,S002,CAJ05,EMP022,Contado,25.41,EUR,,OK,
PAY-0000864,T-500596,24/08/2025 17:32,S002,CAJ05,EMP022,Cash,"2178,52",EUR,1SHEURQ7V,OK,
PAY-0000865,T-500597,2025-09-28 15:18:00,S004,CAJ04,EMP069,Tarjeta Crédito,207.64,EUR,40CM0TU2AQH,OK,
PAY-0000866,T-500598,2025-12-27 17:14:00,S003,CAJ01,EMP049,DEBITO,97.50,EUR,M86CXOTX,OK,
PAY-0000867,T-500599,18/01/2025 02:13,S001,CAJ02,EMP022,cash,"49,631.50",EUR,,OK,
PAY-0000868,T-500600,06/05/25 14:00,S005,CAJ07,EMP028,Gift Card,456.99 EUR,EUR,OQE09O8A9,OK,
PAY-0000869,T-500601,2025-08-21 13:51:52,S005,CAJ02,EMP053,Efectivo,219.08€,EUR,RWARQCFK3EK,OK,
PAY-0000870,T-500602,27/10/25 14:01,S003,CAJ06,EMP050,cash,7.15,EUR,2M6NWMUFGYN5,OK,
PAY-0000871, T-500602 ,2025-10-27,S003,CAJ06,EMP050,Tarjeta Crédito,€0.35,EUR,,OK,
PAY-0000872,T-500603,18/07/25 11:06,S004,CAJ01,EMP075,tarjeta regalo,309.60,EUR,NRUHMEZV,OK,
PAY-0000873,T-500604,23/02/25 10:06,S001,CAJ07,EMP080,Tarjeta debito,182.91,EUR,RILUL7JPTGD2,OK,
PAY-0000874,T-500604,2025-02-23 11:24:00,S001,CAJ07,EMP080,Efectivo,"313,42",EUR,FPUH7ZNJ,OK,
PAY-0000875,T-500605,23/10/25 08:19,S004,CAJ06,EMP041,Tarjeta Débito,144.11,EUR,KFORDCLV,OK,
PAY-0000876,T-500606,28/09/25 09:46,S003,CAJ04,EMP032,Cash,31.31 EUR,EUR,14EHTHUGXNS8,OK,
PAY-0000877,T-500606,28/09/25 09:46,S003,CAJ04,EMP032,Tarjeta credito,"142,78",EUR,VPAJSPJ00V,OK,
PAY-0000878,T-500607,19/08/25 03:43,S002,CAJ03,EMP017,Visa/Mastercard,"1,456.99",EUR,,OK,
PAY-0000879,T-500608,2025-09-04,S002,CAJ04,EMP074,GiftCard,"432,44",EUR,,OK,
PAY-0000880,T-500608,04/09/25 20:15,S002,CAJ04,EMP074,Tarjeta (Crédito),47.71€,EUR,UZZO15U50,OK,
PAY-0000881,T-500609,29/05/2025,S004,CAJ07,EM062,Tarjeta (Crédito),"70,18",EUR,,OK,
PAY-0000882,T-500609,29/05/2025,S004,CAJ07,EM062,Cash,€45.01,EUR,V6TXOMI8CO2X,OK,
PAY-0000883,T-500610,2025-05-10 11:44:00,S004,CAJ05,EMP078,Debit Card,328.61,EUR,UE99OH12PG,OK,
PAY-0000884,T-500611,30/04/25 13:00,S004,CAJ07,EMP048,EFECTIVO,98.54,EUR,J4CYGO6ZUDO9,OK,
PAY-0000885,T-500611,2025-04-30 13:28:00,S004,CAJ07,EMP048,Credit Card,"64,66",EUR,V0B1HI8H7PR2,OK,
PAY-0000886,T-500612,23/05/2025 00:09,S004,CAJ06,EMP063,cash,"462,51",EUR,XCA4X76BT3PP,OK,
PAY-0000887,T-500612,2025-05-23,S004,CAJ06,EMP063,Tarjeta Crédito,30.40,EUR,KJFCLCCR9D,OK,
PAY-0000888,T-500614,01/02/25 04:54,S001,CAJ07,EMP076,CC,383.25,EUR,9KQ5F7UX,OK,
PAY-0000889,T-500615,2025-12-25 23:17:00,S005,CAJ07,EMP053,Credit Card,€257.41,EUR,T8BWK8XN2,OK,
PAY-0000890,T-500615,25/12/2025 23:53,S005,CAJ07,EMP053,Tarjeta (Débito),164.95,EUR,CT3M9GX06AW,OK,
PAY-0000891,T-500616,2025-11-14 01:18:01,S002,CAJ07,EMP001,Cash,"879,20",EUR,9ZMQ77HNS54G,OK,
PAY-0000892,T-500617,12/02/25 19:29,s003,CAJ03,EMP024,Credit Card,48.20,EUR,S8PGBZQ35AW,OK,
PAY-0000893,T-500618,03/02/25 06:50,s004,CAJ02,EMP022,Visa/Mastercard,496.32,EUR,TGUKTQ5SM,OK,
PAY-0000894,T-500619,03/11/25 11:56,,CAJ05,EMP001,TARJETA CREDITO,282.33,EUR,,OK,
PAY-0000895,T-500620,12/12/25 16:49,S004,CAJ06,EMP044,BIZUM,"657,40",EUR,ET4AKW6Z,OK,
PAY-0000896,T-500620,2025-12-12 16:49:00,S004,CAJ06,EMP044,Tarjeta credito,€281.63,EUR,0WTGXY7IN1,OK,
PAY-0000897,T-500621,2025-12-11 20:29:00,S003,CAJ01,EMP052,Tarjeta Crédito,-222.99,EUR,VA3T862VL1T,OK,Importe negativo (posible devolución mal registrada)
PAY-0000898,T-500622,2025-05-20 21:21:34,S004,,EM042,Cash,116.04 EUR,EUR,1N6CLPDIXCV,OK,
PAY-0000899,T-500622,2025-05-20 21:21:34,S004,,EM042,DC,€129.66,EUR,L5AKG06GK,OK,
PAY-0000900,T-500623,29/11/25 20:45,S005,CAJ06,EMP061,Visa/Mastercard,73.10,EUR,3AJNC9HXWMVM,OK,
PAY-0000901,T-500624,19/09/25 09:23,S005,CAJ01,EMP012,CC,"635,14",EUR,,OK,
PAY-0000902,T-500625,05/10/2025 23:24,S005,CAJ04,EMP012,Tarjeta Débito,252.34,EUR,,OK,
PAY-0000903,T-500626,2025-12-28 20:49:00,s001,CAJ08,EMP043,Tarjeta Regalo,360.30,EUR,IVDCCAZXPNGM,OK,
PAY-0000904,T-500626,28/12/25 20:49,S001,CAJ08,EMP043,Tarjeta (Crédito),476.66,EUR,09EI8XQ6TC,OK,
PAY-0000905,T-500626,2025-12-28 20:49:00,S001,CAJ08,EMP043,EFECTIVO,"50,91",EUR,,OK,
PAY-0000906,T-500627,2025-04-24 00:05:51,S005,CAJ07,EMP029,Cash,36.03,EUR,X2WFIYOWYPN,OK,
PAY-0000907,T-500627,2025-04-24 00:05:51,S005,CAJ07,EMP029,TARJETA_REGALO,472.21,EUR,NHRC4VGB7I31,OK,
PAY-0000908,T-500627,2025-04-24 00:05:51,S005,CAJ07,EMP029,Visa/Mastercard,26.53,EUR,,OK,
PAY-0000909,T-500628,2025-05-01 16:51:21,S003,CAJ06,EMP074,GiftCard,"93,33",EUR,32FPKP55,OK,
PAY-0000910,T-500628,2025-05-01 16:51:21,S003,CAJ06,EMP074,Tarjeta (Débito),26.88,EUR,7NQOTSVFK2,OK,
PAY-0000911,T-500628,2025-05-01 16:51:21,S003,CAJ06,EMP074,TARJETA CREDITO,32.99 EUR,EUR,,OK,
PAY-0000912,T-500629,28/06/25 21:07,S002,CAJ04,EMP002,Tarjeta (Crédito),179.60,EUR,,OK,
PAY-0000913,T-500630,2025-11-26 04:51:00,S001,CAJ05,EMP016,DEBITO,842.29,EUR,,OK,
PAY-0000914,T-500631,2025-01-21 01:23:00,S002,CAJ04,EMP029,TARJETA CREDITO,8002.45,EUR,Y7ZJC7R1Q,OK,
PAY-0000915, T-500631 ,2025-01-21 01:50:00,S002,CAJ04,EMP029,Tarjeta Crédito,685.21,EUR,6ZSSJNJ8,OK,
PAY-0000916,T-500632,2025-10-22 06:24:29,S002,CAJ07,EMP061,Cash,187.87,EUR,65VA97KZB5,OK,
PAY-0000917,T-500632,22/10/2025 07:36,S002,CAJ07,EMP061,Tarjeta (Crédito),17.75,EUR,2TYZC5HSSX,OK,
PAY-0000918,T-500634,2 de noviembre de 2025 01:23,S002,CAJ01,EMP074,Vale,€258.21,EUR,SHLLSHWA7S,OK,
PAY-0000919,T-500635,2025-02-27 17:44:00,S002,CAJ02,EMP044,Debit Card,"111,27",EUR,N7P29EUQ,OK,
PAY-0000920,T-500636,11/09/25 16:13,S004,CAJ02,EMP049,Visa/Mastercard,"132,31",EUR,MLZTI89UV1FF,OK,
PAY-0000921,T-500638,2025-07-25 20:46:00,S005,CAJ01,EMP069,Tarjeta (Crédito),308.59,EUR,MF3G1PUXJCN0,OK,
PAY-0000922,T-500639,2025-01-03 01:37:00,s002,CAJ02,EMP077,TARJETA CREDITO,"86,44",EUR,5482Q78E5SFE,OK,
PAY-0000923,T-500639,2025-01-03 03:16:00,s002,CAJ02,EMP077,DEBITO,,EUR,YR58MX4YQQ,OK,
PAY-0000924,T-500640,08/03/25 15:27,S001,CAJ02,EMP047,Credit Card,29.25,EUR,H2AWNF3KE,OK,
PAY-0000925,T-500640,08/03/25 15:27,S001,CAJ02,EMP047,Tarjeta Crédito,37.38,EUR,QNKYP1M2,OK,
PAY-0000926,T-500641,2025-07-18 07:02:49,S002,CAJ06,EMP046,Tarjeta Crédito,33.11,EUR,7HLSZM6VDUQD,OK,
PAY-0000927,T-500641,18/07/2025 07:02,S002,CAJ06,EMP046,Visa/Mastercard,"1181,77",EUR,,OK,
PAY-0000928,T-500642,30/08/25 16:22,S002,CAJ04,EMP036,Cash,€136.13,EUR,AOBK02LVU,OK,
PAY-0000929,T-500643,15/04/2025 14:59,S003,CAJ03,EMP010,Tarjeta Débito,108.67 EUR,EUR,3DC0VSVIT,OK,
PAY-0000930,T-500644,15/04/2025 21:44,S002,CAJ07,EMP078,cash,95.97,EUR,7ZWPD1OT,OK,
PAY-0000931,T-500644,2025-04-15 22:01:00,S002,CAJ07,EMP078,Contado,220.96,EUR,,OK,
PAY-0000932,T-500645,28/03/2025,S002,CAJ04,EMP013,Visa/Mastercard,100.14€,EUR,S9DVELYVRO5X,OK,
PAY-0000933,T-500645,2025-03-28 00:00:00,S002,CAJ04,EMP013,Tarjeta credito,18.72,EUR,,OK,
PAY-0000934,T-500646,19/01/25 15:03,S001,,EMP078,Tarjeta (Débito),1168.85€,EUR,ZHXDO3GTXYZ8,OK,
PAY-0000935,T-500647,2025-09-13 08:55:50,S004,CAJ03,EMP066,Cupón,71.23,EUR,ABCZ7EP62LTG,OK,
PAY-0000936,T-500648,15/07/25 01:06,S005,CAJ08,EMP046,Tarjeta (Crédito),705.39,EUR,GJZG8U6MQBIA,OK,
PAY-0000937,T-500649,2025-01-30 18:49:00,S001,CAJ07,EMP012,Visa/Mastercard,401.62,EUR,F4OHEUN5A,OK,
PAY-0000938,T-500650,2025-07-20 00:15:00,S001,CAJ07,EMP018,Tarjeta debito,107.29,EUR,R2DXJOXV6Y,OK,
PAY-0000939,T-500651,2025-01-17 11:29:00,S004,CAJ06,EMP068,VALE,359.79 EUR,EUR,S2U4X7X8W4,OK,
PAY-0000940,T-500651,2025-01-17,S004,CAJ06,EMP068,Credit Card,21.59 EUR,EUR,,OK,
PAY-0000941,T-500652,2025-05-28 05:25:00,S001,CAJ03,EMP007,Visa/Mastercard,637.56,EUR,LC9BGJQ0AQ,OK,
PAY-0000942,T-500653,03/09/25 02:59,S001,CAJ08,,Bizum,"6,98",EUR,EUMMYYWKMX8,OK,
PAY-0000943,T-500653,03/09/25 02:59,S001,CAJ08,,VALE,4295.22,EUR,EIMB9GM5,OK,
PAY-0000944,T-500654,2025-05-08 14:19:00,S001,CAJ08,EMP001,Cash,€746.86,EUR,923WVLCX7MM,OK,
PAY-0000945,T-500656,18/05/2025,S005,CAJ02,EMP057,Tarjeta Regalo,€0.00,EUR,,OK,
PAY-0000946,T-500657,06/07/25 03:21,S002,CAJ06,EMP021,Debit Card,248.37,EUR,3I2IWMC07LBL,OK,
PAY-0000947,T-500657,06/07/25 03:21,S002,CAJ06,EMP021,DEBITO,406.83,EUR,3TU8LM7XX,OK,
PAY-0000948,T-500658,2025-02-18 23:33:25,S004,CAJ07,EMP014,Credit Card,193.48,EUR,KAKJ6SZXI5,OK,
PAY-0000949,T-500658,19/02/2025 00:56,S004,CAJ07,EMP014,TARJETA CREDITO,"641,13",EUR,VO2MCQ4S4FW,OK,
PAY-0000950,T-500659,07/04/25 05:10,S001,CAJ05,EMP011,Tarjeta (Crédito),"694,64",EUR,RPK404C5CJB,OK,
PAY-0000951,T-500660,2025-03-15 06:58:00,S004,CAJ02,EMP065,Cash,316.06,EUR,JVZHOYYK,OK,
PAY-0000952,T-500661,23/07/25 21:05,S002,CAJ04,EMP007,Cupon,"926,14",EUR,FAIXG2G10Y,OK,
PAY-0000953,T-500663,29/04/25 04:48,S005,CAJ03,EMP063,Tarjeta (Crédito),196.43 EUR,EUR,PGBMCZDBRAE,ANULADO,
PAY-0000954,T-500664,30/05/25 03:35,S003,CAJ06,EMP036,Efectivo,105.73,EUR,PRWMOEGPCP,OK,
PAY-0000955,T-500664,2025-05-30 03:35:00,S003,CAJ06,EMP036,Tarjeta (Crédito),"10,17",EUR,7PHANHDT4RK,OK,
PAY-0000956,T-500665,29 de agosto de 2025 09:35,S002,CAJ08,EMP010,cash,"188,03",EUR,ODKWDGSEOTP,OK,
PAY-0000957,T-500666,15/02/25 14:31,S003,CAJ06,EMP058,cash,"838,18",EUR,7I0YCM90F89V,OK,
PAY-0000958,T-500668,02/01/25 09:33,S004,CAJ07,EMP035,Cupon,217.99,EUR,ATQV9OB3M,OK,
PAY-0000959,T-500668,2025-01-02 09:33:00,S004,CAJ07,EMP035,cash,305.00,EUR,DEK429M0T,OK,
PAY-0000960,T-500669,08/03/2025 10:51,S005,CAJ04,EMP035,Tarjeta Regalo,"0,96",EUR,,OK,
PAY-0000961,T-500669,08/03/25 10:51,S005,CAJ04,EMP035,Debit Card,83.16,EUR,SYVUVO9GB,OK,
PAY-0000962,T-500670,28/08/24 13:05,S002,CAJ01,EMP032,Efectivo,283.52,EUR,B4LVCRFMKSLI,OK,
PAY-0000963,T-500671,23/01/25 05:44,S005,CAJ03,EMP079,EFECTIVO,337.38,EUR,CV0L5C098J,OK,
PAY-0000964,T-500671,23/01/25 05:44,S005,CAJ03,EMP079,Visa/Mastercard,157.04,EUR,MDH1JILHBI,OK,
PAY-0000965,T-500672,10/04/25 22:37,S001,CAJ02,EMP049,Contado,408.30,EUR,VGDR1GX1DOC5,OK,
PAY-0000966,T-500673,2025-06-18,S005,CAJ07,EMP030,Credit Card,491.58,EUR,54I3O6GIL6DT,OK,
PAY-0000967,T-500674,24/09/25 22:43,S002,CAJ01,EMP023,cash,476.34,EUR,E0PCM9A2,OK,
PAY-0000968,T-500675,24/10/25 11:49,S001,CAJ07,EMP015,Financing,5553.97,EUR,Y3CXLLJ0,OK,
PAY-0000969,T-500676,14/11/25 18:41,S05,CAJ01,EMP014,Tarjeta credito,432.20 EUR,EUR,WT1VAWI2,OK,
PAY-0000970,T-500677,17/02/25 19:08,S004,CAJ01,EMP035,Cupón,€896.31,EUR,N6JBP33GIUNW,OK,
PAY-0000971,T-500677,2025-02-17 19:51:00,S004,CAJ01,EMP035,Tarjeta Crédito,668.08,EUR,V5745IP65P,OK,
PAY-0000972,T-500679,2025-08-23 18:24:00,s003,CAJ06,EMP011,Debit Card,679.04,EUR,,OK,
PAY-0000973,T-500680,2025-12-29 07:05:20,S003,CAJ02,EMP064,Cash,347.14,EUR,4W6C8HS2,PENDIENTE,
PAY-0000974,T-500681,13/02/25 22:45,S002,CAJ07,EMP062,tarjeta regalo,€83.27,EUR,HY8N59UL5,OK,
PAY-0000975,T-500682,11/09/25 23:17,S004,CAJ07,EMP043,Tarjeta Crédito,11.44,EUR,3TGLQKBEC54,OK,
PAY-0000976,T-500682,2025-09-11,S004,CAJ07,EMP043,Visa/Mastercard,17.14,EUR,U1OUBNLMA4,OK,
PAY-0000977,T-500683,2025-03-20 22:42:00,s005,CAJ04,EMP031,Cash,137.72,EUR,NR6NOBGPJYHV,OK,
PAY-0000978,T-500683,20/03/25 22:42,S005,CAJ04,EMP031,Contado,410.02 EUR,EUR,QHEQKMQP,OK,
PAY-0000979,T-500685,2025-09-30 09:32:00,S002,CAJ01,EMP055,Credit Card,1757.95,EUR,74ZEMG025,OK,
PAY-0000980,T-500686,12/03/25 20:19,S002,CJ02,EMP054,Debit Card,"103,10",EUR,CV2XB402N,OK,
PAY-0000981,T-500686,12/03/25 20:19,S002,CJ02,EMP054,Credit Card,€119.91,EUR,7PBY615BQ,OK,
PAY-0000982,T-500687,2025-09-07 12:06:00,S004,CAJ01,EMP020,Tarjeta Crédito,214.65,EUR,,OK,
PAY-0000983,T-500688,16 de abril de 2025 13:37,S003,CAJ05,EMP055,Contado,"1755,66",EUR,KQVOX2N5,OK,
PAY-0000984,T-500688,16 de abril de 2025 13:37,S003,CAJ05,EMP055,Tarjeta credito,"799,64",EUR,ZYAGZR64L,OK,
PAY-0000985,T-500689,11/09/25 11:36,S005,CAJ02,EMP060,Credit Card,19.42,EUR,MJKKEGVKA65F,OK,
PAY-0000986,T-500690,2025-04-20 14:21:00,S001,CAJ06,EMP043✓,Tarjeta credito,"22,82",EUR,CYAMNJ8PL3,OK,
PAY-0000987,T-500691,3 de mayo de 2025 04:06,S002,CAJ01,EMP062,Tarjeta (Crédito),1200.70,EUR,78TNMS55,OK,
PAY-0000988,T-500691,3 de mayo de 2025 04:06,S002,CAJ01,EMP062,Contado,€1051.58,EUR,098CJNJZ,OK,
PAY-0000989,T-500692,2025-12-15 04:05:23,S003,CAJ06,EMP013,Tarjeta Débito,€276.35,EUR,9KOHD5MH,OK,
PAY-0000990,T-500692,2025-12-15 04:05:23,S003,CAJ06,EMP013,Visa/Mastercard,101.65,EUR,TXLQ0ZI2L5EU,OK,
PAY-0000991,T-500693,2025-02-06 06:11:00,S001,CAJ03,EMP011,Debit Card,255.58,EUR,,OK,
PAY-0000992,T-500694,20/05/25 22:23,S005,CAJ06,EMP017,Tarjeta (Crédito),"285,88",EUR,7OXNW28BGJ,OK,
PAY-0000993,T-500695,06/01/2025 19:16,S005,CAJ03,EMP064,Tarjeta Crédito,"271,54",EUR,,OK,
PAY-0000994,T-500696 ,12/08/25 21:28,S001,CAJ03,EMP021,TARJETA CREDITO,1416.70,EUR,,OK,
PAY-0000995,T-500697,2025-08-09 22:57:00,S003,CAJ08,EMP018,Visa/Mastercard,385.15,EUR,8BUJDS0SP8JB,OK,
PAY-0000996,T-500697,2025-08-09 20:58:00,S003,CAJ08,EMP018,DC,472.78,EUR,WIHXBX5EV592,OK,
PAY-0000997,T-500698,13/04/25 01:43,S005,CAJ06,EMP053,cash,625.41,EUR,,OK,
PAY-0000998,T-500699,28/11/25 14:15,,CAJ02,EMP021,EFECTIVO,€693.78,EUR,58OHCU0E0R,OK,
PAY-0000999,T-500699,28/11/25 14:15,,CAJ02,EMP021,Contado,4.10,EUR,,OK,
PAY-0001000,T-500700,19/03/25 11:12,s001,CAJ02,EMP051,Visa/Mastercard,"134,06",EUR,TK7P6XSVOLT,OK,
PAY-0001001,T-500701,24/03/25 21:41,S001,CAJ01,EMP061,TARJETA CREDITO,203.17,EUR,RTQJ8CW8N57P,OK,
PAY-0001002,T-500702,27/01/2025,S002,CAJ07,EMP023,Efectivo,"44,14",EUR,I06B8MSG4OG,OK,
PAY-0001003,T-500702,27/01/2025,S002,,EMP023,GiftCard,414.16,EUR,GNTUSJXBCWSB,OK,
PAY-0001004,T-500703,16/05/2025 17:10,S001,CAJ07,EMP039,CC,€80.81,EUR,FOWP473OZRBL,OK,
PAY-0001005,T-500703,16/05/25 15:29,S001,CAJ07,EMP039,Vale,19.94,EUR,NB958804XXU4,OK,
PAY-0001006,T-500704,08/10/25 16:16,S005,CAJ01,EMP077,DC,210.97,EUR,3C2UUDSQNCU,OK,
PAY-0001007,T-500704,2025-10-08 16:16:00,S005,CAJ01,EMP077,Tarjeta credito,"231,01",EUR,2MUJQM2UBAL0,OK,
PAY-0001008,T-500705,14/02/25 02:53,S03,CAJ08,EMP064,cash,1078.08,EUR,,OK,
PAY-0001009,T-500706,2025-08-01 02:35:00,S002,CAJ02,EMP025,DC,60.71,EUR,RG7QSODMX0RD,OK,
PAY-0001010,T-500708,20/08/25 00:47,S003,CAJ03,EMP048,Tarjeta credito,76.14,EUR,3NSXOF6T6W,OK,
PAY-0001011,T-500709,07/01/25 09:06,S005,CAJ02,EMP014,EFECTIVO,€1443.78,EUR,9EMLMBZRK,OK,
PAY-0001012,T-500711,08/12/2025,,CAJ06,EMP065,Efectivo,336.27,EUR,URPV7LYOZD,OK,
PAY-0001013,T-500713,2025-12-31 20:10:00,S004,CAJ07,EMP074,Visa/Mastercard,747.40,EUR,ETJDH231W,OK,
PAY-0001014,T-500713,2025-12-31 19:45:00,S004,CAJ07,EMP074,CC,1149.20,EUR,O158J8H19YX6,OK,
PAY-0001015,T-500714,2025-11-24 09:36:57,S001,CAJ03,EMP074,Cash,381.84,EUR,,OK,
PAY-0001016,T-500715,2025-02-20 17:03:44,S005,CAJ02,EMP004,CC,€694.46,EUR,V2T3FLWL,OK,
PAY-0001017,T-500716,30 de diciembre de 2025 02:36,S002,CAJ07,EMP007,DEBITO,"1753,60",EUR,DNQSAMCTXT,OK,
PAY-0001018,T-500717,11/07/25 22:41,S001,CAJ05,EMP024,Cash,422.77,EUR,96EPT6AAR1,OK,
PAY-0001019,T-500717,11/07/25 22:41,S001,CAJ05,EMP024,CC,"149,61",EUR,NRXYCO8RBT4O,OK,
PAY-0001020,T-500718,11/03/25 19:55,S002,CAJ07,EMP058,VALE,75.43,EUR,VA2J2BUZR,OK,
PAY-0001021,T-500719,2025-03-03 12:25:00,S003,CAJ08,,Tarjeta (Débito),704.47 EUR,EUR,ELIVWOE58,OK,
PAY-0001022,T-500720,23 de febrero de 2025 19:31,S002,CAJ06,EMP028✓,Cash,1016.20,EUR,,OK,
PAY-0001023,T-500721,08/04/2025,S003,CAJ08,EMP052,Tarjeta debito,"26,02",EUR,50K61FTG,OK,
PAY-0001024,T-500721,2025-04-08,S003,CAJ08,EMP052,Visa/Mastercard,,EUR,CRABOQCUCJ7,OK,
PAY-0001025,T-500722,18/10/25 03:17,S002,,EMP058,cash,5.84,EUR,,OK,
PAY-0001026,T-500722,18/10/25 03:17,S002,CAJ08,EMP058,Contado,5.38,EUR,1BIJ200Q696,OK,
PAY-0001027,T-500722,18/10/25 03:17,S002,CAJ08,EMP058,Gift Card,21.31,EUR,N44FBV46MU,OK,
PAY-0001028,T-500723,24 de abril de 2025 23:22,S001,CAJ01,EMP033,Tarjeta Crédito,1520.99 EUR,EUR,FNUKM7Y1UVJ,OK,
PAY-0001029,T-500724,30/10/2025 17:36,S002,CAJ02,EMP048,Cash,754.34,EUR,56PNBXU6ONR,OK,
PAY-0001030,T-500725,2025-03-26 10:54:00,S003,CAJ02,EMP078,TARJETA_REGALO,68.60 EUR,EUR,KFG7I2HVI,OK,
PAY-0001031,T-500725,26/03/25 10:54,S003,CAJ02,EMP078,Tarjeta Crédito,384.83,EUR,MEMTO2VDSIZB,OK,
PAY-0001032,T-500726 ,20 de enero de 2025 06:51,S004,CAJ07,EMP041,CC,430.28,EUR,GMLF2L9O98,OK,
PAY-0001033,T-500727,21 de diciembre de 2025 01:07,S002,CJ05,EMP074,Cash,"1398,05",EUR,WZLOOHVU,OK,
PAY-0001034,T-500728,15/05/25 07:19,S001,CAJ07,EMP036,Tarjeta (Crédito),"456,04",EUR,OKPI1TSQACBS,OK,
PAY-0001035,T-500729,28/03/25 23:57,S004,CAJ02,EMP080,Efectivo,"7,62",EUR,OEQXADGYUJ,OK,
PAY-0001036,T-500730 ,2025-11-01 20:12:00,S003,CAJ01,EMP007,Credit Card,"49,36",EUR,TXP25M9FERJ,OK,
PAY-0001037,T-500730 ,2025-11-01 20:12:00,S003,CAJ01,EMP007,Efectivo,72.55,EUR,AECEEUTZE,OK,
PAY-0001038,T-500731,20/10/2025,S002,CAJ08,EMP041,Tarjeta (Crédito),998.54,EUR,2XCV96Q3Q,OK,
PAY-0001039,T-500732,07/07/25 11:08,S002,CAJ08,EMP042,cash,755.11,EUR,0I7P2R5JGLW,OK,
PAY-0001040,T-500732,07/07/2025 11:08,S002,CAJ08,EMP042,Gift Card,310.99 EUR,EUR,5X4WU1I7XXEQ,OK,
PAY-0001041,T-500733,18/09/25 09:30,S002,CAJ02,EMP008,Visa/Mastercard,"1,274.66",EUR,H2IVD87W,OK,
PAY-0001042,T-500734,11/02/25 00:49,S003,CAJ05,EMP020,Cash,311.35,EUR,,OK,
PAY-0001043,T-500735,13/08/2025,S004,CAJ05,EMP040,Contado,982.71,EUR,POY22CM5AGP6,OK,
PAY-0001044,T-500736,2025-02-15 22:52:00,S002,CAJ08,EMP058,Debit Card,€567.17,EUR,LXB7GIORFZ,OK,
PAY-0001045,T-500736,2025-02-15,S002,CAJ08,EMP058,TARJETA CREDITO,1025.34,EUR,,OK,
PAY-0001046,T-500737,2025-03-15 15:32:00,S003,CAJ07,EMP055,Tarjeta (Débito),€112.18,EUR,B9PDGKRJW,OK,
PAY-0001047,T-500737,15/03/25 13:47,S003,CAJ07,EMP055,BIZUM,€908.45,EUR,NMTR28J9,OK,
PAY-0001048,T-500738,26/01/2025,S001,CAJ01,EMP074,Tarjeta (Crédito),344.44,EUR,CDI99MAZIYWJ,OK,
PAY-0001049,T-500738,2025-01-26 00:00:00,S001,CAJ01,EMP074,Visa/Mastercard,321.19,EUR,8WEJI4P0E,OK,
PAY-0001050,T-500739,16/05/25 00:10,S002,CAJ05,EMP022,FINANCIACION,,EUR,VQCGH8A7B1B,OK,
PAY-0001051,T-500739,2025-05-16 00:10:00,S002,CAJ05,EMP022,Visa/Mastercard,1132.41,EUR,26XNISOSZ0,OK,
PAY-0001052,T-500740,09/05/25 23:54,S003,CAJ04,EMP009,Debit Card,"1.990,10",EUR,FAWTY7KFGHP,OK,
PAY-0001053,T-500741,09/07/2025 15:21,S002,CAJ01,EMP061,Visa/Mastercard,€8.60,EUR,JRU7NSPN,OK,
PAY-0001054,T-500741,09/07/25 15:21,S002,CAJ01,EMP061,Tarjeta (Crédito),213.08,EUR,BWPVFZET8P1H,OK,
PAY-0001055,T-500742,13/10/25 08:58,S002,CAJ02,EMP043,Tarjeta credito,610.85,EUR,88KLX9K9S,OK,
PAY-0001056,T-500743,09/01/25 01:11,S005,CAJ08,EMP067,CC,€436.52,EUR,AUKLWWIA,OK,
PAY-0001057,T-500745,18/04/25 06:48,S005,CAJ06,EMP051,CC,119.83,EUR,2WCFIE6KN0Q,OK,
PAY-0001058,T-500746,28/02/2025 09:19,S003,CAJ01,EMP019,Tarjeta Crédito,597.84 EUR,EUR,4HESKJWB,OK,
PAY-0001059,T-500748,18/03/25 09:37,S005,CAJ02,EMP019,TARJETA CREDITO,€445.38,EUR,4GC5ICNIC4DT,OK,
PAY-0001060,T-500749,09/03/25 07:17,S004,CAJ02,EMP039,DC,1220.73,EUR,2W04NXV50OT1,OK,
PAY-0001061,T-500750,27/12/25 01:22,S002,CAJ04,EMP011,Tarjeta Crédito,1030.99,EUR,QVALBNA0,OK,
PAY-0001062,T-500751,09/06/25 07:53,S004,CAJ06,,Cash,373.44,EUR,V2QJI47JWU7,OK,
PAY-0001063,T-500751,2025-06-09 08:06:00,S004,CAJ06,EMP055,Tarjeta Crédito,1019.94 EUR,EUR,P3M7ZUM7O,PENDIENTE,
PAY-0001064,T-500752,07/12/25 21:44,S003,CAJ06,EMP070,Contado,142.45 EUR,EUR,,OK,
PAY-0001065,T-500753,07/02/25 19:49,S001,CAJ05,EMP014,DC,184.24,EUR,XL6V337PD,OK,
PAY-0001066,T-500754,15/10/2025,S005,CAJ01,EMP067,Visa/Mastercard,191.00€,EUR,KUOZM7I9RY30,OK,
PAY-0001067,T-500755,08/12/25 17:15,S001,CAJ04,EMP001,Tarjeta (Crédito),685.35,EUR,HUKP6JR07H0,OK,
PAY-0001068,T-500755,08/12/25 17:15,S001,CAJ04,EMP001,Efectivo,144.58 EUR,EUR,98JHE17O,OK,
PAY-0001069,T-500756,26/08/25 23:20,S004,CAJ03,EMP070,DC,465.85,EUR,1OO3TVA7XW,OK,
PAY-0001070,T-500757,2025-02-08 20:15:00,S002,CAJ04,EMP038,EFECTIVO,7.17 EUR,EUR,LWG9AY22,OK,
PAY-0001071,T-500757,08/02/25 20:15,S002,CAJ04,EMP038,DC,95.46,EUR,C84AYUF1TK83,OK,
PAY-0001072,T-500758,28/04/25 13:56,s002,CAJ08,EM050,Voucher,519.94,EUR,4780CE91TEF,OK,
PAY-0001073,T-500759,2025-12-17 12:22:00,,CAJ03,EMP065,Credit Card,338.03,EUR,G6VC4PAIIUCU,OK,
PAY-0001074,T-500760,2025-01-27 11:45:00,S003,CAJ03,EMP039,Contado,325.06,EUR,,OK,
PAY-0001075,T-500761,2025-08-28,S005,CAJ06,EMP075,Credit Card,13.67,EUR,HPAZAUR4L,OK,
PAY-0001076,T-500761,28/08/2025 20:38,S005,CAJ06,EMP075,DEBITO,"80,48",EUR,A088QEG0O,OK,
PAY-0001077,T-500762,11/11/25 00:16,S004,CAJ08,EMP030,Contado,,EUR,94LMUXFZJD,OK,
PAY-0001078,T-500763,19/10/25 05:54,S004,CAJ01,EMP015,Credit Card,772.88,EUR,TN8B8ZUF,OK,
PAY-0001079,T-500763,19/10/25 05:54,S004,CAJ01,EMP015,Efectivo,78.89,EUR,WIPM7TFAE,OK,
PAY-0001080,T-500763,19/10/25 05:54,S004,CAJ01,EMP015,EFECTIVO,150.37€,EUR,CW0MDZANCS,OK,
PAY-0001081,T-500764,2025-04-22,S004,CAJ04,EMP063,Visa/Mastercard,"544,79",EUR,5XHQ3U91F,OK,
PAY-0001082,T-500764,2025-04-22 02:32:00,S004,,EMP063,Financiacion,161.62 EUR,EUR,AHAN6CADOU,OK,
PAY-0001083,T-500765,09/08/25 16:53,S001,CAJ03,EMP047,cash,"€1,328.05",eur,W9O01E4ZNZZ,OK,
PAY-0001084,T-500766,19/05/25 10:40,S004,CAJ04,EMP061,Tarjeta Débito,2475.80,EUR,,OK,
PAY-0001085,T-500767,2025-08-22 14:17:21,S002,CAJ05,EMP064,Efectivo,680.01,EUR,9JV8A6M6,OK,
PAY-0001086,T-500768,2025-12-28 21:05:00,S002,CAJ02,EMP031,CC,885.13,EUR,XN5B0MOLRV,OK,
PAY-0001087,T-500769,2025-01-24 01:34:23,S001,CAJ07,EMP043,Cash,866.66,EUR,U6MTQ82DM7GE,OK,
PAY-0001088,T-500770,21/08/2025,S002,CAJ01,EMP010,Tarjeta (Crédito),"-181,70",EUR,,OK,Importe negativo (posible devolución mal registrada)
PAY-0001089,T-500772,27/05/2025 12:01,S004,CAJ01,EMP007,EFECTIVO,272.37,EUR,Y05Y5FNX74SS,OK,
PAY-0001090,T-500772,27/05/25 12:01,S004,CAJ01,EMP007,Contado,8.13,EUR,947XKJQ6X5LD,OK,
PAY-0001091,T-500773,2025-08-17 14:18:45,S003,CAJ07,EMP031,Tarjeta (Crédito),110.11,EUR,IU7HWLWZUB,OK,
PAY-0001092,T-500775,2025-07-31 03:08:59,S005,CAJ02,EMP010,Credit Card,264.98,EUR,YR8H9XDYQ8,OK,
PAY-0001093,T-500776,14/04/25 21:36,S003,CAJ05,EMP032,Tarjeta credito,€34.17,EUR,VM8L10I187YO,OK,
PAY-0001094,T-500777,25/05/25 14:55,S002,CAJ04,EMP071,Visa/Mastercard,1160.97,EUR,LMQ96FBEJH,OK,
PAY-0001095,T-500778,02/02/25 19:32,S004,CAJ05,EMP050,Cupón,939.54,EUR,0DF56TIZANK,OK,
PAY-0001096,T-500778,2025-02-02 19:32:00,S004,CAJ05,EMP050,DC,1303.42,EUR,RT2L2IEO9UV,OK,
PAY-0001097,T-500779,2025-05-16 01:46:23,S002,CAJ01,EMP005,CC,"769,41",EUR,UNMAD1BX,OK,
PAY-0001098,T-500780,03/08/25 21:04,S003,CAJ07,EMP008,cash,"88,04",EUR,VW40F72VE,OK,
PAY-0001099,T-500780,03/08/25 21:04,S003,CAJ07,EMP008,Tarjeta (Débito),24.02,EUR,LWL0TQFT,OK,
PAY-0001100,T-500781,26/12/25 02:27,S005,CAJ05,EMP049,Financing,488.55 EUR,EUR,RAU33X58PZ,OK,
PAY-0001101,T-500782,2025-09-14 00:28:06,S005,CAJ07,EMP036,tarjeta regalo,€349.08,EUR,9D6SV8FL,OK,
PAY-0001102,T-500783,2025-05-20 07:32:00,S002,CAJ01,EMP060,,323.11,EUR,,OK,
PAY-0001103,T-500784,2025-07-12 05:04:00,S001,CAJ05,EMP036,VALE,"376,95",EUR,519EYINY,OK,
PAY-0001104,T-500785,30/03/25 12:40,S001,CAJ08,EMP006,CC,2973.31,EUR,X0B3CIPTNPN,OK,
PAY-0001105,T-500786,18/07/25 11:11,S001,CAJ06,EMP065,Efectivo,57.17,EUR,FXUF1WZW,OK,
PAY-0001106,T-500787 ,2025-05-11 02:17:00,S004,CAJ03,EMP078,CC,"366,35",EUR,0J1MNYW0YFK,OK,
PAY-0001107,T-500789,30 de diciembre de 2025 07:39,S005,CAJ03,EMP011,Gift Card,506.37,EUR,22OU2VNEYN7,OK,
PAY-0001108,T-500789,30 de diciembre de 2025 07:39,S005,CAJ03,EMP011,TARJETA_REGALO,482.06,EUR,SCJWSH3MOKB,OK,
PAY-0001109,T-500790,04/05/25 02:05,S001,CAJ01,EMP068,CC,"358,50",EUR,,OK,
PAY-0001110,T-500791,08/12/25 20:18,S003,CAJ02,EMP057,CC,33.57 EUR,EUR,0HJ7T5BFXPF,OK,
PAY-0001111,T-500791,08/12/2025 21:00,S003,CAJ02,EMP057,TARJETA CREDITO,209.15,EUR,,OK,
PAY-0001112,T-500792,2025-06-08 07:16:00,S004,CAJ03,EMP032,Tarjeta (Crédito),1724.58,EUR,95CPQRT3MF3,OK,
PAY-0001113,T-500793,07/12/25 08:41,S004,,EMP026,Cupon,1022.56,EUR,77E799O6,OK,
PAY-0001114,T-500793,07/12/25 08:41,S004,CAJ03,EMP026,Contado,84.10,EUR,KKVP2ME59O2E,OK,
PAY-0001115,T-500794,29/01/2025,S001,CAJ01,EMP004,Tarjeta Regalo,373.14,EUR,COXKQ5P52DW,OK,
PAY-0001116,T-500794,29/01/2025,S001,CAJ01,EMP004,TARJETA_REGALO,"537,74",EUR,5LOIPZKSBWTS,OK,
PAY-0001117,T-500795,28/08/2025 11:24,S005,CAJ05,EMP044,Contado,€654.66,EUR,,OK,
PAY-0001118,T-500796,12/10/2025,S004,CAJ07,EMP062,Credit Card,252.71,EUR,8S9EP5ROPTX,OK,
PAY-0001119,T-500796,12/10/2025,S004,CAJ07,EMP062,Tarjeta Débito,731.52,EUR,8AGT3JW3,OK,
PAY-0001120,T-500796,2025-10-12 00:00:00,S004,CAJ07,EMP062,TARJETA CREDITO,112.74,EUR,CLMMVH71,OK,
PAY-0001121,T-500797,08/10/2025 14:29,S005,CAJ08,EMP057,Tarjeta credito,€62.13,EUR,9269XKDRU,OK,
PAY-0001122,T-500797,2025-10-08 14:29:00,S005,CAJ08,EMP057,CC,15.02,EUR,A8KY60P0HZWC,OK,
PAY-0001123,T-500798,11 de marzo de 2025 06:57,S005,CAJ07,EMP050,Cupón,331.78,EUR,8PBOWVHD7B,OK,
PAY-0001124,T-500799,22/04/2025,S003,CAJ06,EMP037,Visa/Mastercard,548.86,EUR,,OK,
PAY-0001125,T-500800,11/01/2025,S003,CAJ04,EMP066,TARJETA CREDITO,1244.63,EUR,NZU6MRUWNN6L,OK,
PAY-0001126,T-500800,11/01/2025,S003,CAJ04,EMP066,Tarjeta debito,240.08,EUR,MFL0XN3CQYT9,OK,
PAY-0001127,T-500801,2025-06-26 06:10:58,S003,CAJ07,EMP067,cash,-6.65,EUR,5QA0TKC3N4G7,OK,Importe negativo (posible devolución mal registrada)
PAY-0001128,T-500802,2025-11-09 02:28:40,S003,CAJ03,EMP015,TARJETA CREDITO,"1,060.64",EUR,RLUZK3VJE6,OK,
PAY-0001129,T-500803,29/12/25 02:17,S001,CAJ06,EMP005,Efectivo,"692,03",EUR,PGQTDRKE1F1W,OK,
PAY-0001130,T-500804,2025-04-14 00:38:00,S001,CAJ07,EMP029,EFECTIVO,929.25 EUR,EUR,3DUVSCHL,OK,
PAY-0001131,T-500805,11/03/2025 04:09,,CAJ02,EMP079,Tarjeta Crédito,"502,21",EUR,Y6DES1KL5,OK,
PAY-0001132,T-500806,17/09/25 09:59,S005,CAJ03,EMP030,Tarjeta Crédito,1492.17,EUR,FCN0EAHRX0D,OK,
PAY-0001133,T-500806,17/09/2025 11:37,S005,CAJ03,EMP030,EFECTIVO,145.20,EUR,P5AMVOV4,OK,
PAY-0001134,T-500807,30/06/25 11:39,S003,CAJ08,EMP055,Financiacion,"1,166.78",EUR,IHHB1MTRK,OK,
PAY-0001135,T-500808,12/12/25 13:38,S004,CAJ04,EMP035,CC,1087.45,EUR,9EWEUPAHL5,OK,
PAY-0001136,T-500809,14/11/25 21:12,S004,CAJ01,EMP029,Contado,"740,68",EUR,O6JPRZDI1E,OK,
PAY-0001137,T-500810,2025-10-08 11:39:34,s001,CAJ06,EM070,Bizum,410.16 EUR,EUR,ZZ6CTEL745,OK,
PAY-0001138,T-500811,06/10/2025 00:44,S005,CAJ04,EMP069,Visa/Mastercard,571.28,EUR,,OK,
PAY-0001139,T-500813,2025-10-08 10:34:00,S004,CAJ05,EMP010,TARJETA CREDITO,"1,438.77",EUR,,OK,
PAY-0001140,T-500814,2025-11-01,S001,CAJ07,EMP078,Tarjeta credito,805.16,EUR,OTTX57LYQ,OK,
PAY-0001141,T-500815,07/07/2025 17:08,S004,CAJ02,EMP053,Tarjeta (Crédito),249.90,EUR,3WUG0RQAP3,OK,
PAY-0001142,T-500816,05/07/25 04:09,S001,CAJ01,EMP030,TARJETA CREDITO,"2330,54",EUR,4EMS8E8097,OK,
PAY-0001143,T-500818,2025-08-08 13:05:00,S004,CAJ06,EMP005,cash,"1540,82",EUR,RD84BQQ8DYWW,OK,
PAY-0001144,T-500819,2025-06-15 07:49:49,S002,CAJ08,EMP011,Visa/Mastercard,145.17,EUR,,OK,
PAY-0001145,T-500820,2025-10-18 21:07:00,S001,CAJ07,EMP068,DC,"978,38",EUR,,OK,
PAY-0001146,T-500820,2025-10-18,S001,CAJ07,EMP068,Financiacion,"555,60",EUR,,OK,
PAY-0001147,T-500821,23 de julio de 2025 05:03,S003,CAJ06,EMP022,Tarjeta (Crédito),101.73,EUR,894I1Q2G,OK,
PAY-0001148,T-500821,23 de julio de 2025 05:03,S003,CAJ06,EMP022,Contado,75.45,EUR,,OK,
PAY-0001149,T-500822,02/07/25 17:19,S002,,EMP054,Credit Card,"190,32",EUR,TFFR8COO,OK,
PAY-0001150,T-500822,02/07/25 17:19,S002,,EMP054,tarjeta regalo,68.95,EUR,EDZ3G9R304AB,OK,
PAY-0001151,T-500824,2025-09-14 01:45:00,S003,CAJ07,EMP072,Visa/Mastercard,163.45,EUR,,OK,
PAY-0001152,T-500825,2025-11-10 00:00:00,S005,CAJ07,EMP076,CC,846.31,EUR,,OK,
PAY-0001153,T-500827,2025-07-22 17:15:00,S005,CAJ07,EMP046,Cash,"32,39",EUR,MEFG9O9IH4,OK,
PAY-0001154,T-500828,05/08/25 16:03,S004,CAJ08,EMP033,EFECTIVO,"3,559.02",EUR,SFFQ0NEZH1U,OK,
PAY-0001155,T-500829,11/03/25 12:27,S003,CAJ04,EMP025,EFECTIVO,80.76,EUR,633RGMUDI,OK,
PAY-0001156,T-500829,2025-03-11 12:27:00,S003,CAJ04,EMP025,Credit Card,€98.53,EUR,AHI1YWT3HKO,OK,
PAY-0001157,T-500830,07/09/25 04:50,S003,CAJ01,EMP005,Credit Card,718.48,EUR,T6XNNZL0YDR,OK,
PAY-0001158,T-500832,2025-11-30 04:07:00,S002,CAJ02,EMP008,Visa/Mastercard,148.05 EUR,EUR,SUWUHQ6Q6,OK,
PAY-0001159,T-500833,23/05/25 05:45,S003,CAJ03,EMP076,Efectivo,93.50,EUR,OP6XOYBX,OK,
PAY-0001160,T-500836,2025-12-07 16:04:53,S001,CAJ01,EMP048,Tarjeta Crédito,€497.51,EUR,DM1IYKU9I,OK,
PAY-0001161,T-500837,2025-08-08 10:33:00,S002,CAJ07,EMP023,DEBITO,23.70,EUR,AF3QHYH0,OK,
PAY-0001162,T-500837,2025-08-08 10:33:00,S002,CAJ07,EMP023,Tarjeta Crédito,536.37,EUR,PO2UBATP,OK,
PAY-0001163,T-500838,2025-09-07 06:15:00,S004,CAJ08,EMP047,Vale Devolución,56.03,EUR,22WAHDO61XN,OK,
PAY-0001164,T-500838,07/09/25 06:15,S004,CAJ08,EMP047,EFECTIVO,€11.68,EUR,T15028LSU,OK,
PAY-0001165,T-500839,2025-10-16 14:29:24,S004,CAJ05,EMP065,Tarjeta Crédito,€660.97,EUR,3SWSO0CISUVY,OK,
PAY-0001166,T-500840,2025-09-13 15:50:43,S002,CAJ08,EMP048,Tarjeta debito,47.59,EUR,TH5PKP6VCRJJ,OK,
PAY-0001167,T-500840,2025-09-13 15:50:43,S002,CAJ08,EMP048,DEBITO,308.84,EUR,Z9TOS7CUWB3,OK,
PAY-0001168,T-500840,2025-09-13 16:06:43,S002,CAJ08,EMP048,EFECTIVO,€74.95,EUR,GM4GSD5B,OK,
PAY-0001169,T-500842,7 de julio de 2025 09:45,S004,CAJ04,EMP048,Credit Card,268.39,EUR,W0BMED33I7O,OK,
PAY-0001170,T-500843,12/01/25 02:09,S005,CAJ07,EMP074,Cash,240.58,EUR,7ZVD8H3CHUF,OK,
PAY-0001171,T-500843,12/01/2025 02:09,S005,CAJ07,EMP074,Tarjeta Débito,256.02,EUR,SMFQTNDY69,OK,
PAY-0001172,T-500844,2025-05-01 02:38:00,S005,CAJ03,EMP007,Tarjeta (Débito),"155,09",EUR,YEYXIY47,OK,
PAY-0001173,T-500844,01/05/25 02:38,S005,CAJ03,EMP007,EFECTIVO,"216,53",EUR,VTYZ9345ZW,OK,
PAY-0001174,T-500845,2025-04-06 01:31:20,s003,CAJ04,EMP056,cash,2426.58,EUR,45ZYRDB14JU,OK,
PAY-0001175,T-500846,7 de febrero de 2025 05:09,S002,CAJ07,EMP032,Tarjeta (Crédito),693.41,EUR,VHWT3UBJVJK,OK,
PAY-0001176,T-500847,10/12/25 22:16,S004,CAJ02,EMP076✓,cash,840.73,EUR,O4KF9OQK,OK,
PAY-0001177,T-500848,12/05/25 21:10,S002,CAJ04,EMP039,Tarjeta Crédito,290.09,EUR,VE3OT79YRB,OK,
PAY-0001178,T-500849,02/02/2025 02:15,S004,CAJ07,EMP014,Visa/Mastercard,€33.64,EUR,3OBS0SWV5Q,OK,
PAY-0001179,T-500849,02/02/25 02:15,s004,CAJ07,EMP014,Cash,"1992,20",EUR,AW3IXIEZEV5,OK,
PAY-0001180,T-500850,2025-04-11 10:47:01,S04,CAJ07,EMP007,Tarjeta (Débito),"116,52",EUR,YW5R1F5BF,OK,
PAY-0001181,T-500850,2025-04-11 10:47:01,S04,CAJ07,EMP007,EFECTIVO,243.99,EUR,N5FO9SW23YNR,OK,
PAY-0001182,T-500851,2025-07-26 13:29:00,S003,CAJ06,,EFECTIVO,81.45,EUR,8Y1TL9JNTSS,OK,
PAY-0001183,T-500851,26/07/25 11:54,S003,CAJ06,EMP023,Cash,862.79,EUR,Q0EWLC4H6TVD,OK,
PAY-0001184,T-500852,2025-06-28 17:50:00,S004,CAJ08,EMP016,Tarjeta Crédito,550.89,EUR,,OK,
PAY-0001185,T-500855,2025-09-05 18:32:00,S001,CAJ06,EMP078,Cash,"345,25",EUR,FPWBABHWIKV,OK,
PAY-0001186,T-500855,2025-09-05 16:51:00,S001,CAJ06,EMP078,DEBITO,12.89,EUR,EUFVHP7SR,OK,
PAY-0001187,T-500856,16/10/25 10:19,S003,CAJ01,,Tarjeta credito,€5.59,EUR,HOQQ0RAAOO91,OK,
PAY-0001188,T-500856,2025-10-16,S003,CAJ01,EMP033,EFECTIVO,0.92,EUR,E3H4O8FUJ,OK,
PAY-0001189,T-500856,16/10/25 10:19,S003,CAJ01,EMP033,Tarjeta Crédito,237.19€,EUR,O8BJMIGJ6HM,OK,
PAY-0001190,T-500857,03/07/2025 15:55,S005,CAJ04,EMP007,Contado,"165,82",EUR,LZ72J8DY,OK,
PAY-0001191,T-500857,03/07/2025 15:55,S005,CAJ04,EMP007,Tarjeta Crédito,"202,88",EUR,7H4GYMRRQ,OK,
PAY-0001192,T-500858,2025-03-22 10:39:00,S001,CAJ03,,EFECTIVO,113.28,EUR,PREHVYRON,ANULADO,
PAY-0001193,T-500860,28/11/25 19:10,S05,CAJ06,EMP057,Contado,"278,21",EUR,16JQVLW2V8M,ANULADO,
PAY-0001194,T-500862,21/04/25 06:01,S005,CAJ07,EMP003,Tarjeta Crédito,381.46,EUR,CSNU966WQ,OK,
PAY-0001195,T-500863,11 de marzo de 2025 08:52,S001,CAJ04,EMP015,Visa/Mastercard,"172,92",EUR,WG4O3VSOT,OK,
PAY-0001196,T-500864,2025-09-15 23:06:53,S002,CAJ05,EMP047,Tarjeta (Crédito),1794.75,EUR,,OK,
PAY-0001197,T-500865,02/01/25 07:06,S004,CAJ08,EMP023,cash,62.38,EUR,Q0NJVJPCMW0J,OK,
PAY-0001198,T-500866,2025-07-15 11:40:00,S004,CAJ01,EMP018,Efectivo,22.67,EUR,,OK,
PAY-0001199,T-500867,10/12/2025 02:55,S005,CAJ02,EMP003,Tarjeta credito,7.22 EUR,EUR,EON9SZJ2RQB2,OK,
PAY-0001200,T-500867,2025-12-10 02:55:00,S005,CAJ02,EMP003,Credit Card,289.48,EUR,ITWPHKOKPY98,OK,
PAY-0001201,T-500868,12/01/25 23:54,S004,CAJ04,EMP038,Tarjeta credito,535.14,EUR,BDGRB2D5,OK,
PAY-0001202,T-500869,19 de diciembre de 2025 23:21,S004,CAJ02,EMP043,cash,"209,22",EUR,,OK,
PAY-0001203,T-500869,19 de diciembre de 2025 23:21,S004,CAJ02,EMP043,Contado,€117.58,EUR,OGQ04QPQR,OK,
PAY-0001204,T-500869,19 de diciembre de 2025 23:21,S004,CAJ02,EMP043,Credit Card,867.26,EUR,,OK,
PAY-0001205,T-500870,28/07/25 16:23,S004,CAJ02,EMP034,cash,807.91,EUR,CB2OXEBPBBQH,ANULADO,
PAY-0001206,T-500872,07/02/25 17:16,S004,CAJ03,EMP062,cash,935.38,EUR,,OK,
PAY-0001207,T-500873,09/08/25 16:17,S003,CAJ08,EMP058,DC,157.03,EUR,895TX69VA9,OK,
PAY-0001208,T-500874,2025-06-20 19:48:51,S003,CAJ03,EMP040,TARJETA CREDITO,"395,67",EUR,,OK,
PAY-0001209, T-500875 ,08/10/25 01:30,S001,CAJ05,EMP002,Vale,350.10,EUR,2YHFE5WM,OK,
PAY-0001210,T-500876,05/12/2025,S005,CAJ06,EMP063,Efectivo,"312,29",EUR,U6C8KKQ6,OK,
PAY-0001211,T-500877,2025-08-10 03:16:01,S003,CAJ02,EMP046,Credit Card,"249,61",EUR,5PJEM8SGNXY1,OK,
PAY-0001212,T-500878,8 de mayo de 2025 23:18,S002,CAJ06,EMP052,Cupón,€122.87,EUR,YM31SK05,OK,
PAY-0001213,T-500879 ,2025-09-10 17:57:46,S001,CAJ04,EMP024,EFECTIVO,118.08 EUR,EUR,NLS4SZXQ1,OK,
PAY-0001214,T-500880,05/04/25 17:41,S001,CAJ03,EMP008,Debit Card,"936,81",EUR,RZ56VK3U,OK,
PAY-0001215,T-500881 ,25/03/25 11:53,S004,CAJ02,EMP013,Efectivo,"684,27",EUR,J0AK269RYOH,OK,
PAY-0001216,T-500882,22/08/2025 13:01,S005,CAJ08,EMP033,Efectivo,€1069.23,EUR,,OK,
PAY-0001217,T-500883,12 de marzo de 2025 18:02,S002,CAJ05,EMP015,Contado,97.73 EUR,EUR,MA90DS1BHRNL,OK,
PAY-0001218,T-500884,17/03/25 04:26,S001,CAJ08,EMP069,Visa/Mastercard,267.77,EUR,9TXADN2TVDNH,OK,
PAY-0001219,T-500885,2025-11-02 04:17:00,S005,CAJ03,EMP025,CC,413.79,EUR,GX8UWTK7S1OQ,OK,
PAY-0001220,T-500886,2025-04-29 22:40:33,S003,CAJ05,EMP039,Gift Card,€730.47,EUR,111VPIVXS,PENDIENTE,
PAY-0001221,T-500888,06/11/2025,S001,CAJ07,EMP072,Tarjeta (Crédito),48.73,EUR,3LPLFWAF,OK,
PAY-0001222,T-500889,19 de diciembre de 2025 23:26,S005,CAJ01,EMP050,Tarjeta (Crédito),19.58,EUR,,OK,
PAY-0001223,T-500889,19 de diciembre de 2025 23:26,S005,CAJ01,EMP050,CC,32.12,EUR,GBQIZ1BNZ,OK,
PAY-0001224,T-500891,11/08/2025 10:15,S005,CAJ04,EMP057,Voucher,1229.95,EUR,,OK,
PAY-0001225,T-500891,11/08/25 10:15,S005,CAJ04,EMP057,CC,2088.69,EUR,7J86FBOJPG,OK,
PAY-0001226,T-500892,23/06/25 03:32,S001,CAJ06,EMP047,tarjeta regalo,"7981,32",EUR,,OK,
PAY-0001227,T-500893,10/11/25 01:04,S003,CAJ01,EMP053,Efectivo,352.50,EUR,,OK,
PAY-0001228,T-500895,16/03/25 03:12,S005,CAJ02,EMP060,Credit Card,728.24,EUR,ECJQ427U1,OK,
PAY-0001229,T-500896,2025-06-05 22:10:05,S003,CAJ06,EMP056,EFECTIVO,508.95,EUR,EBCVF6FOVK,OK,
PAY-0001230,T-500897,2025-08-12 02:09:14,S005,CAJ06,EMP026,tarjeta regalo,557.04,EUR,68MA1JLM,OK,
PAY-0001231,T-500898,29/07/2025,s003,CAJ01,EMP006,EFECTIVO,145.79,EUR,UL818CS4QYH,OK,
PAY-0001232,T-500898,29/07/2025,S003,CAJ01,EMP006,TARJETA_REGALO,705.55,EUR,,OK,
PAY-0001233,T-500899,11/01/25 14:25,S002,CAJ05,EMP028,Debit Card,239.17,EUR,ZK4XCZTBL,OK,
PAY-0001234,T-500900,28 de mayo de 2025 18:33,S002,CAJ08,EMP026,cash,"579,46",EUR,36E1JQQXF2A8,OK,
PAY-0001235,T-500901,2025-03-23 18:19:00,S001,CAJ06,EMP041,cash,628.80 EUR,EUR,NMD8IYUBZ9Y,OK,
PAY-0001236,T-500901,23/03/25 16:23,S001,CAJ06,EMP041,Contado,"115,04",EUR,BV30BMZW753,OK,
PAY-0001237,T-500902,2025-06-18,s004,CAJ02,EMP040,DEBITO,91.46,EUR,QU3O193X2,OK,
PAY-0001238, T-500903 ,2025-11-26,S04,CAJ05,EMP042,bizum,541.94,EUR,59ROGA72,ANULADO,Pago anulado por duplicidad
PAY-0001239,T-500904,12 de junio de 2025 19:35,S002,CAJ05,EMP054,Cupon,"221,95",EUR,6LBRHLVO2Y93,OK,
PAY-0001240,T-500905,25/05/2025 22:19,S001,CAJ01,EMP040,Tarjeta (Crédito),59.03,EUR,DQJ3SXGTT0,OK,
PAY-0001241,T-500905,25/05/25 22:19,S001,CAJ01,EMP040,Tarjeta Crédito,540.97,EUR,LTNVV1GFBCHZ,OK,
PAY-0001242,T-500906,24/10/25 03:02,S001,CAJ03,EMP006,EFECTIVO,"392,36",EUR,LOE20RIL,OK,
PAY-0001243,T-500907,29/11/25 19:01,S004,CAJ07,EMP069,Tarjeta credito,"143,36",EUR,UFEUCXSM7,OK,
PAY-0001244,T-500908,2025-03-27,S005,CAJ02,EMP074,Tarjeta (Débito),€658.86,EUR,HXHI7CYRBV,OK,
PAY-0001245,T-500909,14/09/25 01:46,S003,CAJ02,EMP033,cash,"220,85",EUR,93TLO1I7XJ2,OK,
PAY-0001246, T-500910 ,2025-08-14 00:41:22,S003,CAJ03,EMP048,EFECTIVO,521.33,EUR,6WE815VN8LT2,OK,
PAY-0001247,T-500911,06/05/2025 00:11,S02,CAJ01,EMP031,Tarjeta (Débito),€251.77,EUR,,OK,
PAY-0001248,T-500912,11/05/25 23:26,S003,CAJ02,EMP066,Tarjeta debito,143.08,EURO,N67273JYZB,OK,
PAY-0001249,T-500913,22/05/25 21:58,S001,CAJ06,EMP034,DC,"335,80",eur,CS6MJ3T8MEH,OK,
PAY-0001250,T-500913,22/05/25 21:58,S001,CAJ06,EMP034,Tarjeta (Crédito),470.98,EUR,DNRGCL0KGDVE,OK,
PAY-0001251,T-500914,02/02/25 05:18,S002,CAJ05,EMP071,GiftCard,192.22,EUR,F633BQ6FWS,OK,
PAY-0001252,T-500915,2025-05-18 10:55:00,S002,CAJ04,EMP026,Contado,598.52,EUR,86LJXE6L2ZUA,OK,
PAY-0001253,T-500916,2025-11-30 13:54:31,S005,CAJ03,EMP022,EFECTIVO,0.00,EUR,7RCI2AFI4,OK,
PAY-0001254,T-500918,16 de noviembre de 2025 09:42,S005,CAJ01,EMP018,Credit Card,365.41,EUR,RZ6Z6K8Z6R5C,OK,
PAY-0001255,T-500919,2025-04-18 06:32:13,S004,CAJ04,EMP045,Tarjeta (Débito),€1.19,EUR,,OK,
PAY-0001256,T-500919,2025-04-18 06:32:13,S004,CAJ04,EMP045,Tarjeta Crédito,"-29,49",EUR,ULGTDT2SG,OK,Importe negativo (posible devolución mal registrada)
PAY-0001257,T-500920,23/07/25 14:16,S002,CJ06,EMP016,Financiacion,2365.35,EUR,VUCCPUGCGIZZ,OK,
PAY-0001258,T-500921,2025-01-16 22:28:00,S005,CAJ02,EMP044,Visa/Mastercard,25.54,EUR,I736MV3T,OK,
PAY-0001259,T-500921,16/01/25 21:52,S005,CAJ02,EMP044,Tarjeta Crédito,"90,63",EUR,DOXM7Z7AOL,OK,
PAY-0001260,T-500921,16/01/2025 21:52,S005,CAJ02,EMP044,Cash,-147.80,EUR,56FJPZ42Q8B,OK,Importe negativo (posible devolución mal registrada)
PAY-0001261,T-500922,23/08/2025 08:59,S004,CAJ04,EMP012,EFECTIVO,€40.41,EUR,58E6PLUI46,OK,
PAY-0001262,T-500922,2025-08-23 07:18:00,S004,CAJ04,EMP012,Tarjeta credito,"140,96",EUR,2UJ3A3TSAZ,OK,
PAY-0001263,T-500923,12/10/25 10:51,S004,CAJ02,EMP036,Tarjeta (Débito),483.76,EUR,1KVR6AX8K,OK,
PAY-0001264,T-500924,2025-02-10 09:06:00,S004,CAJ08,EMP056,Visa/Mastercard,"1615,93",EUR,KBR9FYYVM19Q,OK,
PAY-0001265,T-500925,15/02/25 14:55,S004,CAJ02,EMP013,Efectivo,262.97,EUR,,OK,
PAY-0001266,T-500925,2025-02-15 15:22:00,S004,CAJ02,EMP013,Visa/Mastercard,"43,45",EUR,JEJMS73D,OK,
PAY-0001267,T-500926,2025-01-15,S001,CAJ08,EMP074,Cupón,"700,35",EUR,LGU1TLXZB63V,OK,
PAY-0001268,T-500926,15/01/25 11:26,S001,CAJ08,EMP074,Tarjeta Crédito,285.18,EUR,1HUKB6MX,OK,
PAY-0001269,T-500928,2025-03-04 08:49:00,S003,CAJ01,EMP034,TARJETA CREDITO,142.96,EUR,X6E9D70QF,OK,
PAY-0001270,T-500929,21/11/25 18:16,S004,CAJ06,EMP069,GiftCard,"196,80",EUR,,OK,
PAY-0001271,T-500930,02/10/25 17:24,S005,CAJ03,EMP026,Financiación,"759,37",EUR,,OK,
PAY-0001272,T-500931,2025-08-29 06:14:00,S005,CAJ05,EMP069,Tarjeta credito,906.14,EUR,V3CH1J8SDQ,OK,
PAY-0001273,T-500932,2025-05-30 14:41:54,S003,CAJ06,EMP051,CC,"858,36",EUR,,OK,
PAY-0001274,T-500933,02/03/25 04:48,S001,CAJ04,EMP006,cash,674.66,EUR,MNYK922LN,OK,
PAY-0001275,T-500933,2025-03-02 04:57:00,S001,CAJ04,EMP006,TARJETA_REGALO,372.81,EUR,0XH2MECYJ,OK,
PAY-0001276,T-500934,09/01/25 01:37,S002,CAJ04,EMP038,Visa/Mastercard,0.31,EUR,OZT4LH19L,OK,
PAY-0001277,T-500934,09/01/25 01:37,S002,CAJ04,EMP038,EFECTIVO,92.41,EUR,EMNIMCHY7,OK,
PAY-0001278,T-500935,2025-10-02 11:20:58,S002,CAJ07,EMP050,Tarjeta Crédito,1156.41,EUR,MKZRRK6UJ,OK,
PAY-0001279,T-500936,2025-08-13 20:17:02,S003,CAJ03,EMP032,Efectivo,1474.19,EUR,XNUFA4AFM3,OK,
PAY-0001280,T-500937,2025-06-28 17:44:00,S002,CAJ04,EMP074,Tarjeta Crédito,"1183,46",EUR,,OK,
PAY-0001281,T-500938,18/05/25 15:21,S005,CAJ06,EMP019,Tarjeta Débito,1553.36,EUR,,OK,
PAY-0001282,T-500939,01/05/2025 07:46,S004,CAJ03,EMP028,Tarjeta debito,552.04,EUR,405G00R5Y5,OK,
PAY-0001283,T-500940,21 de octubre de 2025 00:08,S002,CAJ06,EMP079,EFECTIVO,204.05,EUR,7JBX9K7MNCT,OK,
PAY-0001284,T-500941,2025-07-12 05:30:00,S002,CAJ03,EMP004,Tarjeta Crédito,538.43,EUR,,OK,
PAY-0001285,T-500942,2025-10-02 16:10:00,S004,CAJ06,EMP040,Debit Card,"406,01",EUR,8V1UC8EANR1C,OK,
PAY-0001286,T-500943,2025-01-24 15:38:00,S003,CAJ02,EMP003,Tarjeta (Débito),"1,064.59",EUR,UCQB39BW4Q46,OK,
PAY-0001287,T-500945,13/11/25 06:23,S005,CAJ08,EMP023,Tarjeta debito,563.32 EUR,EUR,,OK,
PAY-0001288,T-500946,2 de marzo de 2025 07:03,S003,CAJ03,EMP064,Efectivo,155.65,EUR,VXLOBICLW,OK,
PAY-0001289,T-500947,14/11/2025 14:10,S004,CAJ02,EMP047,,123.04,EUR,EHAPWPXS2L,OK,
PAY-0001290,T-500947,2025-11-14,S004,CAJ02,EMP047,Efectivo,682.11€,EUR,KOQS8D6KYB27,OK,
PAY-0001291,T-500948,07/08/25 15:30,S005,CAJ02,EMP042,Tarjeta Débito,867.86,EUR,Q8P6U5PS476,OK,
PAY-0001292,T-500949,2025-01-10 06:09:00,S003,CAJ07,EMP049,CC,323.18,EUR,6HRCFU5D0MYS,OK,
PAY-0001293,T-500950,17/08/25 03:36,S001,CAJ01,EMP012,Credit Card,-93.45,EUR,,OK,Importe negativo (posible devolución mal registrada)
PAY-0001294,T-500950,2025-08-17,S001,CAJ01,EMP012,CC,118.08,EUR,ORGC4ATMX5,OK,
PAY-0001295, T-500950 ,17/08/25 03:36,S001,CAJ01,EMP012,Efectivo,"55,34",EUR,,OK,
PAY-0001296,T-500951,2025-07-23,S002,CAJ01,EMP056,Tarjeta Crédito,216.57€,EUR,9PZP802PAJN3,OK,
PAY-0001297,T-500952,07/01/2025 00:00,S003,CAJ04,EMP074,Tarjeta Crédito,945.16,EUR,,OK,
PAY-0001298,T-500953,2025-06-06 02:31:00,S003,CAJ07,EMP048,Tarjeta credito,3740.69€,EUR,LJRNICD0SQP,OK,
PAY-0001299,T-500954,04/01/2025 23:19,S005,CAJ05,EMP035,Visa/Mastercard,"212,94",EUR,5EZKJS7MQ,OK,
PAY-0001300,T-500955,25/09/25 18:35,S05,CAJ07,EMP058,Visa/Mastercard,452.44,EUR,7381ONRPOJ9,OK,
PAY-0001301,T-500955,25/09/25 18:35,S05,CAJ07,EMP058,TARJETA CREDITO,€660.18,EUR,KWSTVS9Q,OK,
PAY-0001302,T-500956,22/04/25 05:48,S003,CAJ05,EMP051,Aplazado,356.90€,EUR,2FO8HBF5JCD,OK,
PAY-0001303,T-500957,2025-01-15 18:28:37,S002,CAJ01,EMP014,Vale,411.28,EUR,MJOQJQ8H,OK,
PAY-0001304,T-500958,15/07/25 14:04,S004,CAJ08,EMP006,Contado,"288,08",EUR,M5TXCX7LY6YV,OK,
PAY-0001305,T-500959,01/03/25 10:58,S002,CAJ04,EMP008,Visa/Mastercard,346.93,EUR,4RVGR0V9D5,OK,
PAY-0001306,T-500959,2025-03-01 10:58:00,S002,CAJ04,EMP008,Cash,28.37,EUR,G8QDE12W,OK,
PAY-0001307,T-500960,05/08/25 06:14,S001,CAJ02,EMP078,Visa/Mastercard,"65,01",EUR,SK0NLYDJ,OK,
PAY-0001308,T-500960,05/08/25 06:14,S001,CAJ02,EMP078,Cash,"113,89",EUR,1MRN10H57,OK,
PAY-0001309,T-500961,23/09/25 18:17,S002,CAJ06,EMP019,DC,2035.10,EUR,7E5RXRMJO,OK,
PAY-0001310,T-500962,17/11/25 00:13,S002,CAJ01,EM010,Tarjeta credito,23.31,EUR,VGZ38M7D5,OK,
PAY-0001311,T-500963,15/12/25 23:20,S004,CAJ06,EMP059,Tarjeta Crédito,"328,41",EUR,VVBQEVFPV,OK,
PAY-0001312,T-500964,25/02/2025,S003,CAJ06,EMP056,Visa/Mastercard,21.16 EUR,EUR,DAJJO5OKHF23,OK,
PAY-0001313,T-500965,25/06/2025 17:48,S003,CAJ07,EMP054,Visa/Mastercard,,EUR,7LRC6G1HAV6,OK,
PAY-0001314,T-500966,04/11/25 14:42,S002,CAJ06,EMP071,TARJETA CREDITO,92.53,EUR,2WHZ3M21O5,OK,
PAY-0001315,T-500966,2025-11-04 15:34:00,S002,CAJ06,EMP071,Contado,"44,98",EUR,OYM3MULOB77,OK,
PAY-0001316,T-500966,04/11/25 14:42,S002,CAJ06,EMP071,Visa/Mastercard,"358,06",EUR,L0MRVNZQE,OK,
PAY-0001317,T-500967,14/09/25 04:23,S005,CAJ04,EMP071,TARJETA CREDITO,"20,15",EUR,L9GFVND9Y,OK,
PAY-0001318,T-500968,03/05/25 21:54,S005,CAJ07,EMP026,CC,"2,167.99",EUR,LO9NLUPYA,OK,
PAY-0001319,T-500968,03/05/25 21:54,S005,CAJ07,EMP026,tarjeta regalo,€275.86,EUR,FRGN1F32L0F,OK,
PAY-0001320,T-500969,04/01/25 08:47,S005,CAJ01,EMP009,Cash,€293.28,EUR,,OK,
PAY-0001321,T-500970,2025-10-01 06:03:26,S001,CAJ06,EMP058,Tarjeta Débito,313.74,EUR,7WG8V961Y2X,OK,
PAY-0001322,T-500971,17 de diciembre de 2025 22:38,S004,CAJ08,EMP036,Debit Card,807.72,EUR,TEUGQV2X2,OK,
PAY-0001323,T-500973,21 de septiembre de 2025 01:34,s003,CAJ06,EMP018,Tarjeta (Crédito),"43,66",EUR,GAFUNH7I3W,OK,
PAY-0001324,T-500974,13/12/25 01:09,S003,CAJ02,EM064,Tarjeta Crédito,"80,06",EUR,RL6ZAZYXW1C,OK,
PAY-0001325,T-500975,13/04/25 04:23,S004,CAJ03,EMP031,EFECTIVO,€11.39,EUR,6YQEF864,OK,
PAY-0001326,T-500975,2025-04-13 04:23:00,S004,CAJ03,EMP031,Tarjeta debito,25.93,EUR,GNYA55HJC,OK,
PAY-0001327,T-500976,11/08/2025 00:00,S001,CAJ01,EM080,EFECTIVO,"211,33",EUR,6RA0DQD29,OK,
PAY-0001328,T-500976,11/08/2025,S001,CAJ01,EM080,Visa/Mastercard,32.62,EUR,2GBUDY7MX,OK,
PAY-0001329, T-500977 ,15/05/25 11:10,S003,CAJ07,EMP044,EFECTIVO,138.20,EUR,IRJQR0U0,OK,
PAY-0001330,T-500978,11/02/25 13:46,s003,CAJ02,EMP017,cash,255.02,EUR,GA4TIAD1CGA6,OK,
PAY-0001331,T-500979 ,28 de agosto de 2025 19:09,,CAJ01,EMP044,VALE,€542.03,EUR,QYJM3PPS,OK,
PAY-0001332,T-500980,26 de diciembre de 2025 20:10,S001,CAJ01,EMP026,Tarjeta credito,290.73,EUR,ECE98J6ZRZQO,OK,
PAY-0001333,T-500981 ,12/07/25 08:32,S003,CAJ04,EMP026,CC,451.08,EUR,XTJ98KSFQ,OK,
PAY-0001334,T-500983,10/06/25 02:44,S003,CAJ04,EMP076,Tarjeta Crédito,"4,80",EUR,,OK,
PAY-0001335,T-500983,2025-06-10 02:44:00,S003,CAJ04,EMP076,CC,"40,01",EUR,Z2LNTJYIU,OK,
PAY-0001336,T-500984,2025-12-17 13:42:46,S003,CAJ03,EMP009,TARJETA CREDITO,687.73,EUR,,OK,
PAY-0001337,T-500984,2025-12-17 13:42:46,S003,CAJ03,EMP009,Tarjeta credito,"288,38",EUR,G5HG5UGHNB,OK,
PAY-0001338,T-500985,26/01/25 14:02,S001,CAJ06,EMP078,Efectivo,€1209.98,EUR,TK41NS6CWE6J,OK,
PAY-0001339,T-500985,26/01/2025 14:02,S001,CAJ06,EMP078,Visa/Mastercard,61.88,EUR,W5NX3M4CLEN7,OK,
PAY-0001340,T-500986,18/05/25 01:13,S005,CAJ04,EMP022,Credit Card,41.23,EUR,6IRX3NGHB3,OK,
PAY-0001341,T-500986,18/05/25 01:13,S005,CAJ04,EMP022,GiftCard,209.00,EUR,V5F4C6VZBM,OK,
PAY-0001342,T-500987,10/01/25 12:10,S004,CAJ03,EMP050,Tarjeta Crédito,"-586,09",EUR,28SIE7COC0W,OK,Importe negativo (posible devolución mal registrada)
PAY-0001343,T-500988,2025-01-07 08:45:00,S004,CAJ03,EMP024,CC,€3.86,EUR,XIRI47C9,OK,
PAY-0001344,T-500988,2025-01-07 08:45:00,S004,CAJ03,EMP024,TARJETA_REGALO,190.89,EUR,,OK,
PAY-0001345,T-500989,27/11/25 17:27,S003,CAJ08,EMP064,Vale Devolución,"3795,59",EUR,HJYDAK4U9M30,OK,
PAY-0001346,T-500990,11/06/25 16:37,S004,CAJ03,EMP064,Tarjeta (Débito),176.22,EUR,CSEFELX6,OK,
PAY-0001347,T-500990,11/06/25 16:37,S004,CAJ03,EMP064,Cupon,"1781,65",EUR,18L30PYN1QI,OK,
PAY-0001348,T-500991,03/07/25 21:33,S002,CAJ06,EMP017,Tarjeta (Crédito),"2,286.16",EUR,44VWGJY4P,OK,
PAY-0001349,T-500991,2025-07-03 21:33:00,S002,CAJ06,EMP017,cash,170.31,EUR,PCJDUCEF,OK,
PAY-0001350,T-500992,17/12/25 05:54,S004,CAJ06,EMP043,EFECTIVO,"109,92",EUR,ACMA2H5CS,OK,
PAY-0001351,T-500992,17/12/25 05:54,S004,CAJ06,EMP043,Tarjeta (Crédito),"82,26",EUR,CD5N9H32ISNK,OK,
PAY-0001352,T-500993,2025-05-02 17:39:33,S002,CAJ04,EMP061,Cupon,"1227,87",EUR,RQQIO1QLML5,OK,
PAY-0001353,T-500994,04/11/25 07:16,S005,CAJ05,EMP050,Contado,2276.67 EUR,EUR,GIX5HY9LX,OK,
PAY-0001354,T-500995,2025-07-08 05:42:00,S001,CAJ08,EMP035,Tarjeta Crédito,195.15,EUR,F76PK90JEZ4,OK,
PAY-0001355,T-500996,15/07/2025 18:49,S005,CAJ05,EMP025,TARJETA CREDITO,2606.34,EUR,GJ9U6V6Z8KV8,OK,
PAY-0001356,T-500997,2025-06-30 13:33:00,S002,CAJ01,EMP054,Tarjeta Crédito,"1,860.84",EUR,,OK,
PAY-0001357,T-500998,16/08/25 18:23,S003,CAJ04,EMP059,Tarjeta (Crédito),397.34,EUR,,OK,
PAY-0001358,T-500998,2025-08-16 18:23:00,S003,CAJ04,EMP059,Visa/Mastercard,357.44,EUR,RZ3RJ4BIOHK,OK,
PAY-0001359,T-500998,16/08/25 18:23,S003,CAJ04,EMP059,GiftCard,€58.80,EUR,511R6MDMB,OK,
PAY-0001360,T-500999,2025-06-03 14:40:42,S003,CAJ07,EMP056,Tarjeta Regalo,16.24,EUR,NOAUNEO5C,OK,
PAY-0001361,T-500999,03/06/2025 15:13,S003,CAJ07,EMP056,cash,"285,20",EUR,6Q0L4ZNRKR1,OK,
PAY-0001362,T-501000,26/12/25 23:47,S001,CAJ01,EMP017,Tarjeta debito,"55,52",EUR,PEAERO71,OK,
PAY-0001363,T-501001,2025-07-31 16:48:22,S003,,EMP009,Tarjeta (Crédito),30.92€,EUR,GPH0RNWK1S2,OK,
PAY-0001364,T-501001,2025-07-31 16:48:22,S003,CAJ07,EMP009,DC,"496,95",EUR,KZN0LYIMOES,OK,
PAY-0001365,T-501001,2025-07-31 16:48:22,s003,CAJ07,EMP009,Tarjeta Débito,€323.60,EUR,XUHXXCDXF,OK,
PAY-0001366,T-501002 ,22/01/25 22:45,S002,CAJ02,EMP034,Efectivo,451.41,EUR,AHYVZYV9BI,OK,
PAY-0001367,T-501002 ,2025-01-22 22:45:00,S002,CAJ02,EMP034,Tarjeta debito,895.47,EUR,3UM330BOQC2,OK,
PAY-0001368,T-501004,10/07/25 20:47,S005,CAJ04,EMP027,Tarjeta debito,"405,62",EUR,VPOUI0OMOM,OK,
PAY-0001369,T-501006,2025-02-11 10:47:00,S005,CAJ04,EMP006,Visa/Mastercard,€551.18,EUR,0LR3OOZIT4,OK,
PAY-0001370,T-501006,2025-02-11 10:47:00,S005,CAJ04,EMP006,Debit Card,€47.84,EUR,FHZ92N7VG,OK,
PAY-0001371,T-501006,2025-02-11 11:06:00,S005,CAJ04,,Efectivo,"1383,46",EUR,,OK,
PAY-0001372,T-501007,31/03/25 05:59,S002,CAJ05,EMP007,Tarjeta (Crédito),1428.58,EUR,HPKJI6NR,OK,
PAY-0001373,T-501008,2025-08-22 17:18:00,S004,CAJ07,EMP059,Tarjeta Crédito,216.40,EUR,JVV0M96XR8Z,OK,
PAY-0001374,T-501009,29/11/25 21:21,S002,CAJ02,EMP004,Credit Card,768.72,EUR,USL42N3V,OK,
PAY-0001375,T-501009,2025-11-29 22:35:00,S002,CAJ02,EMP004,CC,€240.54,EUR,W0K41IU8T,OK,
PAY-0001376,T-501009,29/11/25 21:21,S002,CAJ02,EMP004,Efectivo,"2205,74",EUR,XZMCD6XHMK,OK,
PAY-0001377,T-501011,13/02/2025,S002,CAJ01,EMP061,GiftCard,1403.25,EUR,,OK,
PAY-0001378,T-501012,12/01/2025 14:40,S005,CAJ03,EMP051,TARJETA_REGALO,724.90,EUR,QKZGTSOF1XW5,OK,
PAY-0001379, T-501012 ,12/01/25 14:40,S005,CAJ03,EMP051,Tarjeta (Crédito),255.24,EUR,3D3SCPQ4R,OK,
PAY-0001380,T-501012,2025-01-12 14:40:00,S005,CAJ03,EMP051,Tarjeta debito,"4,75",EUR,,OK,
PAY-0001381,T-501015,13/10/25 12:30,S002,CAJ06,EMP070,CC,3713.78,EUR,C7K4RJNYLIM,OK,
PAY-0001382,T-501016,09/04/25 07:59,S004,CAJ07,EMP056,DEBITO,806.99,EUR,1DE0RII5,OK,
PAY-0001383,T-501017,2025-10-17 05:58:00,S003,CAJ03,EMP070,TARJETA_REGALO,"137,25",EUR,PZGRSPIW06,OK,
PAY-0001384,T-501018,2025-02-10 07:37:00,S001,CAJ02,EMP070,DC,264.34,EUR,TAX28906Q,OK,
PAY-0001385,T-501018,2025-02-10 07:37:00,S001,CAJ02,EMP070,TARJETA CREDITO,426.79,EUR,89WAYM9Q1,OK,
PAY-0001386,T-501019,03/06/25 09:17,S003,CAJ06,EMP048,Tarjeta Crédito,"187,10",EUR,GIU5DSJNCTF,OK,
PAY-0001387,T-501020,12 de julio de 2025 07:37,S004,,EMP065,EFECTIVO,"-79,77",EUR,,OK,Importe negativo (posible devolución mal registrada)
PAY-0001388,T-501020,12 de julio de 2025 07:37,S004,CAJ04,EMP065,Vale,259.40,EUR,DF0NSGT6L,OK,
PAY-0001389,T-501021,29/10/25 09:28,s002,CAJ01,EMP027,Credit Card,€297.09,EUR,,OK,
PAY-0001390,T-501022,05/07/25 19:22,S003,CAJ04,EMP080,EFECTIVO,1017.25,EUR,KCD3I4Z4YID,OK,
PAY-0001391,T-501023,17 de agosto de 2025 00:23,S003,CAJ07,EMP013,Tarjeta debito,1242.91,EUR,F6M1DALPB01,OK,
PAY-0001392,T-501024,2025-10-18 21:40:00,S001,CAJ02,EMP013,EFECTIVO,679.17,EUR,J8OWTK95H3,OK,
PAY-0001393,T-501024,18/10/25 21:40,S001,CAJ02,EMP013,Cash,"3,322.45",EUR,Y1WNGXAM,OK,
PAY-0001394,T-501025,22/06/25 14:23,S004,CAJ03,EMP004,Debit Card,"243,35",EUR,ZK1GA2SYTMXB,OK,
PAY-0001395,T-501026,25/06/25 10:23,S001,CAJ02,EMP063,Tarjeta Crédito,"466,72",EUR,,OK,
PAY-0001396,T-501027 ,2025-01-18 00:00:00,S004,CAJ01,EMP023,EFECTIVO,1763.49,EUR,K179YIXMHV,OK,
PAY-0001397,T-501028,20/06/25 03:21,S001,CAJ03,EMP078,cash,696.72,EUR,LC37SRDV,OK,
PAY-0001398,T-501029,13/06/2025,S005,CAJ08,EMP056,Tarjeta credito,€239.40,EUR,MT6Y6TL71R,OK,
PAY-0001399,T-501030,14 de marzo de 2025 13:00,S002,CAJ03,EMP021,TARJETA_REGALO,15.03,EURO,SF4ET7WAH,OK,
PAY-0001400,T-501030,14 de marzo de 2025 13:00,S002,CAJ03,EMP021,Gift Card,190.38,EUR,,OK,
PAY-0001401,T-501031,17/10/25 23:12,S005,CAJ01,EMP019,Tarjeta Crédito,"655,24",EUR,38IWA81MVEZ4,OK,
PAY-0001402,T-501032,2025-04-05 16:56:00,S005,CAJ05,EMP018,Tarjeta credito,114.65,EUR,,OK,
PAY-0001403,T-501032,05/04/25 15:13,S005,CAJ05,EMP018,Tarjeta credito,17.81,EUR,D7X1JMH6T4U,OK,
PAY-0001404,T-501032,2025-04-05 15:27:00,S005,CAJ05,EMP018,GiftCard,"62,64",EUR,,OK,
PAY-0001405,T-501033,2025-02-26 11:15:00,S005,CAJ02,EMP017,Contado,"635,85",EUR,TL97P7DFLR,OK,
PAY-0001406,T-501034,2025-10-20 04:36:19,S004,CAJ06,EMP034,Tarjeta credito,52.80,EUR,ATDZYUMNQIZ,OK,
PAY-0001407,T-501035,08/09/25 21:32,S002,CAJ03,EMP066,Tarjeta Regalo,106.94,EUR,C0BQOF19,OK,
PAY-0001408,T-501037,2025-12-25 15:12:54,S004,CAJ07,EMP076,Efectivo,"57,66",EUR,,OK,
PAY-0001409,T-501037,2025-12-25 15:12:54,S004,CAJ07,EMP076,Debit Card,441.55 EUR,EUR,Q7S44Z78IY,OK,
PAY-0001410,T-501037,2025-12-25 15:12:54,S004,CAJ07,EMP076,VALE,117.51,EUR,UHO1DKIA,OK,
PAY-0001411, T-501038 ,2025-12-06 17:16:00,S005,CAJ02,EMP035,Efectivo,188.29,EUR,DP0LO2K9QUV,OK,
PAY-0001412,T-501039,19/04/25 04:00,S003,CAJ04,EMP067,Visa/Mastercard,231.35,EUR,,OK,
PAY-0001413,T-501040,06/11/25 22:11,S003,CAJ06,EMP071,TARJETA_REGALO,"242,99",EUR,B3OCJZ5QDE,OK,
PAY-0001414,T-501041,2025-06-02 02:44:00,S005,CAJ06,EMP064,Visa/Mastercard,19.99,EUR,8SPCTATC9,OK,
PAY-0001415,T-501041,02/06/25 02:15,S005,CAJ06,EMP064,Credit Card,€1292.64,EUR,EP9MNRN8WN,OK,
PAY-0001416,T-501042,9 de abril de 2025 23:00,S004,,EMP025,Tarjeta Débito,"445,29",EUR,FOLANGXCD285,OK,
PAY-0001417,T-501043,05/07/25 00:04,S002,CAJ07,EMP063,Contado,"1.760,87",EUR,E7PDJNL72,OK,
PAY-0001418,T-501044,24/09/2025 16:44,S003,CAJ05,EMP013,,904.52,EUR,WTB4V8JQ,OK,
PAY-0001419,T-501045,2025-12-27 08:12:00,S004,CAJ04,EMP074,Tarjeta (Crédito),113.43,EUR,LX9BEAHZ,ANULADO,
PAY-0001420,T-501046,2025-08-27,S004,CAJ01,EMP012,Efectivo,51.55,EUR,29DZUP68,OK,
PAY-0001421,T-501047,19/06/25 00:17,S002,CAJ05,EMP031,Credit Card,"130,25",EUR,32J60V4N5FIC,OK,
PAY-0001422,T-501047,19/06/25 00:17,S002,CAJ05,EMP031,TARJETA_REGALO,59.29,EUR,HKUMCISY,OK,
PAY-0001423,T-501048,25/10/25 02:50,S002,CAJ07,EMP049✓,cash,1402.15,EUR,7O6YU37N,OK,
PAY-0001424,T-501049,26/02/25 02:59,S004,CAJ07,EMP078,Visa/Mastercard,266.50,EUR,,OK,
PAY-0001425,T-501050,2025-07-02 10:02:00,S003,CAJ05,EMP049,Debit Card,619.45,EUR,IJTWV1MM94,OK,
PAY-0001426,T-501051,09/10/25 05:49,S001,CAJ06,EMP003,EFECTIVO,1181.57,EUR,1YJ94KIC0,OK,
PAY-0001427,T-501052,23/10/25 10:20,S002,CAJ04,EMP049,DC,458.06,EUR,C5KTSIQU,OK,
PAY-0001428,T-501053,19/04/2025 05:46,S005,CAJ08,EMP019,Credit Card,"434,70",EUR,R1QJQMFD2SM,OK,
PAY-0001429,T-501055,2025-03-01 07:26:26,S005,CAJ08,EMP048,DEBITO,123.46,EUR,Q6W51IX2L1,OK,
PAY-0001430,T-501057,27/01/25 01:10,S002,CAJ04,EMP078,EFECTIVO,904.86,EUR,O9XS2S1SPZ,OK,
PAY-0001431,T-501058,24/08/25 03:49,S004,CAJ08,EMP067,CC,"1283,05",EUR,WQRUEYS2,OK,
PAY-0001432,T-501059,10/06/25 03:58,S001,CAJ06,EMP015,CC,1520.53,EUR,G3YVOLLLMJ,OK,
PAY-0001433,T-501060,25/02/25 06:28,S004,CAJ03,EMP039,Cash,€298.64,EUR,5ZVOMXW3HB,OK,
PAY-0001434,T-501061,25/12/25 08:37,S002,CAJ01,EMP019,Cash,478.22,EUR,JZ3N3M4LH,OK,
PAY-0001435,T-501062,29/12/25 17:17,S001,CAJ06,EMP071,Credit Card,640.46,EUR,49OZO13JF46,OK,
PAY-0001436,T-501063,2025-07-22 08:55:00,S002,CAJ05,EMP066,TARJETA CREDITO,16.12,EUR,LQ0NH0RUDB,OK,
PAY-0001437,T-501063,22/07/25 08:55,S002,CAJ05,EMP066,Tarjeta (Crédito),22.56,EUR,JZ2HO7DU,OK,
PAY-0001438,T-501064,2025-07-19 14:33:46,S003,CAJ02,EMP063,Cash,530.79,EUR,F72BYNCS583,OK,
PAY-0001439,T-501065,2025-10-23 23:22:00,S004,CAJ08,EMP035,Contado,547.06,EUR,RWF2L0OQZ,OK,
PAY-0001440,T-501066,09/08/2025 15:53,S004,CAJ07,EMP020,Efectivo,126.44,EUR,UHZD9OUQJ,OK,
PAY-0001441,T-501068,17/09/25 07:53,S003,CAJ06,EMP042,CC,2411.30 EUR,EUR,RX6MVFYN,OK,
PAY-0001442,T-501069,09/10/25 06:44,S004,CAJ06,EMP039,Efectivo,"965,24",EUR,D0G2VORFSL0,OK,
PAY-0001443,T-501070,2025-03-01,S005,CAJ04,EMP032,Tarjeta Débito,46.21,EUR,10MEATDUX6,OK,
PAY-0001444,T-501071 ,13 de noviembre de 2025 12:55,S002,CAJ02,EMP008,Cupón,0.00,EUR,IHKPJU9HR6,OK,
PAY-0001445,T-501072,02/04/25 07:23,S004,CAJ07,EMP052,Cash,"53,51",EUR,JEPW5XPV,OK,
PAY-0001446,T-501072,02/04/25 07:23,S004,CAJ07,EMP052,Tarjeta credito,"18,66",EUR,NNWXSS3SV,OK,
PAY-0001447,T-501073,2025-02-05 22:07:00,S001,CAJ01,EMP055,Cash,€22.96,EUR,IXCIJQN6C4,OK,
PAY-0001448,T-501073,2025-02-05 20:26:00,S001,CAJ01,EMP055,Tarjeta Crédito,"231,26",EUR,XBCVLMEI,OK,
PAY-0001449,T-501074,13 de diciembre de 2025 18:14,S003,CAJ06,EMP012,Visa/Mastercard,"1.569,05",EUR,11MH5HZW,OK,
PAY-0001450,T-501075,22/11/25 00:00,S002,CAJ08,EMP076,Contado,€129.96,EUR,FZRG4PB7QU30,OK,
PAY-0001451,T-501075,22/11/25 00:00,S002,CAJ08,EMP076,Tarjeta Crédito,"149,51",EUR,JNBZVFV991,OK,
PAY-0001452,T-501076,2025-05-12 12:31:03,S005,CAJ04,EMP005,DC,"270,49",EUR,QLV488PK,OK,
PAY-0001453,T-501076,2025-05-12 12:31:03,S005,CAJ04,EMP005,Tarjeta credito,€38.19,EUR,Y3N0MWFS5,OK,
PAY-0001454,T-501077,23/03/2025 18:26,S004,CAJ04,EMP040,Visa/Mastercard,503.48,EUR,R77IU31E9,OK,
PAY-0001455,T-501078,2025-08-13 23:15:00,S002,CAJ02,EMP043,Cash,675.59,EUR,7PFTPYBOR9MM,OK,
PAY-0001456,T-501079,2025-06-01 18:28:00,S005,CAJ04,EMP005,Cupón,131.65,EUR,W63TFMS1,OK,
PAY-0001457,T-501079,01/06/2025 19:04,S005,CAJ04,EMP005,tarjeta regalo,-140.76,EUR,NSE13DWW8DX,OK,Importe negativo (posible devolución mal registrada)
PAY-0001458,T-501080,13/11/25 19:37,S004,CAJ07,EMP042,cash,"1,983.47",EUR,WLX04XSBY2,OK,
PAY-0001459,T-501082,2025-11-17 03:15:00,S003,CAJ06,EMP014,Credit Card,145.06,EUR,JX5W3OZYB,OK,
PAY-0001460,T-501083,7 de octubre de 2025 06:33,S003,CAJ04,EMP006,GiftCard,700.68,EUR,DAUDPUSQC3,OK,
PAY-0001461,T-501084,25/12/25 11:49,S001,CAJ07,EMP078,Cash,2178.59,EUR,7NFPE5HDPV,OK,
PAY-0001462,T-501085,16/11/2025 01:00,S005,,EMP030,DC,10.68,EUR,DMR7BJN7C,OK,
PAY-0001463,T-501085,16/11/25 01:00,S005,,EMP030,TARJETA CREDITO,€11.11,EUR,0F6OV0NDYU54,OK,
PAY-0001464,T-501086,2025-09-15 15:42:00,S005,CAJ01,EMP040,tarjeta regalo,"212,76",EUR,KYLJ1J2PEMK,OK,
PAY-0001465,T-501087,12/09/2025 19:51,S002,CAJ07,EMP043,Tarjeta debito,€196.13,EUR,,OK,
PAY-0001466,T-501089,2025-01-02 07:01:16,S005,CAJ02,EMP016,Tarjeta Crédito,"189,73",EUR,YGWR70IO,OK,
PAY-0001467,T-501090,19/04/25 01:56,S004,CAJ08,EMP062,Cupon,2688.34,EUR,1VFUJV2HRWR,OK,
PAY-0001468,T-501092,06/06/25 07:11,S003,CAJ07,EMP066,Credit Card,170.00 EUR,EUR,5RVMK6TTG,OK,
PAY-0001469,T-501092,2025-06-06,S003,CAJ07,EMP066,Visa/Mastercard,,EUR,CEVS40W58CM1,OK,
PAY-0001470,T-501094,2025-11-24 09:32:17,S003,CAJ01,EMP060,TARJETA CREDITO,"30,60",EUR,,OK,
PAY-0001471,T-501094,2025-11-24,S003,CAJ01,EMP060,TARJETA_REGALO,213.99,EUR,8D2IBOCTBLR,OK,
PAY-0001472,T-501095,2025-09-05 19:20:21,S005,CAJ06,EMP005,Efectivo,0.65,EUR,T1U37EB8QHS,OK,
PAY-0001473,T-501095,2025-09-05 19:20:21,S005,CAJ06,EMP005,Cash,118.40,EUR,RW97RSLX,OK,
PAY-0001474,T-501096,10/06/25 00:23,S002,CAJ07,EMP036,Contado,101.44,EUR,BKYYT86R5K,OK,
PAY-0001475,T-501096,10/06/25 00:23,S002,CAJ07,EMP036,Tarjeta credito,18.96,EUR,,OK,
PAY-0001476,T-501097,27 de noviembre de 2025 17:12,S003,CAJ02,EMP068,GiftCard,€-22.37,EUR,A008WBGP,OK,Importe negativo (posible devolución mal registrada)
PAY-0001477,T-501098,23/10/2025,S005,CAJ02,EMP036,Tarjeta credito,"2441,92",EUR,97LA7FG8B,OK,
PAY-0001478,T-501099,16/01/25 19:42,S005,CAJ05,EMP052,,"2,099.92",EUR,7JMDXUBC6A4,OK,
PAY-0001479,T-501100,11/02/25 12:17,,CAJ08,EMP047,Tarjeta debito,64.01,EUR,2N9BO0AKGG5P,OK,
PAY-0001480,T-501100,11/02/25 12:17,,CAJ08,EMP047,Visa/Mastercard,2.88,EUR,F9LQ6W67VZ,OK,
PAY-0001481,T-501101,11 de octubre de 2025 00:25,S005,CAJ02,EMP003,Tarjeta Débito,892.49,EUR,8PCYHC065J,OK,
PAY-0001482,T-501101,11 de octubre de 2025 00:25,S005,CAJ02,EMP003,Credit Card,"345,12",EUR,GAE9DR5D,OK,
PAY-0001483,T-501102,03/04/25 09:29,S001,CAJ05,EMP025,Tarjeta Crédito,1611.77,EUR,JBUX476KEOC,OK,
PAY-0001484,T-501103,18/02/25 09:48,S004,CAJ05,EMP079,EFECTIVO,€424.20,EUR,X7F6TE8CP9,OK,
PAY-0001485,T-501103,2025-02-18 09:48:00,S004,CAJ05,EMP079,Tarjeta (Crédito),347.86,EUR,FKYOF4RPL1I8,OK,
PAY-0001486,T-501104,16/01/2025 14:44,S002,CAJ02,EMP032,Efectivo,1742.49€,EUR,8T4BRP40,OK,
PAY-0001487,T-501104,16/01/25 14:44,S002,CAJ02,EMP032,Debit Card,192.57,EUR,4IJI934QPV,OK,
PAY-0001488,T-501105,2025-05-13 13:40:39,,CAJ04,EMP002,TARJETA CREDITO,90.11,eur,LOUQX0MUL27B,OK,
PAY-0001489,T-501106,2025-02-26 00:26:00,S004,CAJ05,EMP026,Tarjeta Crédito,"857,53",EUR,,OK,
PAY-0001490,T-501107,2025-10-31 11:06:00,S003,,EMP060,Cash,"55,87",EUR,,OK,
PAY-0001491,T-501107,31/10/25 11:06,S003,,EMP060,Tarjeta credito,"344,44",EUR,M3ZH476EG,OK,
PAY-0001492,T-501108,26/06/25 11:35,S002,CAJ01,EMP068,Tarjeta Regalo,€881.94,EUR,BV6JNSCZK,OK,
PAY-0001493,T-501108,2025-06-26 11:35:00,S002,CAJ01,EMP068,Tarjeta debito,452.71,EUR,,OK,
PAY-0001494,T-501108,2025-06-26 11:35:00,S002,CAJ01,EMP068,TARJETA CREDITO,60.49,EUR,MFSWPY6EFIDX,OK,
PAY-0001495,T-501109,2 de abril de 2025 00:57,S004,CAJ08,EM018,Tarjeta Crédito,40.87,EUR,GF0G46U2,OK,
PAY-0001496,T-501110,2025-07-20 15:42:00,S003,CAJ05,EMP035,TARJETA_REGALO,277.92,EUR,I9P8TFXS,OK,
PAY-0001497,T-501111,12/08/25 01:55,S003,CAJ04,EMP072,Efectivo,"925,21",EUR,52TD2QYUOLN,OK,
PAY-0001498,T-501112,12/10/25 12:30,S005,,EMP025,Efectivo,-13.32,EUR,SL3E6KR91,OK,Importe negativo (posible devolución mal registrada)
PAY-0001499,T-501113,12/12/25 17:47,S005,CAJ06,EMP061,Gift Card,82.95 EUR,EUR,H6DU9ZZ99VM,OK,
PAY-0001500,T-501113,12/12/25 17:47,S005,CAJ06,EMP061,Debit Card,64.08,EUR,ADTEBA9NE,OK,
PAY-0001501,T-501114,03/12/25 12:50,S05,CAJ02,EMP018,Tarjeta (Crédito),1589.34,EUR,AZH37WEAQF60,OK,
PAY-0001502,T-501115,07/02/25 14:45,S005,CAJ03,EMP028,CC,65.07,EUR,,OK,
PAY-0001503,T-501115,07/02/25 14:45,S005,CAJ03,EMP028,Efectivo,157.58,EUR,J7W6977XP2,OK,
PAY-0001504,T-501116,4 de noviembre de 2025 05:34,S001,CAJ04,EMP012,Tarjeta Crédito,"432,44",EUR,5MWBWACJ28,OK,
PAY-0001505,T-501117,11/12/25 15:48,S001,CAJ08,EMP028,Efectivo,"1,282.81 EUR",EUR,FKPLPCGBQLC9,OK,
PAY-0001506,T-501118,07/02/25 20:52,S003,CAJ08,EMP022✓,Cash,115.94,EUR,WYR248X5,OK,
PAY-0001507,T-501119,2025-02-22 05:46:15,S002,CAJ05,EMP058,Tarjeta Débito,€109.94,EUR,K1XV1JL7TG6,OK,
PAY-0001508,T-501120,14/01/2025 01:03,S002,CAJ03,EMP001,EFECTIVO,388.06,EUR,,OK,
PAY-0001509, T-501120 ,14/01/2025,S002,CAJ03,EMP001,Tarjeta (Crédito),59.47,EUR,I8UXK02RA81,OK,
PAY-0001510,T-501121,10 de diciembre de 2025 05:52,S004,CAJ03,EMP067,Credit Card,850.24 EUR,EUR,,OK,
PAY-0001511,T-501122,21/11/25 22:30,S004,CAJ04,EMP055,DC,616.02 EUR,EUR,UXHQ5R7A2P,OK,
PAY-0001512,T-501122,21/11/25 22:30,S004,CAJ04,EMP055,Cash,188.09,EUR,X42RR3DB,OK,
PAY-0001513,T-501123,2025-09-27,S003,CAJ08,EMP075,Efectivo,1078.74,EUR,9HJ67TM0ZXO,OK,
PAY-0001514,T-501124,04/04/25 09:27,S002,CAJ03,EMP030,Tarjeta debito,415.59,EUR,,OK,
PAY-0001515,T-501125,18/11/2025 00:00,S003,CAJ02,EMP043,EFECTIVO,371.54,EUR,AOPVBW2P5JG,OK,
PAY-0001516,T-501126,2025-09-22 14:32:00,S004,CAJ02,EMP042,TARJETA CREDITO,47.54,EUR,9UCEGYUA4QG,OK,
PAY-0001517,T-501126,22/09/25 14:32,S004,CAJ02,EMP042,Tarjeta credito,"67,69",EUR,CH4L0AH1KG9U,OK,
PAY-0001518,T-501127,2025-11-10 18:50:00,S001,CAJ01,EMP022,TARJETA CREDITO,-670.22,EUR,TT96J6VD,OK,Importe negativo (posible devolución mal registrada)
PAY-0001519,T-501128,2025-09-19,S001,CAJ01,EMP046,Tarjeta (Crédito),447.47,EUR,YZM5095TKIZI,OK,
PAY-0001520,T-501128,19/09/25 01:09,s001,CAJ01,EMP046,Tarjeta credito,50.60,EUR,3OM8LHPWF,OK,
PAY-0001521,T-501129 ,2025-01-30,S002,CAJ08,EMP067,Tarjeta (Débito),186.81,EUR,,OK,
PAY-0001522,T-501130,15/09/25 02:37,S001,CAJ08,EMP077,Credit Card,640.37,EUR,8NG0DLHXBAAC,OK,
PAY-0001523,T-501131,2025-05-05,S004,CAJ04,EMP035,Efectivo,"259,37",EUR,HHCC5ZSNPI53,OK,
PAY-0001524,T-501132,5 de agosto de 2025 19:22,S004,CAJ04,EMP078,Visa/Mastercard,242.02,EUR,ZZ99HH4R,OK,
PAY-0001525,T-501132,5 de agosto de 2025 19:22,S004,CAJ04,EMP078,Tarjeta Crédito,"1,84",EUR,WF58YJ9OHNJY,OK,
PAY-0001526,T-501133,03/12/25 00:43,S005,CAJ02,EMP007,Visa/Mastercard,355.54,EUR,MCLICE7W68,OK,
PAY-0001527,T-501135,2025-07-22,S001,CAJ07,EMP038,Tarjeta credito,228.26,EUR,LM4GL51N5,OK,
PAY-0001528,T-501135,2025-07-22 16:21:54,S001,CAJ07,EMP038,Credit Card,826.24,EUR,3DB8ACR2L6BG,OK,
PAY-0001529,T-501136,2025-04-08 19:24:41,S002,CAJ07,EMP040,cash,1016.23,EUR,4C3IYX95OJ,OK,
PAY-0001530,T-501136,2025-04-08 19:24:41,S002,CAJ07,EMP040,Tarjeta Débito,491.17,EUR,XBT6HMRYI02,OK,
PAY-0001531,T-501137,24/05/25 07:46,S003,CAJ01,EMP030,Cupón,1186.06,EUR,,PENDIENTE,
PAY-0001532,T-501139,22/02/25 03:20,S003,CAJ03,EMP036,TARJETA CREDITO,"259,40",EUR,K5JAW2DF8,OK,
PAY-0001533,T-501140,25/10/25 02:44,S001,CAJ05,EMP028,Tarjeta credito,619.50,EUR,W1V49TDYF12,OK,
PAY-0001534,T-501141,01/07/25 03:37,S002,CAJ02,EMP077,Efectivo,397.17,EUR,67W5WLO61,OK,
PAY-0001535,T-501142,2025-01-16 05:28:27,S002,CAJ03,EMP042,Credit Card,"892,19",EUR,G5M296NJW,OK,
PAY-0001536,T-501142,2025-01-16 05:28:27,S002,CAJ03,EMP042,Tarjeta (Crédito),292.77,EUR,19XPLKK8,OK,
PAY-0001537, T-501142 ,2025-01-16 05:28:27,S002,CAJ03,EMP042,DEBITO,521.37,EUR,ZV4W5NU4,OK,
PAY-0001538,T-501143,2025-07-14 10:42:30,S005,CAJ06,EMP013,FINANCIACION,449.65,EUR,EGY1LWB46T,PENDIENTE,
PAY-0001539, T-501143 ,2025-07-14 10:42:30,S005,CAJ06,EMP013,TARJETA CREDITO,"702,48",EUR,2PMIAY8MLN,OK,
PAY-0001540,T-501145,02/06/25 03:28,S005,CAJ07,EMP080,Credit Card,"1,310.45",EUR,A03DAZ3RWBJ9,OK,
PAY-0001541,T-501146,2025-05-14 04:31:42,S005,CAJ05,EMP051,Tarjeta (Crédito),"309,16",EUR,UFN4VNBO,OK,
PAY-0001542,T-501147,12/06/25 10:32,S005,CAJ02,EMP036,tarjeta regalo,"220,33",EUR,PHPYHX68Y,OK,
PAY-0001543,T-501148,12/05/25 01:39,S005,CAJ01,EMP003,Cash,"447,15",EUR,52IYBHK3H3Y,OK,
PAY-0001544, T-501149 ,2025-03-16 00:00:00,S001,CAJ03,EMP003,Contado,445.10,EUR,,OK,
PAY-0001545,T-501150,10/03/25 03:51,S001,CAJ08,EMP028,Credit Card,"1470,96",EUR,19FG4UBV9TKR,OK,
PAY-0001546,T-501151,2025-02-25 09:05:20,S004,CAJ08,EMP072,Cash,-573.38,EUR,4S6C6RB0FGY,OK,Importe negativo (posible devolución mal registrada)
PAY-0001547,T-501152,2025-09-17 03:18:00,S005,CAJ04,EMP031,VALE,"204,57",EUR,W6M0JTQU,OK,
PAY-0001548,T-501153,19/01/25 10:39,S001,CAJ06,EMP003,Contado,"108,70",EUR,PP0KLX5R,OK,
PAY-0001549,T-501155,27/07/25 21:01,S005,CAJ08,EMP067,Credit Card,-376.00,EUR,K6M8R8DW,OK,Importe negativo (posible devolución mal registrada)
PAY-0001550,T-501156,2025-12-12 20:25:53,s003,CAJ05,EMP025,EFECTIVO,830.41,EUR,I3M5RPBLA6S,OK,
PAY-0001551,T-501157,2025-07-03 17:46:00,S004,CAJ01,EMP003,Tarjeta (Crédito),€85.62,EUR,UPQVUBQEZQ,OK,
PAY-0001552,T-501157,03/07/25 16:28,S004,CAJ01,EMP003,Tarjeta Crédito,"1291,59",EUR,W24XVOFXJ,OK,
PAY-0001553,T-501158,15/09/25 07:21,S005,CAJ04,EMP029,Cash,1780.11,EUR,FINXB0FP54W,OK,
PAY-0001554,T-501159,11/12/2025,S001,CAJ05,EMP045,Tarjeta Crédito,,EUR,554E0RK1Y2A,OK,
PAY-0001555,T-501162,16/04/2025 14:18,S003,CAJ03,EMP040,TARJETA CREDITO,2082.74,EUR,BQWYO653,OK,
PAY-0001556,T-501163,2025-01-22,S001,CAJ07,EMP050,Tarjeta (Débito),432.78,EUR,,OK,
PAY-0001557,T-501164,2025-04-19,S001,CAJ02,EMP008,TARJETA CREDITO,235.25,EUR,MV6RL7GJCML,OK,
PAY-0001558,T-501165,01/09/25 11:51,S002,CAJ04,EMP057,Tarjeta (Crédito),957.78,EUR,XKIZFZMQP7,OK,
PAY-0001559,T-501165,01/09/25 11:51,S002,CAJ04,EMP057,Tarjeta credito,50.71,EUR,R222H1D2OW25,OK,
PAY-0001560,T-501166,2025-06-09 21:37:00,S004,CAJ08,EMP052,TARJETA CREDITO,1344.81,EUR,,OK,
PAY-0001561,T-501167,22/08/25 17:09,S004,CAJ01,EMP073,Tarjeta Crédito,170.40,EUR,9IHJC5YSA,OK,
PAY-0001562,T-501168,03/05/2025 00:33,S002,CAJ08,EMP017,Vale Devolución,"187,86",EUR,SCDCOWDXC,OK,
PAY-0001563,T-501168,2025-05-03,S002,CAJ08,EMP017,Contado,74.34,EUR,W7NHPGJX,OK,
PAY-0001564,T-501169,05/11/24 12:33,S001,CAJ04,EMP022,DEBITO,-181.19,EUR,F8GVP4N23K,OK,Importe negativo (posible devolución mal registrada)
PAY-0001565,T-501170,29/01/25 20:51,S005,CAJ06,EMP025,CC,"323,58",EUR,,OK,
PAY-0001566,T-501171,14 de noviembre de 2025 11:17,S005,CAJ03,EMP038,EFECTIVO,878.11,EUR,U1CXX3LNC30,OK,
PAY-0001567,T-501172,2025-03-08 03:28:50,S005,CAJ03,EMP064,Gift Card,344.60,EUR,,OK,
PAY-0001568,T-501173,2025-12-28 09:41:00,S005,CAJ03,EMP025,cash,178.76,EUR,QU3G58K4NGOS,OK,
PAY-0001569,T-501174,29/07/25 11:11,S005,CAJ07,EMP030,tarjeta regalo,€362.46,EUR,VUXLY81X,OK,
PAY-0001570,T-501175,5 de septiembre de 2025 06:00,S004,CAJ01,EMP076,cash,€1254.56,EUR,FD627DTQ9RUJ,OK,
PAY-0001571,T-501176,2025-01-01 20:59:00,S004,CAJ03,EMP002,Tarjeta Crédito,"277,26",EUR,,OK,
PAY-0001572,T-501177,2025-06-23 16:58:00,S004,CJ06,EMP043,tarjeta regalo,53.83,EUR,ASW22FIWK5,OK,
PAY-0001573,T-501178,2025-08-05 12:31:00,S005,CAJ07,EMP077,Credit Card,"588,85",EUR,,OK,
PAY-0001574,T-501179,26/09/25 15:58,S002,CAJ01,EMP005,Debit Card,2177.91,EUR,VH4QLCEQ4XY,OK,
PAY-0001575,T-501180,13/10/25 14:39,S005,CAJ03,EMP078,CC,"773,16",EUR,,OK,
PAY-0001576,T-501181,31/07/25 06:09,S001,CAJ08,EMP023,CC,"90,49",EUR,,OK,
PAY-0001577,T-501181,31/07/25 06:09,S001,CAJ08,EMP023,Credit Card,€117.04,EUR,42HQFXCLQ,OK,
PAY-0001578,T-501183,2025-08-13 00:12:00,S005,CAJ03,EMP017,CC,"802,87",EUR,UYG3HD6O,OK,
PAY-0001579,T-501184,15 de septiembre de 2025 16:55,S004,CAJ04,EMP035,Tarjeta credito,903.79,EUR,PKVCM2CD1W,PENDIENTE,
PAY-0001580,T-501186,2025-10-15 03:20:00,S005,CAJ04,EMP018,Tarjeta Débito,441.22,EUR,3S63LC6P0DR,OK,
PAY-0001581,T-501187,2025-09-22 06:59:40,S005,CAJ06,EMP034,Tarjeta credito,80.90,EUR,ZVZZG9BCDC2,OK,
PAY-0001582,T-501188,2025-09-27 18:07:10,S003,CAJ03,EMP076,Contado,119.06,EUR,GNVBA43IJ,OK,
PAY-0001583,T-501189,31/05/25 00:22,S004,CAJ01,EMP063,Cash,370.86 EUR,EUR,2DSAEXMOJD85,OK,
PAY-0001584,T-501190,29/01/25 22:28,S001,CAJ02,,cash,€1531.86,EUR,JF0U2RUP7,OK,
PAY-0001585,T-501190,29/01/25 22:28,S001,CAJ02,EMP066,cash,3046.54,EUR,B4TSG0S0U5,OK,
PAY-0001586,T-501191,2025-04-30,S002,CAJ01,EMP047,Tarjeta (Crédito),"1.626,71",EUR,89NADHE7,OK,
PAY-0001587,T-501192,23/07/2025 16:55,S002,CAJ04,EMP061,TARJETA CREDITO,28.75€,EUR,9VRS5Y4IG7T,OK,
PAY-0001588,T-501193,2025-05-29 17:11:00,S001,CAJ02,EMP046,EFECTIVO,€216.62,EUR,7FGA8X213Y,OK,
PAY-0001589,T-501195,04/11/25 16:43,S004,CAJ06,EMP075,Visa/Mastercard,"1489,25",EUR,XTSFFN9S0AY,OK,
PAY-0001590,T-501196,2025-06-13 20:59:00,S005,CAJ05,EMP044,Efectivo,302.88,EUR,CHGTWY3Y76,OK,
PAY-0001591,T-501197,10/01/2025,S002,CAJ02,EMP055,Efectivo,"704,83",EUR,,OK,
PAY-0001592,T-501198,2025-12-04 08:41:00,S002,CAJ04,EMP015,tarjeta regalo,671.67,EUR,C7BKSKI19UR8,OK,
PAY-0001593,T-501198,04/12/25 06:52,S002,CAJ04,EMP015,Gift Card,"457,43",EUR,,OK,
PAY-0001594,T-501199,2025-05-29 18:26:54,S002,CAJ05,EMP067,Debit Card,"28,82",EUR,ST5TVGOAJN,OK,
PAY-0001595,T500002,28/07/25 06:00,S001,CAJ06,EMP006,Tarjeta Crédito,"2,085.39",EUR,HXCX8G4XU,OK,
PAY-0001596,T500002,2025-07-28 07:57:00,S001,CAJ06,EMP006,Contado,1988.66,EUR,NZUTP4HY5I,OK,
PAY-0001597,T500015,08/07/2025,S005,CAJ02,,Credit Card,418.68,EUR,DHEVPB5V72,OK,
PAY-0001598,T500083,05/08/25 01:45,S001,CAJ02,EMP048,Visa/Mastercard,655.20,EUR,VV5AA2KOY,OK,
PAY-0001599,T500195,16/06/25 03:22,S04,CAJ03,EMP001,Credit Card,123.30,EUR,N0XCS16AHA,OK,
PAY-0001600,T500234,30/04/2025,S002,CAJ05,EMP061,CC,-29.88,EUR,,OK,Importe negativo (posible devolución mal registrada)
PAY-0001601,T500325,14/10/25 19:42,S003,CAJ07,EMP026,TARJETA_REGALO,€504.97,EUR,3X2FFA489CBI,OK,
PAY-0001602,T500397,28/03/25 21:54,S004,CAJ05,EMP060,Credit Card,€226.01,EUR,,OK,
PAY-0001603,T500463,29/09/2025 01:31,S002,CAJ06,EMP039,CC,697.32,EUR,VHWB2ASFL,OK,
PAY-0001604,T500468,2025-05-17 12:31:52,S001,CAJ04,EMP026,Visa/Mastercard,€84.86,EUR,G0QGGBUK,OK,
PAY-0001605,T500513,30 de octubre de 2025 17:23,S003,CAJ07,EMP027,Efectivo,"166,91",EUR,0W6A718FVX9P,OK,
PAY-0001606,T500540,2025-07-24,S004,CAJ08,EMP010,Cash,€101.51,EUR,X97I98UF,OK,
PAY-0001607,T500540,2025-07-24 09:03:27,S004,CAJ08,EMP010,TARJETA CREDITO,718.88,EUR,LMAG75TO3,OK,
PAY-0001608,T500633,05/03/25 13:44,S003,CAJ01,EMP039,Tarjeta (Crédito),"2241,32",EUR,,OK,
PAY-0001609,T500710,29/10/25 17:02,S004,CAJ01,EMP054,EFECTIVO,69.01,EUR,5UBMR81MZAP,OK,
PAY-0001610,T500710,2025-10-29 18:00:00,S004,CAJ01,EMP054,Contado,37.40,EUR,PL6WUGOFRGJ,OK,
PAY-0001611,T500817,2025-08-28 10:05:20,S002,CAJ08,EMP011,bizum,"289,42",EUR,,OK,
PAY-0001612,T500823,14/05/25 23:14,S005,CAJ03,EMP072,DC,"1373,13",EUR,PIJXQTC8S,OK,
PAY-0001613,T500826,2025-12-14 23:06:25,S005,CAJ03,EMP001,Cash,305.69,EUR,0LK872PK6,OK,
PAY-0001614,T500854,25/09/2025,S002,CAJ07,EMP045,Credit Card,"480,17",EUR,YR06O6ATBY76,OK,
PAY-0001615,T500859,04/10/25 12:38,S02,,EMP079,Tarjeta (Débito),3.54,EUR,4CUYSG61VH0,OK,
PAY-0001616,T500859,2025-10-04 14:32:00,S02,CAJ06,EMP079,Tarjeta credito,16.71,EUR,HYO3HI0X5FR,OK,
PAY-0001617,T-ABCDE,2025-13-40,S003,,EMP999,Efectivo,"100,00",EURO,,ANULADO,Ticket no encontrado / registro huérfano
PAY-0001618,,,S001,CAJ02,EMP00?,,10.00,eur,OYJSAZIDR,OK,Ticket no encontrado / registro huérfano
PAY-0001619,T-ABCDE,31/02/2025 10:00,S004,CAJ02,,Efectivo,10.00,EURO,2XSJUIL3P,OK,Ticket no encontrado / registro huérfano
PAY-0001620,T-000001,2025-13-40,S004,CAJ02,,Credit Card,10.00,EUR,,PENDIENTE,Ticket no encontrado / registro huérfano
PAY-0001621,,2025-13-40,S001,,EMP001,Efectivo,10.00,,,OK,Ticket no encontrado / registro huérfano
PAY-0001622,T-000001,,S005,CAJXX,EMP001,Credit Card,€-5.00,EURO,QOZ9G5YXZOU,PENDIENTE,Ticket no encontrado / registro huérfano
PAY-0001623,T-5000000,,S003,CAJ01,EMP00?,,€-5.00,eur,,ANULADO,Ticket no encontrado / registro huérfano
PAY-0001624,,2099-01-01 00:00,S005,CAJ02,,,€-5.00,eur,TY26GKTU,OK,Ticket no encontrado / registro huérfano
PAY-0001625,T-ABCDE,,S001,,EMP999,,"100,00",,,ANULADO,Ticket no encontrado / registro huérfano
PAY-0001626,T-ABCDE,2025-13-40,S004,CAJ01,EMP001,Efectivo,,eur,1VA4S38KR,ANULADO,Ticket no encontrado / registro huérfano
PAY-0001627,T-000001,,S005,CAJ01,EMP00?,,"100,00",EUR,S1D3Q954,ANULADO,Ticket no encontrado / registro huérfano
PAY-0001628,T-000001,2025-13-40,S002,CAJ02,,Tarjeta Crédito,€-5.00,eur,VG6C7NNLKN,ANULADO,Ticket no encontrado / registro huérfano
PAY-0001629,T-999999,2025-13-40,S006,CAJXX,EMP001,,,EUR,,OK,Ticket no encontrado / registro huérfano
PAY-0001630,,2025-13-40,S006,,EMP999,Tarjeta Crédito,,eur,,ANULADO,Ticket no encontrado / registro huérfano
PAY-0001631,,2099-01-01 00:00,S004,,,,,EUR,,ANULADO,Ticket no encontrado / registro huérfano
PAY-0000945,T-500656,18/05/2025,S005,CAJ02,EMP057,Tarjeta Regalo,€0.00,EUR,,OK,
PAY-0000656,T-500428,25/01/25 20:07,S003,CAJ02,EMP022,Efectivo,"275,26",EUR,IADPZ9Q8SU5N,OK,
PAY-0001200,T-500867,2025-12-10 02:55:00,S005,CAJ02,EMP003,Credit Card,289.48,EUR,ITWPHKOKPY98,OK,
PAY-0001606,T500540,2025-07-24,S004,CAJ08,EMP010,Cash,€101.51,EUR,X97I98UF,OK,
PAY-0000267,T-500115,2025-07-25 15:51:00,S004,CAJ06,EMP010,Tarjeta Regalo,"1,136.08",EUR,W56FKPS0D,OK,
PAY-0000203,T-500064,24/12/25 15:40,S004,,EMP031,CC,111.06,EUR,HYLU6K7P9MD,OK,
PAY-0001017,T-500716,30 de diciembre de 2025 02:36,S002,CAJ07,EMP007,DEBITO,"1753,60",EUR,DNQSAMCTXT,OK,
PAY-0000943,T-500653,03/09/25 02:59,S001,CAJ08,,VALE,4295.22,EUR,EIMB9GM5,OK,
PAY-0001138,T-500811,06/10/2025 00:44,S005,CAJ04,EMP069,Visa/Mastercard,571.28,EUR,,OK,
PAY-0001359,T-500998,16/08/25 18:23,S003,CAJ04,EMP059,GiftCard,€58.80,EUR,511R6MDMB,OK,
PAY-0000531,T-500328,28 de mayo de 2025 23:50,S003,CAJ08,EMP058,Tarjeta debito,"2,63",EUR,GOHMJZ6N58Y,OK,payment_id duplicado por error
PAY-0000756,T-500506,19/02/25 15:50,S001,CAJ07,EMP015,Credit Card,"138,71",EUR,3ZA8E83MTEBD,OK,payment_id duplicado por error
PAY-0000141,T-500012,25/03/2025,S001,CAJ02,EMP036,Tarjeta Crédito,914.82,EUR,E4H3GM1BW,OK,payment_id duplicado por error
PAY-0001496,T-501110,2025-07-20 15:42:00,S003,CAJ05,EMP035,TARJETA_REGALO,277.92,EUR,I9P8TFXS,OK,payment_id duplicado por error
PAY-0000716,T-500473,18/08/2025,S004,CAJ02,EMP051,Cash,231.69,EUR,BVLXUIIY3,OK,payment_id duplicado por error
